{"artifacts": ["artifacts/raw/c500-runs/exp-20260827-168-a93522cdb8ea-a01"], "baseline_commit": "235a34a22889c4d1ce5465acc2daaf1cdb67547d", "benchmark": "C500 ABBA case3 0.5455 to 0.5365 ms (-1.6499 percent), arms 0.546 to 0.537 (-1.6484 percent) and 0.545 to 0.536 (-1.6514 percent), with baseline/candidate drift -0.1832/-0.1862 percent. Protected case1 -1.0106 percent aggregate with maximum arm regression +0.2896 percent; case2 -0.0165 percent; case4 -0.0451 percent.", "candidate_commit": "a93522cdb8eac554048681c2a404df04959ebac2", "change": "Added only an exact decode-down selector and fixed unsorted launch after the existing runtime-unsorted reference; kernel body, sorted case2/case4 paths, map/grid, addresses, synchronization, epilogue and ABI stayed exact.", "correctness": "PASS: independent read-only audit approved with no findings; focused/inherited tests 22/22, workflow 12/12 and ABBA tests 3/3; C500 candidate/baseline build, 3/3 differential correctness at matched_ratio 1.0/max_abs 0, full regression, sampled/read-only correctness, source/tree integrity, no-process gates and 31-entry manifest all passed.", "decision": "revert", "device": "c500-local", "environment": "MetaX C500 xcore1000 device 0; MACA 3.7.1.5; MXCC 1.0.0 d9102a1572; driver 3.8.30; 25 percent compute / 16000 MiB slice; no device process before or after; NVIDIA, TileLang and Triton disabled.", "hypothesis": "Adding a case-3-only full-fixed 4096x7168x2048 clone after the runtime-unsorted reference improves case 3 aggregate and both ABBA arms by at least 2.0 percent, keeps fixed resources within 0/232/40/32768/2, and protects every other arm within 0.5 percent.", "id": "exp-20260827-168", "language": "CUDA Maca", "notes": "Tested a93522cdb8eac554048681c2a404df04959ebac2; metadata-only handoff 41d2a652ce18a920d6756ed754fa21581cdb17f9. Source blob eefa7754d3be3eda35cde6f1b4d1414448aa138c; LF SHA-256 58a23b5ee1b1d049ac3b05ab180c9069c6500b66fdcf90e4f892b001268d75f7. No repeat, integration, NVIDIA, TileLang, Triton or OJ; close exact case3 specialization on exp-166 formal best.", "operator": "fused_moe_i8_tn", "result": "REJECTED: fixed case3 resources passed at 0 stack / 232 MT / 40 ST / 32768 shared / 2 warps, but target aggregate and both arms missed the precommitted 2.0 percent gate; the gain is below the credible current 89-to-90 score-tier requirement.", "schema_version": 1, "timestamp": "2026-08-26T22:43:42+00:00"}
{"artifacts": ["handoffs/exp-20260827-169.md"], "baseline_commit": "235a34a22889c4d1ce5465acc2daaf1cdb67547d", "benchmark": "No exp-169 run. Historical exact exp-100 C500 ABBA regressed case2 6.1805 to 27.3710 ms (+342.8606 percent), with both candidate arms 27.452/27.290 ms.", "candidate_commit": "9e9d8e1d5641e9a1720d2450458716a5ffb91817", "change": "Completed source-identical byte, accumulator/register, LDS, barrier/lifecycle and historical replay feasibility analysis; operator source remained unchanged.", "correctness": "Static feasibility and source-identity checks passed. Historical exp-100 exact mechanism passed C500 build, 3/3 correctness, full regression, sampled correctness and manifest.", "decision": "revert", "device": "cpu", "environment": "Read-only analysis of formal xcore1000 source and historical C500-local evidence; no C500, NVIDIA, TileLang, Triton or OJ execution.", "hypothesis": "A case2-only same-expert dual-M CTA can halve pair B staging while retaining 256 threads and at most 32 KiB LDS, improving case2 at least 5.6 percent.", "id": "exp-20260827-169", "language": "CUDA Maca", "notes": "Source blob stayed 4697250e773a83e71aff6b710fcd75a61e7bef0c with LF SHA-256 0edbf3ba0efea172fa1958e25c6904ec4314ff86b9249deaaac56a98092341b3. Close exact dual-M B-reuse replay.", "operator": "fused_moe_i8_tn", "result": "REJECTED: the dual-M output doubles irreducible accumulator state, cannot retain the formal resource shape, adds no barrier reduction in 32 KiB, and exactly duplicates a stable 4.43x target regression.", "schema_version": 1, "timestamp": "2026-08-26T23:03:18+00:00"}
{"artifacts": ["handoffs/exp-20260827-170.md"], "baseline_commit": "235a34a22889c4d1ce5465acc2daaf1cdb67547d", "benchmark": "No exp-170 run. Historical exact exp-071 C500 ABBA regressed case3 0.5695 to 1.4280 ms (+150.746 percent), with both candidate arms exactly 1.428 ms.", "candidate_commit": "7e1ea6676d4d3d9c7286cca8f4fa467538db65b0", "change": "Completed source-identical traffic and historical replay feasibility analysis; operator source remained unchanged.", "correctness": "Static source/job identity checks passed. Historical exp-071 exact mechanism passed C500 build, 3/3 correctness, full regression, sampled correctness and manifest.", "decision": "revert", "device": "cpu", "environment": "Read-only analysis of formal xcore1000 source and historical C500-local evidence; no C500, NVIDIA, TileLang, Triton or OJ execution.", "hypothesis": "A case3-only 128x256x128 wide-N CTA can halve CTA count and repeated A staging, improving decode down at least 4.5 percent.", "id": "exp-20260827-170", "language": "CUDA Maca", "notes": "Source blob stayed 4697250e773a83e71aff6b710fcd75a61e7bef0c with LF SHA-256 0edbf3ba0efea172fa1958e25c6904ec4314ff86b9249deaaac56a98092341b3. Close case3 wide-N replay.", "operator": "fused_moe_i8_tn", "result": "REJECTED: exact 128x256 replay was already target-tested and regressed 2.51x; the independent non-B traffic upper bound is only 3.984 percent, below the 4.5 percent gate.", "schema_version": 1, "timestamp": "2026-08-26T23:03:19+00:00"}
{"artifacts": ["handoffs/exp-20260827-171.md"], "baseline_commit": "235a34a22889c4d1ce5465acc2daaf1cdb67547d", "benchmark": "Not run: the only 16x16x32i8 declaration is guarded for arch 1500/1600 and explicitly unsupported on xcore1000; no packed INT8 dot builtin was found.", "candidate_commit": "22f6d066672f425aea660c76ad9575837e079f52", "change": "Searched target headers, official examples, recovered xcore1000 IR and include declarations; operator source remained unchanged.", "correctness": "Static declaration, target-guard, signature, fragment-layout, official-example and source-identity checks passed; no legal executable candidate exists.", "decision": "revert", "device": "cpu", "environment": "Read-only xcore1000/MACA header and recovered-codegen analysis; no C500, NVIDIA, TileLang, Triton or OJ execution.", "hypothesis": "A declared xcore1000 MMA wider than 16x16x16i8 or a supported packed INT8 dot primitive can remove at least 25 percent of MMA or operand issue structure.", "id": "exp-20260827-171", "language": "CUDA Maca", "notes": "Source blob stayed 4697250e773a83e71aff6b710fcd75a61e7bef0c with LF SHA-256 0edbf3ba0efea172fa1958e25c6904ec4314ff86b9249deaaac56a98092341b3. Close wider-MMA/packed-dot family unless vendor support appears.", "operator": "fused_moe_i8_tn", "result": "REJECTED: xcore1000 exposes only 16x16x16i8 for this contract; no supported wider MMA or packed-dot signature/layout exists, so implementation would be an unsupported cross-architecture builtin experiment.", "schema_version": 1, "timestamp": "2026-08-26T23:03:19+00:00"}
{"artifacts": ["artifacts/raw/c500-runs/exp-20260827-172-b7cfec60e5c7-a01", "handoffs/exp-20260827-172.md"], "baseline_commit": "235a34a22889c4d1ce5465acc2daaf1cdb67547d", "benchmark": "ABBA case2 6.0695 to 6.0055 ms (-1.0545 percent), arms -1.2009/-0.9076 percent; protected case3 aggregate +0.4604 percent but arm A +0.9259 percent. Case1 -1.6152 percent; case4 +0.1053 percent.", "candidate_commit": "b7cfec60e5c7045f31b122c4d047215c4ddd0664", "change": "Selected exact sorted case 2 only for four uint32 expert-local B row/K offset carriers; retained the 64-bit expert base and all B load bytes, predicates, issue anchors, shared/MMA schedule, geometry, epilogue and ABI.", "correctness": "PASS: independent address/dispatch/ABI audit; 37/37 local tests; C500 candidate/baseline builds; 3/3 differential correctness matched_ratio 1.0/max_abs 0; full regression, sampled/read-only correctness, source/tree integrity, no-process gates and 31-entry manifest.", "decision": "revert", "device": "c500-local", "environment": "MetaX C500 xcore1000 device 0; MACA 3.7.1.5; MXCC 1.0.0 d9102a1572; driver 3.8.30; 25 percent compute / 16000 MiB slice; no device process before or after; NVIDIA, TileLang and Triton disabled.", "hypothesis": "Keeping the 64-bit expert base while forming exact case-2 B row/K byte offsets in proven-bounded uint32 carriers produces a real address lowering or resource improvement and improves case 2 aggregate and both C500 arms by at least 1.0 percent, with every protected aggregate and arm within 0.5 percent.", "id": "exp-20260827-172", "language": "CUDA Maca", "notes": "Tested b7cfec60e5c7045f31b122c4d047215c4ddd0664; queue tip 1b235fdb98f5be86fcfb5a571a1c98587f7bb064; source blob 9c4fd081b1105cc9abb19d181218ad2c483f1ac7; LF SHA-256 15a52e408e55de90c84a0128ee4804bce4335b7ac21623df6bafc82bcb740412; manifest-file SHA-256 38bcf982f96b56177e627fdc5788d906eca33560c2223012bad15069edbacbd3. Close four-extra-carrier spelling; a fresh experiment may only reuse the existing B-row carrier if the complete history check remains distinct.", "operator": "fused_moe_i8_tn", "result": "REJECTED: target clone changed from 20 stack/254 MT/40 ST to 0/256/40, case2 arm B missed 1 percent, and protected case3 arm A exceeded 0.5 percent; no repeat, profiler, integration, NVIDIA, TileLang, Triton or OJ.", "schema_version": 1, "timestamp": "2026-08-26T23:37:59+00:00"}
{"artifacts": ["artifacts/raw/c500-runs/exp-20260827-173-6603bee55d3e-a01", "handoffs/exp-20260827-173.md"], "baseline_commit": "235a34a22889c4d1ce5465acc2daaf1cdb67547d", "benchmark": "C500 ABBA case2 6.0610 to 6.0045 ms (-0.9322 percent), arms 6.060 to 6.006 (-0.8911 percent) and 6.062 to 6.003 (-0.9733 percent). Protected case1 1.0185 to 1.0405 ms (+2.1600 percent), arms +3.678/+0.679 percent; case3 0 percent; case4 -0.1353 percent.", "candidate_commit": "6603bee55d3eda1da17000a0f843d888d6e0fe6b", "change": "Selected only the exact sorted case-2 runtime clone, retained the 64-bit expert base, and retasked the existing four signed B-row slots in place as proven-bounded uint32 expert-local B bases; no second carrier array, pointer set, load/predicate/issue, shared/MMA/synchronization, geometry, epilogue, case-4 fixed clone, or ABI change.", "correctness": "PASS: independent detached address/dispatch/carrier-lifetime/ABI audit; 37/37 local related tests; C500 candidate/baseline builds; 3/3 differential correctness at matched_ratio 1.0/max_abs 0; full regression, sampled/read-only correctness, source/tree integrity, no-process gates, terminal status and 31-entry manifest.", "decision": "revert", "device": "c500-local", "environment": "MetaX C500 xcore1000 device 0; MACA 3.7.1.5; MXCC 1.0.0 d9102a1572; driver 3.8.30; authorized 25 percent compute / 16000 MiB slice; no device process before or after; NVIDIA, TileLang and Triton disabled.", "hypothesis": "Reusing the existing four case-2 B row carriers as bounded uint32 local offsets preserves resources at or below 20 stack / 254 MT / 40 ST and improves case 2 aggregate and both ABBA arms by at least 1.0 percent without protected aggregate or arm regression above 0.5 percent.", "id": "exp-20260827-173", "language": "CUDA Maca", "notes": "Tested 6603bee55d3eda1da17000a0f843d888d6e0fe6b; queue tip fe3eb769c73aee428f556d53b35ab14d2c8f1319; source blob f0fe3e22fb2b43810649f8b2fd2c68013ce011e7; LF SHA-256 4485b591212be227f34113063836a37be48d0a425f44ffa046e8afc95b6d87ae; job blob 7f91ad9b45b58a3fa128a95aeb839c7630bc5662; manifest-file SHA-256 58d3de7fb0f4441d1da7f92da2485e5100c4680c9a48e33b406401d9a4435f7b. Close bounded uint32 expert-local B offset carrier family after exp-172 and exp-173 both lowered to 256 MT and failed mandatory arms.", "operator": "fused_moe_i8_tn", "result": "REJECTED: target clone changed from 20 stack / 254 MT / 40 ST to 0 / 256 / 40, all target measurements missed 1 percent, and protected case1 aggregate plus both arms exceeded the 0.5 percent ceiling. No repeat, profile, integration, NVIDIA, TileLang, Triton or OJ.", "schema_version": 1, "timestamp": "2026-08-27T00:03:45+00:00"}
{"artifacts": ["handoffs/exp-20260827-174.md"], "baseline_commit": "235a34a22889c4d1ce5465acc2daaf1cdb67547d", "benchmark": "Not run: feasibility stop gate rejected the mechanism before build, C500, NVIDIA, TileLang, Triton, OJ or browser execution.", "candidate_commit": "03dfa9bf53395f9ed92f860e867dd2dd63c8aad7", "change": "Completed exact A producer-consumer permutation, shuffle-width, instruction lower-bound, register-lifetime and barrier-lifecycle analysis; submission source remained byte-identical.", "correctness": "Static exact coverage proves 256 unique b128 transfers and consumers per wave, with all B-required barriers retained; source/job identity checks passed and no executable candidate was produced.", "decision": "revert", "device": "cpu", "environment": "Read-only MetaX C500 xcore1000 source/codegen feasibility analysis; no device execution.", "hypothesis": "Replace the coalesced A shared transpose with a legal wave64 register exchange, remove 16 KiB A LDS backing, and improve decode cases at least 1 percent without resource regression.", "id": "exp-20260827-174", "language": "cuda_maca", "notes": "Source blob remained 4697250e773a83e71aff6b710fcd75a61e7bef0c with LF SHA-256 0edbf3ba0efea172fa1958e25c6904ec4314ff86b9249deaaac56a98092341b3. Close decode coalesced-A shuffle family unless documented width-64 vector exchange changes the lower bound.", "operator": "fused_moe_i8_tn", "result": "REJECTED: 128 of 256 transfers per wave cross a 32-lane half-wave, no supported width-64 shuffle contract is proven, and any 32-bit formulation needs at least 32 scalar shuffles per thread/tile to replace eight b128 shared operations while extending live ranges.", "schema_version": 1, "timestamp": "2026-08-27T00:33:30+00:00"}
{"artifacts": ["artifacts/raw/c500-runs/exp-20260827-175-536db0b02222-a01", "handoffs/exp-20260827-175.md"], "baseline_commit": "235a34a22889c4d1ce5465acc2daaf1cdb67547d", "benchmark": "ABBA case1 1.0340 to 1.0405 ms (+0.6286 percent regression), arms 1.031 to 1.040 (+0.8729 percent) and 1.037 to 1.041 (+0.3857 percent). Protected case2 +0.0248 percent, case3 -0.5525 percent, case4 +0.2411 percent; every protected arm passes.", "candidate_commit": "536db0b02222a509a968476cbb53732e1d7fffbb", "change": "Added only an exact case1 host selector and a false/0/0/7168 launch; kernel body, schedule, map/grid, addresses, synchronization, epilogue, sorted paths, fallback and ABI remained exact.", "correctness": "PASS: 37/37 local related/workflow tests; C500 candidate/baseline builds; 3/3 differential correctness matched_ratio 1.0/max_abs 0; full regression, sampled/read-only correctness, source/tree integrity, no-process gates and independently rehashed 31-entry manifest.", "decision": "revert", "device": "c500-local", "environment": "MetaX C500 xcore1000 device 0; MACA 3.7.1.5; MXCC 1.0.0 d9102a1572; driver 3.8.30; 25 percent compute / 16000 MiB slice; no device process before or after; NVIDIA, TileLang and Triton disabled.", "hypothesis": "Exact case1 selecting compile-time K=7168 with runtime EM/N improves case1 aggregate and both ABBA arms at least 1 percent while every protected aggregate and arm regresses at most 0.5 percent and resources remain within 20/254/52/32768/2.", "id": "exp-20260827-175", "language": "cuda_maca", "notes": "Tested 536db0b02222a509a968476cbb53732e1d7fffbb; queue tip f95aee96b6b0df5c093fbae41952b7afbeac977a; source blob 05c73509c13f23728aa9fc5f482e60759d72fec4; LF SHA-256 67c52072d034b8795ab2e0cb195b35e4f62b76e9124f8e01fd1c79eaae44848f. Close case1 dimension-specialization family.", "operator": "fused_moe_i8_tn", "result": "REJECTED: the K-only clone passed resources at 0 stack / 234 MT / 52 ST / 32768 shared / 2 warps, but target aggregate and both arms regressed instead of improving 1 percent; no repeat, profiler, integration, NVIDIA, TileLang, Triton or OJ.", "schema_version": 1, "timestamp": "2026-08-27T00:35:05+00:00"}
{"artifacts": ["artifacts/raw/c500-runs/exp-20260827-176-7ae407a7f3bf-a01", "handoffs/exp-20260827-176.md"], "baseline_commit": "235a34a22889c4d1ce5465acc2daaf1cdb67547d", "benchmark": "ABBA case3 0.5455 to 0.5395 ms (-1.0999 percent), arms 0.545 to 0.539 (-1.1009 percent) and 0.546 to 0.540 (-1.0989 percent). Protected case1 -1.0921 percent, case2 -0.0082 percent, case4 -0.0751 percent; every protected arm passes.", "candidate_commit": "7ae407a7f3bfeffbe95c1fbc81673aa7797e11e2", "change": "Added only an exact case3 host selector and a false/0/0/2048 launch; kernel body, schedule, map/grid, addresses, synchronization, epilogue, sorted paths, fallback and ABI remained exact.", "correctness": "PASS: 37/37 local related/workflow tests; C500 candidate/baseline builds; 3/3 differential correctness matched_ratio 1.0/max_abs 0; full regression, sampled/read-only correctness, source/tree integrity, no-process gates and independently rehashed 31-entry manifest.", "decision": "revert", "device": "c500-local", "environment": "MetaX C500 xcore1000 device 0; MACA 3.7.1.5; MXCC 1.0.0 d9102a1572; driver 3.8.30; 25 percent compute / 16000 MiB slice; no device process before or after; NVIDIA, TileLang and Triton disabled.", "hypothesis": "Exact case3 selecting compile-time K=2048 with runtime EM/N improves case3 aggregate and both ABBA arms at least 3.2 percent while every protected aggregate and arm regresses at most 0.5 percent and resources remain within 20/254/52/32768/2.", "id": "exp-20260827-176", "language": "cuda_maca", "notes": "Tested 7ae407a7f3bfeffbe95c1fbc81673aa7797e11e2; queue tip 6bc8e830a1f35a578ae421e9d091dd70c7e5fc46; source blob 7857dc9ac78db92b78a8a6db26488fa4c872cbc1; LF SHA-256 29a77d8d356bd7b71a929ad509af2abc4bada6c0baa1d2345c9c95b030456ede. Close case3 dimension-specialization family.", "operator": "fused_moe_i8_tn", "result": "REJECTED: the K-only clone passed resources at 0 stack / 234 MT / 52 ST / 32768 shared / 2 warps, but target aggregate and both arms improved only about 1.10 percent, below the 3.2 percent score-tier gate and below the exp-168 full-fixed gain; no repeat, profiler, integration, NVIDIA, TileLang, Triton or OJ.", "schema_version": 1, "timestamp": "2026-08-27T00:35:25+00:00"}
{"artifacts": ["artifacts/raw/c500-runs/exp-20260827-177-e494a680d54f-a01", "handoffs/exp-20260827-177.md"], "baseline_commit": "235a34a22889c4d1ce5465acc2daaf1cdb67547d", "benchmark": "ABBA case2 6.0590 to 6.1120 ms (+0.8747 percent regression), arms +0.9244/+0.8251 percent; protected case3 +1.2004 percent, case4 +0.4814 percent, case1 -0.0491 percent.", "candidate_commit": "e494a680d54fa2e9a6c50ead3568c4575e020737", "change": "Moved only the steady A2 and A3 global-load issue points immediately after their matching old-payload shared stores; all addresses, bytes, STS/MMA/LDS/barrier traces, dispatch and epilogue remained exact.", "correctness": "PASS: focused lifecycle proof; C500 candidate/baseline builds; 3/3 differential correctness at matched_ratio 1.0 and max_abs 0; full regression, sampled/read-only correctness, source/tree integrity and independently rehashed 31-entry manifest.", "decision": "revert", "device": "c500-local", "environment": "MetaX C500 xcore1000 device 0; MACA 3.7.1.5; MXCC 1.0.0 d9102a1572; driver 3.8.30; 25 percent compute / 16000 MiB slice; no device process before or after; NVIDIA, TileLang and Triton disabled.", "hypothesis": "Advance steady A2/A3 next-image LDGs to their first legal post-STS points to improve case 2 aggregate and both arms by at least 1 percent while protecting every other observation within 0.5 percent.", "id": "exp-20260827-177", "language": "CUDA Maca", "notes": "Tested e494a680d54fa2e9a6c50ead3568c4575e020737; queue tip af886ace3539feb9b1275709961ab54587323a8e; source blob 39e567982b4c43cae91047b952d1c8656e011c1b; no repeat/profile/integration/OJ.", "operator": "fused_moe_i8_tn", "result": "REJECTED: the case2 target regressed in aggregate and both arms, and protected case3 exceeded the 0.5 percent ceiling; resources were unchanged.", "schema_version": 1, "timestamp": "2026-08-27T01:05:07+00:00"}
