{"artifacts": ["artifacts/raw/c500-runs/exp-20260826-136-ff97001c925c-a01"], "baseline_commit": "2230963fdd9d6394b3b63864500ffab00818b4f0", "benchmark": "ABBA case3 0.5590->0.5510 ms (-1.4311%); case4 3.4570->3.3755 ms (-2.3575%); case2 +0.1136%; case1 aggregate -1.7346% but arm A +1.0348%", "candidate_commit": "ff97001c925cbe7b6e3194c53b995eb1312be3f0", "change": "Added fixed case3/case4 dimensions and fixed-only consumer-entry B0-B3 LDS placement; runtime case1/case2 instances remain formal-best equivalent", "correctness": "MXCC build, 3/3 differential correctness, full regression, sampled/read-only checks, integrity, and 31-entry manifest passed; audited lifecycle/address/output proofs passed", "decision": "revert", "device": "c500-local", "environment": "MetaX C500 sGPU3 25% compute/16000MiB; MACA 3.7.1.5; MXCC 1.0.0 d9102a1572; driver 3.8.30; no device processes or RAS errors", "hypothesis": "Fixed-down exact specialization plus current-iteration B0-B3 LDS should compose into stronger case3/case4 gains without changing generic gate-up kernels", "id": "exp-20260826-136", "language": "CUDA Maca", "notes": "Runtime resources 36/254/40/32768/2; fixed sorted 0/234/40/32768/2; fixed unsorted 0/236/40/32768/2. No repeat, integration, NVIDIA, or OJ.", "operator": "fused_moe_i8_tn", "result": "Rejected: case3 and case4 missed mandatory 3% and 4% target gates, and protected case1 arm A exceeded 0.5% regression", "schema_version": 1, "timestamp": "2026-08-26T07:12:15+00:00"}
{"artifacts": ["artifacts/raw/c500-runs/exp-20260826-137-59d78d88917d-a01"], "baseline_commit": "2230963fdd9d6394b3b63864500ffab00818b4f0", "benchmark": "ABBA case2 6.1615->6.0905 ms (-1.1523%) with arms 6.162/6.161->6.089/6.092; case1 -0.2362% aggregate but arm A +2.1760%; case3 -0.2691%; case4 +0.0289%", "candidate_commit": "59d78d88917d1671a7724079dbdf419dcd370146", "change": "Added a K-only template carrier and selected fixed K only for exact sorted case2; case4 and unsorted paths remain runtime-K", "correctness": "MXCC build, 3/3 differential correctness, full regression, sampled/read-only checks, source/tree integrity, and 31-entry manifest passed", "decision": "revert", "device": "c500-local", "environment": "MetaX C500 sGPU3 25% compute/16000MiB; MACA 3.7.1.5; MXCC 1.0.0 d9102a1572; driver 3.8.30; no device processes or RAS errors", "hypothesis": "Fixing only case2 K=7168 should fold the K loop and address arithmetic while retaining runtime EM and N", "id": "exp-20260826-137", "language": "CUDA Maca", "notes": "Fixed case2 resources 0/234/52/32768/2; runtime sorted and unsorted remain 36/254/40/32768/2. No repeat, integration, NVIDIA, or OJ.", "operator": "fused_moe_i8_tn", "result": "Rejected: case2 fixed codegen used 52 ST registers above the 40 limit, gain missed 1.5% promotion strength, and protected case1 arm A failed", "schema_version": 1, "timestamp": "2026-08-26T07:12:31+00:00"}
{"artifacts": ["artifacts/raw/c500-runs/exp-20260826-138-852c172b14fa-a01"], "baseline_commit": "2230963fdd9d6394b3b63864500ffab00818b4f0", "benchmark": "ABBA case2 6.1615->6.1535 ms (-0.1298%) with stable arms; case1 -3.9982% but candidate drift -7.1099%; case3 -1.0811%; case4 -1.5618%", "candidate_commit": "852c172b14faf48f772d6947b1d4bd24f89e5053", "change": "Moved the A00 shared load from prologue/backedge to steady-loop and peeled-tail consumer entry; all producers, other loads, MMA, barriers, mapping, epilogue, and ABI stayed exact", "correctness": "Independent audit passed; MXCC build, 3/3 differential correctness, full regression, sampled/read-only checks, source/tree integrity, and 31-entry manifest passed", "decision": "revert", "device": "c500-local", "environment": "MetaX C500 sGPU3 25% compute/16000MiB; MACA 3.7.1.5; MXCC 1.0.0 d9102a1572; driver 3.8.30; no device processes or RAS errors", "hypothesis": "Moving only A00 LDS to current steady and tail consumer entry should remove one loop-carried A vector and materially improve case2", "id": "exp-20260826-138", "language": "CUDA Maca", "notes": "Candidate resources 20/254/40/32768/2 versus baseline 36/254/40/32768/2. No repeat, integration, NVIDIA, or OJ.", "operator": "fused_moe_i8_tn", "result": "Rejected: both clones remained 20 stack / 254 MT and failed the resource gate; case2 gain was far below the required 2.5%", "schema_version": 1, "timestamp": "2026-08-26T07:39:06+00:00"}
{"artifacts": [], "baseline_commit": "2230963fdd9d6394b3b63864500ffab00818b4f0", "benchmark": "NOT RUN: pre-edit capacity and locality analysis proved the proposed mechanism is dominated by the already measured exp-122 width-16 layout.", "candidate_commit": "9244bc786d9603f6adae88b00e58af192a4d6558", "change": "No source change was made. The proposed case-4 schedule would split each expert into one width-30 main cluster and one width-2 tail cluster while preserving useful CTA count and arithmetic.", "correctness": "NOT RUN: the candidate was rejected before implementation, build, device execution, or OJ submission; the worktree remained clean at its reserved base.", "decision": "revert", "device": "cpu", "environment": "Static case-4 CTA, traffic, L2-capacity and launch-count analysis only; no accelerator accessed; NVIDIA disabled.", "hypothesis": "Expert-aligned 30+2 cluster splitting could retain the 224 MiB ideal B traffic of width 16 while improving same-expert reuse enough to exceed the case-4 promotion gate.", "id": "exp-20260826-139", "language": "CUDA Maca", "notes": "Width-16 and 30+2 have identical ideal B traffic and unchanged A/MMA/output work. Width-16 uses about 4.25 MiB per cluster, whereas the width-30 main cluster uses about 7.75 MiB and leaves only 256 KiB of an 8 MiB L2; 30+2 also adds one launch and separates the same-expert tail cluster. Since exp-122 width-16 improved case 4 only 0.8821 percent, the proposed layout has no new mechanism that could justify implementation. Reservation refs remain permanent; no source, test, job, handoff, candidate commit, controller action, C500, NVIDIA, browser, or OJ access occurred.", "operator": "fused_moe_i8_tn", "result": "REJECTED before implementation: expert-aligned 30+2 is strictly dominated by the already sub-threshold width-16 candidate under the available traffic and L2-capacity model.", "schema_version": 1, "timestamp": "2026-08-26T08:42:27+00:00"}
{"artifacts": ["handoffs/exp-20260826-140.md"], "baseline_commit": "fa04a5c636170436c1cec3188aaeb35210754642", "benchmark": "NOT RUN: the local C500-native MXCC harness has no TileLang frontend, and NVIDIA is disabled.", "candidate_commit": "dec4865c89827b74ab99d3b748992cff2441c120", "change": "Changed the official TileLang starter from BK64/stages2/128 threads to the coupled BK128/stages1/256-thread geometry; added a prefill-only stable expert-rank workspace and exact (8,N/128,32) grid while decode remains direct.", "correctness": "PASS for py_compile, 4/4 focused static ABI/resource/permutation/grid tests, git diff check, and independent exact-commit audit; target TileLang compile and numeric correctness are unavailable locally and remain the OJ diagnostic boundary.", "decision": "investigate", "device": "cpu", "environment": "CPU/static analysis only; official TileLang starter from metax-maca op_optimization; local PyPI TileLang 0.1.13 API/source review; no accelerator accessed.", "hypothesis": "TileLang BK128 with 256 threads plus exact prefill stable expert clustering compiles correctly on xcore1000 and materially approaches the CUDA formal-best timing class.", "id": "exp-20260826-140", "language": "TileLang", "notes": "Immutable source commit dec4865c89827b74ab99d3b748992cff2441c120; queue tip 41cfc905e425db29457c6bece87ede421808d510; source SHA-256 78124d28f30a901faa1fdb1acd1425ff67734cdbc3c1c9bff00d1f683367955f. Live preflight confirms TileLang and C500 remain available with 10000 ms/4096 MiB and no visible quota/cooldown. Remaining target-only risks are alloc_global/multi-kernel support and isolation, BK128 INT8 lowering, 3D-grid performance, and BF16 epilogue.", "operator": "Fused MoE i8 tn", "result": "INVESTIGATE: no source-level blocker; approved for one controlled TileLang OJ compile/correctness/lowering diagnostic.", "schema_version": 1, "timestamp": "2026-08-26T09:13:37+00:00"}
{"artifacts": ["handoffs/exp-20260826-141.md"], "baseline_commit": "fa04a5c636170436c1cec3188aaeb35210754642", "benchmark": "NOT RUN: C500-native harness has no TileLang frontend; NVIDIA disabled. Exp-140 inherited evidence validates this exact direct BK128 geometry only on decode cases 1/3, not prefill.", "candidate_commit": "af207fbe678e85cbcf339a28de026941b2e990ca", "change": "Changed only the coupled TileLang kernel defaults to BK128/stages1/256 threads; retained the official direct 2D grid and removed every exp-140 rank-map, workspace, multi-kernel and 3D-grid mechanism.", "correctness": "PASS: py_compile, focused static tests 4/4, exact one-line source diff, and independent exact-commit audit of ABI, mapping, bounds, signed INT32 range, 32 KiB shared model, read-only inputs, and four public shapes; target prefill numeric correctness remains OJ-only.", "decision": "investigate", "device": "cpu", "environment": "CPU/static analysis and official TileLang starter comparison only; target C500 compile and timing available only through XPU-OJ for this language.", "hypothesis": "Changing only official starter geometry from BK64/stages2/128 threads to BK128/stages1/256 threads keeps the direct 2D kernel correct for all four public cases and halves T.gemm steps.", "id": "exp-20260826-141", "language": "TileLang", "notes": "Source SHA-256 c0cfa58658cf3cb4afde64f56d82d539300eb73e5431fc3b2a1b9d24ddf2f686. Direct grids: 1024/8192/1792/14336 CTAs; K steps: 56/56/16/16. Audit APPROVE. No C500/NVIDIA run; OJ is the target diagnostic boundary.", "operator": "Fused MoE i8 tn", "result": "INVESTIGATE: independent audit approved exactly one controlled TileLang OJ compile/correctness/timing diagnostic; no source-level blocker.", "schema_version": 1, "timestamp": "2026-08-26T10:10:30+00:00"}
{"artifacts": ["artifacts/raw/c500-runs/exp-20260826-142-9a924b87a1b5-a01"], "baseline_commit": "2230963fdd9d6394b3b63864500ffab00818b4f0", "benchmark": "ABBA case1 1.0765->1.0655 ms (-1.0218% favorable); case2 6.1655->6.4120 ms (+3.9981% regression); case3 0.5640->0.5925 ms (+5.0532%); case4 3.4620->3.6315 ms (+4.8960%).", "candidate_commit": "9a924b87a1b55ead8d28b591015dd524ad5fc8ec", "change": "Packed each A shared row's K-half sectors so four b128 A LDS operations per wave-tile become two aligned b256 LDS operations; global loads, STS, B path, MMA identities, barriers, geometry and epilogue remain unchanged.", "correctness": "PASS: independent mapping/lifecycle audit; C500 build; 3/3 differential correctness at matched_ratio 1.0 and max_abs 0; full regression; sampled/read-only/integrity and 31-entry manifest.", "decision": "revert", "device": "c500-local", "environment": "MetaX C500 xcore1000, MACA 3.7.1.5, MXCC 1.0.0 d9102a1572, driver 3.8.30, 25 percent compute and 16000 MiB slice, no residual device process.", "hypothesis": "A K-half packed b256 LDS reduces shared movement issue but must improve case 2 by at least 1 percent without resource or protected regressions.", "id": "exp-20260826-142", "language": "CUDA Maca", "notes": "Queue commit 9cb6752612d85e7af6930149d177fd3a51060586. Source SHA-256 1cf4fc1e79cf2cdd7f831629b32e179db12633cf25f7bb034564940cd27e07f1. No repeat, profiler, native-IR follow-up, integration, NVIDIA or OJ; close A K-half b256 family.", "operator": "Fused MoE i8 tn", "result": "REJECTED: both case2 arms regressed about 4 percent; cases3/4 regressed; candidate MMA resources 52 stack/256 MT/40 ST and 68 stack/254 MT/40 ST exceeded the 36/254/40 gate.", "schema_version": 1, "timestamp": "2026-08-26T10:34:46+00:00"}
{"artifacts": ["artifacts/raw/c500-runs/exp-20260826-143-7411bf775b74-a01"], "baseline_commit": "2230963fdd9d6394b3b63864500ffab00818b4f0", "benchmark": "NOT RUN: candidate build failed, so no warmup or ABBA samples exist.", "candidate_commit": "7411bf775b74ed1fa44e38061d21ec35efd0ebaf", "change": "Moved load_k from pointer arithmetic into the second argument of six ordinary and four tail-predicated b128 LDG source sites; load issue order, bytes, predicates, pipeline, mapping and ABI were unchanged.", "correctness": "Candidate MXCC build failed before executable generation with 16 errors requiring the __builtin_mxc_ldg_b128 and predicator offset argument to be a constant integer; correctness and regression did not run. Local focused tests passed 7/7 and integrity/20-entry failure manifest verified.", "decision": "revert", "device": "c500-local", "environment": "MetaX C500/xcore1000 device 0; MACA 3.7.1.5; driver 3.8.30; 25 percent compute / 16000 MiB slice; device idle before and after; NVIDIA disabled.", "hypothesis": "Moving dynamic load_k from pointer arithmetic into the native MXC LDG offset operand preserves every effective address and improves case 2 by at least 1 percent in both paired arms.", "id": "exp-20260826-143", "language": "CUDA Maca", "notes": "Tested commit 7411bf775b74; queue tip e4f9c1f10a1b. Terminal failed/1 after 2.312 s; all failure-manifest entries and candidate/baseline tree integrity passed. Close dynamic LDG-offset family; no repeat, integration, profiler, NVIDIA or OJ.", "operator": "fused_moe_i8_tn", "result": "Rejected: xcore1000 MXCC conclusively rejects dynamic load_k in the LDG offset operand; the candidate cannot reach correctness or performance gates.", "schema_version": 1, "timestamp": "2026-08-26T10:36:49+00:00"}
{"artifacts": ["artifacts/raw/c500-runs/exp-20260826-144-5f21699821ce-a01"], "baseline_commit": "2230963fdd9d6394b3b63864500ffab00818b4f0", "benchmark": "ABBA case4 3.4570->3.3280 ms (-3.7316%); arms 3.460->3.327 (-3.8439%) and 3.454->3.329 ms (-3.6190%). Case1 -1.3787%, case2 -0.0162%, case3 -0.3575%; protected observations favorable.", "candidate_commit": "5f21699821ce87e4883fd8eecafd7fd0c20b84e3", "change": "Added optional compile-time K binding and selected K=2048 only for exact sorted case4; case2 and unsorted paths retain runtime K, with map, grid, kernel body, memory, synchronization, epilogue and ABI unchanged.", "correctness": "MXCC candidate/baseline builds, 3/3 differential correctness, full regression, sampled/read-only checks, source/tree integrity and 31-entry manifest passed. The fixed case4 clone used 0 stack / 232 MT / 52 ST / 32768 shared / 2 warps and failed the ST<=40 hard gate; runtime clones stayed 36/254/40/32768/2.", "decision": "revert", "device": "c500-local", "environment": "MetaX C500/xcore1000 device 0; MACA 3.7.1.5; MXCC 1.0.0 d9102a1572; driver 3.8.30; 25 percent compute / 16000 MiB slice; no device process or RAS errors; NVIDIA disabled.", "hypothesis": "Fixing only exact sorted case4 K=2048 improves both C500 case4 arms by at least 1.0 percent while every protected arm and aggregate regresses no more than 0.5 percent.", "id": "exp-20260826-144", "language": "CUDA Maca", "notes": "Tested 5f21699821ce; queue tip 30adbeceffb1. Paired drift stable and all manifest entries verified. No repeat, profile, integration, NVIDIA or OJ; close case4-k-only-specialization.", "operator": "fused_moe_i8_tn", "result": "Rejected: stable case4 gain passed the performance gate, but the fixed clone expanded to 52 ST registers and failed the precommitted resource hard gate. Full-fixed case4 already retains 40 ST and tied 83.50 on OJ, so K-only provides no stronger score evidence.", "schema_version": 1, "timestamp": "2026-08-26T11:02:49+00:00"}
{"artifacts": ["artifacts/raw/c500-runs/exp-20260826-145-9379e1306629-a01", "handoffs/exp-20260826-145.md"], "baseline_commit": "2230963fdd9d6394b3b63864500ffab00818b4f0", "benchmark": "ABBA case4 3.4595->3.3300 ms (-3.7433%); arms 3.462->3.327 (-3.8995%) and 3.457->3.333 ms (-3.5872%). Case2 +0.0081%; case3 0%; case1 +1.6038% with arm A +3.9729%.", "candidate_commit": "9379e1306629a47a7988c75d32abcc608828976c", "change": "Added fixed EM/N/K and A00-placement template parameters; only exact sorted case4 uses fixed dimensions and current-iteration A00, while runtime sorted and unsorted clones retain formal-best placement.", "correctness": "Independent audit approved lifecycle and four-wave mapping. C500 builds passed; 3/3 differential correctness matched_ratio=1.0 max_abs=0; full regression, sampled/read-only correctness, source/tree integrity and 31-entry manifest passed.", "decision": "revert", "device": "c500-local", "environment": "MetaX C500 xcore1000 device 0; MACA 3.7.1.5; MXCC 1.0.0 d9102a1572; driver 3.8.30; 25 percent compute / 16000 MiB slice; no device process before or after; NVIDIA disabled.", "hypothesis": "Exact sorted case4 full-fixed dimensions plus private current-iteration A00 LDS reaches at least 4.9 percent improvement in both arms while preserving protected cases and ST<=40.", "id": "exp-20260826-145", "language": "CUDA Maca", "notes": "Tested 9379e1306629; queue tip de4dd9e2ffc2. Runtime clones stayed 36/254/40/32768/2. No repeat, profile, integration, NVIDIA or OJ; current-iteration A00 adds no measurable gain on top of full-fixed case4.", "operator": "fused_moe_i8_tn", "result": "Rejected: fixed case4 resources passed at 0 stack / 230 MT / 40 ST / 32768 shared / 2 warps, but case4 missed the 4.9 percent aggregate and both-arm gates and protected case1 failed.", "schema_version": 1, "timestamp": "2026-08-26T11:42:07+00:00"}
{"artifacts": ["artifacts/raw/c500-runs/exp-20260826-146-01f95b93d0ae-a01", "handoffs/exp-20260826-146.md"], "baseline_commit": "2230963fdd9d6394b3b63864500ffab00818b4f0", "benchmark": "ABBA case1 1.0840->1.0350 ms (-4.5203%); case2 6.1610->6.0570 ms (-1.6880%), arms -1.6561%/-1.7199%; case3 0.5560->0.5415 ms (-2.6079%); case4 3.4670->3.4095 ms (-1.6585%). Every protected aggregate and arm improved.", "candidate_commit": "01f95b93d0ae276a083accfb24610abd8e51f327", "change": "Moved only group-0 A00/A01 LDS from prologue/backedge positions to their first legal steady and peeled-tail consumers; A STS/LDG, B path, barriers, MMA order, addresses, mapping, epilogue and ABI stayed exact.", "correctness": "Independent lifecycle and four-wave payload audit approved. C500 builds, 3/3 differential correctness at matched_ratio 1.0/max_abs 0, full regression, sampled/read-only checks, source/tree integrity and 31-entry manifest passed.", "decision": "revert", "device": "c500-local", "environment": "MetaX C500 xcore1000 device 0; MACA 3.7.1.5; MXCC 1.0.0 d9102a1572; driver 3.8.30; 25 percent compute / 16000 MiB slice; no device process before or after; NVIDIA disabled.", "hypothesis": "Moving only A00/A01 LDS to their first legal current consumers reaches stack=0 or MT<=250 and improves case2 aggregate and both arms by at least 1 percent without protected regression.", "id": "exp-20260826-146", "language": "CUDA Maca", "notes": "Tested 01f95b93d0ae; queue tip 7f8c98171957. Candidate LF SHA-256 4fe1962ccbade0e598c39c7ac0369cb85b62ed74fc97967a7e018c198acd58c7. No repeat, profile, integration, NVIDIA or OJ; A00+A01 pair does not clear the remaining B/backedge/address spill.", "operator": "fused_moe_i8_tn", "result": "REJECTED: both runtime clones improved stack from 36 to 20 bytes but stayed at 254 MT / 40 ST / 32768 shared / 2 warps, failing the precommitted stack=0 or MT<=250 hard gate despite passing every timing gate.", "schema_version": 1, "timestamp": "2026-08-26T11:59:27+00:00"}
{"artifacts": ["artifacts/raw/c500-runs/exp-20260826-147-c44b7a773517-a01", "artifacts/raw/c500-runs/exp-20260826-147-503fda75197d-a01", "handoffs/exp-20260826-147.md"], "baseline_commit": "2230963fdd9d6394b3b63864500ffab00818b4f0", "benchmark": "Authoritative ABBA: case1 1.0775->1.0655 ms (-1.1137%, candidate drift 4.3145%); case2 6.1645->6.3460 ms (+2.9443% regression), both arms about +2.95%; case3 0.5610->0.5680 ms (+1.2478%); case4 3.4615->3.5355 ms (+2.1378%).", "candidate_commit": "c44b7a77351793123af8fe274b24db65779fe3d9", "change": "Moved only the steady and peeled-tail A11 LDS to immediately before their first MMA(1,0,4); all STS/LDG, B LDS, barriers, MMA order, addresses, mapping, dispatch, epilogue and ABI stayed exact.", "correctness": "Independent lifecycle, synchronization and four-wave payload audit approved after metadata correction. Main-owned C500 run passed builds, 3/3 differential correctness at matched_ratio 1.0/max_abs 0, full regression, sampled/read-only checks, source/tree integrity and 31-entry manifest.", "decision": "revert", "device": "c500-local", "environment": "MetaX C500 xcore1000 device 0; MACA 3.7.1.5; MXCC 1.0.0 d9102a1572; driver 3.8.30; 25 percent compute / 16000 MiB slice; no device process before or after; NVIDIA disabled.", "hypothesis": "Moving only A11 LDS to its first MMA(1,0,4) consumer improves case2 aggregate and both arms by at least 1 percent without resource or protected regression.", "id": "exp-20260826-147", "language": "CUDA Maca", "notes": "Tested source commit c44b7a773517; queue tip 129b9bd4afe0. Candidate LF SHA-256 59117f0cd6c4ba27f23458a58b9652108f82b903bfa749b1239ac9c3fa6b5306. The 503fda source-identical run was launched by a read-only lane outside its task envelope and is retained only as an unused coordination incident; it independently reproduced the regression but its samples were not mixed into the decision. No planned repeat, profile, integration, NVIDIA or OJ; close late-A11 family.", "operator": "fused_moe_i8_tn", "result": "REJECTED: resources matched baseline at 36 stack / 254 MT / 40 ST / 32768 shared / 2 warps, but case2 and protected cases3/4 regressed beyond every timing gate.", "schema_version": 1, "timestamp": "2026-08-26T12:25:59+00:00"}
