{"artifacts": ["artifacts/raw/c500-runs/exp-20260825-096-44e58b6aa73f-a01"], "baseline_commit": "2230963fdd9d6394b3b63864500ffab00818b4f0", "benchmark": "C500-local ABBA medians baseline->candidate: case1 1.0860->1.0315 ms (-5.0184%); case2 6.1865->6.1875 ms (+0.0162%); case3 0.5665->0.5650 ms (-0.2648%); case4 3.4675->3.3290 ms (-3.9942%), arms 3.469/3.466->3.331/3.327.", "candidate_commit": "44e58b6aa73fa8fac00f8207bcd07e1c6cf2e388", "change": "Added optional fixed EM/N/K kernel template carriers and selected <true,32768,7168,2048> only for the existing exact sorted case-4 dispatch; case 2 and unsorted paths retain runtime dimensions.", "correctness": "PASS: candidate/baseline MXCC builds, 3/3 differential correctness, full regression, sampled correctness, source/tree integrity, no-process gates and all 31 manifest entries.", "decision": "keep", "device": "c500-local", "environment": "MetaX C500 device 0; xcore1000; MACA 3.7.1.5; MXCC 1.0.0 d9102a1572; driver 3.8.30; 25 percent compute / 16000 MiB slice; c500-local.", "hypothesis": "Adding only exact case-4 compile-time EM/N/K dimensions to the exp-080 formal-best source improves both case-4 C500 arms by at least 1 percent without protected aggregate regression above 0.5 percent.", "id": "exp-20260825-096", "language": "CUDA Maca", "notes": "Tested commit 44e58b6aa73fa8fac00f8207bcd07e1c6cf2e388; queue commit 135f2898a2231b9cb152ed5550ebe89673781918; workflow 41020a87289bc5b351188f35e6aad0f8dd602bfd; source blob 7e65588f77329d09c1d15c083be5f155b0fc42ec; LF SHA-256 3d80de91345e19098158cbeb2972381c07e445b698c9c8c584051fca5b2ed7b1; job blob 7f91ad9b45b58a3fa128a95aeb839c7630bc5662; manifest-file SHA-256 4cfbad2330f461ab762ddb97b1b02a241a3acb4a69986325caf3d4635663a809. No NVIDIA run; no independent audit required.", "operator": "Fused MoE i8 tn", "result": "KEEP for serialized OJ validation: both case-4 arms improve about 4 percent, protected maximum regression is 0.0162 percent, and no synchronization or mapping behavior changed.", "schema_version": 1, "timestamp": "2026-08-24T17:44:55+00:00"}
{"artifacts": ["artifacts/raw/c500-runs/exp-20260825-097-82f513d45f60-a01", "artifacts/raw/c500-runs/exp-20260825-097-82f513d45f60-a02"], "baseline_commit": "44e58b6aa73fa8fac00f8207bcd07e1c6cf2e388", "benchmark": "C500-local ABBA medians baseline->candidate: attempt 1 case2 6.1850->6.1130 ms (-1.1641 percent), arms 6.186/6.184->6.113/6.113; attempt 2 case2 6.1850->6.1060 ms (-1.2773 percent), arms 6.184/6.186->6.108/6.104. Attempt-2 protected aggregates were all favorable; attempt 1 case1 was noisy and repeat-resolved.", "candidate_commit": "82f513d45f6087a4ad385cb211584cb6b7caf66e", "change": "Changed only the exact sorted case-2 launch from <true,0,0,0> to <true,0,4096,7168>; retained exp-096 exact case4 dimensions and the complete kernel body, map, grid, barriers, epilogue and ABI.", "correctness": "PASS twice: C500 candidate/baseline MXCC builds, 3/3 differential correctness, full regression, sampled correctness, source/tree integrity, no-process gates and all 31 manifest entries.", "decision": "keep", "device": "c500-local", "environment": "MetaX C500 device 0; xcore1000; MACA 3.7.1.5; MXCC 1.0.0 d9102a1572; driver 3.8.30; 25 percent compute / 16000 MiB slice; c500-local.", "hypothesis": "Fixing only case-2 N=4096 and K=7168 while retaining runtime EM on the exp-096 source improves both C500 case-2 arms by at least 1.0 percent without stable protected regression above 0.5 percent.", "id": "exp-20260825-097", "language": "CUDA Maca", "notes": "Tested commit 82f513d45f6087a4ad385cb211584cb6b7caf66e; queue commit bf6185c1e3b55b2988a86c0206e55e6d07d87b29; workflow 24d87019bd8407d283ae69c7a532535d997a2e86; source blob 5963fb1127424102ffb937600eeeed03f4c0ee88; LF SHA-256 34b6b34f12aa603b6502d8f981254620fe92cc732eb7d7d80a6e33d9c664bf96; job blob 7f91ad9b45b58a3fa128a95aeb839c7630bc5662. No NVIDIA or OJ run; no independent audit required.", "operator": "Fused MoE i8 tn", "result": "KEEP for serialized OJ validation: both attempts and all four target arms clear 1 percent; exact repeat resolves the only borderline noisy protected aggregate.", "schema_version": 1, "timestamp": "2026-08-24T18:19:47+00:00"}
{"artifacts": ["artifacts/raw/c500-runs/exp-20260825-098-a4b3463b98e7-a01", "artifacts/raw/c500-runs/exp-20260825-098-a4b3463b98e7-a02"], "baseline_commit": "44e58b6aa73fa8fac00f8207bcd07e1c6cf2e388", "benchmark": "Attempt1 case3 0.5615->0.5560 ms (-0.9795%), arms 0.559/0.564->0.556/0.556; protected case1 +3.6486%. Attempt2 case3 0.5610->0.5500 ms (-1.9608%), arms 0.558/0.564->0.548/0.552; protected aggregates favorable.", "candidate_commit": "a4b3463b98e704c1cc313c547c647488935130b8", "change": "Narrowed only exact case-3 B, scale-B and output-row offset products to uint32_t before widening for pointer addition; all traffic, mapping, synchronization, geometry and ABI remain unchanged.", "correctness": "PASS twice: MXCC candidate/baseline builds, 3/3 differential correctness, full regression, sampled correctness, source/tree integrity, no-process gates and 31-entry manifests.", "decision": "revert", "device": "c500-local", "environment": "MetaX C500 device 0; xcore1000; MACA 3.7.1.5; MXCC 1.0.0 d9102a1572; driver 3.8.30; 25 percent compute / 16000 MiB slice; c500-local.", "hypothesis": "Case-3-only uint32_t offset products improve both decode-down C500 arms by at least 1.0 percent without protected aggregate regression above 0.5 percent.", "id": "exp-20260825-098", "language": "CUDA Maca", "notes": "Tested commit a4b3463b98e704c1cc313c547c647488935130b8; queue commit 3b0c4b54c2b1ea124bc1fa737a2fb08705207e7f; workflow 24d87019bd8407d283ae69c7a532535d997a2e86; source blob 97b93225b68e22d5404f1d1db15802280aeeab3a; LF SHA-256 937260c049c54060ba27d8c2cb8682fd3ba499e556c819c1398db77e9b93fa6b; job blob 7f91ad9b45b58a3fa128a95aeb839c7630bc5662. No NVIDIA or OJ run; no independent audit required.", "operator": "Fused MoE i8 tn", "result": "REJECTED: attempt 1 missed the strict 1 percent target in its first arm and aggregate and exceeded the protected regression gate; attempt 2 passed but did not make the repeat gate stable.", "schema_version": 1, "timestamp": "2026-08-24T18:41:49+00:00"}
{"artifacts": ["artifacts/raw/c500-runs/exp-20260825-099-d340b9762b86-a01"], "baseline_commit": "2230963fdd9d6394b3b63864500ffab00818b4f0", "benchmark": "C500-local ABBA medians baseline->candidate: case1 1.0550->1.0535 ms (-0.1422%), arms 1.074->1.080 (+0.5587%) and 1.036->1.027 (-0.8687%); case2 6.1795->6.1080 (-1.1571%); case3 0.5575->0.5420 (-2.7803%); case4 3.4595->3.3250 (-3.8878%).", "candidate_commit": "d340b9762b8615738f9b2896a4a60cadfa6fd9b6", "change": "Combined only the three exact dispatch/dimension specializations on the exp-080 formal-best source; kernel body, maps, grid, payload, barriers, mapping, epilogue and ABI remain unchanged.", "correctness": "PASS: C500 MXCC candidate/baseline builds, 3/3 differential correctness, full regression, sampled correctness, source/tree integrity and all 31 manifest entries.", "decision": "revert", "device": "c500-local", "environment": "MetaX C500 device 0; xcore1000; MACA 3.7.1.5; MXCC 1.0.0 d9102a1572; driver 3.8.30; 25 percent compute / 16000 MiB slice; run exp-20260825-099-d340b9762b86-a01; c500-local.", "hypothesis": "Combining separately proven exact case-2 N/K, case-3 EM/N/K and case-4 EM/N/K specializations retains at least 1/2/3 percent target gains in both arms and aggregate while every protected case-1 arm and aggregate stays within 0.5 percent regression.", "id": "exp-20260825-099", "language": "CUDA Maca", "notes": "Tested d340b9762b8615738f9b2896a4a60cadfa6fd9b6; metadata e3508deb1c028c0b97bf30819f5d8720fdda707b; workflow e6a68741b27c28eb4bdb5e0de11b3c31a3d6fc5b; source blob a4271d2029836a12afd3e93c81a0921b136d25f5; LF SHA-256 e84c49475f9daf52e275f105fc5bb195d12cb2f579f8fc2596fc09c9708fcd67; no NVIDIA/OJ; no independent audit required.", "operator": "Fused MoE i8 tn", "result": "REJECTED after one attempt: all target gates passed, but protected case-1 arm A regressed 0.5587 percent and exceeded the precommitted 0.5 percent per-arm gate; no attempt 2 or OJ.", "schema_version": 1, "timestamp": "2026-08-24T19:15:40+00:00"}
{"artifacts": ["artifacts/raw/c500-runs/exp-20260825-100-67a411b73d48-a01"], "baseline_commit": "2230963fdd9d6394b3b63864500ffab00818b4f0", "benchmark": "C500-local ABBA medians baseline->candidate: case1 1.0570->1.0820 ms (+2.3652%); case2 6.1805->27.3710 ms (+342.8606%), arms 6.181->27.452 and 6.180->27.290; case3 0.5585->0.5570 (-0.2686%); case4 3.4580->3.4580 (0.0000%).", "candidate_commit": "67a411b73d4886594202c3e3c4d27e01b41fd28c", "change": "Added a case-2-only compact pair builder and dual-accumulator kernel that halves modeled B global/LDS staging per M pair while retaining 16 KiB A plus 16 KiB B LDS and 256 threads.", "correctness": "PASS: independent mapping/synchronization audit approved; C500 MXCC candidate/baseline builds, 3/3 differential correctness, full regression, sampled correctness, source/tree integrity and all 31 manifest entries passed.", "decision": "revert", "device": "c500-local", "environment": "MetaX C500 device 0; xcore1000; MACA 3.7.1.5; MXCC 1.0.0 d9102a1572; driver 3.8.30; 25 percent compute / 16000 MiB slice; run exp-20260825-100-67a411b73d48-a01; c500-local.", "hypothesis": "A sorted case-2 dual-M CTA reuses one staged B tile for two same-expert M accumulator banks, improving aggregate by at least 3 percent and both arms by at least 2 percent while protected arms stay within 0.5 percent.", "id": "exp-20260825-100", "language": "CUDA Maca", "notes": "Tested 67a411b73d4886594202c3e3c4d27e01b41fd28c; metadata 49b0613b2f36c5923072542e977b9ec4c9d54ae8; workflow e6a68741b27c28eb4bdb5e0de11b3c31a3d6fc5b; source blob 1933371c51ce43c8bc4a2d3f15bb2d8cf8b60f6b; LF SHA-256 fbe7f7714869a9b22cb62002c60468fec975972a6a39185ff12a681c736de9d5; audit approve; no NVIDIA/OJ.", "operator": "Fused MoE i8 tn", "result": "REJECTED after one attempt: stable 342.8606 percent case-2 regression decisively falsifies dual-M B reuse; protected case1 also breached gate; no repeat, integration or OJ.", "schema_version": 1, "timestamp": "2026-08-24T19:34:25+00:00"}
{"artifacts": ["artifacts/raw/c500-runs/exp-20260825-101-a54af61158da-a01"], "baseline_commit": "2230963fdd9d6394b3b63864500ffab00818b4f0", "benchmark": "C500-local ABBA medians baseline->candidate: case1 1.0780->1.0620 ms (-1.4842 percent); case2 6.1805->6.1805 (0.0000 percent); case3 0.5605->0.5625 (+0.3568 percent), arms 0.558->0.562 (+0.7168 percent) and 0.563->0.563; case4 3.4625->3.4550 (-0.2166 percent).", "candidate_commit": "a54af61158da2d49fef9aa868e6469d35f7df95f", "change": "Moved only the existing read-only epilogue metadata loads into dead-fragment points of the peeled final MMA tail; preserved load/address/predicate/value multiset, MMA/shared trace, barriers, mapping, output identities, geometry, dispatch and ABI.", "correctness": "PASS: MXCC candidate/baseline builds, 3/3 differential correctness, full regression, sampled correctness, source/tree integrity, no-process gates and all 31 manifest entries.", "decision": "revert", "device": "c500-local", "environment": "MetaX C500 device 0; xcore1000; MACA 3.7.1.5; MXCC 1.0.0 d9102a1572; driver 3.8.30; 25 percent compute / 16000 MiB slice; run exp-20260825-101-a54af61158da-a01; c500-local.", "hypothesis": "Staggering the existing 16 row-metadata b32 loads and two scale-B b128 loads into peeled final-MMA fragment-death points improves at least one down case by 1.5 percent with both arms at least 1 percent, while every other arm stays within 0.5 percent.", "id": "exp-20260825-101", "language": "CUDA Maca", "notes": "Tested a54af61158da2d49fef9aa868e6469d35f7df95f; metadata fdd36d8f5b876d63e2e480243a7b90cf52d5a218; workflow 9bcacf5762060212d977b6e6869ec9129bc75d76; source blob 332639e8605024e05eaea3270b4fa1f01ef0803b; LF SHA-256 d566591042f55be980a8e54ee9bd490e4091e12ca7a5ffcb0ef8802fdfb29852; job blob 7f91ad9b45b58a3fa128a95aeb839c7630bc5662; manifest-file SHA-256 2fee9467fade48f7fde42d94298aa7dc16f3574e5f98f7ee69a18784addf72b6. No NVIDIA/OJ; no independent audit required.", "operator": "Fused MoE i8 tn", "result": "REJECTED after one attempt: neither down case reached 1.5 percent, target arms missed 1 percent, and case3 arm A breached the 0.5 percent protection gate; no repeat, integration or OJ.", "schema_version": 1, "timestamp": "2026-08-24T20:00:31+00:00"}
{"artifacts": ["artifacts/raw/c500-runs/exp-20260825-102-79b1624b0ced-a01"], "baseline_commit": "2230963fdd9d6394b3b63864500ffab00818b4f0", "benchmark": "C500-local ABBA medians baseline->candidate: case1 1.0930->1.0660 ms (-2.4703 percent); case2 6.1825->6.1840 (+0.0243 percent); case3 0.5595->0.5595 (0.0000 percent), arms exact-flat; case4 3.4610->3.4640 (+0.0867 percent), arms 3.465->3.466 and 3.457->3.462.", "candidate_commit": "79b1624b0ced3b8fe376edb50562a73507439e97", "change": "Replaced only the eight unrolled scalar accumulator conversions per row with two native MmaInt4-to-MmaFloat4 conversions; preserved accumulator identities, scaling, BF16 stores, memory/MMA/barrier trace, geometry, mapping, dispatch and ABI.", "correctness": "PASS: MXCC candidate/baseline builds, 3/3 differential correctness, full regression, sampled correctness, source/tree integrity, no-process gates and all 31 manifest entries.", "decision": "revert", "device": "c500-local", "environment": "MetaX C500 device 0; xcore1000; MACA 3.7.1.5; MXCC 1.0.0 d9102a1572; driver 3.8.30; 25 percent compute / 16000 MiB slice; run exp-20260825-102-79b1624b0ced-a01; c500-local.", "hypothesis": "Replacing each epilogue row's eight scalar int32-to-float conversions with two scoped four-lane native vector conversions improves both down-case aggregates by at least 1 percent and all target arms by at least 0.5 percent.", "id": "exp-20260825-102", "language": "CUDA Maca", "notes": "Tested 79b1624b0ced3b8fe376edb50562a73507439e97; metadata 6ed8c53a5c16b2c05a3bfa59899a0f057d0f80b7; workflow 9bcacf5762060212d977b6e6869ec9129bc75d76; source blob 40c27d4aa51ffc0de1d3edeabdfe8fd085ab14e2; LF SHA-256 e42cf1777330a7f5799fbc87e227b7f93f2a6785e33ca7471fa7e3c5d9f8c010; job blob 7f91ad9b45b58a3fa128a95aeb839c7630bc5662; manifest-file SHA-256 daa5aa77e3f86f520148bfe2fe3e4dbb9146801bf4ead7840bb6950e4bbad2b1. No NVIDIA/OJ; no independent audit required.", "operator": "Fused MoE i8 tn", "result": "REJECTED after one attempt: case3 was exactly flat and both case4 arms regressed; every target improvement threshold failed, so no repeat, integration or OJ.", "schema_version": 1, "timestamp": "2026-08-24T20:15:13+00:00"}
{"artifacts": ["artifacts/raw/c500-runs/exp-20260825-103-efded6e774cd-a01"], "baseline_commit": "2230963fdd9d6394b3b63864500ffab00818b4f0", "benchmark": "C500-local ABBA medians baseline->candidate: case1 1.0690->1.0795 ms (+0.9822 percent), arms 1.078->1.079 and 1.060->1.080 (+1.8868 percent arm B); case2 6.1630->6.1635 (+0.0081 percent); case3 0.5595->0.5595 (0.0000 percent); case4 3.4580->3.4600 (+0.0578 percent).", "candidate_commit": "efded6e774cd9eb60520efe23333783aa37b07a9", "change": "Replaced only the epilogue float values[8] array with four named MmaFloat2 pairs while preserving scalar conversions, accumulator identities, scale/BF16/store order, memory and synchronization traces, geometry, mapping, dispatch and ABI.", "correctness": "PASS: MXCC candidate/baseline builds, 3/3 differential correctness, full regression, sampled correctness, source/tree integrity, no-process gates and all 31 manifest entries.", "decision": "revert", "device": "c500-local", "environment": "MetaX C500 device 0; xcore1000; MACA 3.7.1.5; MXCC 1.0.0 d9102a1572; driver 3.8.30; 25 percent compute / 16000 MiB slice; run exp-20260825-103-efded6e774cd-a01; c500-local.", "hypothesis": "Replacing float values[8] with four named MmaFloat2 values eliminates or reduces the 36-byte stack frame and improves at least one down-case aggregate by at least 1.0 percent while every protected arm and aggregate regresses by at most 0.5 percent.", "id": "exp-20260825-103", "language": "CUDA Maca", "notes": "Tested efded6e774cd9eb60520efe23333783aa37b07a9; metadata 1313d071ddcc334ab12d6998e70914ed3c05be16; workflow 65ff14ab7a4420ef6f432bb63d354324263b4d6e; source blob 57db55249695e6091e56880893349d765162d72b; LF SHA-256 6e17f69d452f01fc500bef941d801b7b5af5742101a2fbe182cdee4a0cce6d58; job blob 7f91ad9b45b58a3fa128a95aeb839c7630bc5662; manifest-file SHA-256 af9b70bc10f7218a6328d30ad1fc1b2b26c2b1cf763a5d541d91fa5681a51fec. No NVIDIA/OJ; no independent audit required.", "operator": "Fused MoE i8 tn", "result": "REJECTED after one attempt: both MMA kernels retained the exact 36-byte stack, 254 MT, 40 ST, 32768-byte shared and staticMaxWarps/PEU 2 resources; neither down case improved and protected case1 breached aggregate and per-arm gates; no repeat, integration or OJ.", "schema_version": 1, "timestamp": "2026-08-25T16:32:43+00:00"}
{"artifacts": ["artifacts/raw/c500-runs/exp-20260826-104-85e61a24026d-a01"], "baseline_commit": "2230963fdd9d6394b3b63864500ffab00818b4f0", "benchmark": "C500-local ABBA medians baseline->candidate: case1 1.0940->1.0545 ms (-3.6106 percent, candidate drift -5.8011 percent); case2 6.1620->6.1640 (+0.0325 percent); case3 0.5575->0.5590 (+0.2691 percent); case4 3.4560->3.4570 (+0.0289 percent).", "candidate_commit": "85e61a24026da5c76e6d7186d6facd1e993a2a85", "change": "Replaced only MmaFloat2 scales[4] with one streamed scale_pair, alternating each unchanged scale FMA immediately before its unchanged value-pair FMA; all operands, output mapping, memory, synchronization, geometry, dispatch and ABI remain unchanged.", "correctness": "PASS: MXCC candidate/baseline builds, 3/3 differential correctness, full regression, sampled correctness, source/tree integrity, no-process gates and all 31 manifest entries.", "decision": "revert", "device": "c500-local", "environment": "MetaX C500 device 0; xcore1000; MACA 3.7.1.5; MXCC 1.0.0 d9102a1572; driver 3.8.30; 25 percent compute / 16000 MiB slice; run exp-20260826-104-85e61a24026d-a01; c500-local.", "hypothesis": "Streaming four simultaneously live epilogue scale pairs through one reusable MmaFloat2 lowers both MMA stack frames from 36 bytes to at most 12 bytes and improves at least one down case by at least 1 percent without protected regression.", "id": "exp-20260826-104", "language": "CUDA Maca", "notes": "Tested 85e61a24026da5c76e6d7186d6facd1e993a2a85; metadata 50bafb5193008ab0cdf3742f4283450535638fb8; workflow bf37f43870abe84f71f7e502648b7795d3982b39; source blob c346bd13617d37df1a91bab758be107f4878f415; LF SHA-256 e73ad48cb133fc0b3443c8c7ca24e57c423d022051b0af5a3d7bb1b864675f2e; job blob 7f91ad9b45b58a3fa128a95aeb839c7630bc5662; manifest-file SHA-256 c896ccd2a3c31714a8d68898b32691e04c4bf5e79a3e5240f4e76f8ef80e930a; no NVIDIA/OJ; close scale-pair live-range streaming family.", "operator": "Fused MoE i8 tn", "result": "REJECTED after one attempt: both MMA variants retained exact baseline resources of 36-byte stack, 254 MT, 40 ST, 32768 shared and staticMaxWarps/PEU 2; both down cases missed all gain gates, so no repeat, integration or OJ.", "schema_version": 1, "timestamp": "2026-08-25T16:54:33+00:00"}
{"artifacts": ["artifacts/raw/c500-runs/exp-20260826-105-b3b75ba7602e-a01", "artifacts/raw/c500-runs/exp-20260826-105-b3b75ba7602e-a02"], "baseline_commit": "2230963fdd9d6394b3b63864500ffab00818b4f0", "benchmark": "C500-local attempts 1/2: case1 1.0485->1.0720 (+2.2413 percent; arm A +6.1886 percent) and 1.0530->1.0820 (+2.7540 percent; arm A +6.5815 percent); case2 -0.0081/-0.0487 percent; case3 -2.7051/-2.6978 percent with all arms passing; case4 -3.9196/-3.9074 percent with all arms passing.", "candidate_commit": "b3b75ba7602ef13f7037415da3cadf283e3e10e1", "change": "Added only shared fixed-dimension template carriers and exact case-3/case-4 dispatch; case1, case2 and fallback remain runtime dimensions, while the kernel body, maps, memory, synchronization, geometry, epilogue and ABI remain unchanged.", "correctness": "PASS twice: MXCC candidate/baseline builds, 3/3 differential correctness, full regression, sampled correctness, source/tree integrity, no-process gates and both 31-entry manifests.", "decision": "revert", "device": "c500-local", "environment": "MetaX C500 device 0; xcore1000; MACA 3.7.1.5; MXCC 1.0.0 d9102a1572; driver 3.8.30; 25 percent compute / 16000 MiB slice; runs exp-20260826-105-b3b75ba7602e-a01/a02; c500-local.", "hypothesis": "Combining only proven exact case-3 and sorted case-4 dimensions retains at least 2 and 3 percent target gains with every target arm passing, while all case-1/case-2 arms and aggregates stay within 0.5 percent regression.", "id": "exp-20260826-105", "language": "CUDA Maca", "notes": "Tested b3b75ba7602ef13f7037415da3cadf283e3e10e1; metadata 0e1043848962f707a969b836fe52e8b4c1662f75; workflow bf37f43870abe84f71f7e502648b7795d3982b39; source blob be84f1a682c311ea0694be9885ab6ef3874a6c05; LF SHA-256 0f922248b25d563d38ec8e5392f1be5804b832870b8ca90ba79294a2cafebd68; job blob 7f91ad9b45b58a3fa128a95aeb839c7630bc5662; manifest-file SHA-256 463c6e27638bbf52776b65ea011467ff3fd8c82ae64e7866060eeda5a4e17cd3 and 924623eaf4d11c02769dde6a2c552d6649fc7556394df0f760f96df27fb5a924; no NVIDIA/OJ; close exact case3+case4 combination family.", "operator": "Fused MoE i8 tn", "result": "REJECTED after the single allowed repeat: case3 and case4 retained target gains twice and case2 stayed neutral, but protected case1 aggregate and arm A failed the strict 0.5 percent gate in both attempts; no third repeat, integration or OJ.", "schema_version": 1, "timestamp": "2026-08-25T17:04:25+00:00"}
