{"artifacts": ["artifacts/raw/remote-runs/exp-20260823-043-04228f9725c0-a01/status.json", "artifacts/raw/remote-runs/exp-20260823-043-04228f9725c0-a01/stdout.log", "artifacts/raw/remote-runs/exp-20260823-043-04228f9725c0-a01/environment.txt", "artifacts/raw/remote-runs/exp-20260823-043-04228f9725c0-a01/gpu-before.csv", "artifacts/raw/xpuoj/123337/result-summary.json", "artifacts/raw/xpuoj/123337/spj-report.txt", "artifacts/raw/xpuoj/123337/result-page.png", "artifacts/raw/xpuoj/123337/case-details.png", "artifacts/raw/xpuoj/123337/scoreboard.png"], "baseline_commit": "8c519e6c1bb57e7b124b60806db9575fa1267207", "benchmark": "proxy/NVIDIA RTX A5000 GPU 1 medians: cases 1-4 42.708, 339.006, 21.582 and 172.008 ms, one warmup and five samples. NVIDIA executes the unchanged fallback. Source model changes scale-B traffic 8192->4096 bytes/CTA and b128 loads 512->256 while adding 2048 scalar shuffles. Target/C500 XPU-OJ #123337: case scores 83/73/88/83; exact user-kernel times 1.018/8.206/0.562/4.247 ms; 81.75 total versus the 82.25 formal best.", "candidate_commit": "86efc75a440a35ea54dab84cd31ad6b8af08b57f", "change": "Made lanes 0..15 of each width-32 subgroup issue the original two predicated b128 scale-B loads, then used eight uniform width-32 shuffles to populate unchanged col_scale vectors for all lanes. Matrix/shared pipeline, LDS, barriers, CTA geometry, stores and all other traffic are unchanged.", "correctness": "PASS on committed proxy/NVIDIA snapshot 04228f9725c00067be6d35f47c7b192c7876b768: exact formal-best reconstruction; CUDA 12.2 build; three differential cases matched_ratio=1/max_abs=0; exhaustive 256-thread peer/address/predicate/payload identity, producer initialization, subgroup cover, traffic and read-only regressions; empty stderr. Independent detached audit at final tip 86efc75a440a35ea54dab84cd31ad6b8af08b57f re-derived provenance, width-32 grouping, reconvergence, 2,048 payload identities and exact counts and approved one target validation. XPU-OJ submission #123337 then compiled for xcore1000 and passed 4/4 target correctness.", "decision": "revert", "device": "nvidia+xpuoj/c500", "environment": "proxy/NVIDIA physical GPU 1 RTX A5000; UUID GPU-81000a12-3d75-397b-e816-43e13849f697; driver 535.261.03; CUDA 12.2 nvcc V12.2.140; sm_86; run exp-20260823-043-04228f9725c0-a01 at 2026-08-23T09:45:28+08:00; target XPU-OJ xcore1000 submission #123337 at 2026-08-23T10:55:33+08:00", "hypothesis": "Within each width-32 subgroup, 16 producer lanes can load the two identical scale-B vectors once and broadcast eight float words to their paired consumers, halving per-CTA scale-B global traffic while preserving exact output bits and potentially improving one displayed C500 case.", "id": "exp-20260823-043", "language": "CUDA Maca (target width-32 scale-B wave broadcast plus NVIDIA compatibility path)", "notes": "Candidate LF source SHA-256 9c125db78326a3797a6686899390839577f5070afcfd7f08a99cbaf7fc58aa27; remote-tested commit 04228f9725c00067be6d35f47c7b192c7876b768; final queued handoff tip 86efc75a440a35ea54dab84cd31ad6b8af08b57f; integrated/submitted commit 093081b30da7573048227882f043035ea641d39a. Target cases 83/73/88/83 with exact user-kernel times 1.018/8.206/0.562/4.247 ms scored 81.75 at rank 25, 0.50 below formal best. Reject the scale-B shuffle trade and restore exact formal-best source.", "operator": "Fused MoE i8 tn", "result": "TARGET ACCEPTED 4/4 / 81.75: XPU-OJ #123337 preserved correctness but scored 0.50 below formal best; formal best remains #117114 and the candidate is reverted.", "schema_version": 1, "submission_id": "123337", "target_cases": [83, 73, 88, 83], "target_commit": "093081b30da7573048227882f043035ea641d39a", "target_rank": 25, "target_score": 81.75, "target_times_ms": [1.018, 8.206, 0.562, 4.247], "timestamp": "2026-08-23T09:45:28+08:00"}
{"artifacts": ["artifacts/raw/remote-runs/exp-20260823-044-cbe714f6d622-a01/status.json", "artifacts/raw/remote-runs/exp-20260823-044-cbe714f6d622-a01/stdout.log", "artifacts/raw/remote-runs/exp-20260823-044-cbe714f6d622-a01/environment.txt", "artifacts/raw/remote-runs/exp-20260823-044-cbe714f6d622-a01/gpu-before.csv", "artifacts/raw/xpuoj/123400/result-summary.json", "artifacts/raw/xpuoj/123400/spj-report.txt", "artifacts/raw/xpuoj/123400/result-page.png", "artifacts/raw/xpuoj/123400/case-details.png", "artifacts/raw/xpuoj/123400/scoreboard.png"], "baseline_commit": "8c519e6c1bb57e7b124b60806db9575fa1267207", "benchmark": "proxy/NVIDIA RTX A5000 GPU 2 medians: cases 1-4 45.508, 330.757, 21.005 and 167.564 ms, one warmup and five samples; NVIDIA executes the unchanged fallback. Target/C500 XPU-OJ #123400: case scores 58/53/84/76; exact user-kernel times 3.666/20.020/0.804/6.723 ms; 67.75 total versus the 82.25 formal best.", "candidate_commit": "9a010dd4122d8c4e603e2acc01b5769f051377a1", "change": "Replaced the target 128x128x128 resident tile with an exact 128x128x64 single-buffer pipeline: 8+8 KiB A/B shared, two A and two B producer vectors per thread, 2x4 A and 8x4 B fragments, 64 MMA per K64 tile, and a uniform overwrite/publish barrier pair. Aggregate global/shared bytes, MMA arithmetic, 4x1 output geometry, epilogue, dispatch and NVIDIA fallback remain unchanged; dynamic barriers become 223/63 instead of 111/31.", "correctness": "PASS on committed proxy/NVIDIA snapshot cbe714f6d622649862a33518d3a2bc91264d0777: exact formal-best protected projection; CUDA 12.2 build; three differential cases matched_ratio=1/max_abs=0; exhaustive 512+512 producer bijections, 2048 A and 8192 B fragment-word identities, 16 chains, 1/2/32/112-tile lifecycle, traffic/output/read-only regressions; empty stderr. Independent detached audit at final tip 9a010dd4122d8c4e603e2acc01b5769f051377a1 re-derived mapping, synchronization, tile order and traffic and approved one target validation. XPU-OJ submission #123400 then compiled for xcore1000 and passed 4/4 target correctness.", "decision": "revert", "device": "nvidia+xpuoj/c500", "environment": "proxy/NVIDIA physical GPU 2 RTX A5000; UUID GPU-8dc94d4a-f03d-678c-325a-1db5f31daf9e; driver 535.261.03; CUDA 12.2 nvcc V12.2.140; sm_86; run exp-20260823-044-cbe714f6d622-a01 at 2026-08-23T10:14:58+08:00; target XPU-OJ xcore1000 submission #123400 at 2026-08-23T11:54:11+08:00", "hypothesis": "Halving the MMA K tile from 128 to 64 will trade doubled single-buffer barriers for 16-KiB shared allocation and halved resident fragment state, improving a displayed C500 case by about one percent or one score step if occupancy is limiting.", "id": "exp-20260823-044", "language": "CUDA Maca (target K64 MMA pipeline plus NVIDIA compatibility path)", "notes": "Candidate LF source SHA-256 63fc0d8e17fe0c95aa6f370e32695a40251096e0af7a0506bbb808d20aa4a3f6; remote-tested source/job commit cbe714f6d622649862a33518d3a2bc91264d0777; final queued handoff tip 9a010dd4122d8c4e603e2acc01b5769f051377a1; integrated/submitted commit 5a5fcb5b43da2c624948217a6fb308c8a8fdf8cd. Target cases 58/53/84/76 with exact user-kernel times 3.666/20.020/0.804/6.723 ms scored 67.75 at rank 25, 14.50 below formal best. The 16-KiB allocation and source-state reduction did not offset doubled barriers or target lowering costs; reject and restore the exact formal-best source.", "operator": "Fused MoE i8 tn", "result": "TARGET ACCEPTED 4/4 / 67.75 REGRESSION: XPU-OJ #123400 preserved correctness but regressed every displayed case; formal best remains #117114 and the candidate is reverted.", "schema_version": 1, "submission_id": "123400", "target_cases": [58, 53, 84, 76], "target_commit": "5a5fcb5b43da2c624948217a6fb308c8a8fdf8cd", "target_rank": 25, "target_score": 67.75, "target_times_ms": [3.666, 20.02, 0.804, 6.723], "timestamp": "2026-08-23T10:14:58+08:00"}
{"artifacts": ["artifacts/raw/remote-runs/exp-20260823-045-45172470874e-a01/status.json", "artifacts/raw/remote-runs/exp-20260823-045-45172470874e-a01/stdout.log", "artifacts/raw/remote-runs/exp-20260823-045-45172470874e-a01/environment.txt", "artifacts/raw/remote-runs/exp-20260823-045-45172470874e-a01/gpu-before.csv", "artifacts/raw/xpuoj/123488/result-summary.json", "artifacts/raw/xpuoj/123488/spj-report.txt", "artifacts/raw/xpuoj/123488/result-page.png", "artifacts/raw/xpuoj/123488/case-details.png", "artifacts/raw/xpuoj/123488/scoreboard.png"], "baseline_commit": "8c519e6c1bb57e7b124b60806db9575fa1267207", "benchmark": "proxy/NVIDIA RTX A5000 GPU 3 five-sample medians: cases 1-4 45.515, 328.517, 20.847 and 165.237 ms after one warmup; sampled correctness PASS. NVIDIA executes the unchanged fallback. Target/C500 XPU-OJ #123488 compiled for xcore1000 but failed the sample with matched_ratio 0.130741 and max_abs_diff 294.0; its diagnostic timing payload was 1.175 ms versus 5.828 ms baseline, but no performance conclusion is valid because correctness failed.", "candidate_commit": "017e5a8bc55159b515d5091a9b940cd1c0a18231", "change": "Replaced the target steady four-A plus four-B register LDG and eight ordinary STS paths with eight contiguous direct BSM issues after the final current-tile LDS, followed by arrive(64) plus barrier_inst before the next LDS. The last-tile prologue now fully stores A0..A3/B0..B3 and scopes staging registers before its barrier; stale peeled-tail A2/A3 stores are removed. K128, 128x128 output, 256 threads, 32-KiB LDS, matrix bytes/arithmetic, MMA/LDS order and 111/31 boundaries remain unchanged.", "correctness": "PASS on committed proxy/NVIDIA snapshot 45172470874e073481f4c14ee4fb259b09b8a91b and independent static synchronization audit: exact formal-best reconstruction; exhaustive 1024-vector/16384-byte A and B source/destination images; T=1/2/16/56 lifecycle and 2T-1 boundaries; CUDA 12.2 build; three fallback differential cases matched_ratio=1/max_abs=0; allocation/grid/output/A-bound/read-only regressions; empty stderr. XPU-OJ #123488 then compiled for xcore1000 but failed the first sample: matched_ratio=0.130741, max_abs_diff=294.0 at (1280,855), target=-154.0 versus ref=140.0; all four scored cases were skipped.", "decision": "revert", "device": "nvidia+xpuoj/c500", "environment": "proxy/NVIDIA physical GPU 3 RTX A5000; UUID GPU-afb2badc-bdd8-5ca7-f48c-ea3ffdb05e37; driver 535.261.03; CUDA 12.2 nvcc V12.2.140; sm_86; run exp-20260823-045-45172470874e-a01 at 2026-08-23T12:47:23+08:00; start gate 0 percent utilization, 9 MiB and no compute process; target XPU-OJ xcore1000 submission #123488 at 2026-08-23T13:16:43+08:00", "hypothesis": "Replacing all eight steady next-tile LDG-to-register plus STS paths with one contiguous A0..A3/B0..B3 BSM batch and an arrive(64) count-zero wait preserves the 32-KiB K128 core while removing enough steady staging state and instructions to improve one displayed C500 score step.", "id": "exp-20260823-045", "language": "CUDA Maca (target full A+B count-zero BSM plus NVIDIA compatibility path)", "notes": "Candidate LF source SHA-256 57e4e73615a3dbeba8315ebadea646bdf00127b6d712be82fbd736f1fb2baaaa; source blob aa5d0945f695d040bcba171852be68315e36d71b; remote-tested source/tests/job commit 45172470874e073481f4c14ee4fb259b09b8a91b; final queued handoff tip 017e5a8bc55159b515d5091a9b940cd1c0a18231; integrated/submitted commit 28b51c6a777f927a82358c0db7c836c31ab87f01. MXCC accepted the BSM helpers, but target output rejected the count-zero full A+B completion/visibility model. Score 0, rank 25, formal best remains #117114; reject the mechanism and restore exact formal-best source.", "operator": "Fused MoE i8 tn", "result": "TARGET WRONG ANSWER / 0: XPU-OJ #123488 compiled but failed the sample and skipped all four scored cases; full A+B single-buffer count-zero BSM is target-rejected, formal best remains #117114, and the candidate is reverted.", "schema_version": 1, "submission_id": "123488", "target_cases": ["Skipped", "Skipped", "Skipped", "Skipped"], "target_commit": "28b51c6a777f927a82358c0db7c836c31ab87f01", "target_rank": 25, "target_sample": {"matched_ratio": 0.130741, "max_abs_diff": 294.0, "coordinate": [1280, 855], "target": -154.0, "reference": 140.0, "time_ms": 1.175, "tb_time_ms": 5.828, "speedup": 4.96, "pass": false}, "target_score": 0, "timestamp": "2026-08-23T12:47:23+08:00"}
{"artifacts": ["artifacts/raw/remote-runs/exp-20260823-046-6668338b6a37-a01/status.json", "artifacts/raw/remote-runs/exp-20260823-046-6668338b6a37-a01/stdout.log", "artifacts/raw/remote-runs/exp-20260823-046-6668338b6a37-a01/environment.txt", "artifacts/raw/remote-runs/exp-20260823-046-6668338b6a37-a01/gpu-before.csv"], "baseline_commit": "8c519e6c1bb57e7b124b60806db9575fa1267207", "benchmark": "Proxy/NVIDIA RTX A5000 GPU 2 five-sample medians were 41.692, 330.749, 21.005 and 167.604 ms for cases 1-4. NVIDIA executes the unchanged fallback and provides no C500 performance evidence.", "candidate_commit": "db1f4428355912eb0fe73481574f9f666506ff42", "change": "Replaced eight formal-best steady LDG-plus-STS paths with flat-pointer is_async=false BSM at the corresponding STS sites, retained six ordinary initial prologue paths, replaced only the second steady shared barrier with exact __syncthreads, and used two A2/A3 BSM copies in the peeled tail.", "correctness": "Proxy/NVIDIA committed provenance, CUDA fallback build, three differential cases, exact A/B 1024-vector mappings, public bounds, read-only checks, T=1/2/16/56 labels and reverse-to-best hash passed. Independent detached audit rejected target correctness because A2/A3 same-wave cross-lane LDS occurs before any documented BSM completion primitive, including the T=1 peeled tail.", "decision": "revert", "device": "nvidia", "environment": "proxy/NVIDIA physical GPU 2 RTX A5000; UUID GPU-8dc94d4a-f03d-678c-325a-1db5f31daf9e; driver 535.261.03; CUDA 12.2 nvcc V12.2.140; sm_86; run exp-20260823-046-6668338b6a37-a01 at 2026-08-23T15:08:03+08:00; target MACA branch not executed", "hypothesis": "Replacing each steady register LDG plus ordinary STS path at its formal-best safe overwrite point with flat-pointer ldg_b128_bsm using is_async=false and a documented __syncthreads completion boundary preserves the single-image lifetime while removing vector staging work and may improve one displayed C500 score step.", "id": "exp-20260823-046", "language": "CUDA Maca (target compiler-managed six-plus-two BSM experiment plus NVIDIA compatibility path)", "notes": "Candidate LF SHA-256 353d324b9d4e1fc7514b2774c77bcd22a5b8e4ec2dfc358f8522f27980e2ecbc; remote-tested commit 6668338b6a37c25b4c5907ffb7ab49a67d7a1869; final queued handoff tip db1f4428355912eb0fe73481574f9f666506ff42. Detached audit independently confirmed provenance, addresses, mappings and the six B/A0/A1 paths, but found A2/A3 same-wave cross-lane consumers precede completion. Candidate rejected without integration or OJ; next experiment must restore A2/A3 ordinary staging.", "operator": "Fused MoE i8 tn", "result": "AUDIT REJECTED before integration: B0-B3 and A0/A1 are behind the documented uniform __syncthreads boundary, but A2/A3 are read before completion and make the committed candidate unsafe.", "schema_version": 1, "timestamp": "2026-08-23T07:30:01+00:00"}
{"artifacts": ["artifacts/raw/remote-runs/exp-20260823-047-bb602390f4d5-a01/status.json", "artifacts/raw/remote-runs/exp-20260823-047-bb602390f4d5-a01/stdout.log", "artifacts/raw/remote-runs/exp-20260823-047-bb602390f4d5-a01/environment.txt", "artifacts/raw/remote-runs/exp-20260823-047-bb602390f4d5-a01/gpu-before.csv", "artifacts/raw/xpuoj/123700/result-summary.json", "artifacts/raw/xpuoj/123700/spj-report.txt", "artifacts/raw/xpuoj/123700/result-page.png", "artifacts/raw/xpuoj/123700/case-details.png", "artifacts/raw/xpuoj/123700/scoreboard.png"], "baseline_commit": "8c519e6c1bb57e7b124b60806db9575fa1267207", "benchmark": "proxy/NVIDIA RTX A5000 GPU 3 five-sample medians: cases 1-4 45.541, 328.534, 20.898 and 166.299 ms. NVIDIA executes the unchanged fallback. Target/C500 XPU-OJ #123700 compiled for xcore1000 but failed the sample with matched_ratio 0.130758 and max_abs_diff 294.5; its diagnostic timing payload was 1.073 ms versus 5.829 ms baseline, but no performance conclusion is valid because correctness failed.", "candidate_commit": "b7244b4946214425d42a4428652bd21b93890ee8", "change": "Converted exactly six steady B0-B3/A0-A1 LDG-plus-STS paths to flat-pointer is_async=false BSM at their old STS sites; retained formal-best A2/A3 register LDG/STS in steady and peeled tail; changed only the second steady completion boundary to exact __syncthreads. Bytes, MMA/LDS order, 32 KiB LDS, 256 threads, CTA/grid, epilogue and 2T-1 barriers are unchanged.", "correctness": "PASS on committed proxy/NVIDIA snapshot bb602390f4d57fbdcb826a3f679d956b4376e6fc and independent static synchronization audit: exact formal-best reconstruction; 1024-vector A/B bijections; pending-until-__syncthreads lifecycle; exact ordinary A2/A3 rotation including 504 same-wave cross-lane reads; T=1/2/16/56; CUDA 12.2 build; three fallback differential cases matched_ratio=1/max_abs=0; regression/read-only/workflow gates. XPU-OJ #123700 then compiled for xcore1000 but failed the sample: matched_ratio=0.130758, max_abs_diff=294.5 at (836,4021), target=-167.0 versus ref=127.5; all four scored cases were skipped.", "decision": "revert", "device": "nvidia+xpuoj/c500", "environment": "proxy/NVIDIA physical GPU 3 RTX A5000; UUID GPU-afb2badc-bdd8-5ca7-f48c-ea3ffdb05e37; driver 535.261.03; CUDA 12.2 nvcc V12.2.140; sm_86; run exp-20260823-047-bb602390f4d5-a01 at 2026-08-23T15:57:31+08:00; target XPU-OJ xcore1000 submission #123700 at 2026-08-23T16:27:12+08:00", "hypothesis": "Replacing only steady B0-B3 and A0-A1 register LDG plus ordinary STS with flat-pointer is_async=false BSM completed by the existing uniform __syncthreads removes most steady staging work while preserving the formal-best A2/A3 lifecycle and may improve one displayed C500 score step.", "id": "exp-20260823-047", "language": "CUDA Maca (target safe six-path compiler-managed BSM plus NVIDIA compatibility path)", "notes": "Candidate LF SHA-256 7cdeb1907d95995a8f3898c08c1369b65e26c13578296c335136efc99ac3a991; source blob a88841a51174c938c8e1275a409ca1609607f5d8; remote-tested commit bb602390f4d57fbdcb826a3f679d956b4376e6fc; final queued handoff tip b7244b4946214425d42a4428652bd21b93890ee8; integrated/submitted commit 384e2206d2623a7ba557c9f1d7de9e0f86d23fde. MXCC accepted the BSM helpers and uniform __syncthreads, but target output rejected the safe-six is_async=false completion/visibility model. Score 0, rank 25, formal best remains #117114; reject the mechanism and restore exact formal-best source.", "operator": "Fused MoE i8 tn", "result": "TARGET WRONG ANSWER / 0: XPU-OJ #123700 compiled but failed the sample and skipped all four scored cases; safe-six compiler-managed BSM is target-rejected, formal best remains #117114, and the candidate is reverted.", "schema_version": 1, "submission_id": "123700", "target_cases": ["Skipped", "Skipped", "Skipped", "Skipped"], "target_commit": "384e2206d2623a7ba557c9f1d7de9e0f86d23fde", "target_rank": 25, "target_sample": {"matched_ratio": 0.130758, "max_abs_diff": 294.5, "coordinate": [836, 4021], "target": -167.0, "reference": 127.5, "time_ms": 1.073, "tb_time_ms": 5.829, "speedup": 5.432432, "pass": false}, "target_score": 0, "timestamp": "2026-08-23T08:18:17+00:00"}
{"artifacts": ["handoffs/exp-20260823-050.md"], "baseline_commit": "8c519e6c1bb57e7b124b60806db9575fa1267207", "benchmark": "Not run: mandatory feasibility stop fired before implementation; no documented predicated b128 store exists and unchanged proxy fallback would provide no target evidence.", "candidate_commit": "5a0156d7908ece612824ccef2872660166a4cc0b", "change": "Feasibility analysis only: official-source intrinsic inventory and exhaustive 256-thread output mapping; submission source, tests and remote jobs remain unchanged.", "correctness": "No executable candidate. Exhaustive mapping proved 4096 b64 stores cover 16384 unique scalars exactly once; every same-thread pair is separated by 64 BF16 elements (128 bytes), with zero adjacent pairs.", "decision": "revert", "device": "cpu", "environment": "local Windows PowerShell read-only source analysis; official clone revisions 4f2aa14e92353e382e59bae98abe2c19e652ebd7 and ec06df190bce1a32b6a7ecda929255202021ab65; no local MXCC/SDK and no GPU run", "hypothesis": "A documented predicated b128 global store could replace each current same-row pair of b64 output stores and halve store instructions without changing bytes or mapping.", "id": "exp-20260823-050", "language": "CUDA Maca", "notes": "Handoff-only evidence commit 5a0156d7908ece612824ccef2872660166a4cc0b. Submission source remains formal-best LF SHA-256 bed1887e257f7a513d4ba4db10d5e5ac88ccecf6377d24d4ca3f521fbd795b61 and Git blob 58c7b2418012303666a4d239974d7be7278a86f9. Close widened-output-store family absent documented ABI and a separately proven value-owner remap.", "operator": "Fused MoE i8 tn", "result": "REJECTED before implementation: official source exposes only stg_b64_predicator, and current same-thread b64 values are nonadjacent. A legal b128 replacement requires an undocumented intrinsic plus denylisted cross-lane remapping.", "schema_version": 1, "timestamp": "2026-08-23T10:09:47+00:00"}
