{"artifacts": ["artifacts/raw/remote-runs/exp-20260823-058-446118225a16-a01/status.json", "artifacts/raw/remote-runs/exp-20260823-058-446118225a16-a01/stdout.log", "artifacts/raw/remote-runs/exp-20260823-058-446118225a16-a01/environment.txt", "artifacts/raw/remote-runs/exp-20260823-058-446118225a16-a01/gpu-before.csv"], "baseline_commit": "8c519e6c1bb57e7b124b60806db9575fa1267207", "benchmark": "proxy/NVIDIA GPU 4 A+B+C net overhead median/p95: all-same 7.168/8.192 us, mixed 8.192/9.216 us, all-unique 19.456/21.504 us; all below the 81-us gate. NVIDIA executes a lightweight B/C ownership proxy and cannot establish MACA MMA timing or C500 cache benefit.", "candidate_commit": "f3f974c4d86693d6fc855bb016215b792b8cf3af", "change": "Case-2-only A+B+C launch sequence: publish a 256-entry pair map in output scratch, run the unchanged 256-thread 32-KiB 128x128x128 body with leader/follower pairing, then rerun exact formal-best tile zero to erase scratch; other shapes and fallback unchanged.", "correctness": "PASS on committed proxy snapshot 446118225a164461cbeeeb0859277a1d52ec9411: exact formal-best reconstruction, CUDA builds, three differential cases, exhaustive 9840 short patterns, all-same/mixed/all-unique 256-tile maps, exact M/N ownership, 1-KiB scratch bounds, 1-MiB overwrite, input read-only, and workflow regression. Independent audit approved map publication, alias/alignment, follower return, same-expert ownership, tile-zero overwrite, and paired-loop barrier.", "decision": "keep", "device": "nvidia", "environment": "proxy/NVIDIA physical GPU 4 RTX A5000; driver 535.261.03; CUDA 12.2 nvcc 12.2.140; run exp-20260823-058-446118225a16-a01; MACA paired body not compiled", "hypothesis": "One 256-thread preprocessing CTA can publish same-expert pairs through the first 1 KiB of out so case-2 leaders reuse B across arbitrary M tiles while an ordered tile-zero launch erases all scratch, with complete A+B+C control overhead below 81 us median and p95.", "id": "exp-20260823-058", "language": "CUDA Maca", "notes": "Remote-tested commit 446118225a164461cbeeeb0859277a1d52ec9411; queue tip f3f974c4d86693d6fc855bb016215b792b8cf3af; LF source SHA-256 a1cbab38db9f526781dfbce13c3a337e434a192b8553067aa4d1e2c5a5f52f51. Independent audit recommendation approve. Residual risks are target-only MXCC output type-punning/lowering, launch and tile-zero tail cost, and actual C500 B-cache reuse.", "operator": "Fused MoE i8 tn", "result": "KEEP for direct C500 validation after workflow integration: all assigned source, correctness, ownership, overwrite, regression, and control-overhead gates passed; no blocking independent-audit finding.", "schema_version": 1, "timestamp": "2026-08-23T15:16:35+00:00"}
{"artifacts": ["artifacts/raw/c500-runs/exp-20260823-059-416d6e92a56b-a01/status.json", "artifacts/raw/c500-runs/exp-20260823-059-416d6e92a56b-a01/paired-benchmark.json", "artifacts/raw/c500-runs/exp-20260823-059-416d6e92a56b-a01/correctness.log", "artifacts/raw/c500-runs/exp-20260823-059-416d6e92a56b-a01/regression.log", "artifacts/raw/c500-runs/exp-20260823-059-416d6e92a56b-a01/result-manifest.sha256"], "baseline_commit": "8c519e6c1bb57e7b124b60806db9575fa1267207", "benchmark": "C500-local ABBA paired medians baseline/candidate: decode gate-up 1.090/1.085 ms (-0.459%); prefill gate-up 8.213/8.4515 ms (+2.904% regression); decode down 0.5675/0.5665 ms (-0.176%); prefill down 4.196/4.177 ms (-0.453%).", "candidate_commit": "dc51495e1dc2dd51ae903737965ddbfb5111a73f", "change": "Replayed the exact exp-058 source on the C500-native workflow: a 256-entry pair-map launch, leader/follower paired case-2 MMA launch, and exact-best tile-zero cleanup launch; other shapes remain on the formal-best path.", "correctness": "PASS: CUCC/MXCC builds, random boundary/two-expert/INT8-extreme correctness, full regression, sampled correctness in every ABBA arm, source/tree integrity and 31-entry result manifest all passed.", "decision": "revert", "device": "c500-local", "environment": "MetaX C500 device 0; xcore1000; MACA 3.7.1.5; MXCC 1.0.0 d9102a1572; driver 3.8.30; 25% compute and 16000 MiB slice; post-warmup xcore 1125 MHz; run exp-20260823-059-416d6e92a56b-a01.", "hypothesis": "The audited output-scratch same-expert M-tile pairing path will improve C500-local prefill gate-up enough to outweigh preprocessing and tile-zero cleanup.", "id": "exp-20260823-059", "language": "CUDA Maca", "notes": "Tested commit 416d6e92a56b07bd043b3c2b57b9b82f12e52a63; final metadata-only queue commit dc51495e1dc2dd51ae903737965ddbfb5111a73f; candidate blob 686a676e79f97cbba5b7f8f6ccfab1c759c0ef3e and LF SHA-256 a1cbab38db9f526781dfbce13c3a337e434a192b8553067aa4d1e2c5a5f52f51; baseline LF SHA-256 bed1887e257f7a513d4ba4db10d5e5ac88ccecf6377d24d4ca3f521fbd795b61. Migrated from exp-058 after C500 workflow integration; no OJ submission.", "operator": "Fused MoE i8 tn", "result": "REJECTED: the only targeted workload, prefill gate-up, regressed 2.904%; do not submit to OJ and close output-scratch expert pairing.", "schema_version": 1, "timestamp": "2026-08-23T15:41:12+00:00"}
{"artifacts": [], "baseline_commit": "8c519e6c1bb57e7b124b60806db9575fa1267207", "benchmark": "Not run: independent audit rejected the combined mechanism before the serialized C500 gate.", "candidate_commit": "3b879f2ec10df827d3d82f00438df1a4cc83f87c", "change": "Added a case-2-only 512-thread, eight-wave 4M x 2N kernel, but also replaced the formal-best interleaved instruction schedule with a materially different batched LDG/LDS/STS/MMA pipeline.", "correctness": "PASS by independent exhaustive audit for 1024/1024 A/B vectors, 512 aggregate MMA identities, all 16384 output coordinates, exact scale/store addressing, read-only inputs and T=1/2/56 shared-memory lifecycles with 2T-1 barriers; target build/correctness was intentionally not run after attribution failed.", "decision": "revert", "device": "local-audit", "environment": "Read-only detached audit at exact candidate 3b879f2ec10df827d3d82f00438df1a4cc83f87c; no C500, NVIDIA or OJ access.", "hypothesis": "Splitting the formal four-wave ownership into eight 4M x 2N waves will lower per-wave state and hide case-2 VLS/global-read latency without changing the formal-best issue schedule.", "id": "exp-20260824-062", "language": "CUDA Maca", "notes": "Workflow base 7b305b54856fc9ece1c03f38f825291964e79494; candidate LF source SHA-256 7f2896c124cd351a7b0011364c64319f9e557f488f076c78fe57a6df10529a63. Audit found mapping and synchronization correct but attribution invalid because the candidate also changes global-load overlap, LDS-to-MMA distance, STS overlap, accumulator issue order and barrier-adjacent placement. Successor exp-20260824-063 replays only ownership with the formal-best schedule.", "operator": "Fused MoE i8 tn", "result": "AUDIT NEEDS-FIX: do not run C500 or submit OJ; preserve the mapping proof and rebuild the candidate as a single-variable formal-schedule successor.", "schema_version": 1, "timestamp": "2026-08-23T17:46:55+00:00"}
{"artifacts": ["artifacts/raw/c500-runs/exp-20260824-061-126fd0fd1cc2-a01/status.json", "artifacts/raw/c500-runs/exp-20260824-061-126fd0fd1cc2-a01/paired-benchmark.json", "artifacts/raw/c500-runs/exp-20260824-061-126fd0fd1cc2-a01/result-manifest.sha256", "artifacts/raw/c500-runs/exp-20260824-061-126fd0fd1cc2-a02/status.json", "artifacts/raw/c500-runs/exp-20260824-061-126fd0fd1cc2-a02/paired-benchmark.json", "artifacts/raw/c500-runs/exp-20260824-061-126fd0fd1cc2-a02/result-manifest.sha256"], "baseline_commit": "8c519e6c1bb57e7b124b60806db9575fa1267207", "benchmark": "C500-local attempts a01/a02 candidate latency deltas versus paired baseline: decode gate-up -0.730%/+0.370%; prefill gate-up -0.121%/-1.239%; decode down -1.826%/-1.756%; prefill down -2.196%/-1.971%. The lone regression is below 0.5%; down cases improve consistently and prefill gate-up reaches the 1% gate.", "candidate_commit": "5dd17c8f4c40de7985c3145fff390f7b927560e0", "change": "Replaced indexed MmaLoad128 A/B payload arrays with eight literal scalar destinations while preserving all LDG/STS addresses, predicates, traffic, issue positions, shared layout, MMA/LDS/barrier schedule, geometry and output.", "correctness": "PASS on two verified C500 attempts: CUCC/MXCC build, three correctness cases, full regression, sampled correctness, source/tree integrity, four-case ABBA schema and result manifests all passed.", "decision": "keep", "device": "c500-local", "environment": "MetaX C500 device 0; xcore1000; MACA 3.7.1.5; MXCC 1.0.0 d9102a1572; driver 3.8.30; 25% compute and 16000 MiB slice; runs exp-20260824-061-126fd0fd1cc2-a01 and a02.", "hypothesis": "Scalarizing the eight staged b128 payload destinations will reduce target load-state indexing or spill pressure enough to improve prefill gate-up by at least 1% without a stable regression above 0.5%.", "id": "exp-20260824-061", "language": "CUDA Maca", "notes": "Tested commit 126fd0fd1cc2d1d0a75c2c4c2735a258bd223407; metadata-only queue commit 5dd17c8f4c40de7985c3145fff390f7b927560e0; candidate source blob 23c33e6c177a6492b06a07833be3bfc84827387a; LF SHA-256 c3da111595e1798f288d2b2ead321cff11c2aa30fb6df9122989d03f593f907d; baseline LF SHA-256 bed1887e257f7a513d4ba4db10d5e5ac88ccecf6377d24d4ca3f521fbd795b61. No NVIDIA run.", "operator": "Fused MoE i8 tn", "result": "KEEP for OJ validation: two independent C500 attempts preserve correctness and show repeatable 1.8-2.2% down-case improvement, with non-regressing prefill gate-up that reaches 1.239% in attempt two.", "schema_version": 1, "timestamp": "2026-08-23T18:12:14+00:00"}
{"artifacts": ["artifacts/raw/c500-runs/exp-20260824-060-2ea3dbcce6ff-a01/status.json", "artifacts/raw/c500-runs/exp-20260824-060-2ea3dbcce6ff-a01/paired-benchmark.json", "artifacts/raw/c500-runs/exp-20260824-060-2ea3dbcce6ff-a01/correctness.log", "artifacts/raw/c500-runs/exp-20260824-060-2ea3dbcce6ff-a01/regression.log", "artifacts/raw/c500-runs/exp-20260824-060-2ea3dbcce6ff-a01/result-manifest.sha256"], "baseline_commit": "8c519e6c1bb57e7b124b60806db9575fa1267207", "benchmark": "C500-local ABBA paired medians baseline/candidate: decode gate-up 1.057/1.103 ms (+4.352% regression); prefill gate-up 8.2665/8.475 ms (+2.522% regression); decode down 0.5675/0.5675 ms (0.000%); prefill down 4.192/4.214 ms (+0.525% regression).", "candidate_commit": "97e9f026adb0967940577244a50f11bed0350896", "change": "For case 2 only, waves 0/2 retained early-B scheduling while waves 1/3 issued A0/A1 early and B0-B3 later; addresses, load counts, STS/LDS/MMA positions, barriers, geometry, traffic and output remained unchanged.", "correctness": "PASS: C500 CUCC/MXCC build, three correctness cases, full regression, sampled correctness, source/tree integrity, four-case ABBA schema and manifest all passed. Independent read-only audit approved address, coverage, wave-uniform control and synchronization safety.", "decision": "revert", "device": "c500-local", "environment": "MetaX C500 device 0; xcore1000; MACA 3.7.1.5; MXCC 1.0.0 d9102a1572; driver 3.8.30; 25% compute and 16000 MiB slice; run exp-20260824-060-2ea3dbcce6ff-a01.", "hypothesis": "Wave-phasing case-2 b128 loads across alternating waves will reduce VLS contention and improve prefill gate-up by at least 1% without a stable regression above 0.5%.", "id": "exp-20260824-060", "language": "CUDA Maca", "notes": "Tested commit 2ea3dbcce6ff510b1c346634e14e1e6f39bb66dd; metadata-only queue commit 97e9f026adb0967940577244a50f11bed0350896; source blob 819d5669de9a8ddc6cd420c4d77b7b4b697d4b6e; LF SHA-256 c75de833a623bebacb0de984244ab8c4d91742ee48faa6d684776c222fc997d8. Close wave-phased LDG family; no NVIDIA or OJ run.", "operator": "Fused MoE i8 tn", "result": "REJECTED without attempt two or OJ: the targeted prefill gate-up case regressed 2.522%, decode gate-up regressed 4.352%, and prefill down exceeded the 0.5% regression gate.", "schema_version": 1, "timestamp": "2026-08-23T18:13:53+00:00"}
{"artifacts": ["artifacts/raw/c500-runs/exp-20260824-063-ad06e4a43d9b-a01/status.json", "artifacts/raw/c500-runs/exp-20260824-063-ad06e4a43d9b-a01/paired-benchmark.json", "artifacts/raw/c500-runs/exp-20260824-063-ad06e4a43d9b-a01/correctness.log", "artifacts/raw/c500-runs/exp-20260824-063-ad06e4a43d9b-a01/regression.log", "artifacts/raw/c500-runs/exp-20260824-063-ad06e4a43d9b-a01/result-manifest.sha256"], "baseline_commit": "8c519e6c1bb57e7b124b60806db9575fa1267207", "benchmark": "C500-local ABBA paired medians baseline/candidate: decode gate-up 1.1075/1.0985 ms (-0.813%); prefill gate-up 8.3035/10.5305 ms (+26.820% regression); decode down 0.5725/0.5710 ms (-0.262%); prefill down 4.1810/4.1825 ms (+0.036%).", "candidate_commit": "0d0adfd1a938bb72192c2c2bde94e444a95e3c04", "change": "Added an isolated case-2 512-thread kernel that splits each formal 4M x 1N wave across paired N waves; global A/B traffic, 32-KiB LDS, MMA identities, CTA/grid, output and cases 1/3/4 remain unchanged, while aggregate A LDS and row metadata loads double and one tail barrier is required.", "correctness": "PASS: C500 CUCC/MXCC build, three correctness cases at matched_ratio 1.0/max_abs 0, full regression, all ABBA sampled correctness, source/tree integrity, 31-entry manifest, and independent mapping/synchronization audit passed.", "decision": "revert", "device": "c500-local", "environment": "MetaX C500 device 0; xcore1000; MACA 3.7.1.5; MXCC 1.0.0 d9102a1572; driver 3.8.30; 25% compute and 16000 MiB slice; run exp-20260824-063-ad06e4a43d9b-a01.", "hypothesis": "A case-2-only 512-thread eight-wave 4M x 2N ownership mapping will reduce per-wave accumulator and B-fragment state enough to improve prefill gate-up by at least 1% while preserving the formal-best event schedule.", "id": "exp-20260824-063", "language": "CUDA Maca", "notes": "Tested commit ad06e4a43d9bdb9cde9926597fa95b7387496410; metadata-only queue commit 0d0adfd1a938bb72192c2c2bde94e444a95e3c04; source blob 7c68850d9a46622720ca4b70655a99db5069cbca; LF SHA-256 a3ec90c7c25243fbdaa9d3b80aa0b78e6677e489104461cc99e5600178ea16fc; baseline LF SHA-256 bed1887e257f7a513d4ba4db10d5e5ac88ccecf6377d24d4ca3f521fbd795b61. Audit approved correctness and attribution only; no NVIDIA run.", "operator": "Fused MoE i8 tn", "result": "REJECTED: targeted prefill gate-up regressed 26.820%; no attempt two and no OJ submission; close 512-thread/eight-wave ownership with doubled A LDS/row metadata and required tail barrier.", "schema_version": 1, "timestamp": "2026-08-23T18:47:51+00:00"}
{"artifacts": ["artifacts/raw/c500-runs/exp-20260824-064-76b22562902e-a01/status.json", "artifacts/raw/c500-runs/exp-20260824-064-76b22562902e-a01/paired-benchmark.json", "artifacts/raw/c500-runs/exp-20260824-064-76b22562902e-a01/correctness.log", "artifacts/raw/c500-runs/exp-20260824-064-76b22562902e-a01/regression.log", "artifacts/raw/c500-runs/exp-20260824-064-76b22562902e-a01/result-manifest.sha256"], "baseline_commit": "8c519e6c1bb57e7b124b60806db9575fa1267207", "benchmark": "C500-local ABBA paired medians baseline/candidate: decode gate-up 1.1085/1.0935 ms (-1.353%); prefill gate-up 8.2045/6.4485 ms (-21.403%); decode down 0.5750/0.5730 ms (-0.348%); prefill down 4.1985/4.1940 ms (-0.107%).", "candidate_commit": "418c9bb2aeb5e2a9b429d6f46af204261c659419", "change": "Case-2-only one-CTA stable rank map in output scratch, grid (8,32,32), physical rank-zero skip, and exact formal tile-zero cleanup; formal 256-thread 32-KiB 128x128 MMA body and other shapes remain unchanged.", "correctness": "PASS: C500 MXCC build, 3/3 differential correctness at matched_ratio 1.0/max_abs 0, full regression, sampled correctness in every ABBA arm, source/tree integrity, 31-entry manifest, and independent mapping/synchronization audit.", "decision": "keep", "device": "c500-local", "environment": "MetaX C500 device 0; xcore1000; MACA 3.7.1.5; MXCC 1.0.0 d9102a1572; driver 3.8.30; 25% compute and 16000 MiB slice; warm xcore 1125 MHz; run exp-20260824-064-76b22562902e-a01.", "hypothesis": "Device-sorted 8M expert-cluster scheduling will improve case-2 C500 latency by at least 1% without regressing another public case by more than 0.5%.", "id": "exp-20260824-064", "language": "CUDA Maca", "notes": "Tested commit 76b22562902e3930d66895cd227970d189af41c4; metadata-only queue commit 418c9bb2aeb5e2a9b429d6f46af204261c659419; candidate blob 9ab057e7973aa3844b608a19fa88f369bca5a32d and LF SHA-256 a90d51e97c02725fe613e62a2b553026f48ff34eaf21ac6f28443e5436c6f759; baseline LF SHA-256 bed1887e257f7a513d4ba4db10d5e5ac88ccecf6377d24d4ca3f521fbd795b61. Independent audit approve. No NVIDIA run.", "operator": "Fused MoE i8 tn", "result": "KEEP for OJ validation: targeted prefill gate-up improved 21.403% with no regression on another case; correctness, audit, environment and manifest gates passed.", "schema_version": 1, "timestamp": "2026-08-23T19:34:57+00:00"}
{"artifacts": ["artifacts/raw/c500-runs/exp-20260824-065-9d8eb0ee3de6-a01/status.json", "artifacts/raw/c500-runs/exp-20260824-065-9d8eb0ee3de6-a01/paired-benchmark.json", "artifacts/raw/c500-runs/exp-20260824-065-9d8eb0ee3de6-a01/correctness.log", "artifacts/raw/c500-runs/exp-20260824-065-9d8eb0ee3de6-a01/regression.log", "artifacts/raw/c500-runs/exp-20260824-065-9d8eb0ee3de6-a01/result-manifest.sha256"], "baseline_commit": "adeb4531ada7e6eb6ef250df84b7542002954236", "benchmark": "C500-local paired medians baseline/candidate: decode gate-up 1.0970/1.0735 ms (-2.142%, candidate drift 5.258%); prefill gate-up 6.4430/6.4415 ms (-0.023%); decode down 0.5715/0.5720 ms (+0.087%); prefill down 4.1900/4.1955 ms (+0.131%).", "candidate_commit": "8f746a925c7ec7d041dd714cd9b06c6cd450e680", "change": "Builder loads one expert ID per thread into a 256-int shared array, executes one uniform CTA barrier, then computes the unchanged stable ranks from shared memory; main grid/body and cleanup are unchanged.", "correctness": "PASS: MXCC build, 3/3 differential correctness, full regression, sampled correctness, source/tree integrity, 31-entry manifest, and independent synchronization/mapping audit.", "decision": "revert", "device": "c500-local", "environment": "MetaX C500 device 0; xcore1000; MACA 3.7.1.5; MXCC 1.0.0 d9102a1572; driver 3.8.30; 25% compute and 16000 MiB slice; run exp-20260824-065-9d8eb0ee3de6-a01.", "hypothesis": "Cooperatively stage 256 expert IDs in 1 KiB shared to preserve the case-2 stable map while reducing builder source-level global loads from 65,280 to 256.", "id": "exp-20260824-065", "language": "CUDA Maca", "notes": "Tested commit 9d8eb0ee3de60f2feef9e703148c4556a2b124b0; metadata queue commit 8f746a925c7ec7d041dd714cd9b06c6cd450e680; LF source SHA-256 548d4c7437ad060c860646227c433fd680c0ec3e47570a0b6894598684847dcb. Independent audit approved correctness; performance gate failed. No NVIDIA run.", "operator": "Fused MoE i8 tn", "result": "REJECTED: the only targeted prefill gate-up workload improved just 0.023%, effectively zero; no attempt two or OJ.", "schema_version": 1, "timestamp": "2026-08-23T20:19:34+00:00"}
{"artifacts": ["artifacts/raw/c500-runs/exp-20260824-067-fd2d950f5bee-a01/status.json", "artifacts/raw/c500-runs/exp-20260824-067-fd2d950f5bee-a01/paired-benchmark.json", "artifacts/raw/c500-runs/exp-20260824-067-fd2d950f5bee-a01/correctness.log", "artifacts/raw/c500-runs/exp-20260824-067-fd2d950f5bee-a01/regression.log", "artifacts/raw/c500-runs/exp-20260824-067-fd2d950f5bee-a01/result-manifest.sha256"], "baseline_commit": "adeb4531ada7e6eb6ef250df84b7542002954236", "benchmark": "C500-local paired medians baseline/candidate: decode gate-up 1.0980/1.0720 ms (-2.368%); prefill gate-up 6.6145/6.3065 ms (-4.656%, baseline drift -4.997%, not decision-quality); decode down 0.5705/0.5620 ms (-1.490%); prefill down 4.1840/4.1270 ms (-1.362%). Down-case arm drift stayed bounded and agrees with two prior exp-061 attempts.", "candidate_commit": "e1d5c89f357733317e42bcdcb1f782b62a31a980", "change": "Replace indexed four-element A/B MmaLoad128 payload arrays with eight literal scalars and equivalently expand initial preloads/stores; addresses, traffic, issue anchors, barriers, geometry, epilogue, and expert-sort builder/grid/cleanup remain unchanged.", "correctness": "PASS: MXCC build, 3/3 differential correctness, full regression, sampled correctness, source/tree integrity and 31-entry manifest. The exact source-change fingerprint matches exp-061 and protected exp-064 regions remain byte-identical.", "decision": "keep", "device": "c500-local", "environment": "MetaX C500 device 0; xcore1000; MACA 3.7.1.5; MXCC 1.0.0 d9102a1572; driver 3.8.30; 25% compute and 16000 MiB slice; run exp-20260824-067-fd2d950f5bee-a01.", "hypothesis": "Replay the independently validated staged-load array-to-literal scalarization onto exp-064 to recover at least 1 percent on a down case without changing the expert-sort path.", "id": "exp-20260824-067", "language": "CUDA Maca", "notes": "Tested commit fd2d950f5bee584222eb72c35c39abdbe757a29e; metadata queue commit e1d5c89f357733317e42bcdcb1f782b62a31a980; LF source SHA-256 fa1c93bcd0b73300925dfb076855404b6fe3f15cf8878202e2079377dacc47d7. No independent audit required; exact exp-061 replay. No NVIDIA run.", "operator": "Fused MoE i8 tn", "result": "KEEP for OJ validation: both targeted down cases improve more than 1 percent with no measured regression; case-2 magnitude is discounted due baseline drift.", "schema_version": 1, "timestamp": "2026-08-23T20:20:39+00:00"}
