{"artifacts": ["artifacts/raw/c500-runs/exp-20260824-066-662bfed4e0da-a01/status.json", "artifacts/raw/c500-runs/exp-20260824-066-662bfed4e0da-a01/stderr.log", "artifacts/raw/c500-runs/exp-20260824-066-662bfed4e0da-a01/result-manifest.sha256"], "baseline_commit": "adeb4531ada7e6eb6ef250df84b7542002954236", "benchmark": "No warmup or ABBA timing ran. Exact-source corrected-workflow successor exp-068 later passed correctness and regressed prefill gate-up by 7.250 percent.", "candidate_commit": "45adb11f82f5edba776c3c0a0ab46df9bb48ae6c", "change": "Changed only kOutputScratchSortGridM from 8 to 7; builder, stable map, MMA body, cleanup and other shapes remained unchanged.", "correctness": "NOT RUN: the immutable trusted attempt failed during candidate test compilation because the workflow-base regression hard-coded the exp-064 8M working-set assertions. Source and tree integrity plus the 20-entry failure manifest passed.", "decision": "revert", "device": "c500-local", "environment": "MetaX C500 device 0; xcore1000; MACA 3.7.1.5; MXCC 1.0.0 d9102a1572; driver 3.8.30; 25 percent compute and 16000 MiB slice; run exp-20260824-066-662bfed4e0da-a01.", "hypothesis": "Reducing the device-sorted physical cluster from eight to seven M tiles preserves B reuse while increasing nominal L2 headroom enough for at least 1 percent case-2 improvement.", "id": "exp-20260824-066", "language": "CUDA Maca", "notes": "Tested commit 662bfed4e0dae8e1e537623a8c03a283e7d369b2; metadata queue commit 45adb11f82f5edba776c3c0a0ab46df9bb48ae6c; source LF SHA-256 7189850f4830bb3aa56c5dabbc2f03fdf32600c32ce1fcc6369b5be82c50a0f9. Superseded by exact-source exp-068; no NVIDIA or OJ run.", "operator": "Fused MoE i8 tn", "result": "SUPERSEDED: immutable exp-066 attempt is a stale-harness compile-gate failure; exp-068 is the definitive exact-source C500 rejection.", "schema_version": 1, "timestamp": "2026-08-23T20:37:04+00:00"}
{"artifacts": ["artifacts/raw/c500-runs/exp-20260824-068-945ece07f777-a01/status.json", "artifacts/raw/c500-runs/exp-20260824-068-945ece07f777-a01/paired-benchmark.json", "artifacts/raw/c500-runs/exp-20260824-068-945ece07f777-a01/correctness.log", "artifacts/raw/c500-runs/exp-20260824-068-945ece07f777-a01/regression.log", "artifacts/raw/c500-runs/exp-20260824-068-945ece07f777-a01/result-manifest.sha256"], "baseline_commit": "adeb4531ada7e6eb6ef250df84b7542002954236", "benchmark": "C500-local ABBA paired medians baseline/candidate: decode gate-up 1.1020/1.1085 ms (+0.590 percent); prefill gate-up 6.4480/6.9155 ms (+7.250 percent); decode down 0.5680/0.5725 ms (+0.792 percent); prefill down 4.1975/4.2025 ms (+0.119 percent). Both case-2 candidate arms were slower than paired baseline arms.", "candidate_commit": "1e105ef061da585c4b67281b4dd919536c12b9a6", "change": "Exact-source replay of exp-066 under the generalized trusted harness; submission diff is only kOutputScratchSortGridM 8 to 7, producing case-2 grid 7x32x37.", "correctness": "PASS: MXCC builds, 3/3 differential correctness, full generic regression, sampled correctness in all ABBA arms, source/tree integrity and 31-entry result manifest.", "decision": "revert", "device": "c500-local", "environment": "MetaX C500 device 0; xcore1000; MACA 3.7.1.5; MXCC 1.0.0 d9102a1572; driver 3.8.30; 25 percent compute and 16000 MiB slice; warm xcore 1125 MHz; run exp-20260824-068-945ece07f777-a01.", "hypothesis": "Reducing the proven device-sorted physical cluster from eight to seven M tiles preserves B reuse while increasing nominal L2 headroom enough for at least 1 percent case-2 improvement without a non-target regression above 0.5 percent.", "id": "exp-20260824-068", "language": "CUDA Maca", "notes": "Tested commit 945ece07f77731db9b064a659dc3823b1f157cf3; metadata queue commit 1e105ef061da585c4b67281b4dd919536c12b9a6; source LF SHA-256 7189850f4830bb3aa56c5dabbc2f03fdf32600c32ce1fcc6369b5be82c50a0f9. No NVIDIA or OJ run.", "operator": "Fused MoE i8 tn", "result": "REJECTED: target prefill gate-up regressed 7.250 percent; decode gate-up and decode down also exceeded the 0.5 percent non-target gate. No attempt two or OJ.", "schema_version": 1, "timestamp": "2026-08-23T20:37:34+00:00"}
{"artifacts": ["artifacts/raw/c500-runs/exp-20260824-069-53068f68ebad-a01"], "baseline_commit": "adeb4531ada7e6eb6ef250df84b7542002954236", "benchmark": "ABBA paired medians baseline->candidate: decode gate-up 1.0770->1.0895 ms (+1.161%, noisy -5.244% baseline drift); prefill gate-up 6.4480->6.6390 ms (+2.962%, +0.031% baseline drift); decode down 0.5740->0.5735 ms (-0.087%); prefill down 4.2045->4.1975 ms (-0.166%).", "candidate_commit": "53068f68ebad0ef3aec3a639b01c8cf967ad58fc", "change": "Changed only the case-2 sorted cluster width from 8 to 4, producing grid (4,32,64) while preserving builder, MMA body, scratch cleanup, barriers, LDS, and other cases.", "correctness": "C500 MXCC build, 3/3 differential correctness, full regression, sampled correctness, source/tree integrity, and 31-entry manifest passed.", "decision": "revert", "device": "c500-local", "environment": "MetaX C500 xcore1000; MACA 3.7.1.5; MXCC 1.0.0 d9102a1572; driver 3.8.30; device 0; 25% compute; 16000 MiB; c500-local.", "hypothesis": "Four aligned sorted M tiles per case-2 cluster reduce L2 capacity pressure enough to improve prefill gate-up by at least 1.0% despite doubling ideal B reload groups.", "id": "exp-20260824-069", "language": "CUDA Maca", "notes": "No second attempt, independent audit, NVIDIA run, integration, or OJ submission. Queue commit 1159ae8e2a47515dbea67e4dbb73164aa2bcd497; tested source blob 16497996154ad6b49d9b12e6178f07e3b250cf4c.", "operator": "Fused MoE i8 tn", "result": "Target prefill gate-up regressed 2.962% on stable baseline; extra B reload groups outweighed modeled L2 headroom.", "schema_version": 1, "timestamp": "2026-08-23T21:27:21+00:00"}
{"artifacts": ["artifacts/raw/c500-runs/exp-20260824-070-48d03cb4fd74-a01"], "baseline_commit": "adeb4531ada7e6eb6ef250df84b7542002954236", "benchmark": "ABBA medians baseline->candidate: decode gate-up 1.0885->1.0485 ms (-3.675%, baseline drift -2.271%); prefill gate-up 6.8155->6.4485 ms (-5.385%, baseline drift +11.399%, not decision-quality); decode down 0.5745->0.5760 ms (+0.261%); prefill down 4.1900->3.5735 ms (-14.714%), target arms 4.184->3.573 and 4.196->3.574 ms.", "candidate_commit": "48d03cb4fd741071a2559ba0176032ecfc3353a2", "change": "Extended the existing output-scratch stable expert sort only to prefill-down with grid (8,56,32), preserving case-2 grid (8,32,32), formal MMA body, LDS, barriers, and other cases.", "correctness": "PASS: C500 MXCC build, 3/3 differential correctness, fixed-workflow regression, sampled correctness, source/tree integrity and 31-entry manifest; local exhaustive model proves stable bijection, case2 8192/8192 and case4 14336/14336 ownership, scratch lifetime and read-only inputs.", "decision": "keep", "device": "c500-local", "environment": "MetaX C500 xcore1000; MACA 3.7.1.5; MXCC 1.0.0 d9102a1572; driver 3.8.30; device 0; 25% compute; 16000 MiB; c500-local.", "hypothesis": "Case-4 device-sorted width-eight expert clusters improve paired prefill-down latency by at least 1.0 percent with both candidate arms faster and no other public case regressing over 0.5 percent.", "id": "exp-20260824-070", "language": "CUDA Maca", "notes": "Tested commit 48d03cb4fd741071a2559ba0176032ecfc3353a2; metadata queue commit 2360bab5cac3f28058932e27572b6bfc455e2b84; source blob 9709795f8072bb1cec4036a4ddc00a78d9cb4498; LF SHA-256 e6e2702af81a5d49b6e811dfc320885d97edef971ad4dd4be35e0fd0c21d79c1. No NVIDIA run. Independent mapping/scratch audit approved the exact tested commit with no findings; audit worktree stayed clean.", "operator": "Fused MoE i8 tn", "result": "KEEP: target case improves 14.714% with stable arms, no non-target regression above 0.5%, and independent mapping/scratch audit approval.", "schema_version": 1, "timestamp": "2026-08-24T04:05:20+00:00"}
{"artifacts": ["artifacts/raw/c500-runs/exp-20260824-071-418e74cd5775-a01"], "baseline_commit": "adeb4531ada7e6eb6ef250df84b7542002954236", "benchmark": "ABBA medians baseline->candidate: decode gate-up 1.0990->1.0960 ms (-0.273%); prefill gate-up 6.4465->6.6640 ms (+3.374%, candidate drift -6.392%, noisy); target decode down 0.5695->1.4280 ms (+150.746%), arms 0.568->1.428 and 0.571->1.428; prefill down 4.1835->4.1960 ms (+0.299%).", "candidate_commit": "418e74cd5775f5542eadb85695eba437cc849193", "change": "Added a case-3-only 128x256x128 MACA kernel with 256 threads, 48 KiB single-buffer LDS, 16 K tiles and 32 CTA barriers, halving CTAs and aggregate A staging while preserving other cases.", "correctness": "PASS: C500 MXCC build, 3/3 differential correctness, fixed-workflow regression, sampled correctness, source/tree integrity and 31-entry manifest; local exhaustive structural model passed.", "decision": "revert", "device": "c500-local", "environment": "MetaX C500 xcore1000; MACA 3.7.1.5; MXCC 1.0.0 d9102a1572; driver 3.8.30; device 0; 25% compute; 16000 MiB; c500-local.", "hypothesis": "Halving case-3 N tiles and CTAs with a 128x256x128 kernel improves decode down by at least 1% in both C500 candidate arms without regressing cases 1, 2, or 4 by more than 0.5%.", "id": "exp-20260824-071", "language": "CUDA Maca", "notes": "Tested commit 418e74cd5775f5542eadb85695eba437cc849193; metadata queue commit 15f7c6ae43d65ef38bad905932e1077d78776d75; source blob ffd2da206240d3368c231e9734ab560e1bb8f380; LF SHA-256 f2081a938d350a01ae01f983801f40b6cf4a9bd1d7ab13a53980f04876788d59. No second attempt, audit, integration, NVIDIA, or OJ.", "operator": "Fused MoE i8 tn", "result": "REJECTED: target decode down regressed 150.746% with identical candidate arms; wide kernel costs dominate reduced CTA and A traffic.", "schema_version": 1, "timestamp": "2026-08-24T04:08:45+00:00"}
{"artifacts": ["artifacts/raw/c500-runs/exp-20260824-072-c22a93a2313c-a01/status.json", "artifacts/raw/c500-runs/exp-20260824-072-c22a93a2313c-a01/paired-benchmark.json", "artifacts/raw/c500-runs/exp-20260824-072-c22a93a2313c-a01/correctness.log", "artifacts/raw/c500-runs/exp-20260824-072-c22a93a2313c-a01/regression.log", "artifacts/raw/c500-runs/exp-20260824-072-c22a93a2313c-a01/result-manifest.sha256"], "baseline_commit": "adeb4531ada7e6eb6ef250df84b7542002954236", "benchmark": "C500-local ABBA medians baseline/candidate: decode gate-up 1.1065/1.0905 ms (-1.4460%, noisy); prefill gate-up 6.4450/6.4475 ms (+0.0388%); decode down 0.5730/0.5750 ms (+0.3490%); prefill down 4.1990/3.7085 ms (-11.6814%). Target arms independently improve 4.201->3.708 and 4.197->3.709 ms.", "candidate_commit": "f68b177d186f45236076937a37848fe610694482", "change": "Extended the existing output-scratch stable expert-sort path only to prefill down with grid (30,56,9), 784 out-of-range early returns, and the existing exact tile-zero cleanup; the case-2 sort and formal MMA body remain unchanged.", "correctness": "PASS: C500 MXCC build, 3/3 differential correctness at matched_ratio 1.0/max_abs 0, full generic regression, sampled correctness, source/tree integrity, 31-entry manifest, exact 14336/14336 case-4 ownership, scratch cleanup and read-only-input checks.", "decision": "revert", "device": "c500-local", "environment": "MetaX C500 device 0; xcore1000; MACA 3.7.1.5; MXCC 1.0.0 d9102a1572; driver 3.8.30; 25% compute / 16000 MiB slice; run exp-20260824-072-c22a93a2313c-a01.", "hypothesis": "A case-4-only stable expert sort with grid_x=30 will improve paired prefill-down latency by at least 15% while keeping every other public-case regression below 0.5%.", "id": "exp-20260824-072", "language": "CUDA Maca", "notes": "Tested commit c22a93a2313c6d98617ddc5aefd9f0938ed37641; metadata queue commit f68b177d186f45236076937a37848fe610694482; workflow 99c3bb3e2a5ca7f674123bd42e2550a04e224910; LF source SHA-256 92d3f2d92646774c778d37c0ca89f1399b9406129c17fbd03a30f1129e8047bd. No NVIDIA run.", "operator": "Fused MoE i8 tn", "result": "REJECTED: target case passes the generic 1% gate but misses the 15% hypothesis and is dominated by same-family exp-070 width eight at 3.5735 ms / -14.7136%; no audit, integration or OJ.", "schema_version": 1, "timestamp": "2026-08-24T05:33:05+00:00"}
{"artifacts": ["artifacts/raw/c500-runs/exp-20260824-073-ec1aeda4db7b-a01/status.json", "artifacts/raw/c500-runs/exp-20260824-073-ec1aeda4db7b-a01/paired-benchmark.json", "artifacts/raw/c500-runs/exp-20260824-073-ec1aeda4db7b-a01/correctness.log", "artifacts/raw/c500-runs/exp-20260824-073-ec1aeda4db7b-a01/regression.log", "artifacts/raw/c500-runs/exp-20260824-073-ec1aeda4db7b-a01/result-manifest.sha256"], "baseline_commit": "adeb4531ada7e6eb6ef250df84b7542002954236", "benchmark": "C500-local ABBA medians baseline/candidate: decode gate-up 1.1025/1.1015 ms (-0.091%); prefill gate-up 6.4425/6.3160 ms (-1.964%); decode down 0.5720/0.5730 ms (+0.175%); prefill down 4.1910/4.1860 ms (-0.119%). Case-2 arms 6.440/6.314 and 6.445/6.318 ms.", "candidate_commit": "4e3a68d6904092b721ae799dc630883cd577f47e", "change": "Replaced case-2 output scratch with a 1 KiB module device stable map over all 256 tiles, made rank zero useful, and removed the 32-CTA tile-zero cleanup; the main grid remains (8,32,32).", "correctness": "PASS: MXCC builds, 3/3 differential correctness, full regression, sampled correctness, source/tree integrity, 31-entry manifest, and independent stable-rank/mapping/default-stream audit.", "decision": "keep", "device": "c500-local", "environment": "MetaX C500 xcore1000; MACA 3.7.1.5; MXCC 1.0.0 d9102a1572; driver 3.8.30; device 0; 25% compute; 16000 MiB; c500-local.", "hypothesis": "A full 256-entry module-device stable rank map that makes physical rank zero useful and removes the 32-CTA cleanup launch improves paired case-2 latency by at least 1% in both candidate arms without another case regressing by more than 0.5%.", "id": "exp-20260824-073", "language": "CUDA Maca", "notes": "Tested commit ec1aeda4db7b80986c37da155d49e588e6b824da; metadata queue commit 4e3a68d6904092b721ae799dc630883cd577f47e; LF SHA-256 b167702012537d03aa81b2c23d1874b061d700a04892375cb3a7e16d053e500e. Independent audit approve; residual risk is non-reentrancy under concurrent calls with different expert_ids. No NVIDIA run.", "operator": "Fused MoE i8 tn", "result": "KEEP for OJ validation: target prefill gate-up improved 1.964% with both arms above the 1% gate, no non-target regression above 0.5%, and independent audit approval.", "schema_version": 1, "timestamp": "2026-08-24T05:38:51+00:00"}
{"artifacts": ["artifacts/raw/c500-runs/exp-20260824-074-a4495c93bb0d-a01/status.json", "artifacts/raw/c500-runs/exp-20260824-074-a4495c93bb0d-a01/paired-benchmark.json", "artifacts/raw/c500-runs/exp-20260824-074-a4495c93bb0d-a01/correctness.log", "artifacts/raw/c500-runs/exp-20260824-074-a4495c93bb0d-a01/regression.log", "artifacts/raw/c500-runs/exp-20260824-074-a4495c93bb0d-a01/result-manifest.sha256"], "baseline_commit": "adeb4531ada7e6eb6ef250df84b7542002954236", "benchmark": "C500-local ABBA aggregate medians baseline/candidate: case1 1.1010/1.0675 ms (-3.043%, candidate drift -4.308%, non-attributable); case2 6.7910/6.4485 ms (-5.043%, invalid because baseline arms 7.140/6.442 ms drift -9.776%); case3 0.5745/0.5700 ms (-0.783%); case4 4.1985/4.2110 ms (+0.298%). Stable case2 candidate arms 6.446/6.451 ms equal the valid 6.442-ms baseline arm.", "candidate_commit": "b754a8305f51430c2b285c40cf5aa444e4681d3b", "change": "Added a case-2-only 32768-float module row-factor workspace and 128x256-thread precompute launch; sorted main and tile-zero cleanup consume one factor load instead of two metadata loads plus one multiply, while the sort, MMA/shared body and other cases remain unchanged.", "correctness": "PASS: C500 MXCC build, 3/3 differential correctness at matched_ratio 1.0/max_abs 0, full generic regression, sampled correctness, source/tree integrity, exact row-factor coverage/read-only checks and 31-entry manifest.", "decision": "revert", "device": "c500-local", "environment": "MetaX C500 device 0; xcore1000; MACA 3.7.1.5; MXCC 1.0.0 d9102a1572; driver 3.8.30; 25% compute / 16000 MiB slice; run exp-20260824-074-a4495c93bb0d-a01.", "hypothesis": "Precomputing case-2 scale_a times moe_weights once into a module workspace will improve both candidate arms by at least 1% without another case regressing over 0.5%.", "id": "exp-20260824-074", "language": "CUDA Maca", "notes": "Tested commit a4495c93bb0d6adcb3419e74de61e9974eb2f5e8; metadata queue commit b754a8305f51430c2b285c40cf5aa444e4681d3b; workflow 99c3bb3e2a5ca7f674123bd42e2550a04e224910; LF source SHA-256 e66ecb080bf25081c3312682fb14dad827ff8bc9022fba097627d4b6aae4fba2. Module workspace is also non-reentrant across concurrent independent streams. No NVIDIA run.", "operator": "Fused MoE i8 tn", "result": "REJECTED: apparent case-2 aggregate gain is baseline drift; stable candidate timing does not beat the valid baseline arm by 1%. No attempt two, lifecycle audit, integration or OJ; close row-factor-precompute family.", "schema_version": 1, "timestamp": "2026-08-24T05:39:33+00:00"}
{"artifacts": ["artifacts/raw/c500-runs/exp-20260824-075-340e7c52f79f-a01/status.json", "artifacts/raw/c500-runs/exp-20260824-075-340e7c52f79f-a01/paired-benchmark.json", "artifacts/raw/c500-runs/exp-20260824-075-340e7c52f79f-a01/correctness.log", "artifacts/raw/c500-runs/exp-20260824-075-340e7c52f79f-a01/regression.log", "artifacts/raw/c500-runs/exp-20260824-075-340e7c52f79f-a01/result-manifest.sha256"], "baseline_commit": "ec1aeda4db7b80986c37da155d49e588e6b824da", "benchmark": "C500-local ABBA medians baseline/candidate: case1 1.0995/1.0725 ms (-2.4557%, candidate drift 5.460%, non-attributable); case2 6.3230/6.3135 ms (-0.1502%), with arms 6.323->6.314 and 6.323->6.313 ms; case3 0.5765/0.5760 ms (-0.0867%); case4 4.1920/4.1925 ms (+0.0119%).", "candidate_commit": "614e07a0e2a378c17abda21d88d1bebacd2b2ef3", "change": "Replaced only the case-2 full-map builder with a 256-bin shared histogram, exclusive prefix and atomic rank allocation; retained the 1 KiB module map, (8,32,32) full-useful main grid, zero cleanup and formal MMA path.", "correctness": "PASS: C500 MXCC builds, 3/3 differential correctness, full regression, sampled correctness, source/tree integrity and 31-entry manifest; local exhaustive histogram/rank/ownership models passed.", "decision": "revert", "device": "c500-local", "environment": "MetaX C500 device 0; xcore1000; MACA 3.7.1.5; MXCC 1.0.0 d9102a1572; driver 3.8.30; 25 percent compute and 16000 MiB slice; run exp-20260824-075-340e7c52f79f-a01.", "hypothesis": "A one-CTA shared histogram and prefix builder replaces the O(256^2) stable-rank scan and improves both paired case-2 arms by at least 1 percent without a non-target regression above 0.5 percent.", "id": "exp-20260824-075", "language": "CUDA Maca", "notes": "Tested commit 340e7c52f79f89049c6de2ba89acf05bd36681b8; metadata queue commit 614e07a0e2a378c17abda21d88d1bebacd2b2ef3; source blob f245c4eb96b7c1f8a78b83226bbb128ddf94ead8; LF SHA-256 d0ee63489c897165f32bb55eaa47f29f159067c2c32ef8ea976110a223130b97. No NVIDIA run; histogram-builder acceleration family closed.", "operator": "Fused MoE i8 tn", "result": "REJECTED: both target arms improve only 0.14-0.16 percent, decisively below the 1 percent gate; no attempt two, audit, integration or OJ.", "schema_version": 1, "timestamp": "2026-08-24T07:04:58+00:00"}
{"artifacts": ["artifacts/raw/c500-runs/exp-20260824-076-857c91f9ff4e-a01/status.json", "artifacts/raw/c500-runs/exp-20260824-076-857c91f9ff4e-a01/paired-benchmark.json", "artifacts/raw/c500-runs/exp-20260824-076-857c91f9ff4e-a01/correctness.log", "artifacts/raw/c500-runs/exp-20260824-076-857c91f9ff4e-a01/regression.log", "artifacts/raw/c500-runs/exp-20260824-076-857c91f9ff4e-a01/result-manifest.sha256"], "baseline_commit": "ec1aeda4db7b80986c37da155d49e588e6b824da", "benchmark": "C500-local ABBA medians baseline/candidate: case1 1.0875/1.0975 ms (+0.9195%, noisy); case2 6.3385/6.3170 ms (-0.3392%), but clean baseline A/candidate arms are 6.318/6.317/6.317 ms and baseline B contains large outliers; case3 0.5710/0.5705 ms (-0.0876%); case4 4.2285/4.2070 ms (-0.5085%, outlier-contaminated).", "candidate_commit": "bb88504f36c2e6ae4edac3828dfc02a01dd3e872", "change": "Packed (expert,tile) into the existing 32-bit module-map payload and decoded it in the sorted main path; map size, stable rank, builder launch, case-2 grid, zero cleanup and MMA/shared body remained unchanged.", "correctness": "PASS: C500 MXCC builds, 3/3 differential correctness, full regression, sampled correctness, source/tree integrity and 31-entry manifest; exhaustive pack/unpack, rank and ownership models passed.", "decision": "revert", "device": "c500-local", "environment": "MetaX C500 device 0; xcore1000; MACA 3.7.1.5; MXCC 1.0.0 d9102a1572; driver 3.8.30; 25 percent compute and 16000 MiB slice; run exp-20260824-076-857c91f9ff4e-a01.", "hypothesis": "Packing expert ID and logical tile into each existing map slot removes 8192 dependent case-2 expert-ID loads and improves both paired target arms by at least 1 percent without a non-target regression above 0.5 percent.", "id": "exp-20260824-076", "language": "CUDA Maca", "notes": "Tested commit 857c91f9ff4e2bad0e489217acfeb4d671df1b71; metadata queue commit bb88504f36c2e6ae4edac3828dfc02a01dd3e872; source blob 4f70ac0371d5d2928d07fe6490b22765eadb1a9c; LF SHA-256 088591c33e4a3cb77020fe77add0f54e80b4e2f3d081b9553ab72b1597d78872. No NVIDIA run; packed-map-payload variant closed.", "operator": "Fused MoE i8 tn", "result": "REJECTED: clean case-2 comparison is effectively flat and far below the 1 percent gate; no attempt two, audit, integration or OJ.", "schema_version": 1, "timestamp": "2026-08-24T07:05:39+00:00"}
