{"artifacts": ["artifacts/raw/c500-runs/exp-20260824-077-266de1d5aa17-a01/status.json", "artifacts/raw/c500-runs/exp-20260824-077-266de1d5aa17-a01/paired-benchmark.json", "artifacts/raw/c500-runs/exp-20260824-077-266de1d5aa17-a01/correctness.log", "artifacts/raw/c500-runs/exp-20260824-077-266de1d5aa17-a01/regression.log", "artifacts/raw/c500-runs/exp-20260824-077-266de1d5aa17-a01/result-manifest.sha256"], "baseline_commit": "ec1aeda4db7b80986c37da155d49e588e6b824da", "benchmark": "C500-local ABBA medians baseline/candidate: decode gate-up 1.1040/1.0670 ms (-3.3514%, noisy); prefill gate-up 6.3210/6.3210 ms (0.0000%); decode down 0.5730/0.5745 ms (+0.2618%); prefill down 4.2230/3.5315 ms (-16.3746%), with arms 4.238->3.532 and 4.208->3.531 ms.", "candidate_commit": "60700d74a11caac0532c3a672498cd077b9db1d7", "change": "Added an exact case-4 selector and width-eight grid wrapper so case 4 reuses the existing exp-073 full stable-rank module map and sorted main path; builder, map payload, case-2 path, MMA/shared body, fallback and zero-cleanup contract remain unchanged.", "correctness": "PASS: C500 MXCC builds, 3/3 differential correctness, full regression, sampled correctness, source/tree integrity and 31-entry manifest; local exhaustive stable-rank, case2/case4 ownership, no-scratch and read-only models passed.", "decision": "keep", "device": "c500-local", "environment": "MetaX C500 device 0; xcore1000; MACA 3.7.1.5; MXCC 1.0.0 d9102a1572; driver 3.8.30; 25 percent compute and 16000 MiB slice; run exp-20260824-077-266de1d5aa17-a01.", "hypothesis": "Extending the cleanup-free module full-sort map only to case 4 with a full-useful (8,56,32) grid improves both paired prefill-down arms by at least 1 percent without a non-target regression above 0.5 percent.", "id": "exp-20260824-077", "language": "CUDA Maca", "notes": "Tested commit 266de1d5aa179470255e62e8d5c4306bed4911b8; metadata queue commit 60700d74a11caac0532c3a672498cd077b9db1d7; source blob 6dba88b0762fb17da43adfea7a8d86c758665979; LF SHA-256 57add54199676be946d52cb7604f7507375f3f136f514c627c91c6fe9e8001b7. Independent module-map/mapping/default-stream audit approved the exact tested commit; detached audit worktree remained clean. Residual risk is non-reentrancy under concurrent independent-stream calls with different expert IDs. No NVIDIA run.", "operator": "Fused MoE i8 tn", "result": "KEEP for OJ validation: both target arms improve more than 16 percent, case 2 is flat, the maximum non-target regression is 0.2618 percent and independent audit approved.", "schema_version": 1, "timestamp": "2026-08-24T07:21:49+00:00"}
{"artifacts": ["artifacts/raw/c500-runs/exp-20260824-078-33004fe72bf2-a01"], "baseline_commit": "ec1aeda4db7b80986c37da155d49e588e6b824da", "benchmark": "C500-local ABBA medians baseline->candidate: case1 1.0750->1.0525 ms (-2.0930%, baseline drift 6.136%, non-decision-quality); case2 6.3180->6.1870 ms (-2.0734%); case3 0.5695->0.5645 ms (-0.8780%); case4 4.1980->4.1470 ms (-1.2149%). Case4 arms 4.216->4.159 and 4.180->4.135 ms; all aggregate deltas favorable.", "candidate_commit": "f820b42e9cc663d314906b4ee6f06db06e4d735c", "change": "Replaced two indexed four-entry MmaLoad128 payload arrays with eight literal scalar destinations and equivalently expanded initial loads/stores; builder, map, dispatch, addresses, MMA body, barriers, geometry, epilogue and ABI are unchanged.", "correctness": "PASS: C500 MXCC build, 3/3 differential correctness at matched ratio 1.0 and max abs 0, full regression, sampled correctness, source/tree integrity and 31-entry manifest.", "decision": "keep", "device": "c500-local", "environment": "MetaX C500 xcore1000; MACA 3.7.1.5; MXCC 1.0.0 d9102a1572; driver 3.8.30; device 0; 25% compute; 16000 MiB; c500-local.", "hypothesis": "Replay the staged A/B payload array-to-literal scalarization on exp-073 to improve both down cases while preserving the module full-sort case-2 path.", "id": "exp-20260824-078", "language": "CUDA Maca", "notes": "Tested commit 33004fe72bf265b5ba58353ff92453b1186ac528; metadata queue commit f820b42e9cc663d314906b4ee6f06db06e4d735c; source blob 078d40203ec9c972b0793c229735961dedc9d8b5; LF SHA-256 0d2f9b46b4dd2140403afe81d944d9c76ee7d3861630a7336aa024066e3a932a; manifest SHA-256 2097a4a408f2461807143e68583f67fb1c8c94419977e451aef3a904339c171e. No NVIDIA run. Historical exp-061/067 OJ scores tied, so OJ gain remains uncertain.", "operator": "Fused MoE i8 tn", "result": "KEEP for serialized OJ evaluation after the active exp-077 submission closes: case4 clears 1% in both arms, case3 improves in both arms, stable case2 improves 2.073%, and no aggregate case regresses.", "schema_version": 1, "timestamp": "2026-08-24T07:43:29+00:00"}
{"artifacts": ["artifacts/raw/c500-runs/exp-20260824-079-c69acfc8378e-a01"], "baseline_commit": "ec1aeda4db7b80986c37da155d49e588e6b824da", "benchmark": "C500-local ABBA medians baseline->candidate: case1 1.0905->1.0745 ms (-1.4672%, candidate drift 4.667%, non-attributable); case2 6.3160->6.3170 ms (+0.0158%); case3 0.5685->0.5695 ms (+0.1759%); case4 4.1905->3.9740 ms (-5.1664%), with arms 4.195->3.982 and 4.186->3.966 ms.", "candidate_commit": "27da78bbdb4766020b5f6c3ec149a6db4b18c25d", "change": "Added optional fixed EM/N/K template dimensions and dispatched only case4 to fixed 32768/7168/2048; case4 remains unsorted, case2 full-sort and the protected MMA body remain unchanged.", "correctness": "PASS: C500 MXCC build, 3/3 differential correctness, full frozen regression, sampled correctness, source/tree integrity, 31-entry manifest and protected-body/coverage models.", "decision": "keep", "device": "c500-local", "environment": "MetaX C500 xcore1000; MACA 3.7.1.5; MXCC 1.0.0 d9102a1572; driver 3.8.30; device 0; 25% compute; 16000 MiB; c500-local.", "hypothesis": "An exact case-4 fixed-dimension specialization improves both paired prefill-down arms by at least 1% versus exp-073 without another case regressing over 0.5%.", "id": "exp-20260824-079", "language": "CUDA Maca", "notes": "Tested commit c69acfc8378e4ca00d44890a4546a27ed007c6e0; metadata queue commit 27da78bbdb4766020b5f6c3ec149a6db4b18c25d; source blob c6bcb2cad4078a486effb0d62443ec519518827e; LF SHA-256 3ed4f3c637118d4c38ee7f880af1261ad84aa2f22be06c5cd02b98900bde0373. No NVIDIA run; no independent audit required.", "operator": "Fused MoE i8 tn", "result": "KEEP as a proven component and fallback: target case4 improves 5.166% in both arms, all non-target regressions remain under 0.5%, and correctness/regression/manifest pass. Do not stack onto exp-077 except under a new combination experiment.", "schema_version": 1, "timestamp": "2026-08-24T07:58:50+00:00"}
{"artifacts": ["artifacts/raw/c500-runs/exp-20260824-080-ee3ea236735a-a01/status.json", "artifacts/raw/c500-runs/exp-20260824-080-ee3ea236735a-a01/paired-benchmark.json", "artifacts/raw/c500-runs/exp-20260824-080-ee3ea236735a-a01/correctness.log", "artifacts/raw/c500-runs/exp-20260824-080-ee3ea236735a-a01/regression.log", "artifacts/raw/c500-runs/exp-20260824-080-ee3ea236735a-a01/result-manifest.sha256"], "baseline_commit": "266de1d5aa179470255e62e8d5c4306bed4911b8", "benchmark": "C500-local ABBA medians baseline->candidate: case1 1.0730->1.0565 ms (-1.5377%, two-arm drift makes it non-attributable); case2 6.3195->6.1875 ms (-2.0888%), arms 6.321->6.188 and 6.318->6.187; case3 0.5710->0.5660 ms (-0.8757%); case4 3.5280->3.4650 ms (-1.7857%), arms 3.530->3.465 and 3.526->3.465.", "candidate_commit": "2451ddc7b5ac9ebeb3d4bb7b257f169f91229f5e", "change": "Combined the exact exp-077 case-4 cleanup-free module full-sort path with the exact exp-078 indexed-to-literal MmaLoad128 staged-payload scalarization; map, grids, addresses, MMA/LDS/STS/barrier order, epilogue, ABI and fallback are unchanged.", "correctness": "PASS: C500 MXCC builds, 3/3 differential correctness, frozen full regression, sampled correctness, source/tree integrity, no-process gates and all 31 manifest entries.", "decision": "keep", "device": "c500-local", "environment": "MetaX C500 device 0; xcore1000; MACA 3.7.1.5; MXCC 1.0.0 d9102a1572; driver 3.8.30; 25% compute / 16000 MiB slice; run exp-20260824-080-ee3ea236735a-a01; c500-local.", "hypothesis": "Replay the independently proven staged A/B payload scalarization onto the exp-077 case-4 module full-sort source to improve both paired case-2 and case-4 arms by at least 1% while protecting cases 1 and 3.", "id": "exp-20260824-080", "language": "CUDA Maca", "notes": "Tested commit ee3ea236735ac3dc418e37af018f6d60e623c044; metadata queue commit 2451ddc7b5ac9ebeb3d4bb7b257f169f91229f5e; workflow 82f65220f0530f1c7be0b73515c621cbefd8d1da; source blob e62b793a11b8fdd1b4f7bf58f4bac689aaf5128a; LF SHA-256 762b7581919a9cb75cde0e4732c8ac580ad236f86620f2d3f34c565d7c5a3204; manifest SHA-256 953ca6efd57287344e0bdbd8cdba0917b9952f3c500f46670934e2f211a0c9c7. No NVIDIA run.", "operator": "Fused MoE i8 tn", "result": "KEEP for prioritized OJ validation: all case-2 and case-4 target arms clear 1%, both protected aggregate deltas are favorable, and the exact two-parent source passed target correctness/regression.", "schema_version": 1, "timestamp": "2026-08-24T08:24:47+00:00"}
{"artifacts": ["artifacts/raw/c500-runs/exp-20260824-081-a659af8473ce-a01/status.json", "artifacts/raw/c500-runs/exp-20260824-081-a659af8473ce-a01/paired-benchmark.json", "artifacts/raw/c500-runs/exp-20260824-081-a659af8473ce-a01/correctness.log", "artifacts/raw/c500-runs/exp-20260824-081-a659af8473ce-a01/regression.log", "artifacts/raw/c500-runs/exp-20260824-081-a659af8473ce-a01/result-manifest.sha256"], "baseline_commit": "266de1d5aa179470255e62e8d5c4306bed4911b8", "benchmark": "C500-local ABBA medians baseline->candidate: case1 1.0985->1.0995 ms (+0.0910%); case2 6.3195->6.3230 ms (+0.0554%); case3 0.5750->0.5775 ms (+0.4348%); case4 3.5310->3.3230 ms (-5.8907%), arms 3.535->3.324 and 3.527->3.322.", "candidate_commit": "1fb7eaa814e0aaf2d8dd4db2e9a4deb8b28d2423", "change": "Kept the exp-077 stable map and sorted grids while adding optional fixed EM/N/K template dimensions and selecting <true,32768,7168,2048> only for exact case 4; case 2 and all fallback paths remain runtime-dimensional.", "correctness": "PASS: C500 MXCC builds, 3/3 differential correctness, frozen regression, sampled correctness, source/tree integrity, 31-entry manifest and independent detached exact-commit audit.", "decision": "keep", "device": "c500-local", "environment": "MetaX C500 device 0; xcore1000; MACA 3.7.1.5; MXCC 1.0.0 d9102a1572; driver 3.8.30; 25% compute / 16000 MiB slice; run exp-20260824-081-a659af8473ce-a01; c500-local.", "hypothesis": "Replay the independently proven exact case-4 fixed-dimension specialization onto exp-077's cleanup-free module full-sort source to improve both paired case-4 arms by at least 1% without another case regressing above 0.5%.", "id": "exp-20260824-081", "language": "CUDA Maca", "notes": "Tested commit a659af8473ceeb75cbaccab374cf4164ef9a990b; metadata queue commit 1fb7eaa814e0aaf2d8dd4db2e9a4deb8b28d2423; workflow 82f65220f0530f1c7be0b73515c621cbefd8d1da; source blob cffa50cc7209e666e50e7451613b582d75b9855d; LF SHA-256 6a047579d2768414a8eb09ee9a2daa1e84543b1f2ae10a0be1549ef69a9e8c1b; manifest SHA-256 515e7ed6d76bed82255f1db47b4a007ba7488b05a580cb49fa3c156a260c699d. Process exception: Producer invoked the trusted runner once from a clean primary despite role rules; Main Agent independently reconciled exact artifacts and accepted evidence. No controller/OJ/credential access, tracked edit or NVIDIA run by Producer.", "operator": "Fused MoE i8 tn", "result": "KEEP for serialized OJ validation: both case-4 arms improve about 5.8-6.0%, maximum non-target regression is 0.4348%, all target gates pass and independent audit approved.", "schema_version": 1, "timestamp": "2026-08-24T08:43:29+00:00"}
{"artifacts": ["artifacts/raw/c500-runs/exp-20260824-082-3d58170fe688-a01/status.json", "artifacts/raw/c500-runs/exp-20260824-082-3d58170fe688-a01/paired-benchmark.json", "artifacts/raw/c500-runs/exp-20260824-082-3d58170fe688-a01/correctness.log", "artifacts/raw/c500-runs/exp-20260824-082-3d58170fe688-a01/regression.log", "artifacts/raw/c500-runs/exp-20260824-082-3d58170fe688-a01/result-manifest.sha256"], "baseline_commit": "2230963fdd9d6394b3b63864500ffab00818b4f0", "benchmark": "C500-local ABBA medians baseline->candidate: case1 1.0840->1.0510 ms (-3.0443%, both arms noisy and non-decision-quality); case2 6.1835->6.1085 ms (-1.2129%), arms 6.187->6.110 and 6.180->6.107 ms; case3 0.5615->0.5615 ms (0.0000%); case4 3.4620->3.4610 ms (-0.0289%).", "candidate_commit": "39fd67f9638a05dc0b53781cbe36955756d54443", "change": "Added optional fixed EM/N/K kernel dimensions and selected <true,32768,4096,7168> only for the existing exact case-2 sorted path; the exp-080 scalar payload schedule, case-4 runtime path, map, grids, barriers, addresses and ABI remain unchanged.", "correctness": "PASS: C500 MXCC builds, 3/3 differential correctness, full frozen regression, all sampled correctness checks, source/tree integrity, no-process gates and all 31 manifest entries.", "decision": "keep", "device": "c500-local", "environment": "MetaX C500 device 0; xcore1000; MACA 3.7.1.5; MXCC 1.0.0 d9102a1572; driver 3.8.30; 25% compute / 16000 MiB slice; run exp-20260824-082-3d58170fe688-a01; c500-local.", "hypothesis": "Specializing only exact public case-2 dimensions on the tested exp-080 source improves prefill gate-up without regressing protected cases.", "id": "exp-20260824-082", "language": "CUDA Maca", "notes": "Tested commit 3d58170fe68859366eea4039f656922c8b1c7991; metadata queue commit 39fd67f9638a05dc0b53781cbe36955756d54443; workflow f8df56308d6f99d91a8eb27ddcd799ee14c0cea8; source blob df06edfba00b6eccc94d0163fc6bac9cd2876bab; LF SHA-256 bdf3c6ae2ebaf63481798656eb41e52b4cd56c1c5ebe70d192f26fb8f00e9096; manifest SHA-256 99e0ad1e6d71e32cf976027122e9ea25c99ef3bbe9f6f71fc944a860b59d03f8. No NVIDIA run; no independent audit required.", "operator": "Fused MoE i8 tn", "result": "KEEP for exact-source OJ validation: both target case-2 arms improve more than 1 percent, protected cases 3 and 4 are neutral or favorable, and noisy case 1 is favorable but excluded from attribution.", "schema_version": 1, "timestamp": "2026-08-24T10:06:00+00:00"}
{"artifacts": ["artifacts/raw/c500-runs/exp-20260824-083-0863a84e1587-a01/status.json", "artifacts/raw/c500-runs/exp-20260824-083-0863a84e1587-a01/paired-benchmark.json", "artifacts/raw/c500-runs/exp-20260824-083-0863a84e1587-a01/correctness.log", "artifacts/raw/c500-runs/exp-20260824-083-0863a84e1587-a01/regression.log", "artifacts/raw/c500-runs/exp-20260824-083-0863a84e1587-a01/result-manifest.sha256", "artifacts/raw/c500-runs/exp-20260824-083-0863a84e1587-a02/status.json", "artifacts/raw/c500-runs/exp-20260824-083-0863a84e1587-a02/paired-benchmark.json", "artifacts/raw/c500-runs/exp-20260824-083-0863a84e1587-a02/correctness.log", "artifacts/raw/c500-runs/exp-20260824-083-0863a84e1587-a02/regression.log", "artifacts/raw/c500-runs/exp-20260824-083-0863a84e1587-a02/result-manifest.sha256"], "baseline_commit": "3d58170fe68859366eea4039f656922c8b1c7991", "benchmark": "C500-local attempt 1 baseline->candidate: case1 1.0550->1.0755 ms (+1.9431%, baseline drift -2.9879%), case2 6.1145->6.1125 (-0.0327%), case3 0.5625->0.5645 (+0.3556%), case4 3.4645->3.3295 (-3.8967%). Attempt 2: case1 1.0500->1.0790 (+2.7619%, baseline drift -4.2870%), case2 6.1085->6.1120 (+0.0573%), case3 0.5625->0.5620 (-0.0889%), case4 3.4610->3.3280 (-3.8428%).", "candidate_commit": "5795701e57aa939ce018054d7ed56ac5c2fe104e", "change": "Added only an exact case-4 selector and fixed <true,32768,7168,2048> launch to the exp-082 source; case-2 fixed dispatch, sorted map, grids, scalar payloads, device body, barriers, addresses, ABI and job remained unchanged.", "correctness": "PASS in two trusted attempts: MXCC candidate/baseline builds, 3/3 differential correctness, full frozen regression, sampled correctness, source/tree integrity, no-process and slice gates, and both 31-entry manifests.", "decision": "revert", "device": "c500-local", "environment": "MetaX C500 device 0; xcore1000; MACA 3.7.1.5; MXCC 1.0.0 d9102a1572; driver 3.8.30; 25% compute / 16000 MiB slice; runs exp-20260824-083-0863a84e1587-a01 and a02; c500-local.", "hypothesis": "Adding the proven fixed case-4 dimensions to exact exp-082 improves both prefill-down arms by at least 1 percent without a protected case regressing above 0.5 percent.", "id": "exp-20260824-083", "language": "CUDA Maca", "notes": "Tested commit 0863a84e1587d0ea3db1a1877e3b20d21da7f391; metadata handoff commit 5795701e57aa939ce018054d7ed56ac5c2fe104e; workflow 48a36a596c1fc4878d88c03bf3a2aa4b5007bc8f; source blob 8b10502ed7c275e5cc657397c800bdc4b2d797c7; LF SHA-256 e85dbd9f079608be6e81369e2afe15e33df7fcd150eb91da15e1c4140f78dcf3; manifest-file SHA-256 values 1da142dbf5ca03121b92987a7aaa0d55b6562c489471dd70c69f3407b1df9b24 and c07b81f892c7c8df9829cd17634fcf3dbcfbf61a7dfb835c6cf76fcb704cb236. Not enqueued, integrated or submitted. No NVIDIA run.", "operator": "Fused MoE i8 tn", "result": "REJECTED: case 4 improved strongly and repeatably, but protected decode gate-up could not satisfy the 0.5 percent gate after two attempts; the identical exact case-4 mechanism already lowered exp-081 OJ latency without moving its 85-point bucket, so this combination lacks a credible new OJ point path.", "schema_version": 1, "timestamp": "2026-08-24T11:17:45+00:00"}
{"artifacts": ["artifacts/raw/c500-runs/exp-20260824-084-ea4047fae647-a01"], "baseline_commit": "2230963fdd9d6394b3b63864500ffab00818b4f0", "benchmark": "C500-local ABBA medians baseline->candidate: case1 1.0525->1.0865 ms (+3.2304%); case2 6.1855->6.1855 ms (0.0000%), arms 6.185->6.182 and 6.186->6.189; case3 0.5640->0.5625 ms (-0.2660%); case4 3.4650->3.4645 ms (-0.0144%).", "candidate_commit": "ea4047fae647a59883d9033e84f974b6962a593b", "change": "Replaced addressable A/B fragment arrays with four named A and sixteen named B MmaLoad128 vectors while preserving LDS destinations, MMA operands, schedule, barriers, geometry, epilogue and ABI.", "correctness": "PASS: MXCC builds, 3/3 differential correctness, frozen regression, all sampled correctness, source/tree integrity, no-process gates and 31-entry manifest.", "decision": "revert", "device": "c500-local", "environment": "MetaX C500 xcore1000; MACA 3.7.1.5; MXCC 1.0.0 d9102a1572; driver 3.8.30; device 0; 25% compute / 16000 MiB slice; c500-local.", "hypothesis": "Literal MmaLoad128 fragment vectors reduce MXCC fragment-address work enough to improve both case-2 arms by at least 1 percent without protected regression.", "id": "exp-20260824-084", "language": "CUDA Maca", "notes": "Metadata queue commit 08f4bff3ca76be8024476311987d68da6647a931; source blob 8926fd177e44b24f916672b9cfce139c7ec447ed; LF SHA-256 54e0ab3f1f2c59f9bc35d69191cbcd1244f3f71f74cf5bc2b2e4b019878171cd; manifest-file SHA-256 5f903d2bb689e9bdf693c1e3892fbf91a1c7ceee095fbbf25c13e9afcfee42be. No NVIDIA or OJ run.", "operator": "Fused MoE i8 tn", "result": "REJECTED after one attempt: target case 2 is flat and both protected case-1 arms regress beyond the 0.5 percent gate; do not repeat, integrate or submit.", "schema_version": 1, "timestamp": "2026-08-24T12:02:42+00:00"}
{"artifacts": ["artifacts/raw/c500-runs/exp-20260824-085-337963fcede9-a01"], "baseline_commit": "2230963fdd9d6394b3b63864500ffab00818b4f0", "benchmark": "C500-local ABBA medians baseline->candidate: case1 1.0830->1.0890 ms (+0.5540%); case2 6.1820->7.0640 ms (+14.2672%), arms 6.181->7.027 and 6.183->7.101; case3 0.5605->0.5610 ms (+0.0892%); case4 3.4610->3.4640 ms (+0.0867%).", "candidate_commit": "337963fcede9a1b4ca274953f2e5831ec5ab255d", "change": "Changed only kOutputScratchSortGridM from 8 to 7 for the sorted case-2 launch; case 4, map, payload, MMA body, barriers, addresses, epilogue and ABI remain unchanged.", "correctness": "PASS: MXCC builds, 3/3 differential correctness, frozen regression, all sampled correctness, source/tree integrity, no-process gates and 31-entry manifest.", "decision": "revert", "device": "c500-local", "environment": "MetaX C500 xcore1000; MACA 3.7.1.5; MXCC 1.0.0 d9102a1572; driver 3.8.30; device 0; 25% compute / 16000 MiB slice; c500-local.", "hypothesis": "Reducing exact case-2 sorted physical cluster width from eight to seven creates enough modeled L2 headroom to improve both target arms by at least 1 percent.", "id": "exp-20260824-085", "language": "CUDA Maca", "notes": "Metadata queue commit 99fcf61b1f5dc7a6aaf23231f5ff1e6ca6267d29; source blob 1b1b2b2dc5b526b6956048dbf73a1dd5d6f8ed0c; LF SHA-256 5eb38de94af0270ed0b77b152e0e8d96bd46e25b203c92b19639cff4c3ff7a02; manifest-file SHA-256 fa3b09d3109f10678f69fe84cc67abd6618739632cbf73b7eae323ae3672ce86. No NVIDIA or OJ run.", "operator": "Fused MoE i8 tn", "result": "REJECTED after one attempt: stable case-2 baseline regressed 14.2672 percent in both arms; close width-seven/full-sort interaction and further cluster-width sweeps.", "schema_version": 1, "timestamp": "2026-08-24T12:03:01+00:00"}
