{"artifacts": ["artifacts/raw/c500-runs/exp-20260831-265-c6c898e5e68d-a01", "handoffs/exp-20260831-265.md"], "baseline_commit": "8341aa38e55659285673111df90e786c1fba08df", "benchmark": "NO ABBA: case4 parallel token-aware builder faulted in warmup because capability macro omission made the trusted harness pass nullptr token_ids", "candidate_commit": "c6c898e5e68d39709be8d7278b317db3f81358e3", "change": "Case4-only grid-x32 dual-expert 16-plus-16 blocks with packed logical and canonical A map", "correctness": "Local focused/workflow 21/21 PASS; C500 dual build, 3/3 differential correctness and full regression PASS before warmup", "decision": "revert", "device": "c500-local", "environment": "MetaX C500 xcore1000; MACA 3.7.1.5; paired formal baseline; run exp-20260831-265-c6c898e5e68d-a01 failed/1", "hypothesis": "Case4 dual-expert x32 canonical A blocks must improve case4 by 14.9897 percent for the complete score path", "id": "exp-20260831-265", "language": "cuda", "notes": "Queue tip 26ede43ebdb9d331986f72c8dedae7a1de10103c; source blob af413d5de50ed6667f782cc8beff7e36eb0204c8; LF SHA-256 b8f8052f244525c848c82c1bc0cccdad56141934297d79511dec736dc6232f06; controller rejected; no OJ; formal source unchanged", "operator": "fused_moe_i8_tn", "result": "REJECTED: workflow capability omission caused terminal Xnack ATU fault before case4 timing", "schema_version": 1, "timestamp": "2026-08-30T23:01:03+00:00"}
{"artifacts": ["artifacts/raw/c500-runs/exp-20260831-266-7347c96eff81-a01", "handoffs/exp-20260831-266.md"], "baseline_commit": "8341aa38e55659285673111df90e786c1fba08df", "benchmark": "NO ABBA: case4 serial token-aware builder faulted in warmup because capability macro omission made the trusted harness pass nullptr token_ids", "candidate_commit": "7347c96eff81aa9a17e77cefc5f728df9e194185", "change": "Serialize the case4-only dual-expert x32 packed logical and canonical A map builder", "correctness": "Local focused/workflow 21/21 PASS; C500 dual build, 3/3 differential correctness and full regression PASS before warmup", "decision": "revert", "device": "c500-local", "environment": "MetaX C500 xcore1000; MACA 3.7.1.5; paired formal baseline; run exp-20260831-266-7347c96eff81-a01 failed/1", "hypothesis": "Case4 serial-map dual-expert x32 canonical A blocks must improve case4 by 14.9897 percent for the complete score path", "id": "exp-20260831-266", "language": "cuda", "notes": "Queue tip 565211cc66a0a2b5e7f108e53b8f5f9b867bc59d; source blob 9431f6b8aee7dc51ddb2efa7165a7e74035dfe7b; LF SHA-256 620a839400815459cf94591608e32901d500facaef7ae9846e5f1b67d3d0592c; controller rejected; no OJ; formal source unchanged", "operator": "fused_moe_i8_tn", "result": "REJECTED: workflow capability omission caused terminal Xnack ATU fault before case4 timing", "schema_version": 1, "timestamp": "2026-08-30T23:01:03+00:00"}
{"artifacts": ["artifacts/raw/c500-runs/exp-20260831-267-449054dc0fd3-a01", "handoffs/exp-20260831-267.md"], "baseline_commit": "8341aa38e55659285673111df90e786c1fba08df", "benchmark": "C500 ABBA cases1/2/3/4: 0.8385->0.8370 ms (-0.1789%), 5.9855->5.9845 ms (-0.0167%), 0.5210->0.5215 ms (+0.0960%), 3.3250->3.3290 ms (+0.1203%); case4 arms 3.320->3.332 and 3.330->3.326 ms", "candidate_commit": "449054dc0fd3b9f159af564795aa535e9585f783", "change": "Use the formal stable-sort builder plus an in-place canonical-A pack map and a case4-only 32-wide two-expert 16-plus-16 physical mapping", "correctness": "PASS: local focused/workflow 21/21; detached audit approve; C500 dual build, 3/3 differential correctness, full regression, sampled/read-only checks, source/tree integrity and 31/31 manifest", "decision": "revert", "device": "c500-local", "environment": "MetaX C500 xcore1000; MACA 3.7.1.5; 25 percent compute / 16000 MiB; trusted run exp-20260831-267-449054dc0fd3-a01 succeeded/0", "hypothesis": "Case4 dual-expert x32 canonical A blocks must improve case4 by 14.9897 percent for the complete score path", "id": "exp-20260831-267", "language": "CUDA Maca", "notes": "Queue tip affbf39069252c11cd68c75d45588c1d856a85cd; source blob 5d1c152ef691ec127e2907c93bf534e1bd489c90; LF SHA-256 64f59301de79a75225932c3ed39c68579eb7e7e26b9560c5cf4eb957a9bc137b; controller rejected; no OJ; formal source unchanged", "operator": "Fused MoE i8 tn", "result": "REJECTED: case4 regressed 0.1203 percent in aggregate and missed the 14.9897 percent leaderboard gate", "schema_version": 1, "timestamp": "2026-08-30T23:19:23+00:00"}
{"artifacts": ["handoffs/exp-20260831-268.md"], "baseline_commit": "8341aa38e55659285673111df90e786c1fba08df", "benchmark": "No C500 run, ABBA, manifest or OJ submission; zero device slots consumed", "candidate_commit": "14090c6cb549a1e678f70b47e785f99d88694083", "change": "Stopped an uncommitted dual-expert kernel draft after complete-N ownership accounting proved total CTA count and aggregate A/B loads unchanged; preserved the dirty isolated worktree", "correctness": "Not run: feasibility failed before a candidate commit; draft was incomplete and referenced undefined kCase4DualRowsPerLoad", "decision": "revert", "device": "cpu", "environment": "Read-only source and traffic accounting on formal xcore1000 ownership; no C500, NVIDIA, TileLang, Triton, browser or OJ action", "hypothesis": "Pair two experts in one case4 2M x 2N N64 CTA to share routed A and improve case4 by 14.9897 percent for a complete 85.50 score path", "id": "exp-20260831-268", "language": "CUDA Maca", "notes": "Workflow 80d7a5b375305477b810458b49c5aa01fa3bb249; formal source blob 48704a2870975c3990f4681089b1a4efc35d99fa; preserved uncommitted draft blob 2a6e3c0b492518ce4228f062bf51158b68cb7032 with 596 insertions; reservation refs retained; no controller candidate", "operator": "Fused MoE i8 tn", "result": "REJECTED: N64 paired-expert CTAs merely exchange formal within-expert N-half A sharing for cross-expert A sharing, leaving aggregate CTA count and A/B bytes unchanged", "schema_version": 1, "timestamp": "2026-08-31T02:18:42+00:00"}
{"artifacts": ["artifacts/raw/c500-runs/exp-20260831-269-375abf00f131-a01", "handoffs/exp-20260831-269.md"], "baseline_commit": "8341aa38e55659285673111df90e786c1fba08df", "benchmark": "C500 ABBA cases1/2/3/4: 0.8420->0.8420 ms (0.0000%), 5.9890->6.0495 ms (+1.0102%; candidate arms 6.051/6.048 vs baseline 5.989/5.989), 0.5245->0.5265 ms (+0.3813%), 3.3270->3.4020 ms (+2.2543%; candidate arms 3.402/3.402 vs baseline 3.327/3.327)", "candidate_commit": "375abf00f131cdd6f00bb14ba61d3309f4e05ae7", "change": "Compose canonical routed-A reuse from exp-261 with the independently validated prefill BF16 ties-away conversion from exp-234", "correctness": "PASS: local focused/workflow 22/22; C500 dual build, 3/3 differential correctness, full regression, sampled/read-only checks, source/tree integrity and 31/31 manifest", "decision": "revert", "device": "c500-local", "environment": "MetaX C500/xcore1000 device 0; MACA 3.7.1.5; 25 percent compute / 16000 MiB; trusted run exp-20260831-269-375abf00f131-a01 succeeded/0", "hypothesis": "Canonical routed-A reuse plus prefill ties-away must improve case2 enough to cross the 78-point tier without material protected regression", "id": "exp-20260831-269", "language": "CUDA Maca", "notes": "Metadata tip cadca491d52836059606322ec59cd40547612fca; tested source blob 0fc0589ce510e6ad2c9c4ed010273af142d45ea8; LF SHA-256 0aba115f561da6437acbab7a435931c466440f45b0f5985361f5c93b4bb21c63c; controller rejected; no OJ; formal source unchanged", "operator": "Fused MoE i8 tn", "result": "REJECTED: independently positive component timings did not compose; case2 and case4 regressed decisively in both arms", "schema_version": 1, "timestamp": "2026-08-31T02:48:04+00:00"}
{"artifacts": ["artifacts/raw/c500-runs/exp-20260831-261-f51aa06db997-a01", "artifacts/raw/xpuoj/133848", "handoffs/exp-20260831-270.md"], "baseline_commit": "8341aa38e55659285673111df90e786c1fba08df", "benchmark": "Historical C500 exp-261 cases1/2/3/4: 0.8430->0.8405 ms (-0.2966%), 5.9895->5.9325 ms (-0.9517%), 0.5265->0.5235 ms (-0.5698%), 3.3300->3.3505 ms (+0.6156%); OJ #133848 exact times 0.809/11.026/0.496/5.672 ms", "candidate_commit": "74325499022111dd18296a3e68d1da5a2cd199ab", "change": "Replay the exact tested exp-261 canonical routed-A source for one final leaderboard-first OJ attempt", "correctness": "PASS: local exact-source/harness/workflow 16/16; historical C500 dual build, 3/3 differential correctness, full regression, sampled/read-only and integrity; OJ 4/4 Accepted", "decision": "revert", "device": "xpuoj-c500", "environment": "XPU-OJ contest 12 problem 1; CUDA Maca C500; submission #133848", "hypothesis": "Exact tested canonical-A replay should cross OJ case2 from 77 to 78 after a 0.9517 percent C500 gain", "id": "exp-20260831-270", "language": "CUDA Maca", "notes": "Integrated commit 74325499022111dd18296a3e68d1da5a2cd199ab; source blob 0ab2277d44f39485345a0a92800e1837432c7f1c; LF SHA-256 60b3604bb89b4f20ea51a3f4d9f283446397974e834dfc4909c4ed3171f3d649; controller finalized #133848; formal source restored from 8341aa38e55659285673111df90e786c1fba08df", "operator": "Fused MoE i8 tn", "result": "OJ ACCEPTED 80.25: cases 86/67/89/79; canonical-A transfer regressed both prefill targets and lost 4.50 points versus the 84.75 formal best", "schema_version": 1, "timestamp": "2026-08-31T03:24:21+00:00"}
