{"artifacts": ["artifacts/raw/c500-runs/exp-20260829-213-a1c22ecf45ae-a01", "handoffs/exp-20260829-213.md"], "baseline_commit": "8341aa38e55659285673111df90e786c1fba08df", "benchmark": "C500 ABBA cases1/2/3/4: 0.8410->0.8410 ms (flat), 5.9875->6.1590 ms (+2.8643 percent), 0.5275->0.5225 ms (-0.9479 percent), 3.3310->3.3290 ms (-0.0600 percent); case2 candidate arms both 6.159 ms", "candidate_commit": "a1c22ecf45ae4b4f31f527bb920a89b4400725e5", "change": "Route exact case2 through the existing stable 256-tile full-sort map and direct_moe_kernel_m4<true> on grid 8x32x32 while preserving decode m4 and formal case4", "correctness": "PASS: independent mapping audit; focused 4/4; C500 candidate/baseline build, 3/3 differential correctness, full regression, sampled/read-only checks, source/tree integrity and independently verified 31/31 manifest", "decision": "revert", "device": "c500-local", "environment": "MetaX C500/xcore1000 device0; MACA 3.7.1.5; MXCC 1.0.0 d9102a1572; 25 percent compute / 16000 MiB; no device process before or after", "hypothesis": "Exact case2 stable full-sort scheduling applied to synchronous K256 m4 can recover enough B reuse to cross three leaderboard points", "id": "exp-20260829-213", "language": "CUDA Maca", "notes": "Tested a1c22ecf45ae4b4f31f527bb920a89b4400725e5; queue tip 46d28b7c23ad7fd1da6edf84016452931bcc9070; source blob 162086d67a9d7bc3d48d98d7a7321c74a860a465; controller rejected; paired SHA-256 0f4fe14e820846f51e5a0297ed13f8fc100eb4b91135b628e308ca0e26d87d00; manifest SHA-256 179f80bf82d4b8e70c3119b6328aeb7ee43832a95fa37b858ad16c041d4214a5", "operator": "fused_moe_i8_tn", "result": "REJECTED: exact case2 stably regressed 2.8643 percent; sorted synchronous K256 prefill has no leaderboard point path and no OJ submission", "schema_version": 1, "timestamp": "2026-08-29T02:40:41+00:00"}
{"artifacts": ["artifacts/raw/c500-runs/exp-20260829-214-7a53bdfb2baa-a01", "handoffs/exp-20260829-214.md"], "baseline_commit": "8341aa38e55659285673111df90e786c1fba08df", "benchmark": "C500 ABBA cases1/2/3/4: 0.8410->0.8410 ms, 5.9885->5.9840 ms (-0.075144 percent), 0.5285->0.5250 ms, 3.3300->3.3220 ms; case2 arms 5.988->5.983 and 5.989->5.985 ms.", "candidate_commit": "7a53bdfb2baa314d1fe8995a09b0bb1e47175330", "change": "Replace O(256^2) full-sort rank scans with a 256-item shared bitonic network and pack expert/tile into one map payload.", "correctness": "PASS: focused 5/5, inherited projections 13/13, C500 build, 3/3 differential correctness, full regression, sampled/read-only checks, source/tree integrity and 31/31 manifest.", "decision": "revert", "device": "c500-local", "environment": "MetaX C500/xcore1000 device0; MACA 3.7.1.5; MXCC 1.0.0 d9102a1572; 25 percent compute / 16000 MiB; no device process before or after.", "hypothesis": "A stable 256-item bitonic packed-map builder crosses the exact case-2 next score tier.", "id": "exp-20260829-214", "language": "CUDA Maca", "notes": "Queue tip 1a804600c42ad6c12bb9fcb266888ac7a9e58416; source blob 6e96c16d904ab993146259afd57ede30cf520418; LF SHA-256 e1a209eb3cdf9655cba36316b0148d94ce29827d4cda559d1241747f21a3ef1b; controller rejected; manifest SHA-256 989b0e03744182cda8bdf4907b99ec62faeaf5828fbf1882d94e7dbdd204c78b", "operator": "fused_moe_i8_tn", "result": "REJECTED: case2 gain was only one third of the exact 0.2263 percent next-score-tier requirement; no OJ submission.", "schema_version": 1, "timestamp": "2026-08-29T03:36:23+00:00"}
{"artifacts": ["artifacts/raw/c500-runs/exp-20260829-215-ecda03fefa74-a01", "handoffs/exp-20260829-215.md"], "baseline_commit": "8341aa38e55659285673111df90e786c1fba08df", "benchmark": "C500 ABBA case2 5.9880->5.9855 ms (-0.041750 percent), arms 5.989->5.986 and 5.987->5.985 ms; candidate drift -0.016706 percent.", "candidate_commit": "ecda03fefa74671e6970c7647fa7aed608f97915", "change": "Remove only the exact-case2 CTA guard and metadata, column-scale and output-store predicates while preserving the stable map and all matrix scheduling.", "correctness": "PASS: focused exhaustive inverse/address proof; C500 build, 3/3 differential correctness, full regression, sampled/read-only checks, source/tree integrity and verified 31/31 manifest.", "decision": "revert", "device": "c500-local", "environment": "MetaX C500/xcore1000 device0; MACA 3.7.1.5; MXCC 1.0.0 d9102a1572; 25 percent compute / 16000 MiB.", "hypothesis": "Isolating exact-case2 main-kernel predicate elimination on the stable formal rank map crosses the 0.2263 percent next score tier.", "id": "exp-20260829-215", "language": "CUDA Maca", "notes": "Tested ecda03fefa74671e6970c7647fa7aed608f97915; queue tip cec159f131e9eb2be73e5b4720307fd22512f86a; source blob 0113a27be99cecd37524fc6eb02301d3d10c0591; LF SHA-256 7f2bbbdd9468df211f2b513a6db455b1360cdd003efcdc1f39b382e24ac704fd; controller rejected; manifest SHA-256 5e64475cdc9bbf002f78bf55161a0a5f46d8f9e386f045c45fe8ffad00b89ed.", "operator": "fused_moe_i8_tn", "result": "REJECTED: target gain was only 18.45 percent of the exact next-score-tier requirement; no OJ submission.", "schema_version": 1, "timestamp": "2026-08-29T04:20:18+00:00"}
{"artifacts": ["artifacts/raw/c500-runs/exp-20260829-216-14e6e53d9b59-a01", "handoffs/exp-20260829-216.md"], "baseline_commit": "8341aa38e55659285673111df90e786c1fba08df", "benchmark": "C500 ABBA case2 5.9910->5.9955 ms (+0.075113 percent), arms 5.991->5.996 and 5.991->5.995 ms.", "candidate_commit": "14e6e53d9b59016e989712155cd1995606b44929", "change": "Replace the stable full-rank scan with four wave histograms, shared within-wave stable ranks and a packed expert/tile map payload.", "correctness": "PASS: focused stable-map and inverse proof; C500 build, 3/3 differential correctness, full regression, sampled/read-only checks, source/tree integrity and 31/31 manifest.", "decision": "revert", "device": "c500-local", "environment": "MetaX C500/xcore1000 device0; MACA 3.7.1.5; MXCC 1.0.0 d9102a1572; 25 percent compute / 16000 MiB.", "hypothesis": "A deterministic four-wave histogram plus within-wave stable rank crosses the case2 score tier after composition with the measured predicate gain.", "id": "exp-20260829-216", "language": "CUDA Maca", "notes": "Tested 14e6e53d9b59016e989712155cd1995606b44929; queue tip 5e428614a0b346e5c636516f88a8943ed5d19285; source blob eb74308054d51abdb9cc8decb6776d3cf6c5ef7a; LF SHA-256 60ee81aa82245c280e02f62f45294b1ef14af4893fe99b2a7bff5633c4fde03b; controller rejected; manifest SHA-256 5cc37eae2c33162e1fb0e2dc498362533242a7b673fab5db33d927944b6e16a6.", "operator": "fused_moe_i8_tn", "result": "REJECTED: case2 and both target arms regressed; no composition or OJ submission.", "schema_version": 1, "timestamp": "2026-08-29T04:33:05+00:00"}
{"artifacts": ["artifacts/raw/c500-runs/exp-20260829-217-92aa1becfeec-a01", "handoffs/exp-20260829-217.md"], "baseline_commit": "8341aa38e55659285673111df90e786c1fba08df", "benchmark": "C500 ABBA case1 0.8440->1.1495 ms (+36.196682 percent), case3 0.5280->0.7140 ms (+35.227273 percent); case2 +0.208733 percent, case4 -0.075064 percent", "candidate_commit": "92aa1becfeec303c799c1dc97fecbe920477d0c7", "change": "Dispatch exact decode cases to the complete public 64x128x256 paired-half kernel with synchronous A BSM and ordinary-register B staging", "correctness": "PASS: focused static proof 6/6; C500 dual build, 3/3 differential correctness, full regression, sampled/read-only checks, source/tree integrity and 31/31 manifest", "decision": "revert", "device": "c500-local", "environment": "MetaX C500/xcore1000 device0; MACA 3.7.1.5; 25 percent compute / 16000 MiB; no device process before or after", "hypothesis": "The complete public synchronous M64 decode mapping reduces residency enough to cross an OJ display tier while formal prefill remains exact", "id": "exp-20260829-217", "language": "CUDA Maca", "notes": "Queue tip 136c3b6b08781e0e9db4a4d33bafdd980f91088e; candidate source blob 7724ca9fe7399693139586b8029361cc47193f59; transferred SHA-256 d8951875f9ee204cea519335877bacd84902720d3221621310c930d5ed8c84cc; manifest SHA-256 39d3ac60493b30a004a80a467170f6b4f152bc353f09d873a670eb15fb32f346; controller rejected", "operator": "fused_moe_i8_tn", "result": "REJECTED: intended 32 KiB / 200 MT resource class materialized, but doubled CTA and B traffic caused stable decode regressions above 35 percent; no OJ", "schema_version": 1, "timestamp": "2026-08-29T04:59:50+00:00"}
{"artifacts": ["artifacts/raw/c500-runs/exp-20260829-218-34da30cfcae1-a01", "handoffs/exp-20260829-218.md"], "baseline_commit": "8341aa38e55659285673111df90e786c1fba08df", "benchmark": "C500 ABBA candidate arms case1 11.014/0.833 ms and source-identical case2 40.202/5.982 ms; candidate drift -92.4369/-85.1201 percent; case3 flat and case4 -0.0903 percent", "candidate_commit": "34da30cfcae17c8861bf7027bdc2473975537f56", "change": "Change only the steady and prologue decode-m4 A BSM is_async flags from false to true; keep B synchronous and formal prefill exact", "correctness": "PASS: focused 4/4, workflow 15/15, C500 dual build, 3/3 differential correctness, full regression, sampled/read-only checks, source/tree integrity and 31/31 manifest", "decision": "revert", "device": "c500-local", "environment": "MetaX C500/xcore1000 device0; MACA 3.7.1.5; MXCC 1.0.0 d9102a1572; 25 percent compute / 16000 MiB; no device process after", "hypothesis": "A-only asynchronous BSM in decode m4 recovers load overlap without fully asynchronous A+B DMA queue pressure", "id": "exp-20260829-218", "language": "CUDA Maca", "notes": "Queue tip 77134634fb83fc3584ed91090e85fbb4a97d83b6; source blob e15fb58a5202d315493a16780422bd9cfdfa6937; formal source remained exact; controller rejected; no OJ", "operator": "fused_moe_i8_tn", "result": "REJECTED: catastrophic order-dependent async queue behavior makes the candidate unstable and unsafe for OJ", "schema_version": 1, "timestamp": "2026-08-29T05:41:28+00:00"}
{"artifacts": ["artifacts/raw/c500-runs/exp-20260829-219-69d748e43376-a01"], "baseline_commit": "8341aa38e55659285673111df90e786c1fba08df", "benchmark": "ABBA five-sample arms: case1 0.8430 to 0.8480 ms (+0.593120% slower); case3 0.5255 to 0.5275 ms (+0.380590% slower); prefill noise-level.", "candidate_commit": "69d748e43376b1a1bb1f5ee8bd692f41799bdd33", "change": "Reordered only the decode m4 steady loop's 180 MMA, BSM load, LDS and arrival operations; kept synchronous flags, addresses, K traversal, geometry and prefill exact.", "correctness": "C500 build; differential correctness 3/3 matched_ratio 1.0 max_abs 0; full regression/read-only/sample integrity PASS; focused 4/4 and workflow 12/12 PASS.", "decision": "revert", "device": "c500-local", "environment": "MetaX C500 xcore1000; MACA 3.7.1.5; MXCC 1.0.0 d9102a1572; 25% compute / 16000 MiB; device 0; no process after.", "hypothesis": "Synchronous directpipe issue order improves decode latency without async queue instability.", "id": "exp-20260829-219", "language": "CUDA Maca", "notes": "Candidate source blob 9052fcab874b18f6b389c188d5b068d762bfa46d; close synchronous directpipe issue-order and async m4 families; no OJ.", "operator": "Fused MoE i8 tn", "result": "Valid 31/31-manifest run succeeded/0 but both modified decode cases regressed; no leaderboard tier opportunity.", "schema_version": 1, "timestamp": "2026-08-29T06:29:09+00:00"}
{"artifacts": ["artifacts/raw/c500-runs/exp-20260828-204-ff828c965466-a01", "artifacts/raw/xpuoj/131137", "handoffs/exp-20260829-220.md"], "baseline_commit": "8341aa38e55659285673111df90e786c1fba08df", "benchmark": "C500 ABBA cases1/2/3/4: 0.8385->0.8380, 5.9850->5.9770, 0.5235->0.5225, 3.3250->3.3190 ms; OJ cases 86/77/90/86 and total 84.75", "candidate_commit": "e7e30a6fcd0e80babbb5608f2a20c3d6b2e05a04", "change": "Exact score-policy replay of exp-204 shared histogram, prefix, atomic stable-rank allocation and packed expert/tile map payload", "correctness": "PASS: replay focused 3/3; original C500 dual build, 3/3 differential correctness, full regression, sampled/read-only, source/tree integrity and 31/31 manifest; independent mapping and publication audit APPROVE; OJ 4/4 Accepted", "decision": "revert", "device": "c500-local and XPU-OJ C500", "environment": "MetaX C500/xcore1000; MACA 3.7.1.5; CUDA Maca OJ", "hypothesis": "Leaderboard-first replay may cross an OJ display boundary despite missing the retired local 0.23 percent gate", "id": "exp-20260829-220", "language": "CUDA Maca", "notes": "Original tested ff828c965466cd5139ef87b187e15b1cf185a084; queue d4571db3f4f91666fe6f23e97d6a72a1f60eb30d; integrated a1ccabef2540b701102610206e4e41b3221210b8; candidate blob 885749051bc006232d9889412c78870b29fa09fd; OJ 131137 finalized; source restored to formal blob 48704a2870975c3990f4681089b1a4efc35d99fa", "operator": "fused_moe_i8_tn", "result": "REJECTED TIE: OJ remained 84.75 with unchanged cases and rank 16", "schema_version": 1, "timestamp": "2026-08-29T07:00:43+00:00"}
{"artifacts": ["artifacts/raw/c500-runs/exp-20260829-214-7a53bdfb2baa-a01", "artifacts/raw/xpuoj/131184", "handoffs/exp-20260829-221.md"], "baseline_commit": "8341aa38e55659285673111df90e786c1fba08df", "benchmark": "C500 ABBA cases1/2/3/4: 0.8410->0.8410, 5.9885->5.9840, 0.5285->0.5250, 3.3300->3.3220 ms; OJ cases 86/77/90/86 at 0.808/6.474/0.489/3.486 ms and total 84.75", "candidate_commit": "02b51a53a1ab17abbc34d8131c5ec6058adb9b5c", "change": "Exact score-policy replay of exp-214 stable 256-item bitonic builder with packed expert/tile map payload", "correctness": "PASS: replay identity 3/3; original focused and inherited proofs 18/18; original C500 dual build, 3/3 differential correctness, full regression, sampled/read-only, source/tree integrity and 31/31 manifest; OJ 4/4 Accepted", "decision": "revert", "device": "c500-local and XPU-OJ C500", "environment": "MetaX C500/xcore1000; MACA 3.7.1.5; CUDA Maca OJ", "hypothesis": "Leaderboard-first bitonic replay may cross an OJ display boundary despite missing the retired local 0.23 percent gate", "id": "exp-20260829-221", "language": "CUDA Maca", "notes": "Original tested 7a53bdfb2baa314d1fe8995a09b0bb1e47175330; replay 02b51a53a1ab17abbc34d8131c5ec6058adb9b5c; queue 9b0b87d5a0298e7369e77d61b47c6dfcc7624210; integrated 8d25138235f40e480ba63cf0d56094f4a888ad4c; candidate blob 6e96c16d904ab993146259afd57ede30cf520418; OJ 131184 finalized; source restored to formal blob 48704a2870975c3990f4681089b1a4efc35d99fa", "operator": "fused_moe_i8_tn", "result": "REJECTED TIE: OJ remained 84.75 with unchanged cases and rank 16", "schema_version": 1, "timestamp": "2026-08-29T08:21:04+00:00"}
{"artifacts": ["artifacts/raw/c500-runs/exp-20260829-222-fd46f7aa3e7e-a01", "handoffs/exp-20260829-222.md"], "baseline_commit": "8341aa38e55659285673111df90e786c1fba08df", "benchmark": "C500 ABBA case1 0.8400->0.8415 ms (+0.178571 percent) and case3 0.5250->0.5275 ms (+0.476190 percent); prefill source-identical noise-level", "candidate_commit": "fd46f7aa3e7e01ac9c9c4bdbb7dee7e9cf71c34c", "change": "Fuse decode m4 weights[4][4] and a_scale[4][4] into row_factor[4][4] with one short-lived weight scalar per row", "correctness": "PASS: focused and inherited 13/13, workflow/controller/ABBA 15/15, C500 dual build, 3/3 differential correctness, full regression, sampled/read-only checks, source/tree integrity and 31/31 manifest", "decision": "revert", "device": "c500-local", "environment": "MetaX C500/xcore1000 device0; MACA 3.7.1.5; MXCC 1.0.0 d9102a1572; 25 percent compute / 16000 MiB; no device process after", "hypothesis": "Removing 16 long-lived float values lowers decode m4's 256 MT resource class and improves cases 1/3 enough for an OJ display opportunity", "id": "exp-20260829-222", "language": "CUDA Maca", "notes": "Queue tip 592229e3d330d891ec474d8081a22b6843053833; source blob 46b303286142df1020841564f924d50265641fb2; LF SHA-256 1ad3054a40b79277297645dab3462ce334ec01ed508e12c5db7d4d9fa5766bba; resources remained 0/256/52/65536; controller rejected; no OJ", "operator": "fused_moe_i8_tn", "result": "REJECTED: resource class did not change and both modified decode cases regressed", "schema_version": 1, "timestamp": "2026-08-29T08:46:41+00:00"}
{"artifacts": ["artifacts/raw/c500-runs/exp-20260829-224-2d03ea2c7934-a01", "handoffs/exp-20260829-224.md"], "baseline_commit": "8341aa38e55659285673111df90e786c1fba08df", "benchmark": "C500 ABBA case1 0.8405->0.8460 ms (+0.654372 percent) and case3 0.5250->0.5280 ms (+0.571429 percent); both candidate arms slower; prefill source-identical noise-level", "candidate_commit": "2d03ea2c7934433dbc35cc70e6eb3b1398302c95", "change": "Move only m4 A00 from prologue/backedge to steady/drain consumer entry while preserving A01-03 and every protected operation", "correctness": "PASS: focused/inherited/workflow 29/29; detached audit approve; C500 dual build, 3/3 differential correctness, full regression, sampled/read-only checks, source/tree integrity and 31/31 manifest", "decision": "revert", "device": "c500-local", "environment": "MetaX C500/xcore1000 device0; MACA 3.7.1.5; MXCC 1.0.0 d9102a1572; 25 percent compute / 16000 MiB; no device process after", "hypothesis": "Delay only decode-m4 A00 LDS to each consumer entry; a stable case-1 gain crossing the current display threshold creates an OJ opportunity", "id": "exp-20260829-224", "language": "CUDA Maca", "notes": "Queue tip c58436dfd6a9621d49ca2dbccc2d48612ed16e35; source blob bed47571240e77efdf83fee20638336da4dda6df; LF SHA-256 4efebef57e6a43588f4c0934652b3c3421881c2f307eeaa5f57b66749f4acc3f; m4 resources unchanged 0/256/52/65536; controller rejected; no OJ", "operator": "fused_moe_i8_tn", "result": "REJECTED: exact lifecycle is correct but both decode targets regress and no leaderboard score path exists; no OJ", "schema_version": 1, "timestamp": "2026-08-29T09:23:36+00:00"}
{"artifacts": ["artifacts/raw/c500-runs/exp-20260829-225-a01fcf813cf9-a01", "handoffs/exp-20260829-225.md"], "baseline_commit": "8341aa38e55659285673111df90e786c1fba08df", "benchmark": "C500 ABBA case1 0.8405->0.8490 ms (+1.011303 percent) and case3 0.5265->0.5295 ms (+0.569801 percent); both modified decode cases slower; prefill source-identical noise-level", "candidate_commit": "a01fcf813cf94a8a46b25f35cdce6cf6a1909bd0", "change": "Move only decode m4 A00/A01 LDS from prologue/backedge publication to steady/drain entry while preserving the exact per-tile address multiset and all protected operations", "correctness": "PASS: focused/inherited/workflow 29/29; detached exact-commit audit approve; C500 dual build, 3/3 differential correctness, full regression, sampled/read-only checks, source/tree integrity and result manifest", "decision": "revert", "device": "c500-local", "environment": "MetaX C500/xcore1000 device0; MACA 3.7.1.5; MXCC 1.0.0 d9102a1572; 25 percent compute / 16000 MiB; no device process after", "hypothesis": "Delay decode-m4 A00/A01 LDS as a pair to steady/drain consumer entry; a stable case-1 gain near 5.27 percent would create the next leaderboard display opportunity", "id": "exp-20260829-225", "language": "CUDA Maca", "notes": "Queue tip f10a3c8da2cee0498b3f8c9a70cb2ae56151d663; source blob 3c69476dcde0b0b84b28398094609773294b4f48; LF SHA-256 bf8d374222623e8ce48586be0b47ae8a1c53b96cdddfc1e9cdd03ca5d1810e0b; resources unchanged 0/256/52/65536; controller rejected; no OJ", "operator": "fused_moe_i8_tn", "result": "REJECTED: exact lifecycle is correct but both decode targets regress and no leaderboard score path exists; no OJ", "schema_version": 1, "timestamp": "2026-08-29T09:40:51+00:00"}
{"artifacts": ["artifacts/raw/c500-runs/exp-20260829-226-9c1a151be463-a01", "handoffs/exp-20260829-226.md"], "baseline_commit": "8341aa38e55659285673111df90e786c1fba08df", "benchmark": "C500 ABBA case1 0.8445->0.8450 ms (+0.059207 percent) and case3 0.5320->0.5290 ms (-0.563910 percent); case3 arms improved only 0.938086/0.188324 percent", "candidate_commit": "9c1a151be4639b9aa766fc3230bc6c4d8e3c169d", "change": "Keep token_row_m before the drain but move rowC[16] declaration and affine fill after the drain and accumulator pack, immediately before first metadata use", "correctness": "PASS: focused/inherited/workflow 29/29; detached exact-commit audit approve; C500 dual build, 3/3 differential correctness, full regression, sampled/read-only checks, source/tree integrity and 31/31 manifest", "decision": "revert", "device": "c500-local", "environment": "MetaX C500/xcore1000 device0; MACA 3.7.1.5; MXCC 1.0.0 d9102a1572; 25 percent compute / 16000 MiB; no device process after", "hypothesis": "Materialize decode-m4 row indices only after the drain; retain only on about 1 percent paired case3 gain or a stronger displayed-score path", "id": "exp-20260829-226", "language": "CUDA Maca", "notes": "Queue tip 339d080885e82b0cbc26630d02db89807ae02223; source blob c5ab244d4c3546416174ccabdbc1cb470abb2b89; LF SHA-256 d4c3a09aa0643fa6253a3f2b1ea87c754ffa28d69715a5378975196d679cc44a; resources unchanged 0/256/52/65536; controller rejected; no OJ", "operator": "fused_moe_i8_tn", "result": "REJECTED: m4 remained 256 MT and case3 paired gains were below the mechanism and score thresholds; no OJ", "schema_version": 1, "timestamp": "2026-08-29T10:01:12+00:00"}
