{"artifacts": ["artifacts/raw/remote-runs/exp-20260823-049-6fe3b7194b38-a01/status.json", "artifacts/raw/remote-runs/exp-20260823-049-6fe3b7194b38-a01/stdout.log", "artifacts/raw/remote-runs/exp-20260823-049-6fe3b7194b38-a01/environment.txt", "artifacts/raw/remote-runs/exp-20260823-049-6fe3b7194b38-a01/gpu-before.csv", "artifacts/raw/xpuoj/123828/result-summary.json", "artifacts/raw/xpuoj/123828/spj-report.txt", "artifacts/raw/xpuoj/123828/result-page.png", "artifacts/raw/xpuoj/123828/case-details-viewport.png", "artifacts/raw/xpuoj/123828/scoreboard.png"], "baseline_commit": "8c519e6c1bb57e7b124b60806db9575fa1267207", "benchmark": "proxy/NVIDIA RTX A5000 GPU 1 interleaved 10+10 medians, cases 1-4 baseline 43.3660/340.0500/21.7230/173.1630 ms and candidate 42.7030/342.1920/21.8250/173.4115 ms; deltas -1.529/+0.630/+0.470/+0.144 percent. NVIDIA executes unchanged fallback, so spread is noise/provenance only. Target/C500 XPU-OJ #123828 passed 4/4 at 82.25 with case times 0.979/8.000/0.522/3.915 ms.", "candidate_commit": "144ac670a9bc1d800f071ec8dc534a0c550585c7", "change": "Templated the MACA MMA kernel dimensions and added exact dispatch to four fixed public instances plus an unchanged runtime fallback; matrix/shared/epilogue body, geometry and NVIDIA fallback are unchanged.", "correctness": "PASS on committed snapshot 6fe3b7194b3842b576d67da2e715891298c5f021: exact formal-best reconstruction, candidate/baseline CUDA builds, three differential cases matched_ratio=1/max_abs=0, four fixed public dispatches, unsupported runtime fallback, output/grid/A-bounds and all-zero/read-only regressions. XPU-OJ #123828 then compiled for xcore1000 and passed all four scored cases.", "decision": "revert", "device": "nvidia+xpuoj/c500", "environment": "proxy/NVIDIA physical GPU 1 RTX A5000; driver 535.261.03; CUDA 12.2 nvcc; run exp-20260823-049-6fe3b7194b38-a01; target XPU-OJ xcore1000 submission #123828 at 2026-08-23T18:24:50+08:00", "hypothesis": "Distinct fixed EM/N/K template instances for all four public shapes let MXCC fold shape-dependent bounds, strides and loop limits without changing the validated kernel body, improving at least one displayed C500 case.", "id": "exp-20260823-049", "language": "CUDA Maca", "notes": "Candidate LF SHA-256 6fb18187921f0a568e363f76d8fbeffd533f871ef26dd283016384cc252dd1f6; source blob eaff23b3594e9471c7a4bd341588b4c024d71d28; remote-tested commit 6fe3b7194b3842b576d67da2e715891298c5f021; final queued handoff tip 144ac670a9bc1d800f071ec8dc534a0c550585c7; integrated/submitted commit ed4c5d33820dabd746ecccf8ab820ec2d8517ae2. Target cases 83/73/89/84 and exact displayed times 0.979/8.000/0.522/3.915 ms tied the formal best at rank 25; reject the tie and restore exact #117114 source.", "operator": "Fused MoE i8 tn", "result": "TARGET ACCEPTED 4/4 / 82.25 TIE: XPU-OJ #123828 preserved correctness and matched the formal-best case scores, but did not strictly improve total score or rank; formal best remains #117114 and the candidate is reverted.", "schema_version": 1, "submission_id": "123828", "target_cases": [83, 73, 89, 84], "target_commit": "ed4c5d33820dabd746ecccf8ab820ec2d8517ae2", "target_rank": 25, "target_score": 82.25, "target_times_ms": [0.979, 8.0, 0.522, 3.915], "timestamp": "2026-08-23T10:07:33+00:00"}
{"artifacts": ["artifacts/raw/remote-runs/exp-20260823-048-7aab4110293f-a01/status.json", "artifacts/raw/remote-runs/exp-20260823-048-7aab4110293f-a01/stdout.log", "artifacts/raw/remote-runs/exp-20260823-048-7aab4110293f-a01/environment.txt", "artifacts/raw/remote-runs/exp-20260823-048-7aab4110293f-a01/gpu-before.csv"], "baseline_commit": "8c519e6c1bb57e7b124b60806db9575fa1267207", "benchmark": "proxy/NVIDIA RTX A5000 GPU 0: isolated 1024-byte D2H plus sort median/p95 8.6/9.1 us; paired full-call overhead median/p95 337.5/4212.0 us, exceeding the assigned 81-us gate. Raw run exp-20260823-048-7aab4110293f-a01.", "candidate_commit": "7a78dd759b3920e49c10445f6c0c85877cf8b914", "change": "Added a synchronous 1024-byte expert-ID D2H, stable counting-sort POD, and physical-to-logical M-tile routing only for case 2; CTA/grid/tile/LDS/matrix pipeline/barriers/epilogue remain unchanged.", "correctness": "PASS on committed proxy/NVIDIA snapshot 7aab4110293ff19be489214d8fd330a1a890c4fc: CUDA build, differential correctness, stable permutation and exact CTA coverage, invalid-ID fallback, public bounds, read-only regression, and exact formal-best reconstruction.", "decision": "revert", "device": "nvidia", "environment": "proxy/NVIDIA physical GPU 0 RTX A5000; driver 535.261.03; CUDA 12.2 nvcc; run exp-20260823-048-7aab4110293f-a01; target MACA branch not executed", "hypothesis": "Stable host-side expert grouping for case 2 may improve repeated-expert B-cache locality if its full-call overhead stays below 81 us.", "id": "exp-20260823-048", "language": "CUDA Maca", "notes": "Candidate LF source SHA-256 70f82534d4e5641eeee870111de8a5bcc4b75a5db10338b14f38d5dc961b6e70; remote-tested commit 7aab4110293ff19be489214d8fd330a1a890c4fc; final queue tip 7a78dd759b3920e49c10445f6c0c85877cf8b914. Close synchronous host expert-sort family.", "operator": "Fused MoE i8 tn", "result": "REJECTED before integration/OJ: full-call overhead exceeded the explicit gate and no target-specific cache evidence justified the risk.", "schema_version": 1, "timestamp": "2026-08-23T10:34:21+00:00"}
{"artifacts": ["handoffs/exp-20260823-051.md"], "baseline_commit": "6fe3b7194b3842b576d67da2e715891298c5f021", "benchmark": "No new run. Exact-source exp-049 proxy/NVIDIA evidence measured the normal one-query path at about 94.5 ns, over 21 times below the assigned 2-us opportunity gate.", "candidate_commit": "82b766ed5b56697026938069ccf086abcccc62b7", "change": "Feasibility analysis only; source unchanged. Evaluated pointer lifetime, allocation ABA, concurrency and measured allocation-range query cost.", "correctness": "Rejected before implementation: raw pointer identity has no allocation generation/free hook, so same-address reuse can return a stale shape even with correct locking or thread-local publication.", "decision": "revert", "device": "cpu", "environment": "local Windows/PowerShell source and API analysis; reused proxy/NVIDIA exp-20260823-049 allocation-range timing; no GPU run", "hypothesis": "Memoizing allocation-derived shape for a stable pointer tuple could remove repeated range queries and improve decode fixed overhead.", "id": "exp-20260823-051", "language": "CUDA Maca", "notes": "Handoff-only commit 82b766ed5b56697026938069ccf086abcccc62b7. Source remained exp-049 blob eaff23b3594e9471c7a4bd341588b4c024d71d28 / LF SHA-256 6fb18187921f0a568e363f76d8fbeffd533f871ef26dd283016384cc252dd1f6. Close pointer-only config cache unless a documented allocation-generation token appears.", "operator": "Fused MoE i8 tn", "result": "REJECTED before implementation: pointer-only memoization is not contract-safe and its maximum measured saving is negligible.", "schema_version": 1, "timestamp": "2026-08-23T11:14:16+00:00"}
{"artifacts": ["handoffs/exp-20260823-052.md"], "baseline_commit": "6fe3b7194b3842b576d67da2e715891298c5f021", "benchmark": "Not run because the mandatory documentation gate failed before source editing; unchanged NVIDIA fallback cannot establish C500 cache semantics.", "candidate_commit": "89db7cec74c62f84a30473632777ec68d037dc33", "change": "Documentation feasibility analysis only; source unchanged. Exhaustively inspected authoritative MXMACA builtin documentation and official Fused MoE load tuples.", "correctness": "No executable candidate. Published predicated-load arguments are address, return, streg, predicate and synchronization controls; no documented cache policy exists, and the plain-load signature is not declared.", "decision": "revert", "device": "cpu", "environment": "local Windows/PowerShell source and authoritative MXMACA builtin documentation analysis; official clone 4f2aa14e92353e382e59bae98abe2c19e652ebd7; no GPU run", "hypothesis": "A documented B-load cache policy could improve repeated-expert B reuse in skewed prefill cases without changing load addresses or order.", "id": "exp-20260823-052", "language": "CUDA Maca", "notes": "Handoff-only commit 89db7cec74c62f84a30473632777ec68d037dc33. Source remained exp-049 blob eaff23b3594e9471c7a4bd341588b4c024d71d28 / LF SHA-256 6fb18187921f0a568e363f76d8fbeffd533f871ef26dd283016384cc252dd1f6. Close cache-policy family until documented ABI appears.", "operator": "Fused MoE i8 tn", "result": "REJECTED before implementation: no authoritative cache-control ABI exists for plain or predicated b128 global loads, so changing flags would be a blind undocumented probe.", "schema_version": 1, "timestamp": "2026-08-23T11:14:36+00:00"}
{"artifacts": ["artifacts/raw/remote-runs/exp-20260823-053-80c926c2ea40-a01/status.json", "artifacts/raw/remote-runs/exp-20260823-053-80c926c2ea40-a01/stdout.log", "artifacts/raw/remote-runs/exp-20260823-053-80c926c2ea40-a01/environment.txt", "artifacts/raw/remote-runs/exp-20260823-053-80c926c2ea40-a01/gpu-before.csv"], "baseline_commit": "6fe3b7194b3842b576d67da2e715891298c5f021", "benchmark": "proxy/NVIDIA GPU 2 paired full-call medians baseline/candidate cases 1-4: 41.9820/41.6885, 334.0580/333.2920, 21.0875/21.1710 and 168.2750/167.5865 ms. NVIDIA executes unchanged fallback; deltas are provenance/noise only.", "candidate_commit": "5488be20da36a26cb6e1703f0e7cb3d39515c888", "change": "Four fixed launches pass an empty C++14 carrier while the runtime fallback keeps a 12-byte dimension carrier; the body after local dimension bindings is unchanged.", "correctness": "PASS on committed proxy/NVIDIA snapshot 80c926c2ea407a4deb9b07c5181544f42d4e7174: candidate/baseline builds, differential correctness, exact exp-049 reconstruction, carrier arity/layout, dispatch, public bounds and read-only regression.", "decision": "revert", "device": "nvidia", "environment": "proxy/NVIDIA physical GPU 2 RTX A5000; driver 535.261.03; CUDA 12.2 nvcc; run exp-20260823-053-80c926c2ea40-a01; target MACA carrier not executed", "hypothesis": "Eliding unused runtime EM/N/K values from exp-049 fixed-shape launches could reduce target launch arguments and compiler live-ins enough to improve a decode score step.", "id": "exp-20260823-053", "language": "CUDA Maca", "notes": "Candidate LF SHA-256 2723ef000af5c109ff83a14bad5fbd6e15987114dac4c49fccd7f9ec22ba1348; source blob d778e9b927c3b0b4735c37c92bca4d2c14ad3e88; remote-tested commit 80c926c2ea407a4deb9b07c5181544f42d4e7174; queue tip 5488be20da36a26cb6e1703f0e7cb3d39515c888. Candidate rejected after #123828 tied 82.25; do not combine with formal best under this identity.", "operator": "Fused MoE i8 tn", "result": "REJECTED after proxy gates because its required exp-049 parent tied rather than improved formal best; protocol forbids stacking this dependent change on the losing candidate.", "schema_version": 1, "timestamp": "2026-08-23T11:15:08+00:00"}
{"artifacts": ["artifacts/raw/remote-runs/exp-20260823-054-361478fec993-a01/status.json", "artifacts/raw/remote-runs/exp-20260823-054-361478fec993-a01/stdout.log", "artifacts/raw/remote-runs/exp-20260823-054-361478fec993-a01/environment.txt", "artifacts/raw/remote-runs/exp-20260823-054-361478fec993-a01/gpu-before.csv", "artifacts/raw/xpuoj/123940/result.txt", "artifacts/raw/xpuoj/123940/terminal.png"], "baseline_commit": "8c519e6c1bb57e7b124b60806db9575fa1267207", "benchmark": "proxy/NVIDIA GPU 0 paired 10+10 medians baseline/candidate cases 1-4: 43.0155/41.8945, 333.6165/336.1365, 21.1880/21.3625, 168.0710/169.0115 ms. Both full kernels execute exact fallback, so deltas are provenance/noise only. Target/C500 XPU-OJ #123940 passed 4/4 at 82.00 with user-kernel times 1.017/8.000/0.547/4.135 ms.", "candidate_commit": "6baf92b5c39f89fa9993912d206bd071681c094a", "change": "Replaced exactly two MACA predicated b64 store call sites with aligned uint64_t assignments; output ownership, values, order, bytes, matrix/shared pipeline, metadata, geometry and synchronization are unchanged.", "correctness": "PASS on committed proxy snapshot 361478fec993: exact formal-best reconstruction; CUDA candidate/baseline builds; three differential cases matched_ratio=1/max_abs=0; exhaustive 4096-store, 32768-byte, 16384-value ownership/bounds/8-byte-alignment model; CUDA ordinary-store proxy and read-only regression PASS. XPU-OJ #123940 then compiled for xcore1000 and passed all four scored cases.", "decision": "revert", "device": "nvidia+xpuoj/c500", "environment": "proxy/NVIDIA physical GPU 0 RTX A5000; driver 535.261.03; CUDA 12.2 nvcc; run exp-20260823-054-361478fec993-a01; target XPU-OJ xcore1000 submission #123940 at 2026-08-23T20:02:21+08:00", "hypothesis": "Replacing the two always-true predicated b64 epilogue stores with ordinary aligned uint64_t assignments preserves all output bytes while removing per-store predicate setup and may improve one displayed C500 score step.", "id": "exp-20260823-054", "language": "CUDA Maca", "notes": "Queue tip 6baf92b5c39f89fa9993912d206bd071681c094a; remote-tested commit 361478fec993f2cbab819ea8b20528ceb1e57b38; integrated/submitted commit 87920886af3ee541182d937f6d398b4c5496d686; LF source SHA-256 f73c6ca21426e3a849df28527ac5452d1787e95e9419efd0b658dfedee745405. Target cases 83/73/89/83 scored 82.00, below formal best #117114 at 82.25; reject and restore exact formal-best source.", "operator": "Fused MoE i8 tn", "result": "TARGET ACCEPTED 4/4 / 82.00 REGRESSION: XPU-OJ #123940 preserved correctness but lost one case-4 score point and 0.25 total; formal best remains #117114 and the candidate is reverted.", "schema_version": 1, "submission_id": "123940", "target_cases": [83, 73, 89, 83], "target_commit": "87920886af3ee541182d937f6d398b4c5496d686", "target_rank": 25, "target_score": 82.0, "target_times_ms": [1.017, 8.0, 0.547, 4.135], "timestamp": "2026-08-23T11:50:12+00:00"}
{"artifacts": ["artifacts/raw/remote-runs/exp-20260823-055-7b9dc6e9dd17-a01/status.json", "artifacts/raw/remote-runs/exp-20260823-055-7b9dc6e9dd17-a01/stdout.log", "artifacts/raw/remote-runs/exp-20260823-055-7b9dc6e9dd17-a01/environment.txt", "artifacts/raw/remote-runs/exp-20260823-055-7b9dc6e9dd17-a01/gpu-before.csv", "artifacts/raw/xpuoj/123981/result.txt", "artifacts/raw/xpuoj/123981/terminal.png", "artifacts/raw/xpuoj/123981/result-page.png"], "baseline_commit": "8c519e6c1bb57e7b124b60806db9575fa1267207", "benchmark": "proxy/NVIDIA GPU 1 paired 10+10 medians baseline/candidate cases 1-4: 42.5910/42.6970, 340.0185/341.7850, 21.5705/21.8115, 173.1635/173.4710 ms. Both execute unchanged fallback; deltas are provenance/noise only. Target/C500 XPU-OJ #123981 passed 4/4 at 81.75 with user-kernel times 1.020/8.000/0.552/4.143 ms.", "candidate_commit": "67101842f8b938ee785b788b7c35b71001b1c9df", "change": "Changed only the two unrolled row-metadata load expressions from predicated to ordinary documented b32 form; kept 16 scalar loads per thread and all B, scale-B, store, matrix/shared, geometry and synchronization behavior unchanged.", "correctness": "PASS on committed proxy snapshot 7b9dc6e9dd17: exact formal-best reconstruction; candidate/baseline CUDA builds; three differential cases matched_ratio=1/max_abs=0; exhaustive every-tile row bounds/address/value and 16-hit coverage; traffic accounting; read-only regression and 11 workflow tests PASS. XPU-OJ #123981 then compiled for xcore1000 and passed all four scored cases.", "decision": "revert", "device": "nvidia+xpuoj/c500", "environment": "proxy/NVIDIA physical GPU 1 RTX A5000; driver 535.261.03; CUDA 12.2 nvcc; run exp-20260823-055-7b9dc6e9dd17-a01; target XPU-OJ xcore1000 submission #123981 at 2026-08-23T20:42:14+08:00", "hypothesis": "Replacing the sixteen always-in-bounds per-thread moe_weights and scale_a predicated b32 loads with ordinary b32 loads preserves addresses and bytes while removing 4096 predicate comparisons per CTA and may improve a displayed C500 case.", "id": "exp-20260823-055", "language": "CUDA Maca", "notes": "Queue tip 67101842f8b938ee785b788b7c35b71001b1c9df; remote-tested commit 7b9dc6e9dd17fff02bae7353a81d010ab783fd08; integrated/submitted commit 1cf939603ff6c0e12f34098d10adaa99659aded7; LF source SHA-256 419634b6c6ebbfdd419c31cd86bffcbfc1bc3110d6061fe3d85bbe860d2a3408. Target cases 83/73/88/83 scored 81.75, below formal best #117114 at 82.25; reject and restore exact formal-best source.", "operator": "Fused MoE i8 tn", "result": "TARGET ACCEPTED 4/4 / 81.75 REGRESSION: XPU-OJ #123981 preserved correctness but lost one case-3 and one case-4 score point, 0.50 total; formal best remains #117114 and the candidate is reverted.", "schema_version": 1, "submission_id": "123981", "target_cases": [83, 73, 88, 83], "target_commit": "1cf939603ff6c0e12f34098d10adaa99659aded7", "target_rank": 25, "target_score": 81.75, "target_times_ms": [1.02, 8.0, 0.552, 4.143], "timestamp": "2026-08-23T12:05:09+00:00"}
{"artifacts": ["artifacts/raw/remote-runs/exp-20260823-057-9840c032e6e6-a01/status.json", "artifacts/raw/remote-runs/exp-20260823-057-9840c032e6e6-a01/stdout.log", "artifacts/raw/remote-runs/exp-20260823-057-9840c032e6e6-a01/stderr.log", "artifacts/raw/remote-runs/exp-20260823-057-9840c032e6e6-a01/gpu-before.csv"], "baseline_commit": "8c519e6c1bb57e7b124b60806db9575fa1267207", "benchmark": "proxy/NVIDIA GPU 3 occurrence-control net overhead over 8192 CTA baseline: all-same 149.504 us, mixed 154.624 us, all-unique 355.328 us. All exceed the mandatory 81-us gate; full public fallback benchmark intentionally skipped.", "candidate_commit": "ac944d5f7e729c67ae3023f1e4358ff4048a69db", "change": "Case-2-only even/odd same-expert occurrence ownership and race-free two-logical-tile leader loop; grid, logical 128x128x128 body, 256 threads, 32-KiB LDS, arithmetic/traffic and other shapes remain unchanged.", "correctness": "Source reconstruction, CUDA fallback build and three differential cases PASS. Exhaustive 9840 short expert patterns plus 256-tile all-same/all-unique/mixed distributions proved unique leader ownership, exact 32-N coverage, scan bounds, uniform CTA decisions, next-expert identity and paired-loop barrier lifecycle.", "decision": "revert", "device": "nvidia", "environment": "proxy/NVIDIA physical GPU 3 RTX A5000; driver 535.261.03; CUDA 12.2 nvcc; run exp-20260823-057-9840c032e6e6-a01; expected exit 1 at explicit overhead gate; MACA branch not executed", "hypothesis": "Device-side same-expert occurrence pairing could remove host sort overhead and make each second logical M tile reuse the same expert B working set, improving case 2 beyond the 81-us score boundary.", "id": "exp-20260823-057", "language": "CUDA Maca", "notes": "Queue tip ac944d5f7e729c67ae3023f1e4358ff4048a69db; tested commit 9840c032e6e67c7ab8948009db3bf6180c0e9d11; LF source SHA-256 4520abcd22db0881428bc08ea4785b72bfd5bdfba35c26842193cc3c1b19e69a. Ownership/LDS change would require audit only if promoted; explicit gate rejection makes audit unnecessary.", "operator": "Fused MoE i8 tn", "result": "REJECTED before integration/OJ: mandatory scan/control gate failed even for the most favorable all-same distribution; close device occurrence-scan family.", "schema_version": 1, "timestamp": "2026-08-23T12:06:26+00:00"}
{"artifacts": ["artifacts/raw/remote-runs/exp-20260823-056-636dc99a11df-a01/status.json", "artifacts/raw/remote-runs/exp-20260823-056-636dc99a11df-a01/stdout.log", "artifacts/raw/remote-runs/exp-20260823-056-636dc99a11df-a01/environment.txt", "artifacts/raw/remote-runs/exp-20260823-056-636dc99a11df-a01/gpu-before.csv"], "baseline_commit": "8c519e6c1bb57e7b124b60806db9575fa1267207", "benchmark": "proxy/NVIDIA GPU 2 paired medians baseline/candidate cases 1-4: 42.5135/41.5350, 333.2660/333.2795, 21.0600/21.1710, 168.2865/167.9005 ms. NVIDIA does not compile the MACA marker branch, so deltas are provenance/noise only.", "candidate_commit": "5eb6f44e62e2e52325035453a322142cb6385c21", "change": "Deleted only the two trailing XH_MMA_FENCE invocations from the LDS and STS macros; all memory operations, call sites, addresses, barriers, geometry, epilogue and stores remained exact.", "correctness": "Proxy source reconstruction, CUDA fallback builds, three differential cases, marker counts, T=1/2/16/56 lifecycle and read-only regressions passed. Independent audit returned needs-fix because same-wave cross-lane STS-to-LDS ordering is not proved after removing the official post delimiters.", "decision": "revert", "device": "nvidia", "environment": "proxy/NVIDIA physical GPU 2 RTX A5000; driver 535.261.03; CUDA 12.2 nvcc 12.2.140; run exp-20260823-056-636dc99a11df-a01; MACA branch not compiled", "hypothesis": "Retaining pre-operation markers while deleting only LDS/STS post markers removes 28 scheduling delimiters per thread per K tile without changing operations and may improve a C500 score step.", "id": "exp-20260823-056", "language": "CUDA Maca", "notes": "Tested commit 636dc99a11dfa133de3764dbcb072434935dd948; queue tip 5eb6f44e62e2e52325035453a322142cb6385c21; LF source SHA-256 d3f6a1631a7b7bd04082e5049ca2cf3e4c1cbfe22a043a3c7937fa8b3d06e1aa. Candidate rejected by independent audit; retain both official pre/post markers.", "operator": "Fused MoE i8 tn", "result": "REJECTED before integration/OJ: authoritative MXCC documentation or target ISA was unavailable to prove compiler and same-wave shared ordering with pre-only markers.", "schema_version": 1, "timestamp": "2026-08-23T12:28:32+00:00"}
