{"artifacts": ["artifacts/raw/remote-runs/exp-20260823-032-23683b7b28ed-a01/status.json", "artifacts/raw/remote-runs/exp-20260823-032-23683b7b28ed-a01/stdout.log", "artifacts/raw/remote-runs/exp-20260823-032-23683b7b28ed-a01/environment.txt", "artifacts/raw/remote-runs/exp-20260823-032-23683b7b28ed-a01/gpu-before.csv", "artifacts/raw/xpuoj/122928/result-summary.png", "artifacts/raw/xpuoj/122928/case-details.png", "artifacts/raw/xpuoj/122928/contest-overview.png", "artifacts/raw/xpuoj/122928/result-summary.json"], "baseline_commit": "8c519e6c1bb57e7b124b60806db9575fa1267207", "benchmark": "proxy/NVIDIA RTX A5000 GPU 5 medians: cases 1-4 41.467, 330.679, 20.839 and 167.594 ms, one warmup and five samples; NVIDIA executes the unchanged fallback. Target/C500 XPU-OJ #122928: case scores 82/72/88/83; displayed user-kernel times 1080 us/9 ms/553 us/4148 us; 81.25 total versus the 82.25 formal best.", "candidate_commit": "91ddd7d04fd695a1f25a931641cdba15d9882997", "change": "Reassigned the four 64-thread waves to a 2x2 M/N decomposition, revised A/B shared-fragment ownership, K-loop handoff ordering and the matching epilogue mapping. CTA/grid/tile geometry, 32 KiB LDS allocation, global A/B addresses and bytes, 128 MMAs per tile, output bytes, integer/scaling/BF16 arithmetic, dispatch and NVIDIA fallback remain unchanged.", "correctness": "PASS on committed proxy/NVIDIA snapshot 23683b7b28ed66c4f349f5337dd6d4428a703c3f: exact protected-source reconstruction; CUDA 12.2 build; three differential cases matched_ratio=1/max_abs=0; exhaustive 16384-element output cover; all 1024 A and 1024 B shared cells and fragment identities; 1024 cross-wave A and 1536 cross-wave B reads; exact depth-0..7 MMA chains; dynamic barrier counts 111/31; public allocation/grid/A-load and all-zero/read-only regressions; empty stderr. Independent detached audit re-derived output/operand equivalence and both producer-consumer barrier boundaries and approved the candidate. TARGET PASS: XPU-OJ #122928 compiled for xcore1000 and passed the sample plus all four test cases.", "decision": "revert", "device": "nvidia", "environment": "proxy/NVIDIA physical GPU 5 RTX A5000; UUID GPU-c3ec651b-17a7-c15a-8c55-2a34fc656289; driver 535.261.03; CUDA 12.2 nvcc V12.2.140; sm_86; run exp-20260823-032-23683b7b28ed-a01 at 2026-08-23T03:40:52+08:00; target XPU-OJ CUDA Maca C500 submission #122928 at 2026-08-23T04:04:20+08:00", "hypothesis": "Changing four physical waves from 4x1 M/N ownership to 2x2 preserves the 128x128 core while reducing live A+B operand fragments from 80 to 64 int32 values and LDS b128 operations from 20 to 16 per K tile, potentially improving case 2 by about one displayed score step.", "id": "exp-20260823-032", "language": "CUDA Maca (target 2x2 M/N wave decomposition plus NVIDIA compatibility path)", "notes": "Candidate LF source SHA-256 1f45f0781ca18df6068ee1ad0d3d2d5c6120f2c2a6fc941be12ae7071835db63; remote-tested source/job commit 23683b7b28ed66c4f349f5337dd6d4428a703c3f; final queued handoff tip 91ddd7d04fd695a1f25a931641cdba15d9882997; integrated OJ commit 5088ea3b038ec39fc63b1f8f28a7725da8e72805. Audit found no correctness or synchronization blocker, but the target result regressed every displayed case. The nominal scale metadata increase, cross-wave A behavior or MXCC allocation costs outweighed the fragment/LDS reduction. Restore the exact formal-best source and close 2x2 wave decomposition absent target ISA evidence.", "operator": "Fused MoE i8 tn", "result": "TARGET REJECTED: XPU-OJ #122928 was Accepted 4/4 at 81.25, but all four displayed cases regressed to 82/72/88/83 and case 2 slowed to 9 ms. The 2x2 wave decomposition did not improve the 82.25 formal best.", "schema_version": 1, "timestamp": "2026-08-23T03:40:52+08:00"}
{"artifacts": ["artifacts/raw/remote-runs/exp-20260823-033-5968170b4071-a01/status.json", "artifacts/raw/remote-runs/exp-20260823-033-5968170b4071-a01/stdout.log", "artifacts/raw/remote-runs/exp-20260823-033-5968170b4071-a01/environment.txt", "artifacts/raw/remote-runs/exp-20260823-033-5968170b4071-a01/gpu-before.csv", "artifacts/raw/xpuoj/122954/result-summary.png", "artifacts/raw/xpuoj/122954/case-details.png", "artifacts/raw/xpuoj/122954/contest-overview.png", "artifacts/raw/xpuoj/122954/result-summary.json", "artifacts/raw/xpuoj/122954/spj-report.txt"], "baseline_commit": "8c519e6c1bb57e7b124b60806db9575fa1267207", "benchmark": "proxy/NVIDIA RTX A5000 GPU 6 medians: cases 1-4 42.546, 333.787, 21.188 and 168.999 ms, one warmup and five samples; NVIDIA executes the unchanged fallback. Target/C500 XPU-OJ #122954: case scores 79/68/85/79; exact user-kernel times 1321 us/10.373 ms/742 us/5.617 ms; 77.75 total versus the 82.25 formal best.", "candidate_commit": "9a150b0c722effa63ebcb9c64d1509aa90dfcbeb", "change": "Expanded LDS from 32 to 48 KiB by adding a second B region, redirected next-tile B STS to the inactive region, removed the first steady CTA barrier, and swapped active/inactive CUTE B tensor handles after the surviving barrier. Formal-best 4x1 mapping, A buffer, global traffic, MMA/LDS/STS counts, output and NVIDIA fallback are unchanged.", "correctness": "PASS on committed proxy/NVIDIA snapshot 5968170b4071b75227ad382f89d876a988fb9fe7: exact formal-best reconstruction; CUDA 12.2 build; three differential cases matched_ratio=1/max_abs=0; exact 48-KiB layout; exhaustive wave-private A and four-wave B ownership/reuse models; T=1/2/16/56 schedule; all MMA/global/output/read-only regressions; empty stderr. Independent detached audit rederived A wave ownership, B reuse/parity, tensor-view swap semantics, uniform barriers and full contract and approved target validation. TARGET PASS: XPU-OJ #122954 compiled for xcore1000 and passed the sample plus all four test cases.", "decision": "revert", "device": "nvidia", "environment": "proxy/NVIDIA physical GPU 6 RTX A5000; UUID GPU-c4b80f8d-163c-663e-8188-b6d085348a96; driver 535.261.03; CUDA 12.2 nvcc V12.2.140; sm_86; run exp-20260823-033-5968170b4071-a01 at 2026-08-23T04:34:52+08:00; target XPU-OJ CUDA Maca C500 submission #122954 at 2026-08-23T05:10:48+08:00", "hypothesis": "Keeping A single-buffered and alternating two 16-KiB B regions permits removal of the first steady CTA barrier while preserving reuse safety, reducing dynamic barriers from 111 to 56 for K=7168 and 31 to 16 for K=2048 and potentially improving case 2 by about one score step.", "id": "exp-20260823-033", "language": "CUDA Maca (target B-only shared ping-pong plus NVIDIA compatibility path)", "notes": "Candidate LF source SHA-256 c60d8c0aa9dc9b90106699ecff8dfc6c9cb904565e98f9e9cea7181bcb46e6ed; remote-tested source/job commit 5968170b4071b75227ad382f89d876a988fb9fe7; final queued handoff tip 9a150b0c722effa63ebcb9c64d1509aa90dfcbeb; integrated OJ commit 7474888563dcee41391730b7182844325ca17b31. The target accepted the synchronization and tensor-view swap but every displayed case regressed. The 48-KiB LDS residency/allocation cost outweighed removing about half the barriers, so restore exact formal-best source 8c519e6c1bb5 and close this mechanism.", "operator": "Fused MoE i8 tn", "result": "TARGET REJECTED: XPU-OJ #122954 was Accepted 4/4 at 77.75, but all four displayed cases regressed to 79/68/85/79 and case 2 slowed to 10.373 ms. Restore the 82.25 formal best and reject 48-KiB B ping-pong.", "schema_version": 1, "timestamp": "2026-08-23T04:34:52+08:00"}
{"artifacts": ["artifacts/raw/remote-runs/exp-20260823-034-2cf702f68489-a01/status.json", "artifacts/raw/remote-runs/exp-20260823-034-2cf702f68489-a01/stdout.log", "artifacts/raw/remote-runs/exp-20260823-034-2cf702f68489-a01/environment.txt", "artifacts/raw/remote-runs/exp-20260823-034-2cf702f68489-a01/gpu-before.csv", "artifacts/raw/xpuoj/122971/result-summary.png", "artifacts/raw/xpuoj/122971/case-details.png", "artifacts/raw/xpuoj/122971/contest-overview.png", "artifacts/raw/xpuoj/122971/result-summary.json", "artifacts/raw/xpuoj/122971/spj-report.txt"], "baseline_commit": "8c519e6c1bb57e7b124b60806db9575fa1267207", "benchmark": "proxy/NVIDIA RTX A5000 GPU 7 medians: cases 1-4 41.999, 333.212, 21.067 and 168.970 ms, one warmup and five samples. NVIDIA executes the unchanged fallback, so timings establish provenance and no fallback regression only. Aligned full-wave request model is equal at 32/64-byte segments but rises 128 to 256 at 128-byte segments; 16-lane diagnostics show a possible 1024-request risk. Target/C500 XPU-OJ #122971: case scores 77/66/85/78; exact user-kernel times 1.499/11.683/0.781/5.993 ms; 76.50 total versus the 82.25 formal best.", "candidate_commit": "67c09206e501c75d997934d9967d456aa00a8a38", "change": "Removed the A shared tile, A staging and row-offset arrays, and all A STS/LDS. Four direct b128 loads per thread per K tile now populate exact MMA fragments using the resolved row/chunk mapping and overwrite each fragment only after its final current-tile use. B pipeline, barriers, MMA/output/epilogue and NVIDIA fallback are unchanged.", "correctness": "PASS on committed proxy/NVIDIA snapshot 2cf702f6848999672cf2418d4a0bac3dea4f481d: protected-source equality outside A path; CUDA 12.2 build; three differential cases matched_ratio=1/max_abs=0; exhaustive 1024-vector direct-vs-baseline identity/exact cover/alignment; 56/16-tile fragment lifecycle; exact B/barrier trace and producer-consumer cover; public/output/read-only regressions; empty stderr. Independent detached audit rederived all 1024 A vectors with zero mapping/alignment mismatches, proved each fragment overwrite follows its final use for T=1/2/16/56, confirmed the B/barrier trace byte-identical to baseline, and approved target validation. TARGET PASS: XPU-OJ #122971 compiled for xcore1000 and passed the sample plus all four test cases.", "decision": "revert", "device": "nvidia", "environment": "proxy/NVIDIA physical GPU 7 RTX A5000; UUID GPU-74836844-02b8-80ed-948c-68cac545d7a0; driver 535.261.03; CUDA 12.2 nvcc V12.2.140; sm_86; run exp-20260823-034-2cf702f68489-a01 at 2026-08-23T04:47:16+08:00; target XPU-OJ CUDA Maca C500 submission #122971 at 2026-08-23T05:40:32+08:00", "hypothesis": "Resolving the accepted A shared transpose into direct per-fragment global addresses removes 16 KiB LDS, four A STS and four A LDS b128 operations per thread per K tile plus the A staging array, potentially improving target occupancy or issue efficiency by about one score step.", "id": "exp-20260823-034", "language": "CUDA Maca (target direct global-A fragments plus NVIDIA compatibility path)", "notes": "Candidate LF source SHA-256 78104cf6997534d4442bc171aa09efc2843bb688f907c4c8cad597b7eccbd66d; remote-tested source/job commit 2cf702f6848999672cf2418d4a0bac3dea4f481d; final queued handoff tip 67c09206e501c75d997934d9967d456aa00a8a38; integrated OJ commit 4cc1255081ae9fbbeb626566402b06aaeca0e3dd. The target accepted the direct mapping but every displayed case regressed, with case 2 falling from 73 points / 8.158 ms to 66 points / 11.683 ms. Removing A shared staging exposed poorly coalesced global fragment loads or inadequate latency hiding despite halving LDS. Restore the exact formal-best source and close direct global-A fragments absent target ISA/coalescer evidence.", "operator": "Fused MoE i8 tn", "result": "TARGET REJECTED: XPU-OJ #122971 was Accepted 4/4 at 76.50, but all four displayed cases regressed to 77/66/85/78 and case 2 slowed to 11.683 ms. Restore the 82.25 formal best and reject direct global-A fragments.", "schema_version": 1, "timestamp": "2026-08-23T04:47:16+08:00"}
{"artifacts": ["artifacts/raw/remote-runs/exp-20260823-035-44186b6f9c58-a01/status.json", "artifacts/raw/remote-runs/exp-20260823-035-44186b6f9c58-a01/stdout.log", "artifacts/raw/remote-runs/exp-20260823-035-44186b6f9c58-a01/environment.txt", "artifacts/raw/remote-runs/exp-20260823-035-44186b6f9c58-a01/gpu-before.csv", "artifacts/raw/xpuoj/122979/result-summary.png", "artifacts/raw/xpuoj/122979/case-details.png", "artifacts/raw/xpuoj/122979/contest-overview.png", "artifacts/raw/xpuoj/122979/result-summary.json", "artifacts/raw/xpuoj/122979/spj-report.txt"], "baseline_commit": "8c519e6c1bb57e7b124b60806db9575fa1267207", "benchmark": "proxy/NVIDIA RTX A5000 GPU 5 medians: cases 1-4 45.472, 329.014, 20.838 and 166.254 ms, one warmup and five samples. NVIDIA executes the unchanged fallback. Modeled per-CTA scale-B traffic falls from 512 b128 loads / 8192 bytes to 32 b128 loads / 512 bytes, plus 32 shared stores and 512 LDS reads. Target/C500 XPU-OJ #122979: case scores 79/68/85/79; exact scored user-kernel times 1.310/10.243/0.731/5.533 ms; sample 1.308 ms; 77.75 total versus the 82.25 formal best.", "candidate_commit": "da89b9c4949e45d03340be9d1c48638046912d06", "change": "Added a dedicated 512-byte shared scale-B region after the unchanged 32-KiB A/B layout. Threads 0..31 preload one aligned four-float vector before the existing initial barrier; all 256 threads later perform two vector LDS reads instead of predicated global b128 epilogue loads. MMA, A/B pipeline, barriers, output and NVIDIA fallback are unchanged.", "correctness": "PASS on committed proxy/NVIDIA snapshot 44186b6f9c585f150bbcfe569a6a0e41ef9e3eba: exact formal-best reconstruction; CUDA 12.2 build; three differential cases matched_ratio=1/max_abs=0; exact 33280-byte layout; exhaustive 32-producer cover and 512 epilogue vector mappings; unchanged barrier model 111/31; public allocation/output/read-only regressions; empty stderr. Independent detached audit rederived the 32-producer cover, dedicated shared range, existing-barrier ordering, vector mappings and attribution, and approved target validation. TARGET PASS: XPU-OJ #122979 compiled for xcore1000 and passed the sample plus all four test cases.", "decision": "revert", "device": "nvidia", "environment": "proxy/NVIDIA physical GPU 5 RTX A5000; UUID GPU-c3ec651b-17a7-c15a-8c55-2a34fc656289; driver 535.261.03; CUDA 12.2 nvcc V12.2.140; sm_86; run exp-20260823-035-44186b6f9c58-a01 at 2026-08-23T04:52:21+08:00; target XPU-OJ CUDA Maca C500 submission #122979 at 2026-08-23T06:07:16+08:00", "hypothesis": "Preloading each CTA's 128 scale-B values with 32 aligned b128 global loads into a dedicated 512-byte shared region before the existing initial barrier replaces 512 epilogue global b128 loads and may improve shorter-K cases without changing the MMA pipeline.", "id": "exp-20260823-035", "language": "CUDA Maca (target scale-B shared preload plus NVIDIA compatibility path)", "notes": "Candidate LF source SHA-256 df8d8bb136e3d1ac37fc7f87ae0aeaa60021d7fe4915e424b47e738c7f1ba62e; remote-tested source/job commit 44186b6f9c585f150bbcfe569a6a0e41ef9e3eba; final queued handoff tip da89b9c4949e45d03340be9d1c48638046912d06; integrated OJ commit c2ca7275a7f63605187491debe135008d31c8585. The target accepted the scale-B preload but every displayed case regressed, with case 2 falling from 73 points / 8.158 ms to 68 points / 10.243 ms. The added 512-byte LDS region and 512 epilogue LDS reads outweighed reducing the global scale-B loads. Restore exact formal-best source 8c519e6c1bb5 and close shared scale-B preload absent target ISA or allocation evidence.", "operator": "Fused MoE i8 tn", "result": "TARGET REJECTED: XPU-OJ #122979 was Accepted 4/4 at 77.75, but all four displayed cases regressed to 79/68/85/79 and case 2 slowed to 10.243 ms. Restore the 82.25 formal best and reject shared scale-B preload.", "schema_version": 1, "timestamp": "2026-08-23T04:52:21+08:00"}
{"artifacts": ["artifacts/raw/remote-runs/exp-20260823-037-16028d13289b-a01/status.json", "artifacts/raw/remote-runs/exp-20260823-037-16028d13289b-a01/stdout.log", "artifacts/raw/remote-runs/exp-20260823-037-16028d13289b-a01/environment.txt", "artifacts/raw/remote-runs/exp-20260823-037-16028d13289b-a01/gpu-before.csv", "artifacts/raw/xpuoj/123003/result-page.png", "artifacts/raw/xpuoj/123003/testpoints.png", "artifacts/raw/xpuoj/123003/scoreboard.png", "artifacts/raw/xpuoj/123003/result-summary.json", "artifacts/raw/xpuoj/123003/spj-report.txt"], "baseline_commit": "8c519e6c1bb57e7b124b60806db9575fa1267207", "benchmark": "proxy/NVIDIA RTX A5000 GPU 1 medians: cases 1-4 45.529, 338.713, 21.529 and 171.747 ms, one warmup and five samples. NVIDIA executes the unchanged fallback. Modeled CTA row-metadata b32 loads fall 4096->256 and row-factor multiplies 2048->128, adding 2048 width-16 shuffles. Target/C500 XPU-OJ #123003: case scores 83/73/88/83; exact user-kernel times 1.030/8.270/0.558/4.224 ms; 81.75 total versus the 82.25 formal best.", "candidate_commit": "3a263e17fecb15cde80201004bb2c25161a25994", "change": "Replaced per-thread weights[2][4] and row_scale[2][4] with eight producer lanes in each 16-lane group. Producers load and multiply one unique row factor, and every consumer selects source lane i*4+j with width-16 __shfl_sync. Matrix pipeline, scale-B loads, BF16 conversion, stores, geometry, 32-KiB LDS, barriers and NVIDIA fallback remain unchanged.", "correctness": "PASS on committed proxy/NVIDIA snapshot 16028d13289bcef34c38e6e0b3980571c26d0885: exact formal-best reconstruction; CUDA 12.2 build; three differential cases matched_ratio=1/max_abs=0; exhaustive 128-producer row cover and 2048 consumer mappings with exact factor bits; public grid/A bounds; all-zero/read-only regression; empty stderr. Independent detached audit verified exact source identity, 128 unique initialized producers, all 2048 width-16 consumers, row bounds, factor bit/order equivalence, attribution and unchanged matrix/shared/output contracts, and approved one target submission. TARGET PASS: XPU-OJ #123003 compiled for xcore1000 and passed the sample plus all four test cases.", "decision": "revert", "device": "nvidia", "environment": "proxy/NVIDIA physical GPU 1 RTX A5000; UUID GPU-81000a12-3d75-397b-e816-43e13849f697; driver 535.261.03; CUDA 12.2 nvcc V12.2.140; sm_86; run exp-20260823-037-16028d13289b-a01 at 2026-08-23T06:39:24+08:00; target XPU-OJ CUDA Maca C500 submission #123003 at 2026-08-23T07:03:07+08:00", "hypothesis": "Barrier-free width-16 row-factor producer/consumer shuffles reduce each CTA from 4096 to 256 row-metadata b32 loads and from 2048 to 128 row-factor multiplies, adding 2048 shuffles without changing output bits, and may improve shorter-K cases by a displayed score step.", "id": "exp-20260823-037", "language": "CUDA Maca (target width-16 row-factor shuffle plus NVIDIA compatibility path)", "notes": "Candidate LF source SHA-256 e4441ad5c187c64f7fb97a77881649741d57e7c05fecd5448e8c99be81b36f35; remote-tested source/job commit 16028d13289bcef34c38e6e0b3980571c26d0885; final queued handoff tip 3a263e17fecb15cde80201004bb2c25161a25994; integrated OJ commit cea6b4bd765197a5646c5a216ea476e7612e9b56. Target acceptance resolves width-16 shuffle correctness on xcore1000, but the structural metadata reduction did not improve total score: case 2 measured 8.270 ms and case 3 fell to 88 points. Restore exact formal-best source 8c519e6c1bb5 and close row-factor shuffles absent target ISA evidence.", "operator": "Fused MoE i8 tn", "result": "TARGET REJECTED: XPU-OJ #123003 was Accepted 4/4 at 81.75, but the width-16 row-factor shuffle scored 0.50 below formal best #117114. Restore the 82.25 formal-best source.", "schema_version": 1, "timestamp": "2026-08-23T06:39:24+08:00"}
