{"artifacts": ["artifacts/raw/remote-runs/exp-20260819-010-8c519e6c1bb5/status.json", "artifacts/raw/remote-runs/exp-20260819-010-8c519e6c1bb5/stdout.log", "artifacts/raw/remote-runs/exp-20260819-010-8c519e6c1bb5/environment.txt", "artifacts/raw/remote-runs/exp-20260819-010-8c519e6c1bb5/gpu-before.csv"], "baseline_commit": "707b34b6ea43a42341d66f4645f12ae0219ea4d7", "benchmark": "proxy/NVIDIA RTX A5000 core medians: decode gate-up 45.375 ms, prefill gate-up 338.715 ms, decode down 21.527 ms, prefill down 171.780 ms; one warmup and five samples. The target-only A load change is not executed by the NVIDIA fallback. Regression confirms 224 removed predicates per thread for each gate-up case and 64 for each down case.", "candidate_commit": "8c519e6c1bb57e7b124b60806db9575fa1267207", "change": "Changed only the MACA MMA A global-load primitive, its initial preload, and the now-dead row_a_mask bookkeeping. B loads, double-buffered MMA schedule, launch geometry, output path, A-first shape inference, and NVIDIA fallback are unchanged; added exact A-row/K-tile regression coverage.", "correctness": "PASS: source checks, build, three randomized/boundary/extreme correctness cases, all four A-primary/out-fallback inference cases, exact 16,384-element output mapping, exact M-grid coverage, exact A load rows for every thread/public shape, all-zero/read-only regression, and public-shape sampled outputs all passed.", "decision": "investigate", "device": "nvidia", "environment": "proxy/NVIDIA physical GPU 1 RTX A5000; driver 535.261.03; CUDA 12.2 nvcc V12.2.140; sm_86; run 2026-08-19T02:39:56+08:00", "hypothesis": "All four contract workloads contain only complete 128-row MMA tiles, so replacing the per-load row-predicated A loads with the already-used unpredicated b128 load removes 224 predicate evaluations per thread for gate-up and 64 for down without changing any valid address or arithmetic.", "id": "exp-20260819-010", "language": "CUDA Maca (target exact-row MMA loads plus NVIDIA compatibility path)", "notes": "Candidate source is 32,812 bytes, git blob 58c7b2418012303666a4d239974d7be7278a86f9, SHA-256 ce48c580ff3de1341bad744e18ba3acbd08ee3bf8f3142cb0c504d94e0480de5. The unpredicated __builtin_mxc_ldg_b128 primitive is already used by the OJ-accepted baseline for B loads, but NVIDIA cannot compile the MXMACA branch or establish C500 latency; target compilation, correctness, and score remain the OJ gate.", "operator": "Fused MoE i8 tn", "result": "SUCCEEDED (exit 0): committed snapshot built and completed correctness, benchmark, and regression on physical GPU 1; exact-row proof passed for every target shape and fallback performance stayed in the established noise band.", "schema_version": 1, "timestamp": "2026-08-18T18:39:56+00:00"}
{"artifacts": ["artifacts/raw/remote-runs/exp-20260819-011-48cf11b848ef/status.json", "artifacts/raw/remote-runs/exp-20260819-011-48cf11b848ef/stdout.log", "artifacts/raw/remote-runs/exp-20260819-011-48cf11b848ef/environment.txt", "artifacts/raw/remote-runs/exp-20260819-011-48cf11b848ef/gpu-before.csv"], "baseline_commit": "8c519e6c1bb57e7b124b60806db9575fa1267207", "benchmark": "proxy/NVIDIA RTX A5000 core medians: decode gate-up 42.719 ms, prefill gate-up 338.761 ms, decode down 21.530 ms, prefill down 171.751 ms; one warmup and five samples. Case 2 matches the exp-010 338.715 ms noise band because the target-only template is not executed on NVIDIA.", "candidate_commit": "48cf11b848ef9daa59b0584f5a277272aef0eee3", "change": "Templated the existing MACA 128x128 kernel over optional fixed EM/N/K and dispatched only prefill gate-up to <32768,4096,7168>; the other public shapes use the original runtime <0,0,0> instance. Added exact one-of-four dispatch regression and a committed remote job; MMA operations, loads, shared memory, grid, epilogue, inference, and NVIDIA fallback are unchanged.", "correctness": "PASS: source checks, build, randomized/boundary/two-expert/INT8-extreme cases, all four allocation mappings and public-shape samples, exact MMA output and grid mapping, exact one-of-four specialization dispatch, exact A-load bounds, and all-zero/read-only regression passed.", "decision": "investigate", "device": "nvidia", "environment": "proxy/NVIDIA physical GPU 1 RTX A5000; driver 535.261.03; CUDA 12.2 nvcc V12.2.140; sm_86; run 2026-08-19T03:34:50+08:00", "hypothesis": "Specializing only the 32768x4096x7168 prefill gate-up MMA kernel with compile-time EM/N/K lets MXMACA fold its 56-tile K-loop bounds and matrix strides without changing the validated 128x128 schedule, improving the 73-point target bottleneck while isolating the other three cases.", "id": "exp-20260819-011", "language": "CUDA Maca (case-2 target specialization plus NVIDIA compatibility path)", "notes": "Candidate source is 33,619 bytes, git blob 0ecfbee4150b657b4de6833f15f6dd7c9ee7c59d, SHA-256 c3c5d59cebf6ca62d5c4c51b36aa0ea017898f60a58384977e663f6dd1faa14c. NVIDIA validates provenance and unchanged fallback only; MXMACA template compilation, code generation, C500 correctness, and score require XPU-OJ.", "operator": "Fused MoE i8 tn", "result": "SUCCEEDED (exit 0): committed snapshot built and completed correctness, benchmark, and regression on physical GPU 1; target specialization selection was exactly prefill gate-up.", "schema_version": 1, "timestamp": "2026-08-18T19:35:56+00:00"}
{"artifacts": ["artifacts/raw/remote-runs/exp-20260819-012-d680180dbaed/status.json", "artifacts/raw/remote-runs/exp-20260819-012-d680180dbaed/stdout.log", "artifacts/raw/remote-runs/exp-20260819-012-d680180dbaed/environment.txt", "artifacts/raw/remote-runs/exp-20260819-012-d680180dbaed/gpu-before.csv"], "baseline_commit": "48cf11b848ef9daa59b0584f5a277272aef0eee3", "benchmark": "proxy/NVIDIA RTX A5000 core medians: decode gate-up 45.537 ms, prefill gate-up 338.885 ms, decode down 21.530 ms, prefill down 171.750 ms; one warmup and five samples. Results remain in the established fallback noise band because the target-only boundary changes are not executed on NVIDIA.", "candidate_commit": "d680180dbaed13013f38ce0aa022ef925106e8e1", "change": "Replaced the final-tile B b128 predicated preload and all epilogue b32/b128 predicated loads with already documented unpredicated MXMACA loads; removed row/column clamping and masks, made the retained official b64 store predicate constant true, and used exact K tile division. Added per-thread B vector and epilogue row/column bounds regressions for all four public shapes. MMA order, shared memory, grid, case-2 shape specialization, inference, and NVIDIA fallback are unchanged.", "correctness": "PASS: source checks, build, randomized/boundary/two-expert/INT8-extreme cases, all four allocation mappings and public-shape samples, exact MMA output/grid/specialization dispatch, A-load bounds, new exact B/epilogue bounds, and all-zero/read-only regression passed.", "decision": "investigate", "device": "nvidia", "environment": "proxy/NVIDIA physical GPU 1 RTX A5000; driver 535.261.03; CUDA 12.2 nvcc V12.2.140; sm_86; run 2026-08-19T03:54:07+08:00", "hypothesis": "Because every disclosed EM/N/K dimension is exactly divisible by 128, removing the remaining dynamic boundary predicates from the initial B preload, epilogue scale loads, and output-store conditions reduces enough scalar predicate work to move the 8.058 ms prefill gate-up case across its next score threshold without changing the 128x128 MMA pipeline.", "id": "exp-20260819-012", "language": "CUDA Maca (exact-tile target loads plus NVIDIA compatibility path)", "notes": "Candidate source Git blob is 898a8f2b64d6716ae03732cf228a3c672ddcd39d (31,937 LF bytes, SHA-256 4a211b221c2a05227d65e602c77485b48f5b87fea6c0e096da82e6e4b6b2b7d8); working-tree mixed-EOL file is 32,714 bytes, SHA-256 069edeabf37d3061c69337ff51d2bbc3c731cde662e3676e6975fdd69288034d. NVIDIA validates provenance and unchanged fallback only; MXMACA load/store code generation, C500 correctness, and score remain the next-turn OJ gates.", "operator": "Fused MoE i8 tn", "result": "SUCCEEDED (exit 0): committed snapshot built and completed correctness, benchmark, and regression on physical GPU 1; source checks found no remaining MXMACA load predicators or dynamic exact-tile boundary bookkeeping.", "schema_version": 1, "timestamp": "2026-08-18T19:56:12+00:00"}
{"artifacts": ["artifacts/raw/remote-runs/exp-20260819-013-c903c6162995/status.json", "artifacts/raw/remote-runs/exp-20260819-013-c903c6162995/stdout.log"], "baseline_commit": "d680180dbaed13013f38ce0aa022ef925106e8e1", "benchmark": "proxy/NVIDIA RTX A5000 core medians: decode gate-up 45.535 ms, prefill gate-up 338.703 ms, decode down 21.529 ms, prefill down 171.744 ms; one warmup and five samples. Fallback unchanged as expected; the MACA-only reorder is not executed on NVIDIA.", "candidate_commit": "9115601", "change": "Pure instruction reorder inside the MACA 128x128 K loop: XH_LDG_B_STAGE_I(2)/(3) and XH_LDG_A_STAGE_I(0)/(1) moved to the loop head, joining B(0)/(1); XH_LDG_A_STAGE_I(2)/(3) stay behind their cross-iteration register-rotation STS point. Addresses, MMA/LDS/STS order, shared memory, grid, specialization, epilogue, and NVIDIA fallback unchanged. Added a source-order assertion to the remote job.", "correctness": "PASS: source-order check, build, randomized/boundary/two-expert/INT8-extreme cases (matched_ratio=1.0, max_abs=0), all four allocation mappings, exact MMA output/grid/specialization dispatch, A-load bounds, exact B/epilogue bounds, all-zero/read-only regression.", "decision": "investigate", "device": "nvidia", "environment": "proxy/NVIDIA physical GPU 1 RTX A5000; driver 535.261.03; CUDA 12.2 nvcc V12.2.140; sm_86; run exp-20260819-013-c903c6162995", "hypothesis": "All four public cases run at ~1.0 TB/s effective DRAM bandwidth (measured times match unique-data/1.0TB/s within 1-4%), so the kernel is bandwidth-bound; issuing the six hoistable next-tile loads (B0..B3, A0..A1) at the K loop head before the first MMA raises memory-level parallelism and effective bandwidth, potentially moving the 8.058 ms prefill gate-up case.", "id": "exp-20260819-013", "language": "CUDA Maca (K-loop load-hoist scheduling plus NVIDIA compatibility path)", "notes": "NVIDIA validates provenance and unchanged fallback only; MXMACA scheduling, register pressure, C500 correctness and score remain the OJ gate. Full candidate commit for OJ: resolve HEAD source blob before submitting.", "operator": "Fused MoE i8 tn", "result": "SUCCEEDED (exit 0): committed snapshot c903c6162995 (includes runner infra fix) built and completed correctness, benchmark, and regression on physical GPU 1; source-order assertion confirmed six hoisted loads at the K loop head with A2/A3 rotation preserved.", "schema_version": 1, "timestamp": "2026-08-19T09:06:28+00:00"}
{"artifacts": ["artifacts/raw/remote-runs/exp-20260819-014-f2b5015107c6/status.json", "artifacts/raw/remote-runs/exp-20260819-014-f2b5015107c6/stdout.log"], "baseline_commit": "91156015d58a2bc1a6bb25c931b68af56db337e8", "benchmark": "proxy/NVIDIA RTX A5000 core medians: decode gate-up 45.529 ms, prefill gate-up 338.724 ms, decode down 21.530 ms, prefill down 171.744 ms; one warmup and five samples. Fallback unchanged; MACA-only async G2S path not executed on NVIDIA.", "candidate_commit": "f2b5015107c6b5ad656fbda1edba25075f6d54ef", "change": "MACA kernel G2S rewritten: 8 bsm copies per thread per K tile (4A+4B) into parity-selected 32 KiB buffer; loop issues tile k+1 then waits with __builtin_mxc_arrive(64 + 8) + __builtin_mxc_barrier_inst(); peeled final tile uses arrive(64). Register staging arrays, XH_LDG/XH_MMA_STS macros, A2/A3 cross-iteration rotation, and mid-loop syncs removed; per-tile LDS/MMA consume sequence preserved verbatim from the old tail; epilogue, shape inference, case-2 specialization, and NVIDIA fallback untouched. bsm intrinsic and arrive(64) proven target-compatible by OJ #117079; non-zero arrive count is the one unverified semantic.", "correctness": "PASS: bsm structure source checks, build, randomized/boundary/two-expert/INT8-extreme cases (matched_ratio=1.0, max_abs=0), all four allocation mappings, exact MMA output/grid/specialization dispatch, A-load bounds, exact B/epilogue bounds, all-zero/read-only regression.", "decision": "investigate", "device": "nvidia", "environment": "proxy/NVIDIA physical GPU 1 RTX A5000; driver 535.261.03; CUDA 12.2 nvcc V12.2.140; sm_86; run exp-20260819-014-f2b5015107c6", "hypothesis": "All four public cases measure at ~1.0 TB/s effective DRAM bandwidth (unique-data/1.0TB/s matches within 1-4%), so the kernel is bandwidth-bound. Replacing the LDG-to-register-to-STS G2S chain with official __builtin_mxc_ldg_b128_bsm async direct-to-shared copies over a 64 KiB double buffer removes the register round trip and sustains load/compute overlap across K tiles, potentially raising effective bandwidth above 1.0 TB/s.", "id": "exp-20260819-014", "language": "CUDA Maca (double-buffered async bsm G2S plus NVIDIA compatibility path)", "notes": "NVIDIA validates provenance and unchanged fallback only. MXMACA compile, arrive(64+8) semantics, C500 correctness and score are the OJ gate; wrong semantics should surface as WA or hang.", "operator": "Fused MoE i8 tn", "result": "SUCCEEDED (exit 0): committed snapshot f2b5015107c6 built and completed correctness, benchmark, and regression on physical GPU 1; source assertions confirmed bsm double-buffer structure with preserved per-tile MMA order.", "schema_version": 1, "timestamp": "2026-08-19T10:06:30+00:00"}
{"artifacts":["artifacts/raw/remote-runs/exp-20260819-019-fb2d10b19ceb/status.json","artifacts/raw/remote-runs/exp-20260819-019-fb2d10b19ceb/stdout.log","artifacts/raw/remote-runs/exp-20260819-019-fb2d10b19ceb/environment.txt","artifacts/raw/remote-runs/exp-20260819-019-fb2d10b19ceb/gpu-before.csv","artifacts/raw/xpuoj/121831/result-summary.png","artifacts/raw/xpuoj/121831/result-details.png","artifacts/raw/xpuoj/121831/scoreboard.png"],"baseline_commit":"8c519e6c1bb57e7b124b60806db9575fa1267207","benchmark":"proxy/NVIDIA RTX A5000 medians: decode gate-up 45.537 ms, prefill gate-up 338.692 ms, decode down 21.528 ms, prefill down 171.805 ms; one warmup and five samples. NVIDIA executes the unchanged fallback, so timings only establish no proxy regression. Target/C500 XPU-OJ #121831: case scores 83/64/89/83; user-kernel times 1015 us/12 ms/549 us/4146 us; 79.75 total versus the 82.25 best baseline.","candidate_commit":"fb2d10b19cebea1b9d2ccc569db83b11ea800842","change":"Restored the three non-case-2 paths byte-for-byte to OJ #117114's 82.25-point 128x128 kernel. Replaced only prefill gate-up with a fixed 64x128x128, 256-thread MACA MMA kernel using 24 KiB single-buffered shared memory, eight accumulator fragments, paired grid_x=2 expert halves, mutable A builtin pointers, exact-tile loads, and source-proven A/B swizzles. Added output, grid, load, fragment, and baseline-hash regressions.","correctness":"PASS on committed proxy/NVIDIA snapshot: source proof, build, randomized boundary/two-expert/INT8-extreme correctness (matched_ratio=1.0, max_abs=0), all public allocation mappings and sampled outputs, target specialization selection, exact 128x128 baseline mappings, exact 64x128 output/grid/load coverage, A/B shared-fragment swizzle proof, all-zero/read-only regression. TARGET PASS: XPU-OJ #121831 compiled for xcore1000 and passed sample plus all four test cases.","decision":"revert","device":"nvidia","environment":"proxy/NVIDIA physical GPU 1 RTX A5000; driver 535.261.03; CUDA 12.2 nvcc V12.2.140; sm_86; run 2026-08-22T12:46:39+08:00","hypothesis":"For prefill gate-up, the target-validated 128x128 kernel may be limited by one CTA's accumulator/register and 32 KiB LDS footprint. Splitting only M into paired 64x128 tiles halves accumulator state and reduces LDS to 24 KiB while preserving N=128 so A traffic is unchanged; adjacent halves share one expert and may reuse their duplicated B tile from cache, allowing higher target occupancy to cross the 73-point threshold.","id":"exp-20260819-019","language":"CUDA Maca (target paired 64x128 occupancy kernel plus NVIDIA compatibility path)","notes":"NVIDIA cannot compile or execute the MXMACA branch. Target compilation, intrinsic fragment semantics, actual register/LDS occupancy, duplicated-B cache reuse, C500 correctness, and score remain XPU-OJ gates. Candidate contains no __dp4a, rejected 128x256 wide path, ldg_b128_bsm, or arrive barrier. OJ submitted LF-normalized source was 48,616 bytes, SHA-256 b598a5dc8ccb6edb0708330de00f185b4ef4ef9df80e44db32939586f9fda0ac. Halving M duplicated B traffic and added CTA/synchronization work; the intended occupancy benefit did not compensate. Restore the active submission source exactly to best commit 8c519e6c1bb5.","operator":"Fused MoE i8 tn","result":"TARGET REJECTED: XPU-OJ #121831 was Accepted 4/4 at 79.75, but the specialized case 2 fell from the best baseline's 73 points / 8.158 ms to 64 points / 12 ms. The other three baseline paths remained within measurement noise at 83/89/83.","schema_version":1,"timestamp":"2026-08-22T04:47:44+00:00"}
{"artifacts": ["artifacts/raw/remote-runs/exp-20260822-020-0639295edcea/status.json", "artifacts/raw/remote-runs/exp-20260822-020-0639295edcea/stdout.log", "artifacts/raw/remote-runs/exp-20260822-020-0639295edcea/environment.txt", "artifacts/raw/remote-runs/exp-20260822-020-0639295edcea/gpu-before.csv", "artifacts/raw/xpuoj/121947/result-summary.png", "artifacts/raw/xpuoj/121947/result-details.png", "artifacts/raw/xpuoj/121947/scoreboard.png", "artifacts/raw/xpuoj/121947/scoreboard-self.png"], "baseline_commit": "8c519e6c1bb57e7b124b60806db9575fa1267207", "benchmark": "proxy/NVIDIA RTX A5000 medians: decode gate-up 44.836 ms, prefill gate-up 341.317 ms, decode down 21.527 ms, prefill down 171.753 ms; one warmup and five samples. NVIDIA executes the unchanged fallback, so these numbers establish provenance and no fallback regression only. Static traffic proof for two adjacent N tiles is 3072 b128 vector loads versus 4096 in two baseline CTAs. Target/C500 XPU-OJ #121947: case scores 83/70/88/83; user-kernel times 1016 us/9 ms/551 us/4151 us; 81.00 total versus the 82.25 best baseline.", "candidate_commit": "0639295edcea31a482cfbb018d01aa0e80b9a505", "change": "Added only a prefill gate-up 512-thread paired-N path: two 256-thread baseline subgroups cover 128x256, share double-buffered A, own disjoint B tiles, and use 64 KiB LDS. Restored the stale test file to the 8c519e6 baseline before adding dispatch, output, grid, load, swizzle, shared-layout, traffic, and baseline-hash regressions. The original 128x128 kernel body remains byte-exact.", "correctness": "PASS on committed proxy/NVIDIA snapshot: source proof, build, randomized boundary/two-expert/INT8-extreme correctness (matched_ratio=1.0, max_abs=0), all public allocation mappings and sampled outputs, exact paired-N output/grid/load coverage, A/B swizzle, race-free A buffer swap ordering, 64 KiB shared layout, and all-zero/read-only regression. TARGET PASS: XPU-OJ #121947 compiled for xcore1000 and passed the sample plus all four test cases.", "decision": "revert", "device": "nvidia", "environment": "proxy/NVIDIA physical GPU 1 RTX A5000; driver 535.261.03; CUDA 12.2 nvcc V12.2.140; sm_86; run 2026-08-22T13:51:17+08:00; target XPU-OJ CUDA Maca C500 submission #121947", "hypothesis": "For case 2, fusing two adjacent 128x128 N tiles into one 512-thread CTA can halve CTA count and explicit A tile loads without increasing B loads; double-buffering the shared A tile makes cross-subgroup consumption race-free while retaining the target-validated MMA and B pipeline.", "id": "exp-20260822-020", "language": "CUDA Maca (target paired-N 512-thread MMA plus NVIDIA compatibility path)", "notes": "Candidate source git blob c42ac650e33113bf93ce9bc1b1a587085fea75b6. OJ submitted LF-normalized source was 56,447 bytes, SHA-256 b8eb8233c2f5cf6e8159db73ab6fa50f7ca49c5998653017afea322c1351fd4a. The original 48 KiB single-A handoff design was rejected before commit because its cross-subgroup half-tile STS-to-LDS path lacked a barrier; the committed 64 KiB double-A design was target-correct. Reducing explicit vector loads by 25% did not offset the 512-thread CTA and 64 KiB LDS costs; restore the active submission source exactly to best commit 8c519e6c1bb5.", "operator": "Fused MoE i8 tn", "result": "TARGET REJECTED: XPU-OJ #121947 was Accepted 4/4 at 81.00, but specialized case 2 fell from the best baseline's 73 points / 8.158 ms to 70 points / 9 ms. The other three baseline paths remained within measurement noise at 83/88/83.", "schema_version": 1, "timestamp": "2026-08-22T05:52:20+00:00"}
