{"artifacts": ["artifacts/raw/c500-runs/exp-20260828-198-f81a17e1808c-a01", "handoffs/exp-20260828-198.md"], "baseline_commit": "235a34a22889c4d1ce5465acc2daaf1cdb67547d", "benchmark": "C500 ABBA case2 6.0585 to 14.5270 ms (+139.778823 percent), stable candidate arms 14.525/14.529 ms; stack falls 68 to 20 bytes versus exp-197 but the target remains 2.40x slower than formal.", "candidate_commit": "f81a17e1808c7630ffd5c095081db7bceebdb09a", "change": "Exact sorted case2 keeps exp-197 geometry but reuses four B carriers across two ordered phases instead of retaining eight carriers; all addresses, traffic, shared image, MMA/output, barriers and ABI remain exact.", "correctness": "PASS: local 22/22 plus shell gates, detached phase/lifecycle audit, both builds, 3/3 differential correctness, full regression, sampled/read-only correctness, integrity, no-process gates and verified 31-entry manifest.", "decision": "revert", "device": "c500-local", "environment": "MetaX C500 xcore1000 device0; MACA 3.7.1.5; MXCC 1.0.0 d9102a1572; 25 percent compute / 16000 MiB; no device process before or after.", "hypothesis": "Phasing four B carriers removes exp-197 stack pressure while preserving its exact shared image and reverses enough latency for a leaderboard opportunity.", "id": "exp-20260828-198", "language": "CUDA Maca", "notes": "Tested f81a17e1808c7630ffd5c095081db7bceebdb09a; queue tip 111c60a1d56fbf1dfe127c8f8b59d071e4b18fd0; source blob 22f168d3c4e5819c6937f7fa225416742a22f79e / LF SHA-256 0ca56f9513fcb0e7a977beb9512cf5e7af51dae2b07877091163eba2809eff84. Resources 20/254/40/40960/2. Controller rejected.", "operator": "fused_moe_i8_tn", "result": "REJECTED: stack is not the dominant cause; the complete 64x256 family has no leaderboard opportunity and is closed without OJ.", "schema_version": 1, "timestamp": "2026-08-28T10:51:49+00:00"}
{"artifacts": ["artifacts/raw/c500-runs/exp-20260828-199-6e498c406d60-a03", "handoffs/exp-20260828-199.md"], "baseline_commit": "235a34a22889c4d1ce5465acc2daaf1cdb67547d", "benchmark": "ABBA cases 1/2/3/4: 1.0455->0.8385 ms (-19.7991%), 6.0645->6.3565 ms (+4.8149%), 0.5500->0.5220 ms (-5.0909%), 3.3285->3.7115 ms (+11.5067%).", "candidate_commit": "6e498c406d60651003bf2097affd6acf53798283", "change": "Replaced the formal K128 core with the public K256 four-stage m4 core and set all four A/B BSM call sites to is_async=false; added exact current harness compatibility.", "correctness": "PASS: C500 candidate/baseline build, 3/3 exact differential correctness, full regression, sampled and read-only checks, source/tree integrity, and verified 31-entry manifest.", "decision": "revert", "device": "c500-local", "environment": "MetaX C500 xcore1000 device0; MACA 3.7.1.5; MXCC 1.0.0 d9102a1572; 25 percent compute / 16000 MiB; no device process before or after.", "hypothesis": "Synchronous K256 m4 retains decode gains without the public async DMA queue failure and provides a viable decode component.", "id": "exp-20260828-199", "language": "CUDA Maca", "notes": "Tested source blob cf039b6ac34b6002c0cf561d8b3998b0f81d2cd9, LF SHA-256 0bf077d6fa6993261590a157387f5d344613e0c22f752cd68ad384c527a19033, resources 256 MT / 52 ST / 65536 shared. Controller candidate rejected; no OJ.", "operator": "fused_moe_i8_tn", "result": "REJECTED as all-shape source: both prefill cases regress; retain exact synchronous K256 implementation as a proven decode component for a hybrid.", "schema_version": 1, "timestamp": "2026-08-28T12:28:40+00:00"}
{"artifacts": ["artifacts/raw/c500-runs/exp-20260828-200-e75ea1a8f5ae-a01", "handoffs/exp-20260828-200.md"], "baseline_commit": "235a34a22889c4d1ce5465acc2daaf1cdb67547d", "benchmark": "ABBA case1 1.0345->1.9700 ms (+90.4302%); case2 +4.8448%; case3 -5.1329%; case4 +11.9567%.", "candidate_commit": "e75ea1a8f5ae6db25c84b9cad7ae3630eb0ffea1", "change": "Templated the exp199 runtime m4 kernel, dispatched case1 to fixed 4096/4096/7168, and disabled compiler unrolling on the shared K loop.", "correctness": "PASS: independent audit approved; C500 build, 3/3 exact differential correctness, full regression, sampled/read-only checks, source/tree integrity and manifest all passed.", "decision": "revert", "device": "c500-local", "environment": "MetaX C500 xcore1000 device0; MACA 3.7.1.5; MXCC 1.0.0 d9102a1572; 25 percent compute / 16000 MiB.", "hypothesis": "Compile-time case1 dimensions and K-loop unroll disable improve the synchronous K256 m4 case1 path.", "id": "exp-20260828-200", "language": "CUDA Maca", "notes": "Tested e75ea1a8; queue dd11deb2; fixed resources 60 stack/256 MT/52 ST/65536 shared, runtime 0/256/52/65536. Controller rejected; no OJ.", "operator": "fused_moe_i8_tn", "result": "REJECTED: fixed case1 specialization adds 60-byte stack and nearly doubles target latency; retain runtime m4 only.", "schema_version": 1, "timestamp": "2026-08-28T13:15:23+00:00"}
{"artifacts": ["artifacts/raw/c500-runs/exp-20260828-201-c9ad7fe8c9bb-a01", "handoffs/exp-20260828-201.md"], "baseline_commit": "235a34a22889c4d1ce5465acc2daaf1cdb67547d", "benchmark": "ABBA case1 1.0350->0.8375 ms (-19.0821%); case2 6.0635->6.0640 (+0.00825%); case3 0.5475->0.5215 (-4.74886%); case4 3.3265->3.3275 (+0.03006%).", "candidate_commit": "c9ad7fe8c9bb353ed13f486717a1148f759e1c1a", "change": "Added the exact exp199 runtime m4 core under a nested namespace and dispatched case1/case3 to it; case2/case4, unknown configs, ABI and fallback remain formal-best.", "correctness": "PASS: independent audit approved; C500 build, 3/3 exact differential correctness, full regression, sampled/read-only checks, source/tree integrity and manifest all passed.", "decision": "keep", "device": "c500-local", "environment": "MetaX C500 xcore1000 device0; MACA 3.7.1.5; MXCC 1.0.0 d9102a1572; 25 percent compute / 16000 MiB.", "hypothesis": "Use tested synchronous runtime K256 m4 only for exact decode cases while preserving the formal-best prefill paths.", "id": "exp-20260828-201", "language": "CUDA Maca", "notes": "Tested c9ad7fe8; queue a0950eb8; source blob e2b4b65240e829335d939994e7c8e47f7dfd2a91, LF SHA-256 eb94ca383647ce166fca1e568ad75b4c6c143b816b01f65f2d346d3c7a1effb4. Residual OJ risk: synchronous BSM still uses ldg_b128_bsm.", "operator": "fused_moe_i8_tn", "result": "KEEP for OJ: material decode gains with prefill effectively unchanged and formal kernel resources identical.", "schema_version": 1, "timestamp": "2026-08-28T13:15:23+00:00"}
{"artifacts": ["artifacts/raw/c500-runs/exp-20260828-202-17e295bee2b4-a01", "handoffs/exp-20260828-202.md"], "baseline_commit": "c1ed103ba9ee3936467fefe54010ad0d1afe9bbc", "benchmark": "C500 ABBA case2 6.0620 to 5.9810 ms (-1.336193 percent), arms 6.062 to 5.979 and 6.062 to 5.983 ms; case1 -0.3584 percent, case3 -1.2416 percent, case4 +0.0452 percent", "candidate_commit": "17e295bee2b4ed46522f01ac52511d367b8ff13f", "change": "Only exact sorted case2 uses fixed N/K and the existing four B-row slots as bounded uint32 expert-local offsets; synchronous m4 decode, case4, fallback, schedule and ABI remain exact", "correctness": "PASS: independent audit approved after metadata correction; local current-hybrid 9/9 and workflow 15/15; C500 build, 3/3 differential correctness, full regression, sampled/read-only, source/tree integrity and 31/31 manifest", "decision": "keep", "device": "c500-local", "environment": "MetaX C500/xcore1000 device0; MACA 3.7.1.5; MXCC 1.0.0 d9102a1572; 25 percent compute / 16000 MiB; no device process before or after", "hypothesis": "Compose the proven exact case2 fixed-NK in-place uint32 B-row mechanism with the current decode-m4 formal-prefill hybrid while preserving the OJ-proven decode paths", "id": "exp-20260828-202", "language": "CUDA Maca", "notes": "Workflow b6de983334c63dcd3dc0190bf4ac74161b6e4f08; queue tip 4d0a071ec673fa8b9047dc03c02e3fab465a0b05; source blob 48704a2870975c3990f4681089b1a4efc35d99fa; LF SHA-256 083eb1262dbe220aea0c2b324a00f2cf9b14720dc2b8c1701b261f794eaf8cf1", "operator": "fused_moe_i8_tn", "result": "KEEP for controlled OJ score-tier attempt: target improvement is stable, protected paths pass, and leaderboard score takes priority over unrelated legacy C500 gates", "schema_version": 1, "timestamp": "2026-08-28T14:04:05+00:00"}
{"artifacts": ["artifacts/raw/c500-runs/exp-20260828-203-60474f8003c9-a01", "handoffs/exp-20260828-203.md"], "baseline_commit": "bdb3ffac02b1c7eac2bddbe55ab541d3a7e7e569", "benchmark": "C500 ABBA cases1/2/3/4: 0.8370->0.8365 ms (-0.0597 percent), 5.9835->5.9835 ms (flat), 0.5220->0.5210 ms (-0.1916 percent), 3.3290->3.3235 ms (-0.1652 percent); case2 candidate arms 5.982/5.985 ms", "candidate_commit": "60474f8003c9b4063332c500888a05736615060b", "change": "Pack expert and logical tile into the existing 32-bit full-sort map payload so sorted main decodes both from one load; map size, builder launch, grids, MMA, addresses, synchronization and ABI remain exact", "correctness": "PASS: local/workflow 33/33; C500 candidate/baseline build, 3/3 differential correctness, full regression, sampled/read-only checks, source/tree integrity and independently recomputed 31/31 manifest", "decision": "revert", "device": "c500-local", "environment": "MetaX C500/xcore1000 device0; MACA 3.7.1.5; MXCC 1.0.0 d9102a1572; 25 percent compute / 16000 MiB; no device process before or after", "hypothesis": "Remove one dependent expert_ids load from exact sorted case2 to cross the leaderboard 78-point timing tier", "id": "exp-20260828-203", "language": "CUDA Maca", "notes": "Tested 60474f8003c9b4063332c500888a05736615060b; queue tip d75a4398f5072a3b03743f5a21236305711bdac7; source blob 9598ab5736e7a137d3253edf1f1fab9ef4e1d262; LF SHA-256 9b2d0dc5990d3df736411531d175754b392ad4fe2f50a84ee05397caedcfafdf; manifest SHA-256 7192f171835e07fab8b4b1d4000da7a48a4075749cfe34fd21b5cb7c1083e2f7", "operator": "fused_moe_i8_tn", "result": "REJECTED: case2 was exactly flat and failed the preregistered 0.23 percent leaderboard-tier gate; controller rejected and no OJ submission was made", "schema_version": 1, "timestamp": "2026-08-28T15:20:02+00:00"}
{"artifacts": ["artifacts/raw/c500-runs/exp-20260828-204-ff828c965466-a01", "handoffs/exp-20260828-204.md"], "baseline_commit": "06ceb81cc2a34ddb0e888de696123dbcce861f88", "benchmark": "C500 ABBA cases1/2/3/4: 0.8385->0.8380 ms (-0.059630 percent), 5.9850->5.9770 ms (-0.133668 percent), 0.5235->0.5225 ms (-0.191022 percent), 3.3250->3.3190 ms (-0.180451 percent); case2 candidate arms 5.978/5.976 ms", "candidate_commit": "ff828c965466cd5139ef87b187e15b1cf185a084", "change": "Compose the tested 256-bin shared histogram/prefix/atomic-rank builder with packed expert and logical-tile full-sort payload on the current formal best; cases2/4 share the builder and map while cases1/3 remain unchanged", "correctness": "PASS: independent mapping audit; local focused/full-sort/workflow 42/42; C500 candidate/baseline build, 3/3 differential correctness, full regression, sampled/read-only checks, source/tree integrity and independently recomputed 31/31 manifest", "decision": "revert", "device": "c500-local", "environment": "MetaX C500/xcore1000 device0; MACA 3.7.1.5; MXCC 1.0.0 d9102a1572; 25 percent compute / 16000 MiB; no device process before or after", "hypothesis": "Combining builder acceleration with packed-map consumer removes enough full-sort overhead to cross the next case2 leaderboard tier", "id": "exp-20260828-204", "language": "CUDA Maca", "notes": "Tested ff828c965466cd5139ef87b187e15b1cf185a084; queue tip d2e201fda379bb6538cbea47839c7155c942a30b; source blob 885749051bc006232d9889412c78870b29fa09fd; LF SHA-256 2405dfc415ddf1b60c69cb158e1c72eb768111718fb4daa00b03c75919e26dab; manifest SHA-256 81a2d93fb56c534e37b5bcc1afb959250029b15983fc34d86dc137828a99a55e", "operator": "fused_moe_i8_tn", "result": "REJECTED: case2 improved with both arms favorable but missed the preregistered 0.23 percent leaderboard tier; controller rejected and no OJ submission was made", "schema_version": 1, "timestamp": "2026-08-28T15:55:41+00:00"}
{"artifacts": ["artifacts/raw/c500-runs/exp-20260828-205-fb7f1f3301da-a01", "handoffs/exp-20260828-205.md"], "baseline_commit": "06ceb81cc2a34ddb0e888de696123dbcce861f88", "benchmark": "C500 ABBA cases1/2/3/4: 0.8350->0.8325 ms (-0.299401 percent), 5.9795->5.9835 ms (+0.066895 percent), 0.5230->0.5220 ms (-0.191205 percent), 3.3210->3.3220 ms (+0.030111 percent); case2 baseline arms 5.978/5.981 ms and candidate arms 5.981/5.986 ms", "candidate_commit": "fb7f1f3301da33f73c20c0c107562422e3997e05", "change": "Retain the exp204 packed-map consumer while replacing its two contended shared-atomic histogram phases with four wave64-private histograms and one atomic allocation per tile; case4 shares the builder while cases1/3 and main-kernel behavior remain unchanged", "correctness": "PASS: independent audit approved; local focused/composition/workflow 42/42; C500 candidate/baseline build, 3/3 differential correctness, full regression, sampled/read-only checks, source/tree integrity and independently recomputed 31/31 manifest", "decision": "revert", "device": "c500-local", "environment": "MetaX C500/xcore1000 device0; MACA 3.7.1.5; MXCC 1.0.0 d9102a1572; 25 percent compute / 16000 MiB; no device process before or after", "hypothesis": "Wave-private histograms reduce shared atomic contention enough to add the remaining case2 gain needed for the next leaderboard tier", "id": "exp-20260828-205", "language": "CUDA Maca", "notes": "Tested fb7f1f3301da33f73c20c0c107562422e3997e05; queue tip 27c2e6a49cc6bf65ea2766c2289d266b3e756028; source blob 0c49f47cfd1b78ba7622823fe5711077da8a609b; LF SHA-256 cfc0789cfe36f81fbf15664de8e7209c2736133db1966c57c951b3a565e487ef; manifest SHA-256 d6a2b998e8daa9cd62eac317baaebdd9a7ecee79314ce07154d4b2de5cb2b963", "operator": "fused_moe_i8_tn", "result": "REJECTED: case2 and both target arms regressed, so the candidate has no leaderboard upside independent of any legacy percentage gate; controller rejected and no OJ submission was made", "schema_version": 1, "timestamp": "2026-08-28T16:19:00+00:00"}
{"artifacts": ["artifacts/raw/c500-runs/exp-20260829-206-5d27a991a5b5-a01", "handoffs/exp-20260829-206.md"], "baseline_commit": "5b944eb04009483216d5a676cf284cb888de85e6", "benchmark": "C500 ABBA cases1/2/3/4: 0.8380->0.8365 ms (-0.178998 percent), 5.9815->6.0415 ms (+1.003093 percent), 0.5185->0.5210 ms (+0.482160 percent), 3.3220->3.3270 ms (+0.150512 percent); case2 baseline arms 5.984/5.979 ms and candidate arms 6.042/6.041 ms", "candidate_commit": "5d27a991a5b520e337c8d294010817378ba7fcda", "change": "Use byte-unit K induction only in exact case2 so the existing uint32 B-row offset directly consumes tile bytes instead of multiplying a tile counter by 128; all generic paths and memory semantics remain unchanged", "correctness": "PASS: focused inverse/address proof 3/3; C500 candidate/baseline build, 3/3 differential correctness, full regression, sampled/read-only checks, source/tree integrity and independently verified 31/31 manifest", "decision": "revert", "device": "c500-local", "environment": "MetaX C500/xcore1000 device0; MACA 3.7.1.5; MXCC 1.0.0 d9102a1572; 25 percent compute / 16000 MiB", "hypothesis": "Byte-unit K induction removes a retained steady B address scale and crosses the next case2 leaderboard tier", "id": "exp-20260829-206", "language": "CUDA Maca", "notes": "Tested 5d27a991a5b520e337c8d294010817378ba7fcda; queue tip 4df29162f878df3232016b16a382a4bd206d2272; source blob 158a6904be340716a7488800517bc0e4dd665f26; LF SHA-256 51487192e366892c09642f30d5ed3dd3de5454699c35b357d0a94d67e41b4d5e; manifest SHA-256 245792e79ff0cd73f2cbddc956df14bc972902f664e51f4cbf67ba3ca6f6a735", "operator": "fused_moe_i8_tn", "result": "REJECTED: exact case2 and both target arms regressed by about one percent; controller rejected and no OJ submission was made", "schema_version": 1, "timestamp": "2026-08-29T00:30:00+00:00"}
{"artifacts": ["artifacts/raw/c500-runs/exp-20260829-207-238f9dc8293e-a01", "handoffs/exp-20260829-207.md"], "baseline_commit": "01cf1c3e48430db114044ef3479f65c05de0d216", "benchmark": "C500 ABBA case2 5.9815->5.9805 ms (-0.016718 percent), candidate arms 5.983/5.978 ms versus baseline 5.985/5.978 ms", "candidate_commit": "238f9dc8293e87b55e139f6e41ac0515030f8770", "change": "Fold load_k into the four existing exact-case2 A-row offset carriers", "correctness": "PASS: focused exhaustive proof 3/3; C500 build, 3/3 differential correctness, full regression, integrity and 31/31 manifest", "decision": "revert", "device": "c500-local", "environment": "MetaX C500/xcore1000; MACA 3.7.1.5; 25 percent compute / 16000 MiB", "hypothesis": "Remove repeated exact-case2 A address additions", "id": "exp-20260829-207", "language": "CUDA Maca", "notes": "Tested 238f9dc8293e87b55e139f6e41ac0515030f8770; queue 8a781b2603d6df55ee9e57a24602e5ef06bb4452; source blob da4274a49a60ceb4cdc2acee20b48020301d2af8", "operator": "fused_moe_i8_tn", "result": "REJECTED: target gain far below score tier; no OJ", "schema_version": 1, "timestamp": "2026-08-29T01:00:00+00:00"}
{"artifacts": ["artifacts/raw/c500-runs/exp-20260829-208-f8f794a40fe6-a01", "artifacts/raw/xpuoj/130656", "handoffs/exp-20260829-208.md"], "baseline_commit": "01cf1c3e48430db114044ef3479f65c05de0d216", "benchmark": "C500 ABBA case2 5.9845->5.9720 ms (-0.208873 percent), both candidate arms 5.972 ms; OJ cases 86/72/89/85 at 0.811/8.625/0.503/3.735 ms", "candidate_commit": "f8f794a40fe6bd8e96d9fb4162084a2d53a43e84", "change": "Compose histogram packed map with exact-case2 unpredicated metadata, scale, stores and CTA row guard", "correctness": "PASS: focused proof 3/3; C500 build/correctness/regression/integrity/31-entry manifest; OJ 4/4 Accepted", "decision": "revert", "device": "c500-local and XPU-OJ C500", "environment": "MetaX C500/xcore1000; MACA 3.7.1.5; CUDA Maca OJ", "hypothesis": "Cross the next case2 score tier with stable builder plus epilogue savings", "id": "exp-20260829-208", "language": "CUDA Maca", "notes": "Tested f8f794a40fe6bd8e96d9fb4162084a2d53a43e84; integrated 96f2bf504237996c75a17647a1dbcfb79f214947; OJ 130656 finalized at 83.00; source restored to formal blob 48704a2870975c3990f4681089b1a4efc35d99fa", "operator": "fused_moe_i8_tn", "result": "REJECTED: OJ case2 regressed to 72 and total score fell from 84.75 to 83.00", "schema_version": 1, "timestamp": "2026-08-29T01:25:00+00:00"}
{"artifacts": ["artifacts/raw/c500-runs/exp-20260829-209-a662731f1517-a01", "handoffs/exp-20260829-209.md"], "baseline_commit": "8341aa38e55659285673111df90e786c1fba08df", "benchmark": "C500 ABBA cases1/2/3/4: 0.8340->0.8275 ms (-0.779376 percent), 5.9790->5.9815 ms (+0.041813 percent), 0.5175->0.5155 ms (-0.386473 percent), 3.3205->3.3255 ms (+0.150580 percent)", "candidate_commit": "a662731f1517eab24162a7d1c911981c7cf031f2", "change": "Remove guaranteed-true CTA, A/B, metadata, scale and store predicates only from the exact decode m4 path while preserving the BSM request and arrival schedule", "correctness": "PASS: local focused/workflow 28/28; detached audit approved exact bounds and BSM schedule; C500 build, 3/3 differential correctness, full regression, sampled/read-only checks, source/tree integrity and 31/31 manifest", "decision": "revert", "device": "c500-local", "environment": "MetaX C500/xcore1000 device0; MACA 3.7.1.5; MXCC 1.0.0 d9102a1572; 25 percent compute / 16000 MiB", "hypothesis": "Removing guaranteed-true exact m4 predicates and clamps reduces decode case1 latency enough to cross its next OJ score tier without changing the BSM schedule", "id": "exp-20260829-209", "language": "CUDA Maca", "notes": "Tested a662731f1517eab24162a7d1c911981c7cf031f2; queue tip dc64928c36153d0925c45c69f67d008e754b40e0; source blob aab9cc66671d5ad58522938350296a8b56591554; LF SHA-256 ea0f2383ccf23b0a39dad05b6acfde110d1eecd8957cee7851a47e6de2a03f99; paired SHA-256 d08bc60713028aef0c1ba69d6a5f1c199e481ebd3374b94fefacb46a99beacd9; manifest SHA-256 d772d57b9412513eaae9cf63ed4677d2f12b2f5e5f4b9007e3a09bfc0a97b3bf", "operator": "fused_moe_i8_tn", "result": "REJECTED: best relevant case1 gain was 0.779376 percent versus approximately 5.4 percent needed for its next OJ tier; controller rejected and no OJ submission was made", "schema_version": 1, "timestamp": "2026-08-28T18:06:48+00:00"}
{"artifacts": ["handoffs/exp-20260829-212.md"], "baseline_commit": "8341aa38e55659285673111df90e786c1fba08df", "benchmark": "NOT RUN: independent upper-bound review rejected the leaderboard premise before C500", "candidate_commit": "d7aa74b5639c07427addb0af3dd7415284e5416c", "change": "Remove eight prologue-only dummy token loads from decode m4 and change the first two arrival thresholds from 12/8 to the public waitfix 4/0 sequence", "correctness": "Static exact-commit synchronization audit PASS for C500 testing: 16-request prologue publication, steady eight-request carry and drain lifetimes are safe under the inherited MACA FIFO arrival contract", "decision": "revert", "device": "cpu", "environment": "Read-only source, public-provenance, instruction-volume and synchronization analysis; no C500 or OJ", "hypothesis": "Deleting semantically unused token loads materially improves decode case1 toward its next OJ score tier", "id": "exp-20260829-212", "language": "CUDA Maca", "notes": "Candidate d7aa74b5639c07427addb0af3dd7415284e5416c; no controller candidate or OJ submission; formal source remained blob 48704a2870975c3990f4681089b1a4efc35d99fa", "operator": "fused_moe_i8_tn", "result": "REJECTED: deletes only 0.06198 percent of case1 wave instructions with a 0.8595 percent lane-byte ceiling and makes prologue waits more conservative, far below the 5.27 percent next-point requirement", "schema_version": 1, "timestamp": "2026-08-28T19:05:00+00:00"}
