{"artifacts": ["artifacts/raw/c500-runs/exp-20260830-251-63ac0f37f512-a01", "handoffs/exp-20260830-251.md"], "baseline_commit": "8341aa38e55659285673111df90e786c1fba08df", "benchmark": "C500 ABBA cases1/2/3/4: 0.8420->0.8390 ms (-0.3563%), 5.9895->6.5320 ms (+9.0575%, candidate arms 6.531/6.533), 0.5275->0.5245 ms (-0.5687%), 3.3355->3.3265 ms (-0.2698%); resources unchanged at 0 stack/230 MT/40 ST/32768 shared/staticMaxWarps 2.", "candidate_commit": "63ac0f37f5120ff398c3035a22eeb9b838157ad8", "change": "Only exact case 2 moves B2/B3/A0/A1 next-tile register loads beside existing head-issued B0/B1; addresses, traffic, STS/LDS/MMA, barriers, epilogue, mapping, grid, ABI and protected paths remain exact.", "correctness": "PASS: local focused/workflow 15/15; C500 dual build, differential correctness 3/3 matched_ratio 1.0 max_abs 0, full regression, source/tree integrity and 31/31 manifest.", "decision": "revert", "device": "c500-local", "environment": "MetaX C500/xcore1000, MACA 3.7.1.5, 25 percent compute / 16000 MiB, device 0; trusted run exp-20260830-251-63ac0f37f512-a01 succeeded/0.", "hypothesis": "Hoist all six dependency-safe next-tile loads to the exact case-2 K-loop head to hide enough VLS pipeline latency for at least 2.72 percent improvement.", "id": "exp-20260830-251", "language": "CUDA Maca", "notes": "Tested commit 63ac0f37f5120ff398c3035a22eeb9b838157ad8; queue tip 845c7b71cc2ec93ac896598104c54e15eda6851e; source blob b7a22f60d9cabfb0c9578172fdaf7499cee35e92; LF SHA-256 e56fa3e744a041ea2ac9168e424ae12c4adf82635b6b70b00433ffab2700eeca; controller rejected; no OJ submission; formal source never changed.", "operator": "Fused MoE i8 tn", "result": "REJECTED: target case 2 regressed decisively in both arms, falsifying the six-load-at-loop-head latency-hiding hypothesis.", "schema_version": 1, "timestamp": "2026-08-30T10:39:57+00:00"}
{"artifacts": ["artifacts/raw/c500-runs/exp-20260830-253-0f97ac511083-a01", "handoffs/exp-20260830-253.md"], "baseline_commit": "8341aa38e55659285673111df90e786c1fba08df", "benchmark": "C500 ABBA cases1/2/3/4: 0.8410->0.8405 ms (-0.0595%), 5.9870->6.0390 ms (+0.8685%, candidate arms 6.042/6.036), 0.5300->0.5255 ms (-0.8491%), 3.3275->3.4275 ms (+3.0053%); exact prefill ST registers increased from 40 to 54 and generic from 40 to 60.", "candidate_commit": "0f97ac511083d75b38f54aa9093b29ef9901a11b", "change": "Add only schedule_category(3) to the MACA prefill MMA template, selecting MXCC metaxgpu-ilp machine scheduling without changing source operations, addresses, synchronization, dispatch, decode or fallback.", "correctness": "PASS: local focused/workflow 14/14; C500 dual build, differential correctness 3/3 matched_ratio 1.0 max_abs 0, full regression, source/tree integrity and 31/31 manifest.", "decision": "revert", "device": "c500-local", "environment": "MetaX C500/xcore1000, MACA 3.7.1.5, MXCC 1.0.0 d9102a1572, 25 percent compute / 16000 MiB, device 0; trusted run exp-20260830-253-0f97ac511083-a01 succeeded/0.", "hypothesis": "Select MXCC metaxgpu-ilp scheduling for the full prefill MMA template to expose enough independent work for at least 2.724 percent case-2 improvement.", "id": "exp-20260830-253", "language": "CUDA Maca", "notes": "Tested commit 0f97ac511083d75b38f54aa9093b29ef9901a11b; queue tip f101ec85d194c7ac7b06e0cbb75df332a9ad2a3c; source blob 5cc3e4cd41dcaeffd0e7b0f2cd78031a66d3c5be; LF SHA-256 21360e772d7a0e094c20615b2d7e9e423545a6f109d654573deb73920c78074e; controller rejected; no OJ submission; formal source never changed. Experiment 252 remains an empty reserved lane and was not reused.", "operator": "Fused MoE i8 tn", "result": "REJECTED: target case 2 regressed in both low-drift arms, protected case 4 regressed 3.0053 percent, and ST register pressure increased materially.", "schema_version": 1, "timestamp": "2026-08-30T11:43:56+00:00"}
{"artifacts": ["artifacts/raw/c500-runs/exp-20260830-254-6066fdb1de1f-a01", "handoffs/exp-20260830-254.md"], "baseline_commit": "8341aa38e55659285673111df90e786c1fba08df", "benchmark": "C500 ABBA cases1/2/3/4: 0.8390->0.8395 ms (+0.0596%), 5.9855->5.9860 ms (+0.0084%, candidate arms 5.986/5.986), 0.5250->0.5265 ms (+0.2857%), 3.3330->3.3285 ms (-0.1350%); candidate and baseline resource shapes were identical.", "candidate_commit": "6066fdb1de1fc98f1baa053c745cb8c7ff38c5cc", "change": "Add only schedule_category(8) to the MACA prefill MMA template, selecting MXCC metaxgpu-memflow machine scheduling without changing source operations, addresses, synchronization, dispatch, decode or fallback.", "correctness": "PASS: focused 2/2; C500 dual build, differential correctness 3/3 matched_ratio 1.0 max_abs 0, full regression, source/tree integrity and 31/31 manifest.", "decision": "revert", "device": "c500-local", "environment": "MetaX C500/xcore1000, MACA 3.7.1.5, MXCC 1.0.0 d9102a1572, 25 percent compute / 16000 MiB, device 0; trusted run exp-20260830-254-6066fdb1de1f-a01 succeeded/0.", "hypothesis": "Select MXCC metaxgpu-memflow scheduling for the VLS-dominated prefill MMA template to obtain at least 2.724 percent case-2 improvement.", "id": "exp-20260830-254", "language": "CUDA Maca", "notes": "Tested commit 6066fdb1de1fc98f1baa053c745cb8c7ff38c5cc; queue tip 6c6083d0d7187e227e69893494252b09bfb799a3; source blob a1433f12d3bc3a60fd2b25f18ec7ffae744e9201; LF SHA-256 a4d2fd7a2306dbc06d9c4641a81929a2185564e804ce6e3bccea6502e9c9261e; controller rejected; no OJ submission; formal source never changed.", "operator": "Fused MoE i8 tn", "result": "REJECTED: exact target case 2 was noise-flat with no favorable arm and the compiler reported no resource change, far below the score-tier gate.", "schema_version": 1, "timestamp": "2026-08-30T11:52:57+00:00"}
{"artifacts": ["artifacts/raw/c500-runs/exp-20260830-255-cad33f259d29-a01", "handoffs/exp-20260830-255.md"], "baseline_commit": "8341aa38e55659285673111df90e786c1fba08df", "benchmark": "C500 ABBA cases1/2/3/4: 0.8405->0.8415 ms (+0.1190%), 5.9880->6.0025 ms (+0.2422%, candidate arms 6.004/6.001), 0.5270->0.5240 ms (-0.5693%), 3.3310->3.3415 ms (+0.3152%); case2 staticMaxWarps stayed 2 while ST increased 40 to 42.", "candidate_commit": "cad33f259d29cd461349ab7af076eb56c1be361e", "change": "Add only schedule_category(9) to the MACA prefill MMA template, selecting MXCC metaxgpu-maxwarp scheduling without changing source operations, addresses, synchronization, dispatch, decode or fallback.", "correctness": "PASS: focused 2/2; C500 dual build, differential correctness 3/3 matched_ratio 1.0 max_abs 0, full regression, source/tree integrity and 31/31 manifest.", "decision": "revert", "device": "c500-local", "environment": "MetaX C500/xcore1000, MACA 3.7.1.5, MXCC 1.0.0 d9102a1572, 25 percent compute / 16000 MiB, device 0; trusted run exp-20260830-255-cad33f259d29-a01 succeeded/0.", "hypothesis": "Select MXCC metaxgpu-maxwarp scheduling to raise exact-prefill residency above two warps and improve case2 by at least 2.724 percent.", "id": "exp-20260830-255", "language": "CUDA Maca", "notes": "Tested commit cad33f259d29cd461349ab7af076eb56c1be361e; queue tip 498d7f9f39aa1535eb5c865fba2de53777a24a1e; source blob b012d49b8742f067b753cc1096e7d7ca94cad26c; LF SHA-256 484cf6b772e7c731ea7b03728ffa9f970413ae2a1adf954dc59b455f8a1f96cb; controller rejected; no OJ submission; formal source never changed; close ILP/memflow/maxwarp schedule-category family.", "operator": "Fused MoE i8 tn", "result": "REJECTED: case2 regressed in both arms, staticMaxWarps remained two and ST pressure increased, falsifying the occupancy-directed scheduler hypothesis.", "schema_version": 1, "timestamp": "2026-08-30T12:00:41+00:00"}
{"artifacts": ["artifacts/raw/c500-runs/exp-20260830-256-419f71db8988-a01", "handoffs/exp-20260830-256.md"], "baseline_commit": "8341aa38e55659285673111df90e786c1fba08df", "benchmark": "C500 ABBA cases1/2/3/4: 0.8450->0.8450 ms, 5.9920->6.3115 ms (+5.332109 percent; arms 6.307/6.316 vs 5.992/5.992), 0.5285->0.5310 ms, 3.3360->3.3360 ms; dual-M resources 0 stack/216 MT/36 ST/49152 shared/2 warps.", "candidate_commit": "419f71db8988bed4cd101f561b1bef4e845e5b98", "change": "Add an exact-case2 512-thread dual-M clone with 32 KiB A plus 16 KiB shared B, one formal accumulator set per thread, fixed-u32 B offsets, paired-M grid, and formal case4 dispatch.", "correctness": "PASS: focused 8/8 and workflow/ABBA 23/23; C500 dual build, differential correctness 3/3 matched_ratio 1.0 max_abs 0, full regression, sampled correctness, source/tree integrity and 31/31 manifest.", "decision": "revert", "device": "c500-local", "environment": "MetaX C500/xcore1000 device 0; MACA 3.7.1.5; 25 percent compute / 16000 MiB; trusted run exp-20260830-256-419f71db8988-a01 succeeded/0.", "hypothesis": "Pair adjacent sorted case2 M ranks in one 512-thread CTA to share B, reduce staged matrix bytes by 25 percent, and improve case2 by at least 2.724 percent.", "id": "exp-20260830-256", "language": "CUDA Maca", "notes": "Queue tip 3d5ff3d51dae1abc01b8a6e99a9650b78a803dba; source blob 827d98fbe941781bf43264da71746e98462820c3; LF SHA-256 541f97d62eca457ad1929f27b57e646e4caa4ef9e5d1f12270f1d34776084241; controller rejected; no OJ; formal source never changed; close dual-M/shared-B family.", "operator": "Fused MoE i8 tn", "result": "REJECTED: exact case2 regressed decisively in aggregate and both arms, falsifying the 56-K-tile amortization hypothesis.", "schema_version": 1, "timestamp": "2026-08-30T15:25:40+00:00"}
{"artifacts": ["artifacts/raw/c500-runs/exp-20260831-257-04f6f01e52f2-a01", "handoffs/exp-20260831-257.md"], "baseline_commit": "8341aa38e55659285673111df90e786c1fba08df", "benchmark": "C500 ABBA cases1/2/3/4: 0.8445->0.8445 ms (0.0%), 5.9920->6.7900 ms (+13.3178%, candidate arms 6.907/6.673 vs baseline 5.990/5.994), 0.5275->0.5280 ms (+0.0948%), 3.3300->3.3330 ms (+0.0901%); case2 resources stayed 0 stack/230 MT/40 ST/32768 shared/2 warps.", "candidate_commit": "04f6f01e52f2fe0ea189956c29fd532b71720227", "change": "Build a generic bounded worklist of at most forty expert-aligned width-seven rank groups for exact case2 and map grid (7,32,40) through one packed start/size descriptor per CTA, with contiguous width-seven fallback for arbitrary distributions.", "correctness": "PASS: focused grouping 3/3; detached exact-commit mapping/publication audit; C500 dual build, differential correctness 3/3 matched_ratio 1.0 max_abs 0, full regression, sampled/read-only checks, source/tree integrity and 31/31 manifest.", "decision": "revert", "device": "c500-local", "environment": "MetaX C500/xcore1000 device 0; MACA 3.7.1.5; 25 percent compute / 16000 MiB; trusted run exp-20260831-257-04f6f01e52f2-a01 succeeded/0.", "hypothesis": "Removing all mixed-expert clusters from width-seven case2 scheduling creates enough L2 headroom to improve both C500 arms by at least 2.724 percent despite 768 early-return CTAs.", "id": "exp-20260831-257", "language": "CUDA Maca", "notes": "Queue tip abd9c6a9b3ad4d0c3860f6b87ab980bb3c163e3e; source blob 78b23b269d0bc2e7dc34e16c41002cf329844221; LF SHA-256 cd39bf9f5ae9a472b33b6ceb2836aefbaca1b21a152375f573e2f2bec844cb11; controller rejected; no OJ; formal source never changed; close expert-aligned width-seven scheduling.", "operator": "Fused MoE i8 tn", "result": "REJECTED: exact case2 regressed decisively in aggregate and both arms, so pure expert boundaries do not recover the width-seven scheduling penalty.", "schema_version": 1, "timestamp": "2026-08-31T02:10:02+08:00"}
{"artifacts": ["artifacts/raw/c500-runs/exp-20260831-258-01a01ca936e7-a01", "handoffs/exp-20260831-258.md"], "baseline_commit": "8341aa38e55659285673111df90e786c1fba08df", "benchmark": "C500 ABBA cases1/2/3/4: 0.8455->0.8455 ms, 5.9910->8.0965 ms (+35.1444%; arms 8.101/8.092), 0.5315->0.5300 ms, 3.3340->3.3330 ms", "candidate_commit": "01a01ca936e7a2af0425b3fefa4e1140842d7f9e", "change": "Split only exact case2 from one (8,32,32) main launch into 32 ordered (8,32,1) launches with a physical-rank base; preserve useful CTA work, stable map, decode, case4 and fallback", "correctness": "PASS: local focused/workflow 19/19; C500 dual build, 3/3 differential correctness, full regression, sampled/read-only, source/tree integrity and manifest; audit found no mapping/publication/ABI correctness flaw", "decision": "revert", "device": "c500-local", "environment": "MetaX C500/xcore1000 device0; MACA 3.7.1.5; MXCC d9102a1572; 25 percent compute / 16000 MiB; no device process after", "hypothesis": "Sequential width-eight case2 cluster launches prevent cross-cluster L2 overlap and improve case2 by at least 2.724 percent after launch overhead", "id": "exp-20260831-258", "language": "CUDA Maca", "notes": "Candidate source blob 9c9e9f724ea2ed7c18e8282d43b1cb0d39843254; LF SHA-256 41293582ea7c16e549db7a408fd7fe68e4a04353a87e1e3e33c3484abac3d5b5; queue tip b5a3c4a14d20b945e5af539278749bc8f631a0c6; controller rejected; no OJ; formal source never changed", "operator": "Fused MoE i8 tn", "result": "REJECTED: exact case2 regressed decisively in both low-drift arms; extra default-stream launch boundaries dominate and the multi-launch family has no leaderboard path", "schema_version": 1, "timestamp": "2026-08-30T19:05:41+00:00"}
{"artifacts": ["artifacts/raw/c500-runs/exp-20260831-259-e0dc951aaf35-a01", "handoffs/exp-20260831-259.md"], "baseline_commit": "8341aa38e55659285673111df90e786c1fba08df", "benchmark": "C500 ABBA cases1/2/3/4: 0.8495->0.8430 ms (-0.7652%), 5.9875->5.9900 ms (+0.0418%), 0.5270->0.5275 ms (+0.0949%), 3.3280->3.3290 ms (+0.0300%); m4 resources unchanged at 0 stack/256 MT/52 ST/65536 shared/2 warps", "candidate_commit": "e0dc951aaf35cc069618313a4a0c1032cab72551", "change": "Add only schedule_category(8) to the synchronous decode m4 kernel; preserve executable operations, mapping, synchronization, prefill and ABI", "correctness": "PASS: focused/workflow 14/14; C500 dual build, differential correctness 3/3 matched_ratio 1.0 max_abs 0, full regression, sampled/read-only, source/tree integrity and 31/31 manifest", "decision": "revert", "device": "c500-local", "environment": "MetaX C500/xcore1000 device0; MACA 3.7.1.5; 25 percent compute / 16000 MiB; trusted run exp-20260831-259-e0dc951aaf35-a01 succeeded/0", "hypothesis": "MXCC memflow scheduling on decode m4 must improve case1 by 5.2711 percent and case3 by 10.5677 percent for the complete C1+C2+C3 score path", "id": "exp-20260831-259", "language": "CUDA Maca", "notes": "Queue tip 091c10ebc0f8b4ed2351e3111f7b6d7339ff7cb6; candidate blob cf2f2972060dd59356b7cfd2cc8f9570ddad139e; LF SHA-256 7f0a0740558d99c70fb4567a18f7fb0d17169d8c77f6186ea3587b85e98bad04; controller rejected; formal source never changed", "operator": "Fused MoE i8 tn", "result": "REJECTED: case1 gain was far below 5.2711 percent and case3 regressed instead of improving 10.5677 percent; no complete leaderboard path and no OJ", "schema_version": 1, "timestamp": "2026-08-30T20:04:54+00:00"}
{"artifacts": ["handoffs/exp-20260831-260.md"], "baseline_commit": "8341aa38e55659285673111df90e786c1fba08df", "benchmark": "NOT RUN: no C500 slot consumed", "candidate_commit": "f906f67ac22b71b27f838cc116f2c961bdce81bd", "change": "No submission-source change; stopped when the frozen harness was found not to allocate token_ids or construct duplicate routed A rows", "correctness": "NOT RUN: invalid workflow harness could not exercise the mechanism", "decision": "revert", "device": "cpu", "environment": "CPU workflow audit only", "hypothesis": "Build a prefill-only canonical A-row map from token_ids to reduce unique A traffic in cases 2 and 4", "id": "exp-20260831-260", "language": "CUDA Maca", "notes": "No candidate queue, C500 run, browser, or OJ action; formal source unchanged", "operator": "Fused MoE i8 tn", "result": "WORKFLOW-REJECTED before implementation; mechanism moved to a fresh workflow-bearing experiment", "schema_version": 1, "timestamp": "2026-08-30T21:24:47+00:00"}
{"artifacts": ["artifacts/raw/c500-runs/exp-20260831-261-f51aa06db997-a01", "handoffs/exp-20260831-261.md"], "baseline_commit": "8341aa38e55659285673111df90e786c1fba08df", "benchmark": "C500 ABBA cases1/2/3/4: 0.8430->0.8405 ms (-0.2966%), 5.9895->5.9325 ms (-0.9517%), 0.5265->0.5235 ms (-0.5698%), 3.3300->3.3505 ms (+0.6156%); sorted ST registers 40->52", "candidate_commit": "f51aa06db997ea8407aeb6bf21f7ba1cc4454c73", "change": "Build token-to-canonical-row in the existing full-sort builder and use it only for sorted prefill A loads; decode and generic paths remain isolated", "correctness": "PASS: local 19/19 focused/workflow; C500 dual build, 3/3 differential correctness, full regression, sampled/read-only checks, source/tree integrity and 31/31 manifest", "decision": "revert", "device": "c500-local", "environment": "MetaX C500/xcore1000, MACA 3.7.1.5, 25 percent compute / 16000 MiB, device 0; trusted run exp-20260831-261-f51aa06db997-a01 succeeded/0", "hypothesis": "Canonical routed A rows must improve case 2 by 5.967 percent and case 4 by 6.847 percent for the complete three-point path", "id": "exp-20260831-261", "language": "CUDA Maca", "notes": "Queue tip 495e0bb2da7eee0ff57380b47cd730c3f64c631c; source blob 0ab2277d44f39485345a0a92800e1837432c7f1c; LF SHA-256 60b3604bb89b4f20ea51a3f4d9f283446397974e834dfc4909c4ed3171f3d649; controller rejected; no OJ; formal source unchanged", "operator": "Fused MoE i8 tn", "result": "REJECTED: case2 gain was far below the full score path and case4 regressed in both arms", "schema_version": 1, "timestamp": "2026-08-30T21:25:11+00:00"}
{"artifacts": ["artifacts/raw/c500-runs/exp-20260831-262-50524878744f-a01", "handoffs/exp-20260831-262.md"], "baseline_commit": "8341aa38e55659285673111df90e786c1fba08df", "benchmark": "C500 ABBA cases1/2/3/4: 0.8425->0.8440 ms (+0.1780%), 5.9905->5.9970 ms (+0.1085%), 0.5275->0.5275 ms, 3.3320->3.3885 ms (+1.6957%); main resources restored to formal 230 MT/40 ST", "candidate_commit": "50524878744fddec4baa42b6961b4f83604da9dc", "change": "Split canonical publication and direct routed-row-map construction into ordered builders so the sorted main kernel performs one map load and carries no token_ids pointer", "correctness": "PASS: local 19/19 focused/workflow; C500 dual build, 3/3 differential correctness, full regression, sampled/read-only checks, source/tree integrity and 31/31 manifest", "decision": "revert", "device": "c500-local", "environment": "MetaX C500/xcore1000, MACA 3.7.1.5, 25 percent compute / 16000 MiB, device 0; trusted run exp-20260831-262-50524878744f-a01 succeeded/0", "hypothesis": "Direct routed-row canonical mapping must improve case2 by 5.967 percent and case4 by 6.847 percent while restoring formal main-kernel resources", "id": "exp-20260831-262", "language": "CUDA Maca", "notes": "Queue tip 1924661a10c7015ec5f5e255ff4b045a8f0a0ddb; source blob 375d12f8a17efe276e4f35e4649fc2c15b111edb; LF SHA-256 820dd19643dee5014876de030cc330b1a9d9e5457374c1f0889a91a8e3b54e05; controller rejected; no OJ; formal source unchanged", "operator": "Fused MoE i8 tn", "result": "REJECTED: route-map generation/read traffic erased case2 gain and regressed case4 in both arms", "schema_version": 1, "timestamp": "2026-08-30T21:41:57+00:00"}
{"artifacts": ["artifacts/raw/c500-runs/exp-20260831-263-059566b48ad4-a01"], "baseline_commit": "8341aa38e55659285673111df90e786c1fba08df", "benchmark": "ABBA C1 +0.1783%; C2 -0.3841%; C3 -0.0953%; C4 -1.2915% speed improvement convention", "candidate_commit": "059566b48ad4a85c71ecb4bfa2d14754005939d9", "change": "Packed logical/canonical tile map plus slice-major expert-minor physical cluster ordering", "correctness": "dual build; 3/3 differential; full regression; sampled/read-only; integrity; 31/31 manifest PASS", "decision": "revert", "device": "c500-local", "environment": "MetaX C500 xcore1000; MACA 3.7.1.5; paired formal baseline", "hypothesis": "Interleave validated canonical-A clusters while preserving width-eight same-expert B reuse", "id": "exp-20260831-263", "language": "cuda", "notes": "Independent audit APPROVE for correctness; builder adds two uniform barriers; controller rejected without OJ", "operator": "fused_moe_i8_tn", "result": "Aligned-route upper-bound regressed both prefill targets across both arms", "schema_version": 1, "timestamp": "2026-08-30T22:18:23+00:00"}
{"artifacts": ["artifacts/raw/c500-runs/exp-20260831-264-fdeae9adf5ea-a01", "artifacts/raw/c500-runs/exp-20260831-264-fdeae9adf5ea-a02", "handoffs/exp-20260831-264.md"], "baseline_commit": "8341aa38e55659285673111df90e786c1fba08df", "benchmark": "NO ABBA: attempts a01 and a02 both faulted deterministically in the first prefill map-builder warmup after decode case1 with Xnack ATU Fault 0x8", "candidate_commit": "fdeae9adf5ea01131f18ce9e9156b9636c02d59f", "change": "Packed logical/canonical tile map plus sorted-only grid reinterpretation as physical M equals x plus y times eight and N equals z", "correctness": "Local focused/workflow 27/27 PASS; both C500 attempts passed dual build, 3/3 differential correctness and full regression before warmup", "decision": "revert", "device": "c500-local", "environment": "MetaX C500 xcore1000; MACA 3.7.1.5; 25 percent compute / 16000 MiB; paired formal baseline; runs a01/a02 failed/1", "hypothesis": "Sorted prefill M-inner coordinate mapping must improve case 2 by 5.967 percent and case 4 by 6.847 percent for the complete 85.50 path", "id": "exp-20260831-264", "language": "cuda", "notes": "Queue tip 372c4c48c1796564de5de329923433805c95166a; source blob 325c12eb167b5ceed3b14e318f32c17764378ff4; LF SHA-256 dd3afa9557b4e1d502bca29d8324a40ecd32c7098a3a39749e15797379d5c72a; independent audit found mapping correct but CTA scheduler adjacency is not guaranteed by CUDA; controller rejected; no OJ; formal source unchanged", "operator": "fused_moe_i8_tn", "result": "REJECTED: repeated illegal-address terminal failure prevents complete C500 gate and OJ eligibility", "schema_version": 1, "timestamp": "2026-08-30T22:52:13+00:00"}
