{"artifacts": ["artifacts/raw/xpuoj/132271", "handoffs/exp-20260830-239.md"], "baseline_commit": "8341aa38e55659285673111df90e786c1fba08df", "benchmark": "C500 NOT RUN. OJ 132271 Accepted 84.50 with cases 86/77/89/86 and exact user-kernel times 0.809/6.444/0.496/3.453 ms; case3 ratio was 89.99 percent and fell one display point; live rank 16.", "candidate_commit": "75fc2bf05c8a05cf6437b80c0d08343876930496", "change": "Only exact sorted case2 composes the histogram packed payload map, A load_k folding, odd-cluster N serpentine, and formal K128 ties-away conversion while preserving formal predicates, case4, decode m4, and ABI.", "correctness": "PASS: focused identity/mapping/address/BF16 tests 15/15, workflow tests 12/12, restricted inverse to formal source, template-identical remote job, browser source SHA verification, and OJ 4/4 Accepted. No C500 target build/regression/resource evidence exists because SSH transport was unavailable.", "decision": "revert", "device": "xpuoj-c500", "environment": "CUDA Maca XPU-OJ C500. Local MetaX C500 transport unavailable: BatchMode authentication returned Permission denied (password); no target build/resource/regression/performance claim is made for the exact composition.", "hypothesis": "Compose exact-case2 histogram packed map, A load_k folding, odd-cluster N serpentine, and formal K128 ties-away to cross the 78-point boundary while retaining formal predicates.", "id": "exp-20260830-239", "language": "CUDA Maca", "notes": "Producer 75fc2bf05c8a05cf6437b80c0d08343876930496; integrated 75a531a4a125bf24be16a220564834f05c8520d8; source blob d7862886cbd8dc1ca31c86d154bac59fe3f36d1c; LF SHA-256 8275fb7579a0e67119924a5198ae127d95e5429243417f5bee5d3bcc3df21f9f; OJ 132271 finalized; formal source restored exactly to blob 48704a2870975c3990f4681089b1a4efc35d99fa.", "operator": "Fused MoE i8 tn", "result": "REJECTED: OJ regressed 0.25 from formal best 84.75 because case3 fell from 90 to 89 while case2 remained 77.", "schema_version": 1, "timestamp": "2026-08-29T21:29:23+00:00"}
{"artifacts": ["artifacts/raw/xpuoj/132310", "handoffs/exp-20260830-240.md"], "baseline_commit": "8341aa38e55659285673111df90e786c1fba08df", "benchmark": "C500 NOT RUN. OJ 132310 Accepted 84.75 with cases 86/77/90/86 and exact user-kernel times 0.806/6.451/0.494/3.483 ms; case2 regressed from formal 6.425 ms; live rank 17.", "candidate_commit": "8c73437d1bbd551fba45e8102bdee1a7a3b61301", "change": "Invert only the sorted dispatch polarity so the exact case2 K128 specialization is referenced before case4 while preserving the kernel body, map, grids, template arguments, decode m4, generic fallback, ABI, and three launch instances.", "correctness": "PASS: focused source-order/dispatch-equivalence tests 4/4, workflow tests 12/12, restricted inverse to formal source, template-identical remote job, browser source SHA verification, and OJ 4/4 Accepted. No C500 target build/regression/resource evidence exists because SSH transport was unavailable.", "decision": "revert", "device": "xpuoj-c500", "environment": "CUDA Maca XPU-OJ C500. Local MetaX C500 transport unavailable: BatchMode authentication returned Permission denied (password); no target performance claim is made.", "hypothesis": "Place the exact case2 K128 specialization before case4 in native source order without changing dispatch semantics to cross the 78-point case2 boundary.", "id": "exp-20260830-240", "language": "CUDA Maca", "notes": "Tested 8c73437d1bbd551fba45e8102bdee1a7a3b61301; queue tip e4a13f863df66e32055d98da1da96d7b0655e529; integrated 2bfd72a2585f78ba5fd1b1d591765921850a6a13; source blob 7603f336a375bda936d36449e5c65ad95c54c9cd; LF SHA-256 5897c7ff4ee73b166a22138c5e91a09032fc49130ee03fd40ab645b24e3e0710; OJ 132310 finalized; formal source restored exactly.", "operator": "Fused MoE i8 tn", "result": "REJECTED TIE: native case2-first placement did not cross an OJ display tier and did not exceed formal best 84.75.", "schema_version": 1, "timestamp": "2026-08-29T22:12:06+00:00"}
{"artifacts": ["handoffs/exp-20260830-241.md"], "baseline_commit": "8341aa38e55659285673111df90e786c1fba08df", "benchmark": "C500 NOT RUN; rejected before controller enqueue and OJ because a stricter isolated successor preserved formal case4 placement.", "candidate_commit": "63d66e1db27ea376db4f128d480c6536789d70a8", "change": "Reframe only host dispatch so K128 references appear generic -> case4 -> case2 while preserving execution actions, map publication, kernel bodies, grids, template arguments, decode m4, ABI and exactly three instances.", "correctness": "PASS: focused 4/4, workflow 12/12, restricted inverse to formal LF SHA-256, git diff check and template-identical remote job.", "decision": "revert", "device": "none", "environment": "Local proof only. C500 transport unavailable; no controller candidate or browser action.", "hypothesis": "Move exact case2 K128 after both generic and case4 to test the inverse direction of exp-240's 26 us regression.", "id": "exp-20260830-241", "language": "CUDA Maca", "notes": "Tested 63d66e1db27ea376db4f128d480c6536789d70a8; rejection handoff 9e0116a9d5f2a6ceedca44bbe19ad47d4440ffa2; source blob 1db5cc70dd758e0ab17cb67fd1024f403997e217; LF SHA-256 45dcd7804ce3f34bdc6440d561c89b8455f3d8b5f8a67528251d29d2e5b1717f; no enqueue/integration/push/OJ.", "operator": "Fused MoE i8 tn", "result": "REJECTED BEFORE ENQUEUE: successor exp-242 isolates case2-last placement while preserving case4 formal placement.", "schema_version": 1, "timestamp": "2026-08-29T22:30:00+00:00"}
{"artifacts": ["artifacts/raw/xpuoj/132350", "handoffs/exp-20260830-242.md"], "baseline_commit": "8341aa38e55659285673111df90e786c1fba08df", "benchmark": "C500 NOT RUN. OJ 132350 Accepted 83.00 with cases 86/72/89/85 and exact user-kernel times 0.819/8.612/0.502/3.780 ms; live rank 17 and formal best remained 84.75.", "candidate_commit": "d70bbcb9200345738c41990dd5a1075111cadf38", "change": "Keep case4 K128 first and move exact sorted case2 K128 after the cold generic reference, preserving map-before-sorted publication, kernel bodies, grids, template arguments, decode m4, ABI and exactly three K128 instances.", "correctness": "PASS: focused 4/4, workflow 12/12, restricted inverse, git diff check, template-identical remote job, browser normalized source SHA verification and OJ 4/4 Accepted. No C500 target build/regression/resource evidence exists because SSH transport was unavailable.", "decision": "revert", "device": "xpuoj-c500", "environment": "CUDA Maca XPU-OJ C500. Local MetaX C500 transport unavailable: BatchMode authentication returned Permission denied (password); no target performance claim is made.", "hypothesis": "Place exact case2 K128 after generic while preserving case4 first to reverse exp-240's 26 us regression direction and cross case2 score 78.", "id": "exp-20260830-242", "language": "CUDA Maca", "notes": "Tested d70bbcb9200345738c41990dd5a1075111cadf38; queue tip 9152da89857990dfa3c7796c209528b4d83400a5; integrated d043aef46c89578f8288c856061a0e35be50c27e; source blob b3dd9233b237613a0be11888713abf700e892a02; LF SHA-256 13d40c40eb63783ce2dc391bbc7abdce7cb995723aa8013b8261cade6c8f2bdc; OJ 132350 finalized; formal source restored exactly.", "operator": "Fused MoE i8 tn", "result": "REJECTED: case2 regressed from 77 points / 6.425 ms to 72 points / 8.612 ms and cases3/4 each lost one point; local K128 placement family closed.", "schema_version": 1, "timestamp": "2026-08-29T22:59:57+00:00"}
{"artifacts": ["artifacts/raw/xpuoj/132378", "handoffs/exp-20260830-243.md"], "baseline_commit": "8341aa38e55659285673111df90e786c1fba08df", "benchmark": "C500 NOT RUN. OJ 132378 Accepted 84.75 with cases 86/77/90/86 and exact user-kernel times 0.804/6.445/0.490/3.484 ms; case2 was 20 us slower than formal, live rank 17, and formal best remained 84.75.", "candidate_commit": "4b6552fdf29c5514bb0af773b216dc1c306910e4", "change": "Invert only the outer decode/prefill boundary so the exact formal K128 block case4 -> case2 -> generic appears before the decode m4 call, preserving the full K128 block, map publication, kernel bodies, grids, template arguments, m4 body, ABI and execution actions.", "correctness": "PASS: focused source-order/dispatch-equivalence tests 5/5, workflow tests 12/12, restricted inverse to formal source, template-identical remote job, browser source SHA verification, and OJ 4/4 Accepted. No C500 target build/regression/resource evidence exists because SSH transport was unavailable.", "decision": "revert", "device": "xpuoj-c500", "environment": "CUDA Maca XPU-OJ C500. Local MetaX C500 transport unavailable: BatchMode authentication returned Permission denied (password); no target performance claim is made.", "hypothesis": "Move the whole exact formal K128 dispatch block before decode m4 without changing execution semantics to test whether the outer source boundary can cross a display tier.", "id": "exp-20260830-243", "language": "CUDA Maca", "notes": "Tested 4b6552fdf29c5514bb0af773b216dc1c306910e4; queue tip 8e07b52e54c02c992a5bf016f4a3a25401b4c36c; integrated 0da01f0845a0042d1337ed58b13a7a5265f24292; source blob 634232f592aa24103a803e0e5ad92908258002e2; LF SHA-256 de375681d6c5555f0f76f2080ad31ddffcbef857ddba3d3a909ab1aadff59e34; OJ 132378 finalized; formal source restored exactly.", "operator": "Fused MoE i8 tn", "result": "REJECTED TIE: whole K128-before-m4 placement did not cross an OJ display tier and did not exceed formal best 84.75; whole-boundary layout family closed.", "schema_version": 1, "timestamp": "2026-08-29T23:37:26+00:00"}
{"artifacts": ["artifacts/raw/xpuoj/132434", "handoffs/exp-20260830-244.md"], "baseline_commit": "27c93a4c04ab19de336ee6420b3af4f531133593", "benchmark": "C500 NOT RUN because BatchMode SSH required password. OJ 132434 Accepted 79.75 with cases 81/72/86/80 and displayed user-kernel times 1.121 ms / 9 ms / 0.672 ms / 5 ms; live rank and formal best remained 17 / 84.75.", "candidate_commit": "17c0f1b1595b559595982762d95f2b42b07ae5c6", "change": "Replaced the measured Triton routed/gather split with the exact public 3047133 submit_triton.py: one 128x128x128 INT8 kernel, num_warps 8, num_stages 2, 1D GROUP_M=1 grid, acc=tl.dot(a,b,acc=acc), A evict_last and B evict_first.", "correctness": "PASS: official Git blob identity; static contract 9/9; Python compileall; workflow controller tests 12/12; browser model SHA matched committed source; OJ 4/4 Accepted.", "decision": "revert", "device": "xpuoj-c500", "environment": "XPU-OJ Triton Maca C500, maca torch 2.8.0+metax 3.7.1.5; local C500 transport unavailable; leaderboard-first exception used.", "hypothesis": "Replay the exact public OJ-87.75 Triton cache-hint source; asymmetric A/B eviction policy plus BK128/ns2/1D native INT8 dot should exceed the 85.5 target.", "id": "exp-20260830-244", "language": "Triton", "notes": "Queue tip 4ffde185d0c0f2a12c3f7535dca7b9ad6000fed0; integrated ad8f4ebef1d41877efd7246d882a9a7485120d12; source blob 2310e294fa74f343b0130b8ae32ed7b62e49a984; LF SHA-256 f052b7adad4085df1ec07121de06da3f4103fca479e3b435efa6b41d3da8a46b; OJ 132434 finalized; Triton source restored to baseline blob 794f7ec343457a8cdab0fc05076b79c14e489dfb.", "operator": "Fused MoE i8 tn", "result": "REJECTED: public cache-hint Triton replay regressed 5.00 total points versus formal CUDA best and did not reach 85.5.", "schema_version": 1, "timestamp": "2026-08-30T00:37:04+00:00"}
{"artifacts": ["artifacts/raw/c500-runs/exp-20260830-245-ba791d3f6727-a01", "handoffs/exp-20260830-245.md"], "baseline_commit": "8341aa38e55659285673111df90e786c1fba08df", "benchmark": "C500 ABBA decode gate-up baseline/candidate 0.8385/0.8400 ms (+0.178891%, arms 0.840/0.840); decode down 0.5240/0.5255 ms (+0.286260%, arms 0.525/0.526). Prefill source-identical and noise-flat.", "candidate_commit": "ba791d3f6727637e68f46c4fc42e75933af49d86", "change": "Set only the prologue and steady decode-m4 B BSM is_async flags to true; preserve A, addresses, requests, issue order, arrival/barrier text, geometry, prefill, epilogue and ABI.", "correctness": "PASS: focused 4/4 and workflow 12/12; C500 both arms built, differential correctness 3/3 matched_ratio 1.0 max_abs 0, full regression, sampled/all-zero read-only, source/tree integrity and 31/31 manifest passed.", "decision": "revert", "device": "c500-local", "environment": "MetaX C500/xcore1000, MACA 3.7.1.5, 25% compute, 16000 MiB; trusted run exp-20260830-245-ba791d3f6727-a01 succeeded/0.", "hypothesis": "Only decode m4 B BSM becomes asynchronous while A remains synchronous, potentially overlapping B latency enough to cross a decode display tier without exp-218 A-queue instability.", "id": "exp-20260830-245", "language": "CUDA Maca", "notes": "Queue tip d1eb586acdf6e764b65be702c28392026edd5d86; source blob 3dc387dd37c4714f54b5ae1c6497c1c1a84707ad; LF SHA-256 a539f074ebf516db317dd995f745e5b9a4e1b027b4d1bc927a7efaa9bd0d6d87; controller rejected; formal source never changed.", "operator": "Fused MoE i8 tn", "result": "REJECTED: both decode targets regressed in both candidate arms and remain far from their next display thresholds; no OJ submission.", "schema_version": 1, "timestamp": "2026-08-30T03:11:43+00:00"}
{"artifacts": ["handoffs/exp-20260830-246.md"], "baseline_commit": "8341aa38e55659285673111df90e786c1fba08df", "benchmark": "NOT RUN: two independent score-bound audits rejected the mechanism before source implementation or C500.", "candidate_commit": "e9b81d9c9960347445884aa30f78058884742716", "change": "Proposed replacing eight decode-m4 dummy token b32 loads with scalar samples spanning the last 32-KiB B tile while preserving the request count and formal pipeline; no source edit was made.", "correctness": "NOT RUN: the exact public mapping is in bounds for public shapes, but the score upper bound was dispositive before implementation.", "decision": "revert", "device": "none", "environment": "Read-only public-source, traffic-share and OJ score-threshold analysis; no C500, controller or browser submission.", "hypothesis": "Repurpose mandatory dummy gvm requests as B prefetch to hide enough decode memory latency for leaderboard points.", "id": "exp-20260830-246", "language": "CUDA Maca", "notes": "Empty worktree/reservation refs are based at e9b81d9c9960347445884aa30f78058884742716; public blob ff45cf3ff3af00cf56e537e70b045020a142f34d; formal source blob 48704a2870975c3990f4681089b1a4efc35d99fa remained exact.", "operator": "Fused MoE i8 tn", "result": "REJECTED BEFORE IMPLEMENTATION: impossible traffic-share ceilings 1.79%/6.25% are below the case1/case3 next-point requirements 5.27%/10.55%, and the decode-only mechanism cannot supply three raw points.", "schema_version": 1, "timestamp": "2026-08-30T03:47:44+00:00"}
{"artifacts": ["artifacts/raw/c500-runs/exp-20260830-248-dd606401339d-a01", "handoffs/exp-20260830-248.md"], "baseline_commit": "8341aa38e55659285673111df90e786c1fba08df", "benchmark": "C500 ABBA case1 0.840->1.143 ms (+36.0714%, candidate arms 1.061/1.225); case3 0.525->0.579 ms (+10.2857%, arms 0.580/0.578); source-identical cases2/4 flat. Candidate resources 0 stack/229 MT/54 ST/32768 shared/staticMaxWarps 2 versus baseline 0/256/52/65536/2.", "candidate_commit": "dd606401339dfb228b0255ae8ce0819eaa10ee79", "change": "Only decode m4 uses a 128x128x128 single-buffer full-fragment-residency pipeline with eight BSM launches and one count-zero completion per K tile; prefill paths remain exact.", "correctness": "PASS: local focused/workflow 18/18; detached mapping/lifecycle audit APPROVE; C500 dual build, differential correctness 3/3 matched_ratio 1.0 max_abs 0, full regression, sampled/read-only and integrity/31-entry manifest passed.", "decision": "revert", "device": "c500-local", "environment": "MetaX C500/xcore1000, MACA 3.7.1.5, 25% compute, 16000 MiB; trusted run exp-20260830-248-dd606401339d-a01 succeeded/0.", "hypothesis": "Halving decode m4 K256 to K128 while fully consuming each shared image into registers before same-bank overwrite may reduce resource pressure enough to increase residency and cross a decode score tier.", "id": "exp-20260830-248", "language": "CUDA Maca", "notes": "Queue tip 2c4eacf21d913b2dffe4f02e9133cf14cfb8eea6; source blob 43796844e2ec075241f9f350161cb33c8982a2a8; LF SHA-256 ca4299bd6b9bc8091e4495398c344c8619e2c659c6765a525354271532369e68; controller rejected; formal source never changed; close K128 full-fragment residency.", "operator": "Fused MoE i8 tn", "result": "REJECTED: both score-bearing decode paths regressed decisively and staticMaxWarps remained 2, falsifying the intended second-residency mechanism; no repeat, integration or OJ.", "schema_version": 1, "timestamp": "2026-08-30T06:52:20+00:00"}
{"artifacts": ["artifacts/raw/c500-runs/exp-20260830-247-a8f733a3edaf-a01", "handoffs/exp-20260830-247.md"], "baseline_commit": "8341aa38e55659285673111df90e786c1fba08df", "benchmark": "C500 ABBA case1 0.843->0.846 ms (+0.355872%, candidate arms 0.846/0.846); case3 0.528->0.532 ms (+0.757576%, arms 0.531/0.533); source-identical cases2/4 noise-flat. Resources changed 0 stack/256 MT/52 ST/65536 shared to 0/256/50/65536.", "candidate_commit": "a8f733a3edaf1b897ff5fa3d40b43970a59c4f36", "change": "Only the decode m4 epilogue consumes accumulators directly and forms affine rows on demand; matrix pipeline, synchronization, dispatch and prefill remain exact.", "correctness": "PASS: focused 4/4 and workflow 12/12; C500 dual build, differential correctness 3/3 matched_ratio 1.0 max_abs 0, full regression, sampled/read-only and integrity/31-entry manifest passed.", "decision": "revert", "device": "c500-local", "environment": "MetaX C500/xcore1000, MACA 3.7.1.5, 25% compute, 16000 MiB; trusted run exp-20260830-247-a8f733a3edaf-a01 succeeded/0.", "hypothesis": "Removing decode m4 packed-output and row-index duplicate lifetimes may lower the 256-MT allocation and cross a decode score tier.", "id": "exp-20260830-247", "language": "CUDA Maca", "notes": "Candidate source blob 4366e541ead903d3ee6d76e4022f3dec300e3fc9; LF SHA-256 bacd9408db5800e5aeaae187d6348b2996218e3c7483a30d092253e17f510c0d; controller rejected; formal source never changed; close m4 direct-accumulator epilogue family.", "operator": "Fused MoE i8 tn", "result": "REJECTED: limiting 256 MT allocation was unchanged and both decode targets regressed in both arms; no repeat, integration or OJ.", "schema_version": 1, "timestamp": "2026-08-30T07:03:23+00:00"}
{"artifacts": ["artifacts/raw/c500-runs/exp-20260830-249-f1d337c67a8b-a01", "handoffs/exp-20260830-249.md"], "baseline_commit": "8341aa38e55659285673111df90e786c1fba08df", "benchmark": "C500 ABBA cases1/2/3/4: 0.8380->0.8330 ms (-0.596659 percent), 5.9845->5.9860 ms (+0.025065 percent), 0.5255->0.5205 ms (-0.951475 percent), 3.3290->3.3305 ms (+0.045059 percent); decode candidate arms were favorable", "candidate_commit": "f1d337c67a8b55193bf49e85f81e8e83bb7a843d", "change": "Retask decode-m4 A offsets as uint32 and replace CUTE B coordinate formation with one 64-bit expert/tile base plus eight uint32 row/K offsets; preserve traffic, issue order, synchronization, mapping, epilogue and ABI", "correctness": "PASS: focused 4/4 with 5,111,808 exhaustive A/B starts; detached exact-commit audit; C500 dual build, 3/3 differential correctness, full regression, sampled/read-only checks, source/tree integrity and 31/31 manifest", "decision": "revert", "device": "c500-local", "environment": "MetaX C500/xcore1000 device0; MACA 3.7.1.5; MXCC 1.0.0 d9102a1572; 25 percent compute / 16000 MiB", "hypothesis": "Bounded uint32 A/B local byte offsets remove repeated high-half address work in decode m4 and cross a leaderboard tier without decode regressions", "id": "exp-20260830-249", "language": "CUDA Maca", "notes": "Tested f1d337c67a8b55193bf49e85f81e8e83bb7a843d; queue tip 24736d7066786dfbb644aa25a302f4df74da267e; source blob aa13e868ff24eb4b0f5694ba0c628ca150795c2b; LF SHA-256 0a1fea73bf443832a5a1ce44d6ed48302b6495f5f8e450969064a1eb5d977af7; no OJ submission", "operator": "fused_moe_i8_tn", "result": "REJECTED: lowering changed m4 resources from 256 MT/52 ST to 254 MT/54 ST and improved both decode cases, but gains are far below the next OJ tiers and cannot contribute three raw points alone", "schema_version": 1, "timestamp": "2026-08-30T09:31:26+00:00"}
{"artifacts": ["handoffs/exp-20260830-250.md"], "baseline_commit": "8341aa38e55659285673111df90e786c1fba08df", "benchmark": "NOT RUN: direct staging model increases A+B bytes from 32 KiB to 48 KiB per K step, while 48 KiB does not establish higher residency and historical 128x64 regressed case 2 about 23 percent.", "candidate_commit": "29a26c1a468f8bf2394c0e176b97c5797ac16bf7", "change": "No source change; feasibility modeled matrix staging, shared-memory occupancy, synchronization, and historical N64 evidence.", "correctness": "NOT RUN: source remains exact formal best; feasibility failed before implementation.", "decision": "revert", "device": "cpu", "environment": "Local source/traffic/occupancy analysis only; no C500, controller candidate, browser, or OJ action.", "hypothesis": "A case-2-only 128x64 phased CTA computes two adjacent N64 halves serially and saves enough CTA lifecycle cost to improve case 2 by at least 2.72 percent.", "id": "exp-20260830-250", "language": "CUDA Maca", "notes": "Workflow reservation 72721b4657ed62e342e1855649dbc5ca48c69665; baseline 8341aa38e55659285673111df90e786c1fba08df; source blob remained 48704a2870975c3990f4681089b1a4efc35d99fa; preserve reservation/worktree provenance and do not reuse ID.", "operator": "fused_moe_i8_tn", "result": "REJECTED BEFORE IMPLEMENTATION: no quantified path to the required 2.72 percent case-2 gain; direct form adds 50 percent staged matrix traffic.", "schema_version": 1, "timestamp": "2026-08-30T10:14:58+00:00"}
