{"artifacts": ["artifacts/raw/c500-runs/exp-20260826-106-56c59d79c493-a01"], "baseline_commit": "2230963fdd9d6394b3b63864500ffab00818b4f0", "benchmark": "C500-local ABBA medians baseline->candidate: case1 1.0880->1.0725 ms (-1.4246 percent, high candidate drift 3.7037 percent); case2 6.1640->6.1595 (-0.0730 percent); case3 0.5610->0.5575 (-0.6239 percent, arms -0.7130/-0.5348 percent); case4 3.4620->3.4545 (-0.2166 percent, arms -0.2599/-0.1734 percent).", "candidate_commit": "56c59d79c493671bd092559a648216f93ba9372c", "change": "Collapsed only a_frag[2][8] to a_frag[8], retaining logical row only in the unchanged shared-memory address and preserving every A-LDS/MMA call site and order, traffic, barriers, geometry, mapping, epilogue and ABI.", "correctness": "PASS: MXCC candidate/baseline builds, 3/3 differential correctness, full regression, sampled correctness, source/tree integrity, no-process gates and all 31 manifest entries.", "decision": "revert", "device": "c500-local", "environment": "MetaX C500 device 0; xcore1000; MACA 3.7.1.5; MXCC 1.0.0 d9102a1572; driver 3.8.30; 25 percent compute / 16000 MiB slice; run exp-20260826-106-56c59d79c493-a01; c500-local.", "hypothesis": "Reusing one physical 8-int32 A-fragment row after each logical row final MMA use lowers the runtime MMA stack below 36 bytes or MT below 254 and improves at least one down-case aggregate by at least 1.0 percent with both target arms at least 0.75 percent.", "id": "exp-20260826-106", "language": "CUDA Maca", "notes": "Tested 56c59d79c493671bd092559a648216f93ba9372c; metadata f4f17bd06367ce7fd312c146356462df2f523164; workflow 41e6e11b1c4d6392f45ef9224ba1629e451e5ee6; source blob af962110043c0aec54e9ca615bf127b7b956a01d; LF SHA-256 a0b0ce54d369115708fb1c295874ec994d4f2a02a841e9f1fb33628c21c91892; job blob 7f91ad9b45b58a3fa128a95aeb839c7630bc5662; manifest-file SHA-256 6f71e0ac9d8a5596bf41c47018aae731a864b565276c09bdfbaa754960cac571; no NVIDIA/OJ; close A-fragment physical-slot-reuse family.", "operator": "Fused MoE i8 tn", "result": "REJECTED after one attempt: both MMA kernels retained exact baseline resources of 36-byte stack, 254 MT, 40 ST, 32768-byte shared and staticMaxWarps/PEU 2, and neither target aggregate nor either target arm met the precommitted gain gate; no repeat, integration or OJ.", "schema_version": 1, "timestamp": "2026-08-25T17:30:10+00:00"}
{"artifacts": ["artifacts/raw/c500-runs/exp-20260826-107-2e0f3a71d0c5-a01", "artifacts/raw/c500-runs/exp-20260826-107-2e0f3a71d0c5-a02"], "baseline_commit": "2230963fdd9d6394b3b63864500ffab00818b4f0", "benchmark": "C500-local attempts 1/2: case3 improved 2.6150/2.6810 percent with every arm passing; case4 improved 3.9046/3.9434 percent with every arm passing; case2 was neutral. Attempt1 case1 regressed 2.8216 percent amid about 5 percent two-sided drift; the permitted exact repeat improved case1 5.7222 percent with 0.0979 percent candidate drift and all protected gates passing.", "candidate_commit": "2e0f3a71d0c55a0899eed7a368ca3705d06a7346", "change": "Reproduced the proven exact case3/case4 dimension carriers but exchanged only the two unsorted branch references, preserving sorted dispatch/map prerequisites and every kernel-body, memory, MMA, barrier, geometry, epilogue and ABI operation.", "correctness": "PASS twice: MXCC candidate/baseline builds, 3/3 differential correctness, full regression, sampled correctness, source/tree integrity, no-process gates and both 31-entry manifests.", "decision": "keep", "device": "c500-local", "environment": "MetaX C500 device 0; xcore1000; MACA 3.7.1.5; MXCC 1.0.0 d9102a1572; driver 3.8.30; 25 percent compute / 16000 MiB slice; runs exp-20260826-107-2e0f3a71d0c5-a01/a02; c500-local.", "hypothesis": "Ordering exact case3/case4 specializations as runtime sorted, fixed sorted, runtime unsorted, fixed unsorted moves the byte-identical protected case1 kernel from the regressed 0xe800 placement to about 0xbf00 while retaining at least 2 percent case3 and 3 percent case4 gains.", "id": "exp-20260826-107", "language": "CUDA Maca", "notes": "Tested 2e0f3a71d0c55a0899eed7a368ca3705d06a7346; queue tip 1cc9d01410cdc2bf3da9d510f1a8b759b3be87f7; workflow 97fa256a808fffe6ff71e73853a70cbd98232d49; source blob 508945021d988a0ecfa0b428012902b2003aff08; LF SHA-256 d0de8b33b509e3ca76092a6d326e9fd7a29228f6a54b0c7671f288e4025cb554; job blob 7f91ad9b45b58a3fa128a95aeb839c7630bc5662; manifest-file SHA-256 11172ea2068a688802db3b30971a2bd3782f187b78aa8d8a40676eac49ca7756 and 732dc19f4d67e0658b57bc798aa2f0c02fc4220021b8d03b82364b93e90276f2; no NVIDIA; no independent audit required.", "operator": "Fused MoE i8 tn", "result": "PASSED after one precommitted drift repeat: target gains and codegen/resource gates passed twice, and attempt2 resolved the only protected miss. Native order is 0x6700/0x9600/0xbf00/0xee00; generic unsorted is byte-identical to formal best.", "schema_version": 1, "timestamp": "2026-08-25T17:59:03+00:00"}
{"artifacts": ["handoffs/exp-20260826-108.md"], "baseline_commit": "2230963fdd9d6394b3b63864500ffab00818b4f0", "benchmark": "Not run because the numerical contract stop gate failed before implementation.", "candidate_commit": "3de6a03acb30b79a9d7643576b87cd5f65d8cf05", "change": "Feasibility analysis only; submission source remained exact formal best.", "correctness": "STOP: finite float32 0x7f7f8000 and 0xff7f8000 round to BF16 infinities under RNE but truncate to maximum finite BF16, which is not close under the live contract.", "decision": "revert", "device": "cpu", "environment": "Local exhaustive bit-pattern boundary analysis; no C500, NVIDIA, or OJ run.", "hypothesis": "Directly truncating float32 to the retained BF16 high word removes RNE integer work while every finite conversion remains within the live tolerance.", "id": "exp-20260826-108", "language": "CUDA Maca", "notes": "Worktree restored clean at workflow base b5b3462a05a12c88cfbf9f06bfdaff2b858a2c25; reservation retained; no candidate/job/enqueue.", "operator": "Fused MoE i8 tn", "result": "REJECTED before implementation; direct BF16 truncation is not contract-safe under the assigned every-finite-conversion gate.", "schema_version": 1, "timestamp": "2026-08-25T18:46:29+00:00"}
{"artifacts": ["handoffs/exp-20260826-109.md"], "baseline_commit": "2230963fdd9d6394b3b63864500ffab00818b4f0", "benchmark": "Not run; exp-075 already measured only 0.1502 percent case-2 improvement with about 0.14-0.16 percent per arm.", "candidate_commit": "3de6a03acb30b79a9d7643576b87cd5f65d8cf05", "change": "Historical-dedup analysis only; submission source remained exact formal best.", "correctness": "No executable candidate; the assigned mechanism exactly duplicates exp-20260824-075.", "decision": "revert", "device": "cpu", "environment": "Local repository and experiment-ledger analysis; no C500, NVIDIA, or OJ run.", "hypothesis": "A shared histogram, exclusive prefix, and atomic allocation map builder materially reduces case-2 full-map construction cost.", "id": "exp-20260826-109", "language": "CUDA Maca", "notes": "Worktree clean at workflow base; reservation retained; no candidate/job/enqueue.", "operator": "Fused MoE i8 tn", "result": "REJECTED before implementation as an exact replay of a closed sub-one-percent family.", "schema_version": 1, "timestamp": "2026-08-25T18:46:29+00:00"}
{"artifacts": ["handoffs/exp-20260826-110.md"], "baseline_commit": "2230963fdd9d6394b3b63864500ffab00818b4f0", "benchmark": "Not run because the dependency stop gate failed before implementation.", "candidate_commit": "3de6a03acb30b79a9d7643576b87cd5f65d8cf05", "change": "Dependency feasibility analysis only; submission source remained exact formal best.", "correctness": "STOP: committed regression tests directly reference the proposed deletion targets, so deletion would break the required test contract.", "decision": "revert", "device": "cpu", "environment": "Local source/reference analysis; no C500, NVIDIA, or OJ run.", "hypothesis": "Removing legacy output-scratch helper and kernel definitions changes target layout without affecting the tested surface.", "id": "exp-20260826-110", "language": "CUDA Maca", "notes": "Worktree clean at workflow base; reservation retained; no candidate/job/enqueue; any revised layout requires a new experiment ID.", "operator": "Fused MoE i8 tn", "result": "REJECTED before implementation; widening into test refactoring would violate the lane's single-variable boundary.", "schema_version": 1, "timestamp": "2026-08-25T18:46:29+00:00"}
{"artifacts": ["artifacts/raw/c500-runs/exp-20260826-111-a74138ab4137-a01"], "baseline_commit": "2230963fdd9d6394b3b63864500ffab00818b4f0", "benchmark": "C500-local ABBA baseline->candidate: case1 1.0820->1.0725 ms (-0.8780 percent); case2 6.1630->6.1625 (-0.0081 percent); case3 0.5615->0.5600 (-0.2671 percent); case4 3.4610->3.4570 (-0.1156 percent). No case reached 1 percent in both arms.", "candidate_commit": "a74138ab4137a4c31024d0e94d49d7e9ef864ae0", "change": "Moved only the 31-line legacy output-scratch helper and kernel definition pair after the hot MMA kernels; all definitions, launches, addresses, traffic, synchronization, mapping and ABI remained unchanged.", "correctness": "PASS: candidate/baseline MXCC builds, 3/3 differential correctness, full regression, sampled correctness, source/tree integrity, no-process gates and all 31 manifest entries; hot MMA resources remained 36-byte stack, 254 MT, 40 ST, 32768 shared and 2 static warps/PEU.", "decision": "revert", "device": "c500-local", "environment": "MetaX C500 device 0; xcore1000; MACA 3.7.1.5; MXCC 1.0.0 d9102a1572; driver 3.8.30; 25 percent compute / 16000 MiB slice; run exp-20260826-111-a74138ab4137-a01; c500-local.", "hypothesis": "Relocating the unchanged legacy builder after the hot kernels improves at least one C500 case by 1 percent in both ABBA arms without changing runtime behavior or resources.", "id": "exp-20260826-111", "language": "CUDA Maca", "notes": "Tested a74138ab4137a4c31024d0e94d49d7e9ef864ae0; queue commit 699f60b84fa0920d0db24f9c7057001d2a854618; final handoff tip 29b0ebf86f710045cb8b41bf77d7972eea62ceaf; workflow 3bfc266540d8e59c895daebb51511283891138b2; source blob aaa42841a013d51f60d001dc207249a47071fefe; LF SHA-256 6368b2f54d54a77deefd762814df108ee0ac85be4691d0bb6237e6aeaede10a3; job blob 7f91ad9b45b58a3fa128a95aeb839c7630bc5662; paired SHA-256 16cae56075592c710ae4de8a2a066a25733443a8dbbb1a71b10c0cee16f1ba73; manifest-file SHA-256 a1bbfb5aa8c48d5c8c9d2f15f1c3a779165441877680e017d0fc7cbe4f426147; no NVIDIA/OJ; close legacy-builder relocation family.", "operator": "Fused MoE i8 tn", "result": "REJECTED after one attempt: every improvement was below the precommitted 1 percent gate; no repeat, integration or OJ.", "schema_version": 1, "timestamp": "2026-08-25T19:14:15+00:00"}
{"artifacts": ["artifacts/raw/c500-runs/exp-20260826-112-1bf91e44a404-a01"], "baseline_commit": "2230963fdd9d6394b3b63864500ffab00818b4f0", "benchmark": "C500-local ABBA baseline->candidate: case1 1.0245->1.0725 ms (+4.6852 percent); case2 6.1645->6.3060 (+2.2954 percent); case3 0.5600->0.5710 (+1.9643 percent); case4 3.4590->3.5330 (+2.1393 percent). Both case-2 arms and every aggregate regressed.", "candidate_commit": "1bf91e44a404691b778222985567dd7e11bf78e6", "change": "Changed only seven initial-preload and steady-loop address anchors so K tiles execute in order 0 through T-1 instead of T-1 then 0 through T-2; operation counts, synchronization, mapping, geometry, epilogue and ABI remained unchanged.", "correctness": "PASS: independent lifecycle audit approved; local focused 6/6 and workflow tests passed; candidate/baseline MXCC builds, 3/3 differential correctness, full regression, sampled correctness, source/tree integrity, no-process gates and all 31 manifest entries passed. Candidate MMA resources increased from 254 to 256 MT and failed the resource gate.", "decision": "revert", "device": "c500-local", "environment": "MetaX C500 device 0; xcore1000; MACA 3.7.1.5; MXCC 1.0.0 d9102a1572; driver 3.8.30; 25 percent compute / 16000 MiB slice; run exp-20260826-112-1bf91e44a404-a01; c500-local.", "hypothesis": "Rotating K-tile traversal from tail-first to monotone order removes one address wrap and improves both case-2 C500 arms by at least 1 percent while preserving resources and protected cases.", "id": "exp-20260826-112", "language": "CUDA Maca", "notes": "Tested 1bf91e44a404691b778222985567dd7e11bf78e6; metadata/queue tip 85527f7ccaa84b35d8070705204d920c45c99453; workflow 3bfc266540d8e59c895daebb51511283891138b2; source blob 28b254fef10bec00682f6f566903699e994b200f; LF SHA-256 785f6c04f45b1dfe1c6e6e39c09e53fadb85c110f1e76d7f19a4e686831b0491; job blob 7f91ad9b45b58a3fa128a95aeb839c7630bc5662; paired SHA-256 dbebaa18938d840ea36966b48b4f09c500cd82660fedb1e8d1143c072ac7c746; manifest-file SHA-256 891496e289b4fcf2a333c079979e147ece8021059e9bfc4eec208d54de984925; independent audit approve; no NVIDIA/OJ; close monotone K traversal family.", "operator": "Fused MoE i8 tn", "result": "REJECTED after one attempt: both MMA kernels exceeded the 254-MT gate at 256 MT, target case2 regressed 2.2954 percent and all protected aggregates exceeded 0.5 percent regression; no repeat, integration or OJ.", "schema_version": 1, "timestamp": "2026-08-25T19:14:15+00:00"}
{"artifacts": ["artifacts/raw/c500-runs/exp-20260826-113-53ed8e17b352-a01", "handoffs/exp-20260826-113.md"], "baseline_commit": "2230963fdd9d6394b3b63864500ffab00818b4f0", "benchmark": "Not run because candidate MXCC compilation failed before baseline build, correctness, warmup, or ABBA.", "candidate_commit": "53ed8e17b352656ce03765bd8adb608a04510c82", "change": "Replaced four pairs of manual scalar BF16 RNE pack operations with the native packed conversion, using a reinterpret-cast write directly through each MmaStore64 vector element.", "correctness": "NOT RUN: trusted C500 candidate compilation failed at all four pack sites with address of vector element requested; local 7/7 pack and mapping models passed but cannot substitute for target correctness.", "decision": "revert", "device": "c500-local", "environment": "MetaX C500 device 0; xcore1000; MACA 3.7.1.5; MXCC 1.0.0 d9102a1572; driver 3.8.30; 25 percent compute / 16000 MiB slice; run exp-20260826-113-53ed8e17b352-a01; c500-local.", "hypothesis": "The documented xcore1000 packed FP32-to-BF16 intrinsic reduces epilogue integer work enough to improve at least one case by 1 percent in both C500 ABBA arms while preserving exact conversion and resources.", "id": "exp-20260826-113", "language": "CUDA Maca", "notes": "Tested 53ed8e17b352656ce03765bd8adb608a04510c82; metadata/queue tip eb162185312da3ef4809e6c43710b671f66ade20; workflow 1cd60df0680ecee574687ec7f757830d3ce0adbc; source blob e3cf400e686e0ab8b3f2d4238b5fcc141fa1803a; LF SHA-256 363c27e3021af88efa5964b24bb3a9cc9e97daac880a1719998f6a1558e6647f; manifest-file SHA-256 08f59a61ba1828c9aeee637550fc4e0c9a537763b2928aad9d85024d84264778; no NVIDIA/OJ.", "operator": "Fused MoE i8 tn", "result": "REJECTED after one C500 attempt: exact candidate is invalid MXCC source; corrected addressable storage requires new experiment exp-20260826-116.", "schema_version": 1, "timestamp": "2026-08-25T20:07:05+00:00"}
{"artifacts": ["artifacts/raw/c500-runs/exp-20260826-114-bd9b5c2a675b-a01", "handoffs/exp-20260826-114.md"], "baseline_commit": "2230963fdd9d6394b3b63864500ffab00818b4f0", "benchmark": "C500-local ABBA baseline->candidate: case1 1.0920->1.0730 ms (-1.7399 percent, but only one arm improved); target case2 6.1630->6.1345 (-0.4624 percent; arms -0.4544/-0.4705); case3 0.5585->0.5575 (-0.1791); case4 3.4600->3.4605 (+0.01445).", "candidate_commit": "bd9b5c2a675b35259b10b326819ea6a9ec623057", "change": "Added a case2-only compile-time N-serpentine specialization that reverses logical tile N for odd sorted cluster ranks; mapping, grids, work, memory bytes, synchronization, epilogue, and ABI remained unchanged.", "correctness": "PASS: independent mapping audit, focused 6/6, candidate/baseline builds, 3/3 differential correctness, full regression, sampled correctness, source/tree integrity, and manifest. Target kernel increased from 254 to 256 MT and failed the resource gate.", "decision": "revert", "device": "c500-local", "environment": "MetaX C500 device 0; xcore1000; MACA 3.7.1.5; MXCC 1.0.0 d9102a1572; driver 3.8.30; 25 percent compute / 16000 MiB slice; run exp-20260826-114-bd9b5c2a675b-a01; c500-local.", "hypothesis": "Alternating case2 N traversal across expert-pure sorted clusters reuses boundary B tiles and improves both target C500 arms by at least 1 percent without changing protected cases or resources.", "id": "exp-20260826-114", "language": "CUDA Maca", "notes": "Tested bd9b5c2a675b35259b10b326819ea6a9ec623057; metadata/queue tip 4001eb1450fcb6ce0afefee5c30e74acabf7d162; workflow 1cd60df0680ecee574687ec7f757830d3ce0adbc; source blob bb011b56858f7b0ebd952b253105cbd4a523d497; LF SHA-256 6d299c50bdbbe70a9259bc156cfa62dfa52199b12b8c46db9e505542d63314aa; paired SHA-256 d859232e3774817349c610b4d330bed6de92546a590e3f4aff64fe04365726d7; manifest-file SHA-256 ca4f46f3860100408d51402a4ff72bc1a0bba3ba844b5561a56065a8e37897b4; independent audit approve; no NVIDIA/OJ.", "operator": "Fused MoE i8 tn", "result": "REJECTED after one attempt: target case2 improved only 0.4624 percent and its kernel exceeded the 254-MT ceiling at 256 MT; no repeat, integration, or OJ.", "schema_version": 1, "timestamp": "2026-08-25T20:07:05+00:00"}
{"artifacts": ["handoffs/exp-20260826-115.md"], "baseline_commit": "2230963fdd9d6394b3b63864500ffab00818b4f0", "benchmark": "Not run because the structural-opportunity gate failed before implementation; no executable candidate or remote job was produced.", "candidate_commit": "4b2b7793c84145e9806de4582ca31ac326f635ab", "change": "Feasibility analysis only; submission source remained exact formal best. Exhaustively modeled owner mapping, payload transfer, alignment, output coverage, cache lines, and wave issue counts.", "correctness": "STOP: exact coverage and payload reconstruction pass, but the mechanism preserves 256 aligned 128-byte cache lines and all 64 wave store issue positions while irreducibly adding 128 wave shuffle issues per CTA; formal baseline already uses 254 MT.", "decision": "revert", "device": "cpu", "environment": "Local exhaustive integer/address/payload/cost model; no C500, NVIDIA, or OJ run.", "hypothesis": "Adjacent odd-lane b64 payload gather plus predicated b128 stores halves output store operations and yields at least 1 percent without changing output coverage or transactions.", "id": "exp-20260826-115", "language": "CUDA Maca", "notes": "Handoff commit 4b2b7793c84145e9806de4582ca31ac326f635ab; workflow 1cd60df0680ecee574687ec7f757830d3ce0adbc; unchanged source blob e62b793a11b8fdd1b4f7bf58f4bac689aaf5128a and LF SHA-256 762b7581919a9cb75cde0e4732c8ac580ad236f86620f2d3f34c565d7c5a3204; reservation retained; no candidate/job/enqueue.", "operator": "Fused MoE i8 tn", "result": "REJECTED before implementation: halving active-lane b64 stores does not reduce wave store issues or memory transactions and strictly adds 8192 lane shuffle invocations per CTA.", "schema_version": 1, "timestamp": "2026-08-25T20:07:05+00:00"}
{"artifacts": ["artifacts/raw/c500-runs/exp-20260826-116-217de6a1ac59-a01", "handoffs/exp-20260826-116.md"], "baseline_commit": "2230963fdd9d6394b3b63864500ffab00818b4f0", "benchmark": "C500-local ABBA baseline->candidate: case1 1.0585->1.0740 ms (+1.4643 percent, conflicting arms and -5.7798 percent baseline drift); case2 6.1685->6.1680 (-0.0081); case3 0.5635->0.5630 (-0.0887); case4 3.4635->3.4610 (-0.0722). No case improved 1 percent in both arms.", "candidate_commit": "217de6a1ac5942e1c6ff43afbce1d7add029fcf0", "change": "Replaced four manual scalar BF16 RNE pair packs with direct packed-conversion intrinsic assignments into an aligned two-element native-vector array; store addresses, values, order, width, mapping, pipeline, and ABI remained unchanged.", "correctness": "PASS: target builds, 3/3 differential correctness, full regression, sampled correctness, source/tree integrity, and 31-entry manifest. Both MMA kernels remained 36 stack / 254 MT / 40 ST / 32768 shared / 2 warps.", "decision": "revert", "device": "c500-local", "environment": "MetaX C500 device 0; xcore1000; MACA 3.7.1.5; MXCC 1.0.0 d9102a1572; driver 3.8.30; 25 percent compute / 16000 MiB slice; run exp-20260826-116-217de6a1ac59-a01; c500-local.", "hypothesis": "The documented xcore1000 packed FP32-to-BF16 intrinsic through addressable aligned array storage lowers epilogue work enough to improve at least one case by 1 percent in both C500 arms without increasing resources.", "id": "exp-20260826-116", "language": "CUDA Maca", "notes": "Tested 217de6a1ac5942e1c6ff43afbce1d7add029fcf0; queue tip 970d943d1216d19662b77b459123cbd4bc8ef5d3; post-queue handoff hash correction 66f859f8466c85d99bf1a00e0af546186591cf09; workflow 1cd60df0680ecee574687ec7f757830d3ce0adbc; source blob b133e556d9bc9f3d2fcf74851e912560b61c4d20; committed LF SHA-256 2af244ea09eb1f78e0980bbf8e56eb8dd853a3386c5d3c8fd28a9668f54a3b37; raw CRLF worktree SHA-256 0847d69f966b06f5e38d4989e7d59322ab50a415a2f8bf534d43e3b0d87750d5; paired SHA-256 658f7cedb1658a91fb7eaedad652fa97e604a2f8a57278f9517f1c33efbe971b; manifest-file SHA-256 965778e6b07317f430ab36a37906f850ded53f60fbf3abb617eea07f310759e7; no NVIDIA/OJ.", "operator": "Fused MoE i8 tn", "result": "REJECTED after one attempt: compile-safe intrinsic spelling changed no reported resource and stable cases 2-4 were flat below 0.1 percent; no repeat, integration, or OJ.", "schema_version": 1, "timestamp": "2026-08-25T20:31:39+00:00"}
