{"artifacts": ["artifacts/raw/c500-runs/exp-20260826-117-527a65707895-a01", "handoffs/exp-20260826-117.md"], "baseline_commit": "2230963fdd9d6394b3b63864500ffab00818b4f0", "benchmark": "C500-local ABBA baseline->candidate: case1 1.0455->1.0580 ms (+1.1956 percent, high drift); case2 6.1625->6.1645 (+0.03245); target case3 0.5570->0.5675 (+1.8851, arms +1.9749/+1.7953); target case4 3.4590->3.4970 (+1.0986, arms +1.1567/+1.0405).", "candidate_commit": "527a65707895ae7a782c2aaf217b70935178c1c4", "change": "Added exact case3/case4 peeled-tail specializations that write row-group 0 before the unchanged final row-group-1 MMA block, then write row-group 1; protected cases use the baseline epilogue branch.", "correctness": "PASS: independent lifecycle/mapping audit, focused 8/8, target builds, 3/3 differential correctness, full regression, sampled correctness, integrity, and 31-entry manifest. Targets remained 36 stack / 254 MT / 32768 shared / 2 warps, with ST only 40->38.", "decision": "revert", "device": "c500-local", "environment": "MetaX C500 device 0; xcore1000; MACA 3.7.1.5; MXCC 1.0.0 d9102a1572; driver 3.8.30; 25 percent compute / 16000 MiB slice; run exp-20260826-117-527a65707895-a01; c500-local.", "hypothesis": "Consuming row-group 0 immediately before the final row-group-1 MMA tail creates a real accumulator last-use boundary that reduces stack, MT, or spills and improves both K=2048 targets by 1 percent per arm.", "id": "exp-20260826-117", "language": "CUDA Maca", "notes": "Tested 527a65707895ae7a782c2aaf217b70935178c1c4; queue tip cf80a4baa16e5fd6f574da6b924a27c89d784144; workflow 1cd60df0680ecee574687ec7f757830d3ce0adbc; source blob b50a2803ca4234f84c6694255b1649e38dd85c2f; LF SHA-256 7f0239a7d4513bc0066a2fd121eead440196a77f960dce533e8d624d62dd4cf8; paired SHA-256 d0b24478ca4b4a2b0e590e40d1c6d6508f79a2e190462c2e7b294961768d350c; manifest-file SHA-256 800cdf7d40a107bcd38c49408bc0108598aab7bd7720af45d84bb0c4aaff8188; independent audit approve with residual retained scale/output-state risk; no NVIDIA/OJ.", "operator": "Fused MoE i8 tn", "result": "REJECTED after one attempt: controlling stack/MT classes did not improve and both target cases regressed over 1 percent in both arms; no repeat, integration, or OJ.", "schema_version": 1, "timestamp": "2026-08-25T20:41:14+00:00"}
{"artifacts": ["artifacts/raw/c500-runs/exp-20260826-118-ae7ef3a71b2d-a01", "handoffs/exp-20260826-118.md"], "baseline_commit": "2230963fdd9d6394b3b63864500ffab00818b4f0", "benchmark": "C500-local ABBA baseline->candidate: case1 1.0775->1.0530 ms (-2.2738 percent, only one arm >=1 and high drift); case2 6.1665->6.1655 (-0.0162); target case3 0.5625->0.5650 (+0.4444); target case4 3.4605->3.4605 (0.0).", "candidate_commit": "ae7ef3a71b2db806bbdc473be2341caf2a945b44", "change": "Replaced each epilogue row's first absolute output offset with builtin 32x32-to-64 MAD and reused the pointer plus 64 for the second b64 store; values, predicates, order, width, mapping, pipeline, and ABI remained unchanged.", "correctness": "PASS: focused 6/6, target builds, 3/3 differential correctness, full regression, sampled correctness, integrity, and 31-entry manifest. Resources stayed 36 stack / 254 MT / 40 ST / 32768 shared / 2 warps.", "decision": "revert", "device": "c500-local", "environment": "MetaX C500 device 0; xcore1000; MACA 3.7.1.5; MXCC 1.0.0 d9102a1572; driver 3.8.30; 25 percent compute / 16000 MiB slice; run exp-20260826-118-ae7ef3a71b2d-a01; c500-local.", "hypothesis": "Using the documented xcore1000 unsigned wide-MAD for each first output-store address and deriving the second by +64 reduces native wide address instructions and improves both K=2048 target arms by 1 percent.", "id": "exp-20260826-118", "language": "CUDA Maca", "notes": "Tested ae7ef3a71b2db806bbdc473be2341caf2a945b44; queue tip 3591d8921df8232927ec581289122815ed33b84e; workflow 4d0127ec3fb8a15bfa51b3583e0ebec0b08044a1; source blob b5a674a949c078952af2c07fba726b43de205d48; LF SHA-256 2772b302f69e2719405acd5fba7ae8dd0ac532055c446653941a2ae8c6a77ca4; paired SHA-256 4cd8035ecadb968bbd9ef766dc204bddfbc2f9248a66f30f4196533cb910a839; manifest-file SHA-256 1c3566f069c741838da6b08b6b6dc989034c4feb66ba7f41913ec69a10e7c1c0; candidate/baseline executables both 270752 bytes; no NVIDIA/OJ.", "operator": "Fused MoE i8 tn", "result": "REJECTED after one attempt: embedded device IR retained no wide-MAD intrinsic or demonstrated native wide-address reduction, and neither K=2048 target improved; no repeat, integration, or OJ.", "schema_version": 1, "timestamp": "2026-08-25T21:00:38+00:00"}
{"artifacts": ["artifacts/raw/c500-runs/exp-20260826-119-74901bd30880-a01", "handoffs/exp-20260826-119.md"], "baseline_commit": "2230963fdd9d6394b3b63864500ffab00818b4f0", "benchmark": "C500-local ABBA baseline->candidate: case1 1.0550->1.0825 ms (+2.6066 percent, baseline drift +6.2561); case2 6.1665->6.1675 (+0.0162); target case3 0.5635->0.5615 (-0.3549); target case4 3.4630->3.4625 (-0.0144). Neither target reached 1 percent in either arm.", "candidate_commit": "74901bd308802dc47716ae5b01b4843671761bd5", "change": "Replaced the eight common-epilogue __builtin_mxc_pk_fma_f32(a,b,zero) calls with __builtin_mxc_pk_mul_f32(a,b) and removed zero2; all values except accepted signed-zero representation, memory, mapping, synchronization, geometry, dispatch and ABI remained unchanged.", "correctness": "PASS: target builds, 3/3 differential correctness, full regression, sampled correctness, source/tree integrity and 31-entry manifest. Candidate IR retained llvm.mxc.pk.mul.f32, but both MMA kernels remained 36 stack / 254 MT / 40 ST / 32768 shared / 2 warps.", "decision": "revert", "device": "c500-local", "environment": "MetaX C500 device 0; xcore1000; MACA 3.7.1.5; MXCC 1.0.0 d9102a1572; driver 3.8.30; 25 percent compute / 16000 MiB slice; run exp-20260826-119-74901bd30880-a01; c500-local.", "hypothesis": "Replacing packed FP32 FMA-with-zero by the documented two-operand packed multiply removes zero-source pressure and improves both arms of case 3 or case 4 by at least 1 percent without increasing resources.", "id": "exp-20260826-119", "language": "CUDA Maca", "notes": "Tested 74901bd308802dc47716ae5b01b4843671761bd5; queue tip a6ae8221ffcd4ae0ac4ff390dcc5e144976709e2; workflow e2374f6c6f9a17bde117353f2b65769fb1457cd8; source blob 16586936442c59429b9c8428f596c48af83b8d17; LF SHA-256 2f47c58edbeeb502162d6b1caa5069f67b535e82f284a092658a5e82e353d031; paired SHA-256 c2f33f8823081f4f001cf52b7f446f82a2b57a9ddac3b90b50f6262cacecaeed; manifest-file SHA-256 e3d65d2649aebd235699b6dfa6b9df263c2aa52060cd923925eec7903ef84712; candidate IR llvm.mxc.pk.mul.f32 versus baseline llvm.mxc.pk.fma.f32; no NVIDIA/OJ; close packed-FP32-MUL-for-zero-FMA family.", "operator": "Fused MoE i8 tn", "result": "REJECTED after one attempt: a real packed-MUL IR distinction changed neither resource classes nor executable size and provided no material target timing gain; no repeat, integration or OJ.", "schema_version": 1, "timestamp": "2026-08-25T21:21:01+00:00"}
{"artifacts": ["artifacts/raw/c500-runs/exp-20260826-120-05530d7c81f4-a01", "handoffs/exp-20260826-120.md"], "baseline_commit": "2230963fdd9d6394b3b63864500ffab00818b4f0", "benchmark": "C500-local ABBA baseline->candidate: case1 1.0765->1.0835 ms (+0.6503 percent); case2 6.1670->6.1660 (-0.0162); case3 0.5635->0.5625 (-0.1775); target case4 3.4640->4.2980 (+24.0762), arms 3.464/3.464->4.292/4.304 ms. Both target arms regressed and protected case1 exceeded 0.5 percent.", "candidate_commit": "05530d7c81f46750bda31afc23f67acd4f5c66b0", "change": "Added an exact sorted case-4 compile-time path that consumes all current A/B fragments before the overwrite barrier, then loads and publishes the next K128 tile; preserved tail-first traversal, 31 barriers, 32 KiB shared memory, operation counts, mapping, epilogue, ABI and other dispatch paths.", "correctness": "PASS: independent lifecycle audit approved exact commit; target builds, 3/3 differential correctness, full regression, sampled correctness, source/tree integrity and 31-entry manifest all passed. Exact case-4 resources changed 36 stack / 254 MT / 40 ST to 0 / 232 / 42 with shared 32768 and 2 warps, so ST failed the <=40 gate.", "decision": "revert", "device": "c500-local", "environment": "MetaX C500 device 0; xcore1000; MACA 3.7.1.5; MXCC 1.0.0 d9102a1572; driver 3.8.30; 25 percent compute / 16000 MiB slice; run exp-20260826-120-05530d7c81f4-a01; c500-local.", "hypothesis": "Phase-separating each exact case-4 K128 tile removes next-tile payload overlap, lowers stack or MT while retaining at most 40 ST, and improves both target ABBA arms by at least 1 percent without protected regression above 0.5 percent.", "id": "exp-20260826-120", "language": "CUDA Maca", "notes": "Tested 05530d7c81f46750bda31afc23f67acd4f5c66b0; queue tip ca935f96dec7f7ab635bd3e41b756bbd890fafee; workflow d110e181b81f85fb21ce4596de4ba1311f47c9c6; source blob 5da5f654eee010995861fd683250129c0a00fc0b; LF SHA-256 61490ae2fa71525a9ec4feb8225d52da45b15f7acd3663a01204dfddc4a26b9a; paired SHA-256 c6afd986c396e79b174b5423caeb74273344e115fea364b6618ff581b77b47bd; manifest-file SHA-256 44082b8a30c737433c2133a34e4fdce57a99cfe30d4b7829ea0f9804867b0a89; independent audit approve for correctness/lifecycle; no NVIDIA/OJ; close synchronous phase-separated K128 family.", "operator": "Fused MoE i8 tn", "result": "REJECTED after one attempt: real stack/MT reduction was outweighed by lost global-load overlap, ST increased above the hard gate, and exact case4 regressed 24.0762 percent; no repeat, integration or OJ.", "schema_version": 1, "timestamp": "2026-08-25T21:47:43+00:00"}
{"artifacts": ["artifacts/raw/c500-runs/exp-20260826-121-3731f874ec82-a01", "handoffs/exp-20260826-121.md"], "baseline_commit": "2230963fdd9d6394b3b63864500ffab00818b4f0", "benchmark": "C500-local ABBA baseline->candidate: case1 1.0750->1.0885 ms (+1.2558 percent); target case2 6.1585->7.2995 (+18.5272, both arms +18.51/+18.55); case3 0.5570->0.5750 (+3.2316); case4 3.4565->3.9230 (+13.4963).", "candidate_commit": "3731f874ec82f7fa5cd23e4490120293dc1f30dd", "change": "Repacked the 16 KiB B shared tile into adjacent logical-row pairs and replaced sixteen B128 LDS operations with eight source-level B256 loads while preserving global traffic, MMA identities, barriers, mapping, epilogue and ABI.", "correctness": "PASS: independent exact-commit audit, focused 9/9, target builds, 3/3 differential correctness, full regression, sampled correctness, source/tree integrity and 31-entry manifest. Candidate resources improved to 0 stack / 248 MT / 40 ST / 32768 shared / 2 warps from 36/254/40/32768/2.", "decision": "revert", "device": "c500-local", "environment": "MetaX C500 device 0; xcore1000; MACA 3.7.1.5; MXCC 1.0.0 d9102a1572; driver 3.8.30; 25 percent compute / 16000 MiB slice; run exp-20260826-121-3731f874ec82-a01; c500-local.", "hypothesis": "Packing adjacent B fragment rows for eight source-level 256-bit LDS loads per wave/tile reduces shared issue pressure and improves both case2 arms by at least 1 percent without protected regressions.", "id": "exp-20260826-121", "language": "CUDA Maca", "notes": "Tested 3731f874ec82f7fa5cd23e4490120293dc1f30dd; queue tip a5e2acdf1073a8e3502cfa8b2431578b58e20608; workflow fa7afd6f8059d9fb4e956bafc2d56cc927d111b7; source blob a3ec75955dae41ab7c18a2d0f203bb3378cf4612; LF SHA-256 578ff760466206bc01dafde5edfc5a6be5ac07837041d0f355dd805b48efda15; paired SHA-256 f97da6087a06a3a09c4aec497cd977c9c907610127c500f20f015eac49d92ba4; manifest-file SHA-256 f0c092b3f69b137564e92f27a121760d6777f4e000b08df47bec8f2ba62dfe3b; audit APPROVE; exact native b256 lowering unresolved; no NVIDIA/OJ; close B-fragment row-pair b256 family.", "operator": "Fused MoE i8 tn", "result": "REJECTED after one attempt: all four cases regressed and case2 failed decisively despite improved resource classes; no repeat, profiler, integration or OJ.", "schema_version": 1, "timestamp": "2026-08-25T22:34:32+00:00"}
{"artifacts": ["artifacts/raw/c500-runs/exp-20260826-122-c282f61d0fa3-a01", "handoffs/exp-20260826-122.md"], "baseline_commit": "2230963fdd9d6394b3b63864500ffab00818b4f0", "benchmark": "C500-local ABBA baseline->candidate: case1 1.0475->1.0830 ms (+3.3890 percent); case2 6.1610->6.1625 (+0.02435); case3 0.5570->0.5575 (+0.08977); target case4 3.4575->3.4270 (-0.88214), arms -0.8962/-0.8681 percent.", "candidate_commit": "c282f61d0fa34add7a6a2122768f2b746af74b8c", "change": "Changed only the exact sorted case4 module full-sort launch width from 8 to 16, producing grid (16,56,16) with exact 14336-CTA cover and no kernel-body, resource, mapping, synchronization, epilogue or ABI change.", "correctness": "PASS: focused coverage/map/lifecycle proof, target builds, 3/3 differential correctness, full regression, sampled correctness, source/tree integrity and 31-entry manifest. Resources remained 36 stack / 254 MT / 40 ST / 32768 shared / 2 warps.", "decision": "revert", "device": "c500-local", "environment": "MetaX C500 device 0; xcore1000; MACA 3.7.1.5; MXCC 1.0.0 d9102a1572; driver 3.8.30; 25 percent compute / 16000 MiB slice; run exp-20260826-122-c282f61d0fa3-a01; c500-local.", "hypothesis": "Exact case4 width 16 halves ideal B refill to 224 MiB while its 4.25 MiB cluster working set fits C500 L2, improving aggregate and both case4 arms by at least 1 percent without protected regression above 0.5 percent.", "id": "exp-20260826-122", "language": "CUDA Maca", "notes": "Tested c282f61d0fa34add7a6a2122768f2b746af74b8c; queue tip fe3ae6925caab4060d49204cb364212a7a331453; workflow fad257680afb2468b8b1bea9ff1cbc866a92b357; source blob 7966b751e84c706e819600e3d3e7bee70304351d; LF SHA-256 0e1e56b197c41cae325e5b16ab6e7e6daed6318830ddc01b390980bf0e15a213; paired SHA-256 31951fc130e3c823fa1cc6cdaa51e4863ca0b6ec1af0b6e240af826edf4a2b83; manifest-file SHA-256 2d5eca7d47e8dad41dea1f7a3bdcb97d18c25aae55bf025787a6660fc87b049c; no NVIDIA/OJ; close width16 L2-fit validation without sweep.", "operator": "Fused MoE i8 tn", "result": "REJECTED after one attempt: target case4 and both arms missed the 1 percent gate, while protected case1 regressed 3.3890 percent; no repeat, profiler, OJ or neighboring-width sweep.", "schema_version": 1, "timestamp": "2026-08-25T22:35:00+00:00"}
{"artifacts": ["artifacts/raw/c500-runs/exp-20260826-123-03160a7b3cfa-a01", "handoffs/exp-20260826-123.md"], "baseline_commit": "2230963fdd9d6394b3b63864500ffab00818b4f0", "benchmark": "C500-local ABBA baseline->candidate: case1 1.0970->1.0625 ms (-3.1449 percent); target case2 6.1670->6.3470 (+2.9188, both arms +3.000/+2.838); case3 0.5635->0.5990 (+6.2999); case4 3.4605->3.7790 (+9.2039).", "candidate_commit": "03160a7b3cfaa100b4c285fef8b202681c6b91f4", "change": "Replaced one byte/CUTE shared backing with two typed MmaLoad128 arrays and direct vector indices while preserving shared addresses, LDS/STS/MMA/fence/barrier trace, geometry, dispatch, epilogue and ABI.", "correctness": "PASS: C500 build, 3/3 differential correctness, full regression, sampled correctness, source/tree integrity and 31-entry manifest. Resources failed: both MMA kernels changed from 36 stack / 254 MT / 40 ST to 84 / 256 / 40 at 32768 shared and 2 warps.", "decision": "revert", "device": "c500-local", "environment": "MetaX C500 device 0; xcore1000; MACA 3.7.1.5; MXCC 1.0.0 d9102a1572; driver 3.8.30; 25 percent compute / 16000 MiB slice; run exp-20260826-123-03160a7b3cfa-a01; c500-local.", "hypothesis": "Two align-16 typed A/B shared objects retain shared address space, remove generic shared-address work, and improve both case-2 arms by at least 1 percent without increasing resources.", "id": "exp-20260826-123", "language": "CUDA Maca", "notes": "Tested 03160a7b3cfaa100b4c285fef8b202681c6b91f4; queue tip b6950d3a75904b7376ab731107ee7547c41caa45; workflow d0942cae504cdf1c240781790ec7d0b6fadb59e6; source blob 7abe6888b8f218516ea09728f36543c89a5db954; LF SHA-256 1abcff5a693b2c33e9c3cd1da983aaeb16ddcc04acd2b7379cdd99d6a612ba8d; paired SHA-256 50b179bddbbcf944cfd4f7f561710282ec4c36ad73baec48584aa4a69ab3a4d0; manifest-file SHA-256 b11f61041b919acd1d1949dd2b9acc714e46a674bca0ea88361693c7f6767a4a; no NVIDIA/OJ; close typed-split-shared/alignment family.", "operator": "Fused MoE i8 tn", "result": "REJECTED after one attempt: target case2 and protected cases3/4 regressed decisively, and stack/MT exceeded the hard resource gate; no repeat, codegen audit, profile, integration or OJ.", "schema_version": 1, "timestamp": "2026-08-25T23:31:46+00:00"}
{"artifacts": ["artifacts/raw/c500-runs/exp-20260826-124-9718b670399b-a01", "handoffs/exp-20260826-124.md"], "baseline_commit": "2230963fdd9d6394b3b63864500ffab00818b4f0", "benchmark": "C500-local ABBA baseline->candidate: case1 1.0550->1.0750 ms (+1.8957 percent with high baseline drift and conflicting arms); case2 6.1690->6.1650 (-0.06484); case3 0.5630->0.5625 (-0.08881); target case4 3.4615->3.4605 (-0.02889), both arms far below 1 percent.", "candidate_commit": "9718b670399bbcb364ef243229aa885084eedc5f", "change": "Added an exact sorted case-4 compile-time cyclic tile-N permutation while keeping width, grid, stable M map, CTA/traffic cardinality, MMA/shared/barrier trace, epilogue and ABI unchanged.", "correctness": "PASS: independent mapping audit APPROVE; C500 build, 3/3 differential correctness, full regression, sampled correctness, integrity and 31-entry manifest. New true/true case4 instance increased MT 254->256 with 36 stack / 40 ST / 32768 shared / 2 warps; false instances remained 254 MT.", "decision": "revert", "device": "c500-local", "environment": "MetaX C500 device 0; xcore1000; MACA 3.7.1.5; MXCC 1.0.0 d9102a1572; driver 3.8.30; 25 percent compute / 16000 MiB slice; run exp-20260826-124-9718b670399b-a01; c500-local.", "hypothesis": "Case-4 width-eight cluster phases 0/32/8/40 consume retained B N tiles first and improve aggregate plus both case-4 arms by at least 1 percent without changing resources.", "id": "exp-20260826-124", "language": "CUDA Maca", "notes": "Tested 9718b670399bbcb364ef243229aa885084eedc5f; queue tip 42fcaaa3686d96b7b8703b08ba0c2b89bb653280; workflow d0942cae504cdf1c240781790ec7d0b6fadb59e6; source blob 20d15ada1c3d36ffd4ba74f06db190c9dfe6f67d; LF SHA-256 d8eb9f39bc122c4eb1b6ab1588a772bd1b1fe1c63c89e5a22e26d73831c9181f; paired SHA-256 82243bd644b2a5af618004ada433d1ef04c866130835c14bd19478b8a5865fdf; manifest-file SHA-256 55ce8ea86bf800033b49698bfe4b9c905661864c1e694b9d847f5a8407b1af90; audit APPROVE; no NVIDIA/OJ; close cyclic N-start family.", "operator": "Fused MoE i8 tn", "result": "REJECTED after one attempt: target case4 was flat and the new specialization exceeded the 254-MT resource gate; no repeat, profile, integration, OJ, phase variation or width sweep.", "schema_version": 1, "timestamp": "2026-08-25T23:32:16+00:00"}
{"artifacts": ["artifacts/raw/c500-runs/exp-20260826-125-41a4758ff340-a01", "handoffs/exp-20260826-125.md"], "baseline_commit": "2230963fdd9d6394b3b63864500ffab00818b4f0", "benchmark": "C500-local ABBA baseline->candidate: case1 1.0735->1.0505 ms (-2.1425 percent); case2 6.1600->6.0870 (-1.1851, both arms -1.1851); case3 0.5555->0.5395 (-2.8803); case4 3.4595->3.3195 (-4.0468). Every target arm exceeded 1 percent and case1 improved in both arms.", "candidate_commit": "41a4758ff340e8efc7bfe2510eedd0014d8a8494", "change": "Changed only the first sorted launch reference from runtime dimensions to fixed N=4096/K=7168 on exact exp-107; kernel body, map, grids, memory, barriers, epilogue and ABI stayed unchanged.", "correctness": "PASS: MXCC builds, 3/3 differential correctness, full regression, all sampled correctness, source/tree integrity, no-process gates and all 31 manifest entries. Four instances stayed within 36 stack / 254 MT / 40 ST / 32768 shared / 2 warps.", "decision": "revert", "device": "c500-local", "environment": "MetaX C500 device 0; xcore1000; MACA 3.7.1.5; MXCC 1.0.0 d9102a1572; driver 3.8.30; 25 percent compute / 16000 MiB slice; run exp-20260826-125-41a4758ff340-a01; c500-local.", "hypothesis": "Composing exp-107 native placement with case-2 N/K-only specialization improves every case-2/3/4 ABBA arm by at least 1 percent while protecting case 1.", "id": "exp-20260826-125", "language": "CUDA Maca", "notes": "Tested 41a4758ff340e8efc7bfe2510eedd0014d8a8494; queue tip 3ed9f2e94450cf5ac42d85f59892c3f543e04b44; workflow 5bea3a667966574b7527017643de0215a6f12568; source blob 7929a59830b68c5c28123809cc3a431bb3f1675f; LF SHA-256 21aa844912214a1fe7a726ceb751e5c3949c2d8c4ce283f0a9bde8f66b438b65; paired SHA-256 411ad6ff6159a6edd024befe13c3669d3fab3ad477700dbed8d60d2026b76405; manifest-file SHA-256 e9da3be47c524a7e6913b1bb96eab8718798eba57aa6a30270538d4a162b9b89; no NVIDIA/OJ; retain formal-best source.", "operator": "Fused MoE i8 tn", "result": "PASSED all local gates after one stable attempt, but rejected before integration/OJ because case2 matches already OJ-tied exp-092 and case3/4 match already OJ-tied exp-107 without a materially stronger per-case score-threshold opportunity.", "schema_version": 1, "timestamp": "2026-08-26T00:13:44+00:00"}
