{"artifacts": ["artifacts/raw/remote-runs/exp-20260822-026-fa736f1cef8e/status.json", "artifacts/raw/remote-runs/exp-20260822-026-fa736f1cef8e/stdout.log", "artifacts/raw/remote-runs/exp-20260822-026-fa736f1cef8e/environment.txt", "artifacts/raw/remote-runs/exp-20260822-026-fa736f1cef8e/gpu-before.csv", "artifacts/raw/xpuoj/122553/result-summary.png", "artifacts/raw/xpuoj/122553/result-details.png", "artifacts/raw/xpuoj/122553/scoreboard-self.png"], "baseline_commit": "8c519e6c1bb57e7b124b60806db9575fa1267207", "benchmark": "proxy/NVIDIA RTX A5000 medians: decode gate-up 45.543 ms, prefill gate-up 338.702 ms, decode down 21.706 ms, prefill down 171.855 ms; one warmup and five samples. NVIDIA executes the unchanged fallback, so these timings establish provenance and no fallback regression only. Target/C500 XPU-OJ #122553: case scores 83/69/88/83; exact user-kernel times 1016 us/10 ms/552 us/4143 us; 80.75 total versus the 82.25 best baseline.", "candidate_commit": "fa736f1cef8e643774eae2e0309956c176e2e613", "change": "Added a case-2-only 128x64x128, 256-thread MACA kernel. A geometry and software-pipelined two-barrier K handoff follow the target-validated 128x128 core; B uses a proven 4*(row%16)+row/16 shared permutation so four fragments form contiguous b64 output columns. The candidate uses 24 KiB LDS, half the accumulator/B-fragment state, twice the CTAs and nominal A bytes, unchanged total B bytes/MMA/output work, and leaves the other three shapes on the exact best kernel. Added dispatch, exact-cover, fragment-permutation, traffic/resource, and barrier-order regressions.", "correctness": "PASS on committed proxy/NVIDIA snapshot: source proof matched the OJ #117114 baseline kernel hash; CUDA 12.2 build; randomized boundary, two-expert, and INT8-extreme correctness each matched_ratio=1.0/max_abs=0; all public allocation/output/grid/A-load regressions; case-2-only dispatch; exact 128x64 output and 1x64x256 grid cover; contiguous B-fragment permutation; 2x CTA/A, 1x B/MMA, 24 KiB LDS, half-accumulator model; all-zero/read-only regression. TARGET PASS: XPU-OJ #122553 compiled for xcore1000 and passed the sample plus all four test cases.", "decision": "revert", "device": "nvidia", "environment": "proxy/NVIDIA physical GPU 1 RTX A5000; driver 535.261.03; CUDA 12.2 nvcc V12.2.140; sm_86; run exp-20260822-026-fa736f1cef8e at 2026-08-22T22:02:40+08:00; target XPU-OJ CUDA Maca C500 submission #122553 at 2026-08-22T22:42:37+08:00", "hypothesis": "For case 2, halving the 128x128 CTA N tile to 128x64 while retaining 256 threads halves per-thread accumulator and B-fragment state and reduces LDS from 32 KiB to 24 KiB. The extra CTA and nominal 2x A requests may be offset by better C500 register/LDS occupancy and L2 reuse, while total B bytes and MMA work remain unchanged.", "id": "exp-20260822-026", "language": "CUDA Maca (target case-2 128x64 occupancy kernel plus NVIDIA compatibility path)", "notes": "Candidate source git blob ea6f51d67f29f85b1a44c732cf72cc6b3c9e19f1; submitted LF source was 48783 bytes with SHA-256 c77205fa3e45b095a4a6d426fe0f4606f86d201b3993a8985b505c640dcd90a5. The target accepted the N64 fragment permutation, dispatch, stores, and synchronization, but case 2 regressed from the best 73 points / 8.158 ms to 69 points / 10 ms. Halving accumulator/B-fragment state and reducing LDS to 24 KiB did not offset twice the CTA count and nominal A traffic. Restore active submission and regression source exactly to best commit 8c519e6c1bb5. No rejected __dp4a, BSM/non-zero arrive, wide/paired CTA, alternate N schedule, cooperative scale cache, adjacent-M, or N64 path remains active.", "operator": "Fused MoE i8 tn", "result": "TARGET REJECTED: XPU-OJ #122553 was Accepted 4/4 at 80.75, but the case-2 128x64 occupancy kernel fell from the best baseline's 73 points / 8.158 ms to 69 points / 10 ms. The other three baseline paths measured 83/88/83; best remains 82.25 and live rank 25.", "schema_version": 1, "timestamp": "2026-08-22T14:05:21+00:00"}
{"artifacts": ["artifacts/raw/remote-runs/exp-20260823-027-91c20aa647c4-a01/status.json", "artifacts/raw/remote-runs/exp-20260823-027-91c20aa647c4-a01/stdout.log", "artifacts/raw/remote-runs/exp-20260823-027-91c20aa647c4-a01/environment.txt", "artifacts/raw/remote-runs/exp-20260823-027-91c20aa647c4-a01/gpu-before.csv", "artifacts/raw/xpuoj/122822/result-summary.png", "artifacts/raw/xpuoj/122822/result-details.png", "artifacts/raw/xpuoj/122822/contest-status-after.png", "artifacts/raw/xpuoj/122822/result-summary.json"], "baseline_commit": "8c519e6c1bb57e7b124b60806db9575fa1267207", "benchmark": "proxy/NVIDIA RTX A5000 GPU 0 medians: cases 1-4 45.543, 333.655, 21.189, 168.112 ms, one warmup and five samples; NVIDIA executes the unchanged fallback. Target/C500 XPU-OJ #122822: case scores 83/73/89/83; user-kernel times 1018 us/8 ms/546 us/4126 us; 82.00 total versus the 82.25 best baseline.", "candidate_commit": "dba945bcff9caf3f79f2a94c816ff5ed18ec2096", "change": "Only the MACA epilogue weights/scale_a row metadata loads changed from 16 scalar b32 instructions per thread to 4 aligned b128 instructions. Bytes, predicates' covered rows, arithmetic, stores, MMA/K-loop, barriers, CTA, LDS, threads, grid and NVIDIA fallback are unchanged. Added exhaustive alignment/address/load-count regression, a deterministic remote job and committed handoff.", "correctness": "PASS on committed proxy/NVIDIA snapshot 91c20aa647c41bc1ef2b6d0d5a3d14af17e0bba4: source reconstruction matched baseline SHA-256 bed1887e...; CUDA 12.2 build; three differential cases matched_ratio=1.0/max_abs=0; all public allocation/output/grid/A-load checks; exhaustive 256-thread two-group contiguous/aligned/in-bounds metadata proof; all-zero/read-only regression; empty stderr. TARGET PASS: XPU-OJ #122822 compiled for xcore1000 and passed the sample plus all four test cases.", "decision": "revert", "device": "nvidia", "environment": "proxy/NVIDIA GPU 0 RTX A5000; driver 535.261.03; CUDA 12.2 nvcc V12.2.140; sm_86; run exp-20260823-027-91c20aa647c4-a01 at 2026-08-23T00:54:25+08:00; target XPU-OJ CUDA Maca C500 submission #122822 at 2026-08-23T01:17:43+08:00", "hypothesis": "Each thread's two groups of four output rows are contiguous and float4-aligned, so replacing sixteen predicated b32 metadata loads with four predicated b128 loads preserves 64 bytes and output mapping while removing twelve target LDG instructions; shorter decode kernels may improve by about 1 percent or cross a score step.", "id": "exp-20260823-027", "language": "CUDA Maca (target row-metadata b128 LDG plus NVIDIA compatibility path)", "notes": "Candidate source SHA-256 dcb5eea82d50cb090f317bf70a63923565aba1289970500c6e59d1bebd3ed09a; integrated OJ commit be2a1c8b3c227469ace72329203f079fee0f50ea. The target accepted MmaFloat4 b128 predicated metadata loads, but all four displayed case scores matched the common 83/73/89/83 no-gain band and total score remained 0.25 below the formal best. Restore active submission and regression source exactly to best commit 8c519e6c1bb5; close row-metadata vector-width tuning absent new target evidence.", "operator": "Fused MoE i8 tn", "result": "TARGET REJECTED: XPU-OJ #122822 was Accepted 4/4 at 82.00, but row-metadata b128 vectorization did not improve any displayed case score and remained below the 82.25 formal best. The target-compatible source measured 83/73/89/83 and is reverted.", "schema_version": 1, "timestamp": "2026-08-23T00:54:25+08:00"}
{"artifacts":["artifacts/raw/remote-runs/exp-20260823-028-a14f93a2a785-a01/status.json","artifacts/raw/remote-runs/exp-20260823-028-a14f93a2a785-a01/stdout.log","artifacts/raw/remote-runs/exp-20260823-028-a14f93a2a785-a01/environment.txt","artifacts/raw/remote-runs/exp-20260823-028-a14f93a2a785-a01/gpu-before.csv","artifacts/raw/xpuoj/122853/result-summary.png","artifacts/raw/xpuoj/122853/case-details.png","artifacts/raw/xpuoj/122853/contest-overview.png","artifacts/raw/xpuoj/122853/result-summary.json"],"baseline_commit":"8c519e6c1bb57e7b124b60806db9575fa1267207","benchmark":"proxy/NVIDIA RTX A5000 GPU 1 medians: cases 1-4 45.526, 340.131, 21.535, 171.873 ms, one warmup and five samples; NVIDIA executes the unchanged fallback. Target/C500 XPU-OJ #122853: case scores 83/73/88/83; user-kernel times 1019 us/8 ms/553 us/4152 us; 81.75 total versus the 82.25 best baseline.","candidate_commit":"5b92ff47820a0246afef75de6e3b3761e68daeff","change":"Removed only the 16-vector output temporary and changed each values[8] assignment to consume the corresponding even-then-odd accum components directly. Global/shared bytes, barriers, CTA/LDS/threads, MMA/load/store order, K loop, output mapping, scale arithmetic and NVIDIA fallback are unchanged.","correctness":"PASS: committed source reconstruction, CUDA 12.2 build, three differential correctness cases, exact 64-component accumulator remap, all public allocation/output/grid/A-load regressions and all-zero/read-only checks passed. Independent detached audit re-derived all 64 mappings, found no scope or synchronization issue and approved the candidate. TARGET PASS: XPU-OJ #122853 compiled for xcore1000 and passed the sample plus all four test cases.","decision":"revert","device":"nvidia","environment":"proxy/NVIDIA physical GPU 1 RTX A5000; driver 535.261.03; CUDA 12.2 nvcc 12.2.140; sm_86; run exp-20260823-028-a14f93a2a785-a01 at 2026-08-23T01:03:08+08:00; target XPU-OJ CUDA Maca C500 submission #122853 at 2026-08-23T01:57:19+08:00","hypothesis":"Consuming the exact accum[2][8] components directly removes the output[16] materialization and 64 scalar copies without changing mapping, potentially reducing target register pressure enough for about 1 percent or one score step.","id":"exp-20260823-028","language":"CUDA Maca (target direct accumulator epilogue plus NVIDIA compatibility path)","notes":"Candidate source SHA-256 64d29d4bb1c3249ce3d415181bc0e3517759e85fb8c71e6bc8d86519f3a1ee36; integrated OJ commit 1f79ee2a70912b1c38f4cf082ff6dd7188c437dd. The target accepted the exact direct accumulator mapping, but case 3 fell to 88 and the 81.75 total was 0.50 below the formal best. MXCC did not expose a useful score-level register-pressure benefit. Restore active submission and regression source exactly to best commit 8c519e6c1bb5; close output-temporary removal absent new target evidence.","operator":"Fused MoE i8 tn","result":"TARGET REJECTED: XPU-OJ #122853 was Accepted 4/4 at 81.75, but direct accumulator consumption did not improve the target score and remained 0.50 below the 82.25 formal best. The target-compatible source measured 83/73/88/83 and is reverted.","schema_version":1,"timestamp":"2026-08-23T01:03:08+08:00"}
{"artifacts":["artifacts/raw/remote-runs/exp-20260823-029-4d3b61735c20-a01/status.json","artifacts/raw/remote-runs/exp-20260823-029-4d3b61735c20-a01/stdout.log","artifacts/raw/remote-runs/exp-20260823-029-4d3b61735c20-a01/environment.txt","artifacts/raw/remote-runs/exp-20260823-029-4d3b61735c20-a01/gpu-before.csv","artifacts/raw/xpuoj/122877/result-summary.png","artifacts/raw/xpuoj/122877/case-details.png","artifacts/raw/xpuoj/122877/contest-overview.png","artifacts/raw/xpuoj/122877/result-summary.json"],"baseline_commit":"8c519e6c1bb57e7b124b60806db9575fa1267207","benchmark":"proxy/NVIDIA RTX A5000 GPU 2 medians: cases 1-4 41.764, 330.759, 21.014, 167.627 ms, one warmup and five samples; NVIDIA executes the unchanged fallback. Target/C500 XPU-OJ #122877: case scores 83/73/89/83; user-kernel times 1026 us/8 ms/550 us/4153 us; 82.00 total versus the 82.25 best baseline.","candidate_commit":"d9af80d87cfdc6a83ea91a6e5ef647fdecd37f06","change":"Removed only the MACA global-B CUTE tile coordinate object, formed four clamped row pointers at K tile zero, used a constant last-tile offset for the unchanged predicated preload, fed the four loop LDGs from the pointers and advanced them by 128 bytes after each existing pipeline body. Bytes, predicates, barriers, CTA/LDS/threads, MMA/LDS/STS order, epilogue and NVIDIA fallback are unchanged.","correctness":"PASS: committed protected-source trace, CUDA 12.2 build, three differential correctness cases, exhaustive B address equivalence for every public shape/N tile/thread/load/K tile including last-tile predicates, all allocation/output/grid/A-load regressions and all-zero/read-only checks passed. TARGET PASS: XPU-OJ #122877 compiled for xcore1000 and passed the sample plus all four test cases.","decision":"revert","device":"nvidia","environment":"proxy/NVIDIA physical GPU 2 RTX A5000; driver 535.261.03; CUDA 12.2 nvcc V12.2.140; sm_86; run exp-20260823-029-4d3b61735c20-a01 at 2026-08-23T01:05:55+08:00; target XPU-OJ CUDA Maca C500 submission #122877 at 2026-08-23T02:19:16+08:00","hypothesis":"Four loop-invariant B row pointers advanced by 128 bytes per K iteration can replace repeated CUTE three-dimensional coordinate formation at four LDG sites without changing addresses or instruction order, potentially reducing target integer address work by about 1 percent or one score step.","id":"exp-20260823-029","language":"CUDA Maca (target B-pointer induction plus NVIDIA compatibility path)","notes":"Candidate source SHA-256 24593aa2bb075e83bf0885023564bd494d561bd47704b5037b31a1ce68b078c9; integrated OJ commit 99851e42f5b9f7f79268991a4626104cdb4e3cb0. The target accepted the induced B pointers and exact last-tile predicate, but case 2 stayed at 73 and the 82.00 total remained 0.25 below the formal best. MXCC likely already strength-reduces the CUTE coordinate or the four explicit 64-bit pointers offset the source-level integer simplification. Restore active submission and regression source exactly to best commit 8c519e6c1bb5; close B-pointer induction absent new target evidence.","operator":"Fused MoE i8 tn","result":"TARGET REJECTED: XPU-OJ #122877 was Accepted 4/4 at 82.00, but induced B row pointers did not improve the target score and remained 0.25 below the 82.25 formal best. The target-compatible source measured 83/73/89/83 and is reverted.","schema_version":1,"timestamp":"2026-08-23T01:05:55+08:00"}
{"artifacts": ["artifacts/raw/remote-runs/exp-20260823-031-0834d0fad792-a01/status.json", "artifacts/raw/remote-runs/exp-20260823-031-0834d0fad792-a01/stdout.log", "artifacts/raw/remote-runs/exp-20260823-031-0834d0fad792-a01/environment.txt", "artifacts/raw/remote-runs/exp-20260823-031-0834d0fad792-a01/gpu-before.csv", "artifacts/raw/xpuoj/122918/result-summary.png", "artifacts/raw/xpuoj/122918/case-details.png", "artifacts/raw/xpuoj/122918/contest-overview.png", "artifacts/raw/xpuoj/122918/result-summary.json"], "baseline_commit": "8c519e6c1bb57e7b124b60806db9575fa1267207", "benchmark": "proxy/NVIDIA RTX A5000 GPU 4 medians: cases 1-4 41.584, 328.877, 21.037 and 166.309 ms, one warmup and five samples; NVIDIA executes the unchanged fallback. Target/C500 XPU-OJ #122918: case scores 83/73/89/84; displayed user-kernel times 1021 us/8 ms/545 us/4102 us; 82.25 total, exactly tying the formal-best score without improving case 2.", "candidate_commit": "99fe0670dbf86fe7cfccf03d5385d8788700ca23", "change": "Added one four-MMA interleaving macro and replaced the deterministic 13 adjacent independent steady-loop macro pairs. This interleaves 52 of 128 steady MMAs while preserving the exact MMA multiset, every per-accumulator K-depth chain, every LDG/LDS/STS/barrier at the same atomic-MMA-relative index, all bytes/addresses/resources, the peeled tail, epilogue, dispatch and NVIDIA fallback.", "correctness": "PASS on committed proxy/NVIDIA snapshot 0834d0fad792229f36b36a02c66b76f920dfdd8d: exact reverse transformation reconstructed baseline SHA-256 bed1887e...; CUDA 12.2 build; three differential cases matched_ratio=1/max_abs=0; exact 128-MMA multiset and all 16 depth chains 0..7; unchanged memory anchors/barriers; fragment-before-use proof; peeled tail/resources exact; public allocation/output/grid/A-load and all-zero/read-only regressions; empty stderr. TARGET PASS: XPU-OJ #122918 compiled for xcore1000 and passed the sample plus all four test cases.", "decision": "revert", "device": "nvidia", "environment": "proxy/NVIDIA physical GPU 4 RTX A5000; UUID GPU-7b8df9d9-f81c-0362-ea16-4fef072dfe24; driver 535.261.03; CUDA 12.2 nvcc V12.2.140; sm_86; run exp-20260823-031-0834d0fad792-a01 at 2026-08-23T02:54:14+08:00; target XPU-OJ CUDA Maca C500 submission #122918 at 2026-08-23T03:42:53+08:00", "hypothesis": "Interleaving adjacent independent accumulator chains instead of issuing two immediate RAW-dependent MMAs to the same accumulator can expose scoreboard-level ILP and improve case 2 by about 1 percent or one score step without changing memory or synchronization operations.", "id": "exp-20260823-031", "language": "CUDA Maca (target MMA-chain interleave plus NVIDIA compatibility path)", "notes": "Candidate source SHA-256 0fea0c4f20ed055e9ea3b7a707d22de3feb1b35bd670125a601ab2486e6afbce; remote-tested source/job commit 0834d0fad792229f36b36a02c66b76f920dfdd8d; final queued handoff tip 99fe0670dbf86fe7cfccf03d5385d8788700ca23; integrated OJ commit 582080db66ff63d0acf9a2fa2945482399ff1c96. The target accepted the reordering and reproduced the formal-best 83/73/89/84 vector, but case 2 stayed at 73 and total score stayed exactly 82.25. MXCC scheduling or the memory-bound kernel erased the source-order benefit; restore formal-best source 8c519e6c1bb5 and close this mechanism absent target ISA evidence.", "operator": "Fused MoE i8 tn", "result": "TARGET NO GAIN: XPU-OJ #122918 was Accepted 4/4 at 82.25, exactly tying but not exceeding formal best #117114. Case 2 remained 73 points, so revert the MMA-chain interleave.", "schema_version": 1, "timestamp": "2026-08-23T02:54:14+08:00"}
{"artifacts": ["artifacts/raw/remote-runs/exp-20260823-030-40da8cc3ab15-a01/status.json", "artifacts/raw/remote-runs/exp-20260823-030-40da8cc3ab15-a01/stdout.log", "artifacts/raw/remote-runs/exp-20260823-030-40da8cc3ab15-a01/environment.txt", "artifacts/raw/remote-runs/exp-20260823-030-40da8cc3ab15-a01/gpu-before.csv", "artifacts/raw/xpuoj/122909/result-summary.png", "artifacts/raw/xpuoj/122909/case-details.png", "artifacts/raw/xpuoj/122909/contest-overview.png", "artifacts/raw/xpuoj/122909/result-summary.json"], "baseline_commit": "8c519e6c1bb57e7b124b60806db9575fa1267207", "benchmark": "proxy/NVIDIA RTX A5000 GPU 3 medians: cases 1-4 44.810, 328.513, 20.847 and 166.287 ms, one warmup and five samples; NVIDIA executes the unchanged fallback. Target/C500 XPU-OJ #122909: case scores 83/73/89/84; displayed user-kernel times 1020 us/8 ms/542 us/4121 us; 82.25 total, exactly tying the formal-best score.", "candidate_commit": "765273877feed0cc541701e88fa41ff0e74788d5", "change": "Only the two per-pair BF16 rounding expressions changed from retained-LSB ties-even bias to unsigned +0x8000 ties-away bias. Exact reverse replacement reconstructs the formal-best source; byte permutation, two b64 stores and their arguments, output mapping, scale arithmetic, MMA/K-loop, bytes, addresses, barriers, CTA/LDS/threads, dispatch and NVIDIA fallback are unchanged.", "correctness": "PASS on committed proxy/NVIDIA snapshot 40da8cc3ab157380aa4916ce68b193d466c36171: exact source reconstruction; CUDA 12.2 build; three fallback differential cases matched_ratio=1/max_abs=0; 393216 boundary pairs over all retained high words; all 391680 finite RNE outputs passed official tolerance with max atol-relevant relative error 0.0078125; public allocation/output/grid/A-load and all-zero/read-only regressions; empty stderr. Independent detached audit re-derived the bit algebra, confirmed no finite RNE result becomes nonfinite, identified only pre-existing/irrelevant NaN payload caveats, and approved one target experiment. TARGET PASS: XPU-OJ #122909 compiled for xcore1000 and passed the sample plus all four test cases.", "decision": "revert", "device": "nvidia", "environment": "proxy/NVIDIA physical GPU 3 RTX A5000; UUID GPU-afb2badc-bdd8-5ca7-f48c-ea3ffdb05e37; driver 535.261.03; CUDA 12.2 nvcc V12.2.140; sm_86; run exp-20260823-030-40da8cc3ab15-a01 at 2026-08-23T02:52:31+08:00; target XPU-OJ CUDA Maca C500 submission #122909 at 2026-08-23T03:17:57+08:00", "hypothesis": "Replacing BF16 round-to-nearest-even retained-LSB extraction with ties-away rounding removes an estimated 192 source-level scalar ALU operations per thread while every finite converted result remains inside the official rtol 2 percent and atol 0.005 tolerance.", "id": "exp-20260823-030", "language": "CUDA Maca (target BF16 ties-away pack plus NVIDIA compatibility path)", "notes": "Candidate source SHA-256 ae7e4ccc4954b3a8b72e4e6c991be4265bb04edaf49db7f1c57dbba46e85d0d9; remote-tested source/job commit 40da8cc3ab157380aa4916ce68b193d466c36171; final queued handoff tip 765273877feed0cc541701e88fa41ff0e74788d5; integrated OJ commit ea37ed399b5d5ac38aaac8f7e11b40d58b0c3cea. The target accepted ties-away conversion and reproduced the formal-best 83/73/89/84 case vector, but the score remained exactly 82.25 and rank remained 25. The source-level 192-operation estimate did not produce a score gain, so restore exact RNE formal-best source 8c519e6c1bb5 and close this mechanism absent ISA evidence.", "operator": "Fused MoE i8 tn", "result": "TARGET NO GAIN: XPU-OJ #122909 was Accepted 4/4 at 82.25, exactly tying but not exceeding formal best #117114. Preserve #117114 as formal best and revert the ties-away source.", "schema_version": 1, "timestamp": "2026-08-23T02:52:31+08:00"}
