{"artifacts": ["artifacts/raw/c500-runs/exp-20260826-148-58f6dfc3126a-a01", "handoffs/exp-20260826-148.md"], "baseline_commit": "2230963fdd9d6394b3b63864500ffab00818b4f0", "benchmark": "ABBA case1 1.0665->1.0895 ms (+2.1566%); case2 6.1650->6.1680 ms (+0.0487%), arms +0.0649%/+0.0324%; case3 -0.1789%; case4 +0.1012%.", "candidate_commit": "58f6dfc3126a8772955531e7bc75a5f877257ca8", "change": "Moved only steady and peeled-tail A01 LDS to immediately before their first MMA(0,0,4); A00 and all A/B STS/LDG, B LDS, barriers, MMA order, addresses, dispatch, epilogue and ABI stayed exact.", "correctness": "Focused 8/8 proof passed. C500 builds, 3/3 differential correctness at matched_ratio 1.0/max_abs 0, full regression, read-only checks, source/tree integrity and 31-entry manifest passed.", "decision": "revert", "device": "c500-local", "environment": "MetaX C500 xcore1000 device 0; MACA 3.7.1.5; MXCC 1.0.0 d9102a1572; driver 3.8.30; 25 percent compute / 16000 MiB slice; no device process before or after; NVIDIA disabled.", "hypothesis": "Moving only A01 LDS to its first MMA(0,0,4) consumer improves case2 aggregate and both arms by at least 1 percent without resource or protected regression.", "id": "exp-20260826-148", "language": "CUDA Maca", "notes": "Tested 58f6dfc3126a; queue tip b11ff80. Candidate LF SHA-256 cc48c4e796c7f163db1cc66af0f3ba19a5e4d5faa65ab60b76e4a8a8d88eb60d. No repeat, profile, integration, NVIDIA or OJ; late A01 alone does not explain exp-146 gain.", "operator": "fused_moe_i8_tn", "result": "REJECTED: resources matched baseline at 36 stack / 254 MT / 40 ST / 32768 shared / 2 warps, but target case2 was neutral and protected case1 regressed over 2 percent in aggregate and both arms.", "schema_version": 1, "timestamp": "2026-08-26T14:37:06+00:00"}
{"artifacts": ["artifacts/raw/c500-runs/exp-20260826-149-4508b533a464-a01", "handoffs/exp-20260826-149.md"], "baseline_commit": "2230963fdd9d6394b3b63864500ffab00818b4f0", "benchmark": "ABBA case1 -6.1453%; case2 6.1635->6.1215 ms (-0.6814%), arms -0.6653%/-0.6976%; case3 -3.6607%; case4 -1.8478%.", "candidate_commit": "4508b533a464989f43ba21bb4709e611199dd58a", "change": "Moved only steady and peeled-tail A00 from the formal preheader/backedge to after XH_LDG_B_STAGE_I(0/1) and tail entry; A01 and all remaining operations stayed formal-best exact.", "correctness": "Independent audit approved lifecycle and four-wave payload. Focused 7/7 passed. C500 builds, 3/3 differential correctness at matched_ratio 1.0/max_abs 0, full regression, read-only checks, source/tree integrity and 31-entry manifest passed.", "decision": "revert", "device": "c500-local", "environment": "MetaX C500 xcore1000 device 0; MACA 3.7.1.5; MXCC 1.0.0 d9102a1572; driver 3.8.30; 25 percent compute / 16000 MiB slice; no device process before or after; NVIDIA disabled.", "hypothesis": "Moving only A00 to the exact exp-146 position after both steady B LDGs improves case2 aggregate and both arms by at least 1 percent while protecting every arm and meeting 20/254/40 resources.", "id": "exp-20260826-149", "language": "CUDA Maca", "notes": "Tested 4508b533a464; queue tip 7a9d632ac32d. Candidate LF SHA-256 39898f81f5d86fd1e29a9b513ebc0f81a3c99434fad47143faed83a6e4c71ab0. No repeat, profile, integration, NVIDIA or OJ; isolate proves favorable late A00 and motivates a newly gated A00+A01 pair interaction experiment.", "operator": "fused_moe_i8_tn", "result": "REJECTED: resources improved to 20 stack / 254 MT / 40 ST / 32768 shared / 2 warps and every case improved, but target case2 aggregate and both stable arms missed the precommitted 1 percent gate.", "schema_version": 1, "timestamp": "2026-08-26T14:52:48+00:00"}
{"artifacts": ["artifacts/raw/c500-runs/exp-20260826-150-bcd9b3c1eaf7-a01", "artifacts/raw/c500-runs/exp-20260826-150-bcd9b3c1eaf7-a02", "artifacts/raw/xpuoj/128026", "handoffs/exp-20260826-150.md"], "baseline_commit": "2230963fdd9d6394b3b63864500ffab00818b4f0", "benchmark": "C500 ABBA attempt1 case2 6.1595->6.0585 ms (-1.6397%), arms -1.6718%/-1.6077%; attempt2 6.1640->6.0620 ms (-1.6548%), arms -1.6867%/-1.6229%. Attempt2 cases1/3/4 improved 4.6716%/2.8520%/1.9931% and every protected arm improved. OJ #128026 scored 83.75 with cases 84/77/89/85 at 0.961/6.539/0.516/3.562 ms, rank 20.", "candidate_commit": "bcd9b3c1eaf78c5e2f36594be14febb87919df98", "change": "Moved only runtime-clone A00/A01 LDS placements in steady and peeled-tail schedules; A/B STS and LDG, B LDS, barriers, MMA order, addresses, mapping, dispatch, epilogue, ABI and read-only inputs stayed exact.", "correctness": "Independent audit approved exact-source lifecycle, payload and ABI. Both trusted C500 attempts passed MXCC build, 3/3 differential correctness at matched_ratio 1.0/max_abs 0, full regression, read-only checks, source/tree integrity and 31-entry manifests; OJ accepted all 4 cases.", "decision": "keep", "device": "xpuoj-c500", "environment": "MetaX C500 xcore1000; MACA 3.7.1.5; MXCC 1.0.0 d9102a1572; driver 3.8.30; 25 percent compute / 16000 MiB slice; no device process before/after; NVIDIA disabled. OJ slice remains unspecified.", "hypothesis": "Moving the exact runtime group-0 A00+A01 LDS pair to their first legal consumers yields a non-additive schedule benefit of at least 1.2 percent on case 2 while preserving every protected arm and staying within 20 stack / 254 MT / 40 ST.", "id": "exp-20260826-150", "language": "CUDA Maca", "notes": "Tested bcd9b3c1eaf7; integrated/submitted 287eb38a6dda. Source blob 418ae0c8d1191e0978e40a609738bac96a924729; LF SHA-256 4fe1962ccbade0e598c39c7ac0369cb85b62ed74fc97967a7e018c198acd58c7. Submission finalized and OJ slot released; deferred user report remains pending.", "operator": "fused_moe_i8_tn", "result": "KEPT: resources improved to 20 stack / 254 MT / 40 ST / 32768 shared / 2 warps; repeated target timing passed; OJ #128026 was 4/4 Accepted and raised the formal best from 83.50 to 83.75 and rank from 21 to 20.", "schema_version": 1, "timestamp": "2026-08-26T15:23:33+00:00"}
{"artifacts": ["artifacts/raw/c500-runs/exp-20260826-152-147e60be4ddf-a01", "handoffs/exp-20260826-152.md"], "baseline_commit": "287eb38a6dda53048e24960eba39879e548fc977", "benchmark": "ABBA case1 1.0310->1.0095 ms (-2.0854%); case2 6.0595->6.0710 ms (+0.1898%), arms +0.2642%/+0.1155%; case3 -1.1949%; case4 -0.2065%. Stable case2 drift +0.1156%/-0.0329%.", "candidate_commit": "147e60be4ddfa14137b855cd6a264c354b759297", "change": "Moved only runtime group-0 B0/B1 LDS from preheader/backedge carry positions to the current steady and peeled-tail consumers after unchanged early B LDGs; B2/B3, A path, LDG/STS/MMA/barriers, mapping, epilogue and ABI stayed exact.", "correctness": "Independent synchronization/mapping audit approved. C500 builds; 3/3 differential correctness matched_ratio=1.0 max_abs=0; full regression, sampled/read-only correctness, source/tree integrity and 31-entry manifest passed.", "decision": "revert", "device": "c500-local", "environment": "MetaX C500 xcore1000 device 0; MACA 3.7.1.5; MXCC 1.0.0 d9102a1572; driver 3.8.30; 25 percent compute / 16000 MiB slice; no device process before/after; NVIDIA disabled.", "hypothesis": "Consumer-local current-iteration B0/B1 LDS reaches stack=0 or MT<=250 and improves case 2 aggregate and both arms by at least 1.0 percent while protecting all other arms within 0.5 percent.", "id": "exp-20260826-152", "language": "CUDA Maca", "notes": "Tested 147e60be4ddf; queue tip 05d7278f4b6d. Candidate blob d09e3017f3eaf9f94073e235bed10c1107fd2ef9; LF SHA-256 c13e83aa1259d6e82bda75e337b0d15fe19df1748154953a45c21ecdf7ae0619. No repeat/profile/integration/NVIDIA/OJ; close consumer-local B0/B1 subset family.", "operator": "fused_moe_i8_tn", "result": "REJECTED: resources improved from 20 stack / 254 MT to 0 stack / 250 MT with 40 ST / 32768 shared / 2 warps unchanged, but target case2 regressed in aggregate and both arms and failed the 1.0 percent timing gate.", "schema_version": 1, "timestamp": "2026-08-26T15:58:08+00:00"}
{"artifacts": ["artifacts/raw/c500-runs/exp-20260826-151-fa106148676a-a01", "handoffs/exp-20260826-151.md"], "baseline_commit": "287eb38a6dda53048e24960eba39879e548fc977", "benchmark": "ABBA case1 1.0290->1.0250 ms (-0.3887%, noisy); case2 6.0610->6.1170 ms (+0.9239%), both arms +0.9239% with zero drift; case3 +0.4575%; case4 +0.7815%, both arms above the 0.5% protection gate.", "candidate_commit": "fa106148676a7d41629869030924c088300eca7a", "change": "Moved only runtime A10 LDS in steady and peeled tail; all A/B STS/LDG, B LDS, barriers, MMA order, addresses, mapping, dispatch, epilogue and ABI stayed exact.", "correctness": "Independent lifecycle, barrier and four-wave payload audit approved after correcting the candidate LF SHA-256. C500 builds; 3/3 differential correctness matched_ratio=1.0 max_abs=0; full regression, sampled/read-only correctness, source/tree integrity and 31-entry manifest passed.", "decision": "revert", "device": "c500-local", "environment": "MetaX C500 xcore1000 device 0; MACA 3.7.1.5; MXCC 1.0.0 d9102a1572; driver 3.8.30; 25 percent compute / 16000 MiB slice; no device process before/after; NVIDIA disabled.", "hypothesis": "Moving only A10 LDS to the last legal steady pre-barrier slot and peeled-tail first-consumer slot reaches stack=0 or MT<=250 and improves case 2 aggregate and both arms by at least 1.0 percent without protected regression above 0.5 percent.", "id": "exp-20260826-151", "language": "CUDA Maca", "notes": "Tested fa106148676a after metadata/proof-only hash correction; queue tip 2c331d9b8f89. Candidate source blob a59030f0b3f4286ffe66d36fbcdcd223d2ca2c9f; LF SHA-256 49ba8da66f274e6d06a4ce029e38b0e102d5886a291e61c4d8c3d37f123d9869. No repeat/profile/integration/NVIDIA/OJ; close late A10 family.", "operator": "fused_moe_i8_tn", "result": "REJECTED: resources remained 20 stack / 254 MT / 40 ST / 32768 shared / 2 warps, failing the resource gate; target case2 and protected case4 regressed stably.", "schema_version": 1, "timestamp": "2026-08-26T16:01:23+00:00"}
{"artifacts": ["artifacts/raw/c500-runs/exp-20260827-153-5bac1c97e540-a01", "handoffs/exp-20260827-153.md"], "baseline_commit": "287eb38a6dda53048e24960eba39879e548fc977", "benchmark": "ABBA case1 +0.5845 percent; case2 6.0645 to 6.2430 ms, +2.9434 percent, both candidate arms exactly 6.243 ms; case3 +1.5469 percent; case4 +1.7536 percent.", "candidate_commit": "5bac1c97e5405f43c802b4c3c2bc0c48605634e4", "change": "Moved only the two steady next-tile B2/B3 global-load issue sites to the loop head after unchanged B0/B1; addresses, bytes, STS/LDS/MMA/barriers, A path, tail, mapping, epilogue and ABI stayed exact.", "correctness": "PASS: focused proof; C500 candidate/baseline builds; 3/3 differential correctness matched_ratio 1.0 max_abs 0; full regression, sampled/read-only correctness, source/tree integrity and 31-entry manifest.", "decision": "revert", "device": "c500-local", "environment": "MetaX C500 xcore1000 device 0; MACA 3.7.1.5; MXCC 1.0.0 d9102a1572; driver 3.8.30; 25 percent compute / 16000 MiB slice; no device process before or after; NVIDIA disabled.", "hypothesis": "Issuing steady B2/B3 immediately after B0/B1 improves case2 and both arms by at least 1 percent while protecting other arms within 0.5 percent.", "id": "exp-20260827-153", "language": "CUDA Maca", "notes": "Tested 5bac1c97e540; queue tip d29b72c5ae805ed2ec8e5a2fe063a08accd7e1f7; source blob 930bedda0ab32bfa18f0388456703960d2060538; LF SHA-256 24c4cdc0132a95d1e13fb4f80d85e485408debab5dabe23005f1d72c6580639f; resources unchanged 20 stack / 254 MT / 40 ST / 32768 shared / 2 warps. No repeat/profile/integration/NVIDIA/OJ.", "operator": "fused_moe_i8_tn", "result": "REJECTED: target case2 and all protected cases regressed; the early B2/B3 LDG issue hypothesis is refuted.", "schema_version": 1, "timestamp": "2026-08-26T16:43:57+00:00"}
{"artifacts": ["artifacts/raw/c500-runs/exp-20260827-154-1b446c6ffbd3-a01", "handoffs/exp-20260827-154.md"], "baseline_commit": "287eb38a6dda53048e24960eba39879e548fc977", "benchmark": "ABBA case1 1.0280 to 1.0510 ms (+2.2374 percent); case2 6.0625 to 6.1300 (+1.1134), arms 6.062/6.063 to 6.130/6.130; case3 +2.0165; case4 +1.3121 percent.", "candidate_commit": "1b446c6ffbd3e4616a6ed9a97720b0b261228e3d", "change": "Moved only two ordinary B2/B3 shared-store issue sites to immediately after the first steady CTA barrier; addresses, bytes, LDG/LDS/MMA/barriers, B0/B1, A path, mapping, epilogue and ABI stayed exact.", "correctness": "PASS: independent lifecycle/mapping audit; C500 builds; 3/3 differential correctness matched_ratio 1.0 max_abs 0; full regression, sampled/read-only correctness, source/tree integrity and all 31 manifest entries.", "decision": "revert", "device": "c500-local", "environment": "MetaX C500 xcore1000 device 0; MACA 3.7.1.5; MXCC 1.0.0 d9102a1572; driver 3.8.30; 25 percent compute / 16000 MiB slice; no device process before or after; NVIDIA disabled.", "hypothesis": "Moving next-image B2/B3 stores to the first legal post-barrier point improves case2 and both arms by at least 1 percent without protected regression or worse resources.", "id": "exp-20260827-154", "language": "CUDA Maca", "notes": "Tested 1b446c6ffbd3; queue tip f1ac62aee58184023dafe0ec6386f1006870db59; source blob 6fb63e5876c98f66c2342e9b7f55854a74fe04ae; LF SHA-256 da744ce6be344e6ca3c73853f1bdf8fc146575ce250f5d3ebb325e269322f033; resources unchanged 20/254/40/32768/2. Attempt 1 was invoked outside an Auditor read-only envelope; Main independently validated status, identities, hashes, correctness, resources, ABBA and 31-entry manifest and accepted the artifact as authoritative. No repeat/profile/integration/NVIDIA/OJ.", "operator": "fused_moe_i8_tn", "result": "REJECTED: every case regressed; contiguous first-legal B2/B3 publication hurts target issue scheduling despite unchanged resources.", "schema_version": 1, "timestamp": "2026-08-26T16:44:19+00:00"}
{"artifacts": ["artifacts/raw/c500-runs/exp-20260827-155-36b9724b18b3-a01", "handoffs/exp-20260827-155.md"], "baseline_commit": "287eb38a6dda53048e24960eba39879e548fc977", "benchmark": "ABBA case1 1.0405 to 1.0420 ms (+0.1442 percent), arms -0.3820/+0.6770 percent; case3 0.5480 to 0.5375 (-1.9161), arms -1.8248/-2.0073; sorted case2 -0.0330 and case4 -0.0442 percent.", "candidate_commit": "36b9724b18b3614a246526f79f96c5733f744641", "change": "Added compile-time sorted/unsorted selection so only the unsorted clone uses exp-152 B0/B1 consumer-local LDS; sorted case2/4 projects exactly to formal best, with all other operations unchanged.", "correctness": "PASS: independent lifecycle/mapping audit; C500 builds; 3/3 differential correctness matched_ratio 1.0 max_abs 0; full regression, sampled/read-only correctness, source/tree integrity and all 31 manifest entries.", "decision": "revert", "device": "c500-local", "environment": "MetaX C500 xcore1000 device 0; MACA 3.7.1.5; MXCC 1.0.0 d9102a1572; driver 3.8.30; 25 percent compute / 16000 MiB slice; no device process before or after; NVIDIA disabled.", "hypothesis": "Selecting consumer-local B0/B1 LDS only for unsorted decode retains at least 1.5 percent case1 and 1 percent case3 improvement in aggregate and both arms while sorted cases remain formal-best exact.", "id": "exp-20260827-155", "language": "CUDA Maca", "notes": "Tested 36b9724b18b3; queue tip afaee02cd8bb47a69da2659bcc0347b2f3594472; source blob b15e383c0b16dbb08941c7de36ef496e4bd1f560; LF SHA-256 a1d7ef773b32ad4437308ad6327013b44f0f3bc5bbfc6d493a2d8b29dfd5eb70. Sorted resources 20/254/40/32768/2; unsorted 0/250/40/32768/2. Case3 result may be reused only through a newly isolated case3 experiment. No repeat/profile/integration/NVIDIA/OJ.", "operator": "fused_moe_i8_tn", "result": "REJECTED: case3 improved and sorted paths stayed neutral, but mandatory case1 aggregate/both-arm gain failed and one case1 arm exceeded the 0.5 percent protection gate.", "schema_version": 1, "timestamp": "2026-08-26T16:44:47+00:00"}
{"artifacts": ["artifacts/raw/c500-runs/exp-20260827-156-66bb7d514d83-a01", "handoffs/exp-20260827-156.md"], "baseline_commit": "287eb38a6dda53048e24960eba39879e548fc977", "benchmark": "ABBA case2 6.0575 to 6.0185 ms (-0.6438 percent), arms -0.6603/-0.6274 percent; case1 +0.8165 percent with arm A +1.5340 percent; case3 0.0000 percent; case4 -0.0738 percent. Case2 baseline/candidate drift -0.0165/+0.0166 percent.", "candidate_commit": "66bb7d514d83ca2543e9f197c012024da31e9da2", "change": "Added optional fixed EM/N/K carriers and selected full exact 32768x4096x7168 dimensions only for sorted case 2; runtime sorted precedes the fixed reference and case 4 plus unsorted paths remain runtime, with the kernel suffix and formal late-A00/A01 schedule exact.", "correctness": "PASS: focused reverse projection and 14 local tests; C500 candidate/baseline build; 3/3 differential correctness matched_ratio 1.0 max_abs 0; full regression, sampled/read-only correctness, source/tree integrity, no-process gate and 31-entry manifest.", "decision": "revert", "device": "c500-local", "environment": "MetaX C500 xcore1000 device 0; MACA 3.7.1.5; MXCC 1.0.0 d9102a1572; driver 3.8.30; 25 percent compute / 16000 MiB slice; no device process after; NVIDIA disabled.", "hypothesis": "Replaying exact case-2 full dimensions on exp-150 improves case 2 aggregate and both arms by at least 1.0 percent, protects every other aggregate and arm within 0.5 percent, and preserves runtime resources with fixed ST at most 40.", "id": "exp-20260827-156", "language": "CUDA Maca", "notes": "Tested 66bb7d514d83; queue tip dbee37622982. Source blob fe016d42832824ebd87534da80e3f7e79417afff; LF SHA-256 7960251eb1e84229d8cd79181afb3c31af8ce073f68464ac3e285723c3c84a6c. No repeat/profile/integration/NVIDIA/OJ; historical exact case2 dimensions do not compose strongly enough with exp-150.", "operator": "fused_moe_i8_tn", "result": "REJECTED: fixed case2 codegen reached 0 stack / 232 MT / 40 ST while runtime clones stayed 20/254/40, but target gain missed 1.0 percent and protected case1 aggregate and arm A exceeded 0.5 percent.", "schema_version": 1, "timestamp": "2026-08-26T17:01:58+00:00"}
{"artifacts": ["artifacts/raw/c500-runs/exp-20260827-157-3b24fb923b04-a01", "handoffs/exp-20260827-157.md"], "baseline_commit": "287eb38a6dda53048e24960eba39879e548fc977", "benchmark": "ABBA case3 0.5480 to 0.5375 ms (-1.9161 percent), arms -2.3679/-1.4625 percent; case1 +1.2124 percent with arms -1.3321/+3.8576 percent; case2 exactly neutral; case4 -0.0589 percent. Case1 baseline/candidate drift -3.8059/+1.2536 percent.", "candidate_commit": "3b24fb923b04cfc9583d093b2d1462edddea1b33", "change": "Added one exact case3 selector and fixed dimension clone; only that clone uses consumer-local B0/B1 LDS while runtime unsorted case1 and sorted cases2/4 project exactly to exp-150. All B2/B3, A scheduling, LDG/STS/MMA/barriers, addresses, map/grid, epilogue and ABI remain protected.", "correctness": "PASS: independent audit approved exact ancestry/reservations, case3-only dispatch, T=16 lifecycle, four-wave payload mapping, barriers, ABI and read-only inputs; local 7/7 and combined 22/22 tests; C500 build, 3/3 differential correctness matched_ratio 1.0 max_abs 0, full regression, sampled/read-only, integrity, no-process and 31-entry manifest.", "decision": "revert", "device": "c500-local", "environment": "MetaX C500 xcore1000 device 0; MACA 3.7.1.5; MXCC 1.0.0 d9102a1572; driver 3.8.30; 25 percent compute / 16000 MiB slice; no device process after; NVIDIA disabled.", "hypothesis": "A fixed unsorted 4096x7168x2048 clone that alone selects consumer-local B0/B1 combines separately measured exact-case3 and B0/B1 gains to improve case3 aggregate and both arms by at least 3.5 percent while protecting every case1/2/4 arm within 0.5 percent.", "id": "exp-20260827-157", "language": "CUDA Maca", "notes": "Tested 3b24fb923b04; queue tip f3d4547c6e55. Source blob 8e347008ab4cc8fdc06ddafdec130af19a7707c8; LF SHA-256 4d0c4110e652c3a30c66ffb0ca1c53d29c309686402f9aa70dfca16d995ff485. Independent audit approve/no findings. No repeat/profile/integration/NVIDIA/OJ.", "operator": "fused_moe_i8_tn", "result": "REJECTED: fixed case3 resources reached 0 stack / 234 MT / 40 ST while runtime clones stayed 20/254/40, but target case3 and both arms missed 3.5 percent and protected case1 arm B regressed 3.8576 percent; exact dimensions added no measurable gain over case3-only B0/B1.", "schema_version": 1, "timestamp": "2026-08-26T17:04:28+00:00"}
