{"artifacts": ["artifacts/raw/c500-runs/exp-20260827-178-778d9c4f0f20-a01", "handoffs/exp-20260827-178.md"], "baseline_commit": "235a34a22889c4d1ce5465acc2daaf1cdb67547d", "benchmark": "ABBA case3 0.5405 to 0.5410 ms (+0.0925 percent), arms 0/+0.1852 percent; case4 3.3225 to 3.3190 ms (-0.1053 percent), arms -0.0602/-0.1506 percent; case2 +0.0330 percent.", "candidate_commit": "778d9c4f0f20e8d1ba7e6659897245ceb365d4cd", "change": "Replaced two repeated wide output-row products with one uint32 element offset widened at the unchanged pointer additions; store width, values, predicates, order, coverage, dispatch and kernel schedule remained exact.", "correctness": "PASS: 37/37 local focused/workflow tests; C500 candidate/baseline builds; 3/3 differential correctness at matched_ratio 1.0 and max_abs 0; full regression, sampled/read-only correctness, integrity and independently rehashed 31-entry manifest.", "decision": "revert", "device": "c500-local", "environment": "MetaX C500 xcore1000 device 0; MACA 3.7.1.5; MXCC 1.0.0 d9102a1572; driver 3.8.30; 25 percent compute / 16000 MiB slice; no device process before or after; NVIDIA, TileLang and Triton disabled.", "hypothesis": "Compute each output row times N once in a proven-bounded uint32 carrier and reuse it at both b64 stores to improve at least one down case aggregate and both arms by 1 percent while protecting all observations within 0.5 percent.", "id": "exp-20260827-178", "language": "CUDA Maca", "notes": "Tested 778d9c4f0f20e8d1ba7e6659897245ceb365d4cd; queue tip 65c6a7e14292b288c8265fee228fb53f79d427bd; source blob 82f21dc555214caf4962808ce38f946e20df8e84; no repeat/profile/integration/OJ.", "operator": "fused_moe_i8_tn", "result": "REJECTED: neither down case aggregate-and-both-arm triple approached the required 1 percent; resources were unchanged.", "schema_version": 1, "timestamp": "2026-08-27T01:05:07+00:00"}
{"artifacts": ["artifacts/raw/c500-runs/exp-20260827-179-b715bdcd7ca3-a01", "handoffs/exp-20260827-179.md"], "baseline_commit": "235a34a22889c4d1ce5465acc2daaf1cdb67547d", "benchmark": "ABBA case4 3.3240 to 3.3225 ms (-0.0451 percent), arms 0/-0.0902 percent; protected case1 1.0005 to 1.0405 ms (+3.9980 percent), arms +3.100/+4.895 percent; case2 +0.0247 percent; case3 flat.", "candidate_commit": "b715bdcd7ca3048f953ef59f0b8e27e72582b858", "change": "Selected constant true only for the exact fixed case4 template at both existing b64 predicated store sites; store intrinsic, address, value, order, traffic and every runtime predicate remained exact.", "correctness": "PASS: 37/37 local focused/workflow tests; C500 candidate/baseline builds; 3/3 differential correctness at matched_ratio 1.0 and max_abs 0; full regression, sampled/read-only correctness, integrity and independently rehashed 31-entry manifest.", "decision": "revert", "device": "c500-local", "environment": "MetaX C500 xcore1000 device 0; MACA 3.7.1.5; MXCC 1.0.0 d9102a1572; driver 3.8.30; 25 percent compute / 16000 MiB slice; no device process before or after; NVIDIA, TileLang and Triton disabled.", "hypothesis": "Constant-fold only the exact fixed case4 clone store predicates to true to improve case4 aggregate and both arms by 1 percent while protecting all other observations within 0.5 percent.", "id": "exp-20260827-179", "language": "CUDA Maca", "notes": "Tested b715bdcd7ca3048f953ef59f0b8e27e72582b858; queue tip 05437b2434c2cd91341ed0126c30b9015d1ce8cb; source blob f49ccc2871d512d4fc79af60fbbb96cfcc8f5c9e; no repeat/profile/integration/OJ.", "operator": "fused_moe_i8_tn", "result": "REJECTED: case4 was effectively flat despite fixed-clone ST registers falling 40 to 30, and protected case1 hard-failed aggregate and both-arm ceilings.", "schema_version": 1, "timestamp": "2026-08-27T01:08:16+00:00"}
{"artifacts": ["artifacts/raw/c500-runs/exp-20260827-180-e1c5b9bd14b9-a01", "handoffs/exp-20260827-180.md"], "baseline_commit": "235a34a22889c4d1ce5465acc2daaf1cdb67547d", "benchmark": "ABBA case2 6.0605 to 5.9785 ms (-1.3530 percent), arms 6.061 to 5.980 (-1.3364 percent) and 6.060 to 5.977 (-1.3696 percent). Protected case1 -0.7174 percent, case3 -1.0082 percent and case4 -0.0902 percent; every protected arm was favorable or flat.", "candidate_commit": "e1c5b9bd14b98abb6120a09420424b15910b7cfe", "change": "Selected exact sorted case 2 as <true,0,4096,7168> and only in that clone retasked the existing four load_b_row slots as bounded uint32 expert-local byte offsets; the 64-bit expert base, all loads, schedule, map/grid, synchronization, MMA/LDS, epilogue, fixed case4 clone and ABI stayed exact.", "correctness": "PASS: independent address/dispatch/ABI audit; local focused and workflow tests; C500 candidate/baseline builds; 3/3 differential correctness matched_ratio 1.0/max_abs 0; full regression, sampled/read-only correctness, source/tree integrity, no-process gates and independently rehashed 31-entry manifest.", "decision": "keep", "device": "c500-local", "environment": "MetaX C500 xcore1000 device 0; MACA 3.7.1.5; MXCC 1.0.0 d9102a1572; driver 3.8.30; authorized 25 percent compute / 16000 MiB slice; no device process before or after; NVIDIA, TileLang and Triton disabled.", "hypothesis": "Composing exact case-2 N/K specialization with in-place bounded uint32 expert-local B-row carrier reuse improves case 2 aggregate and both C500 arms by at least 1.2 percent, protects every other aggregate and arm within 0.5 percent, and keeps the target clone within 0 stack / 254 MT / 40 ST / 32768 shared / 2 warps.", "id": "exp-20260827-180", "language": "CUDA Maca", "notes": "Tested e1c5b9bd14b98abb6120a09420424b15910b7cfe; queue tip 2eab389e49f4718dfbf5844c081d5b918e6191a9; integrated source commit b5d5a2b. Source blob 5e1b0ab494047cc565feb1969f2f119eb0c3f294; LF SHA-256 dfa9bdea39d86896fad6827bd7c2f57957d438f12a9013fdbcbec5406a828e07. Independent audit APPROVE with 1835008 exact B addresses. Transport candidate/baseline SHA-256 d7cbe3fbaaeeb97eced35cbfa8488bc9c97f00727b4aeb2911f85fdc1802aefa / 4c7100e457fda5b8e1ffe32d9dff448fc6366f742435723e02393e6d334f3ccc; 31/31 manifest entries independently match. Eligible for serialized OJ; local absolute time is not OJ-equivalent.", "operator": "fused_moe_i8_tn", "result": "KEEP: all target, protected-arm and resource gates passed in one stable attempt; exact case2 resources improved to 0 stack / 230 MT / 40 ST / 32768 shared / 2 warps while fixed case4 and runtime unsorted stayed protected.", "schema_version": 1, "timestamp": "2026-08-27T01:59:56+00:00"}
{"artifacts": ["handoffs/exp-20260827-181.md", "artifacts/raw/c500-codegen/formal-best-exp080-20260826-a01/xcore1000.ll"], "baseline_commit": "235a34a22889c4d1ce5465acc2daaf1cdb67547d", "benchmark": "No C500 run: xcore1000 IR preflight found the steady B-load add, extension and GEP chain remains; fixed N/K folding is preloop/tail only, so the claimed >=344064 net instruction deletion is unsupported.", "candidate_commit": "f5811a123a4b250676431b077c157f69c346e951", "change": "Only exact case-3 dispatch and the four existing load_b_row slots/steady-tail B-address operands change; the candidate preserves B bytes, predicates, order, map/grid, LDS, barriers, MMA, epilogue and ABI.", "correctness": "PASS (no-device): independent audit enumerated all 917504 B vector starts with zero equality/alignment/bounds/signed-carrier failures; dispatch, schedule projection, ABI and read-only inputs are exact.", "decision": "revert", "device": "cpu", "environment": "No device accessed. Static preflight used formal-best xcore1000 LLVM IR from artifacts/raw/c500-codegen/formal-best-exp080-20260826-a01 and candidate source; C500, NVIDIA, TileLang, Triton and OJ disabled.", "hypothesis": "An exact case-3 <false,0,7168,2048> clone with in-place bounded uint32 expert-local B-row carriers deletes at least 344064 main instructions without compensating work.", "id": "exp-20260827-181", "language": "CUDA Maca", "notes": "Candidate source blob 2f376b7cfd459eefeaa7b164f3f274de3cbdd54b; LF SHA-256 9e0c3b255f1bd2508f477f3386e53940ec7dd82edb06a888e31952b19b48da27. Independent safety audit APPROVE only; native lowering/resources/timing not approved. The prior source model incorrectly described three deletions per B event although 344064 corresponds to three per wave/K tile, and the baseline steady chain remains structurally present.", "operator": "Fused MoE i8 tn", "result": "REJECTED before C500: performance preflight finds no defensible >=1 percent main-instruction reduction; do not build, time, integrate, enqueue or submit.", "schema_version": 1, "timestamp": "2026-08-27T03:35:23+00:00"}
{"artifacts": ["artifacts/raw/c500-runs/exp-20260827-182-a0b838f11c01-a01", "handoffs/exp-20260827-182.md"], "baseline_commit": "235a34a22889c4d1ce5465acc2daaf1cdb67547d", "benchmark": "C500 ABBA case3 0.5420 to 0.5350 ms (-1.2915 percent), arms 0.539 to 0.531 (-1.4842 percent) and 0.545 to 0.539 (-1.1009 percent), baseline/candidate drift 1.1132/1.5066 percent. Protected case1 -1.4776 percent, case2 -0.0495 percent and case4 -0.2401 percent, with no protected arm beyond the 0.5 percent ceiling.", "candidate_commit": "a0b838f11c01d1d3acfe02b75d4a1ec77ffd28b2", "change": "Added only the exact decode-down selector and fixed unsorted launch; kernel body, sorted paths, map/grid, addresses, synchronization, epilogue and ABI stayed exact.", "correctness": "PASS: 22/22 focused/inherited no-device tests plus 15/15 workflow/ABBA tests; C500 candidate/baseline builds, 3/3 differential correctness at matched_ratio 1.0/max_abs 0, full regression, all-zero read-only, sampled correctness, source/tree integrity and 31-entry manifest.", "decision": "revert", "device": "c500-local", "environment": "MetaX C500 xcore1000 device 0; MACA 3.7.1.5; MXCC 1.0.0 d9102a1572; driver 3.8.30; 25 percent compute / 16000 MiB slice; no device process before or after; NVIDIA, TileLang and Triton disabled.", "hypothesis": "An exact case-3 full-fixed 4096x7168x2048 clone after the runtime-unsorted reference improves case-3 aggregate and both ABBA arms by at least 1.5 percent while protected observations remain within 0.5 percent and the clone stays within 0/232/40/32768/2.", "id": "exp-20260827-182", "language": "CUDA Maca", "notes": "Tested a0b838f11c01; metadata handoff 119dec586b7f2dcb8b2c0b7705327b8d61ddd009. Candidate source blob eefa7754d3be3eda35cde6f1b4d1414448aa138c; LF SHA-256 58a23b5ee1b1d049ac3b05ab180c9069c6500b66fdcf90e4f892b001268d75f7. Raw stage source SHA-256 candidate/baseline f04b1d4feace6516857b86cead603929f0789a86c2fad562f2c6c2418bec12cf / 4c7100e457fda5b8e1ffe32d9dff448fc6366f742435723e02393e6d334f3ccc; workflow/candidate/baseline/stage archives e75b395e8ed7d45a8e87dc020524bbc1b3bc9906e954f8234858a1f22c316a2a / 777dd8ff057116c7c3bf3f820878ba53447532eeaa3c5d272f34a9bc6fc8913e / aa366722f62ee409474596d898d280fa8e781c4124976a48e769ead8a456271f / 2b83a1f81233a4c2f65dfbc13f03286c06d2e7d74171416d3abe8efd3daf8682. Same source mechanism as exp-168 replay, rejected under current 1.5 percent gate; no enqueue/OJ.", "operator": "fused_moe_i8_tn", "result": "REJECTED: target aggregate and both arms miss the precommitted 1.5 percent promotion gate; candidate drift is 1.5066 percent, so no repeat, integration, enqueue or OJ attempt.", "schema_version": 1, "timestamp": "2026-08-27T04:14:39+00:00"}
{"artifacts": ["artifacts/raw/c500-runs/exp-20260827-183-9bc9006f58fd-a01", "handoffs/exp-20260827-183.md"], "baseline_commit": "235a34a22889c4d1ce5465acc2daaf1cdb67547d", "benchmark": "ABBA: case1 1.0310 to 1.1380 ms (+10.3783%); case2 6.0605 to 6.3815 ms (+5.2966%); case3 0.5450 to 0.5685 ms (+4.3119%); case4 3.3265 to 3.5370 ms (+6.3280%). Every aggregate and both arms regressed; resources unchanged.", "candidate_commit": "9bc9006f58fd8a10e325691e8fc7f713a8fa3b81", "change": "Only the initial and steady four A b128 global-to-register loads use __builtin_mxc_load_global_async128; addresses, bytes, LDS/STS, MMA, barriers, mapping, dispatch, epilogue and ABI remain exact.", "correctness": "PASS: candidate/baseline C500 builds, 3/3 differential correctness at matched_ratio 1.0/max_abs 0, full regression, all-zero/read-only and sampled correctness, integrity and independently rehashed 31-entry manifest.", "decision": "revert", "device": "c500-local", "environment": "MetaX C500 xcore1000 device 0; MACA 3.7.1.5; MXCC 1.0.0 d9102a1572; 25 percent compute / 16000 MiB slice; no device process before or after; NVIDIA, TileLang and Triton disabled.", "hypothesis": "Replacing only proven-in-bounds A ldg_b128 calls with the public MCTLASS load_global_async128 builtin improves case 2 by at least 1 percent without protected-case regression.", "id": "exp-20260827-183", "language": "CUDA Maca", "notes": "Tested 9bc9006f58fd8a10e325691e8fc7f713a8fa3b81; metadata handoff 5b98fd0. Candidate source blob 422ab48c986b3a26c0a9060bc6796e93aafa6e1a; source SHA-256 d944a6403b7a2315bb756982f4ce95da135083475234afc351c0e2f8053534ee. Fixed/runtime resources 0/230/40/32768/2 and 20/254/40/32768/2. C500 raw source hashes candidate/baseline d944a6403b7a2315bb756982f4ce95da135083475234afc351c0e2f8053534ee / 4c7100e457fda5b8e1ffe32d9dff448fc6366f742435723e02393e6d334f3ccc; workflow/candidate/baseline/stage archives 582a713b92f9fe0e2e0f1c56b42da0181565f7e9acea8a3dccf06811e9157ad6 / bf1d61b83766d6d2c94af4e5181af8806c7542a7bd53678ed487d022e8bb995a / aa366722f62ee409474596d898d280fa8e781c4124976a48e769ead8a456271f / 2b83a1f81233a4c2f65dfbc13f03286c06d2e7d74171416d3abe8efd3daf8682. Do not profile/replay this spelling family.", "operator": "fused_moe_i8_tn", "result": "REJECTED: target-supported async global-to-register A-load spelling is decisively slower in all public shapes; no repeat, integration, enqueue or OJ submission.", "schema_version": 1, "timestamp": "2026-08-27T07:20:34+00:00"}
{"artifacts": ["artifacts/raw/c500-runs/exp-20260827-184-e6a0760a6033-a01", "handoffs/exp-20260827-184.md"], "baseline_commit": "235a34a22889c4d1ce5465acc2daaf1cdb67547d", "benchmark": "C500 ABBA case2 6.0565 to 5.9780 ms (-1.2961 percent), arms -1.2715/-1.3218 percent; protected case1 -1.0000 percent, case3 +0.1850 percent, case4 +0.1204 percent.", "candidate_commit": "e6a0760a60338862a385db025153a987da2d25ce", "change": "Only exact sorted case 2 dispatches to <true,32768,4096,7168> and retasks four existing B-row carriers as bounded expert-local uint32 byte offsets; all load sequence, schedule, map/grid, barriers, LDS, MMA, epilogue and ABI remain exact.", "correctness": "PASS: 24/24 focused static tests; candidate/baseline C500 builds; 3/3 differential correctness matched_ratio 1.0/max_abs 0; full regression, sampled and all-zero read-only correctness, integrity, no-process gates and verified 31-entry manifest.", "decision": "revert", "device": "c500-local", "environment": "MetaX C500 xcore1000 device 0; MACA 3.7.1.5; MXCC 1.0.0 d9102a1572; 25 percent compute / 16000 MiB slice; no device process before or after; NVIDIA, TileLang and Triton disabled.", "hypothesis": "Full-fixed sorted case-2 plus in-place uint32 expert-local B-row carriers improves case-2 aggregate and both ABBA arms by at least 1.5 percent while protected observations remain within 0.5 percent.", "id": "exp-20260827-184", "language": "CUDA Maca", "notes": "Tested e6a0760a60338862a385db025153a987da2d25ce; metadata handoff deeb29efc0861d801f83aabc378b34c113886404. Source blob de78ffa4a69773d0114f6a5a4c77041e327e3ddc; LF SHA-256 06d76bcfa5d2008326df00a779ce0d34118060a921994c8d190c6cb86b6acf33. C500 staged candidate/baseline source SHA-256 9fda2ab4070b7c44371c4c2e21b21c6f76dff09bfe025be07b7a2b2baa241f08 / 4c7100e457fda5b8e1ffe32d9dff448fc6366f742435723e02393e6d334f3ccc.", "operator": "fused_moe_i8_tn", "result": "REJECTED: target aggregate and both arms are stable but below the precommitted 1.5 percent gate; no enqueue, integration or OJ submission.", "schema_version": 1, "timestamp": "2026-08-27T08:15:45+00:00"}
{"artifacts": ["artifacts/raw/c500-runs/exp-20260827-185-65893b28c2ad-a01"], "baseline_commit": "235a34a22889c4d1ce5465acc2daaf1cdb67547d", "benchmark": "C500 ABBA: prefill-gate-up baseline 6.0585 ms, candidate 6.8230 ms, +12.61863497565403%; candidate arms 6.722/6.924 ms vs baseline 6.060/6.057 ms.", "candidate_commit": "65893b28c2addec5febc5482c466907d562db58f", "change": "Case-2-only B0-B3 raw BSM replaces four steady normal B payload loads and LDS stores; adds arrive(64), arrive(4096), barrier_inst before the existing CTA publication.", "correctness": "C500 build exit 0; randomized correctness and regression PASS; independent synchronization audit approved before run.", "decision": "revert", "device": "c500-local", "environment": "MetaX C500/xcore1000; MACA 3.7.1.5; device 0; 25% compute; 16000 MiB; workflow 2189fb94fddf2409b4ad7d9dbf092571ec81f9.", "hypothesis": "Exact sorted case-2 raw async BSM B0-B3 with documented gvmcnt and bsmcnt completion before CTA publication improves steady global-to-shared staging.", "id": "exp-20260827-185", "language": "CUDA Maca", "notes": "Audited documented dual-counter BSM completion is correct but the wait path regressed case 2; reject without OJ and close BSM-counter completion family.", "operator": "Fused MoE i8 tn", "result": "Correct but target-regressed; protected deltas decode gate-up -1.06075%, decode down -0.09242%, prefill down -0.21046%.", "schema_version": 1, "timestamp": "2026-08-27T09:54:00+00:00"}
{"artifacts": ["handoffs/exp-20260827-186.md", "artifacts/raw/c500-codegen/exp107-codegen-20260826-a01/xcore1000.ll"], "baseline_commit": "235a34a22889c4d1ce5465acc2daaf1cdb67547d", "benchmark": "No C500 run: saved formal-best fixed-case4 xcore1000 IR already hoists/folds the claimed coordinate work, and the candidate provides no comparative native instruction deletion.", "candidate_commit": "994169d1cb159f5631669320dd4c55c3f122d310", "change": "Only the existing four fixed-case4 B-row carriers and five B address operands change; load traffic/order, map/grid, shared/MMA/barriers, epilogue and ABI remain exact.", "correctness": "PASS no-device: focused proof 7/7 and independent exhaustive audit covered 917504 local B b128 starts plus all 256 expert intervals with zero address, alignment or bounds failures.", "decision": "revert", "device": "cpu", "environment": "No device accessed. Static preflight used saved formal-best xcore1000 LLVM IR; C500, NVIDIA, TileLang, Triton and OJ were disabled.", "hypothesis": "Exact fixed case-4 in-place bounded uint32 B-row offsets delete at least 1 percent of critical native work without protected regression.", "id": "exp-20260827-186", "language": "CUDA Maca", "notes": "Queue tip 00003a73e4f0e58c0c9799d2d0c603a8814950a5; controller rejected after immutable enqueue. Candidate source blob 8d433829d261e80b9531f68915d71f6ff543adc2; LF SHA-256 7e1bae3ed14f88537ec666a6767c7c7540a09274af262f223bb2718b1e3fcf8b. Original issue model confused lane/scalar operations with native issues: B wave-load 3670016, native MMA 117440512.", "operator": "Fused MoE i8 tn", "result": "REJECTED before C500/OJ: the native performance model fails the approximately 1 percent structural gate.", "schema_version": 1, "timestamp": "2026-08-27T12:26:23+00:00"}
{"artifacts": ["artifacts/raw/c500-runs/exp-20260827-187-d1c242fe6ce9-a01", "handoffs/exp-20260827-187.md"], "baseline_commit": "235a34a22889c4d1ce5465acc2daaf1cdb67547d", "benchmark": "C500 ABBA case2 6.1175 to 9.0360 ms (+47.7074 percent), baseline arms 6.121/6.114 ms and candidate arms 9.033/9.039 ms; protected case4 +0.6420 percent.", "candidate_commit": "d1c242fe6ce95f31f2afd29953bfd768ecaf47b3", "change": "Added an exact sorted case-2-only 128x256x128, 512-thread/eight-wave kernel that shares one A tile across paired N waves while preserving 128-column B/output ownership; all other paths and ABI remain exact.", "correctness": "PASS: independent exact-commit coverage/lifecycle audit; local focused 10/10 and workflow/ABBA 15/15; C500 candidate/baseline builds, 3/3 differential correctness at matched_ratio 1.0/max_abs 0, full regression, sampled/all-zero read-only correctness, integrity and independently rehashed 31-entry manifest.", "decision": "revert", "device": "c500-local", "environment": "MetaX C500 xcore1000 device 0; MACA 3.7.1.5; MXCC 1.0.0 d9102a1572; 25 percent compute / 16000 MiB slice; no device process before or after; NVIDIA, TileLang and Triton disabled.", "hypothesis": "Halving exact case-2 CTA count through a 128x256x128 eight-wave wide-N tile improves case-2 aggregate and both arms by at least 1 percent while every protected observation remains within 0.5 percent.", "id": "exp-20260827-187", "language": "CUDA Maca", "notes": "Tested d1c242fe6ce95f31f2afd29953bfd768ecaf47b3; queue tip 21c7b0ca1257033ca1f70df85a1672cd5b8710d4; source blob 2249dfccc95da02068e14463e6df6b1328148cee; LF SHA-256 2c7967f37ce1f457210cea9ad1cb99416e7c59ccc3cb64fc9887adb4eb5dc30f; job blob 7f91ad9b45b58a3fa128a95aeb839c7630bc5662. Candidate resources 0 stack / 244 MT / 40 ST / 49152 shared / 2 warps. Controller rejected after immutable enqueue; no repeat/profile/integration/OJ.", "operator": "fused_moe_i8_tn", "result": "REJECTED: stable target regression of 47.7074 percent and protected case4 regression above the 0.5 percent ceiling.", "schema_version": 1, "timestamp": "2026-08-27T13:39:10+00:00"}
