{"artifacts": ["artifacts/raw/remote-runs/exp-20260823-036-3f59ed9d56b5-a01/status.json", "artifacts/raw/remote-runs/exp-20260823-036-3f59ed9d56b5-a01/stdout.log", "artifacts/raw/remote-runs/exp-20260823-036-3f59ed9d56b5-a01/environment.txt", "artifacts/raw/remote-runs/exp-20260823-036-3f59ed9d56b5-a01/gpu-before.csv", "artifacts/raw/xpuoj/123033/result-page.png", "artifacts/raw/xpuoj/123033/testpoints.png", "artifacts/raw/xpuoj/123033/scoreboard.png", "artifacts/raw/xpuoj/123033/result-summary.json", "artifacts/raw/xpuoj/123033/spj-report.txt"], "baseline_commit": "8c519e6c1bb57e7b124b60806db9575fa1267207", "benchmark": "proxy/NVIDIA RTX A5000 GPU 0 medians: cases 1-4 45.549, 333.616, 21.190 and 167.675 ms, one warmup and five samples. NVIDIA executes the unchanged fallback. Modeled B fragment state falls 64->32 int32/thread with 32-KiB LDS, A/B LDG 4/4, STS 4/4, LDS 4/16 and 128 MMA/tile unchanged. Target/C500 XPU-OJ #123033: case scores 82/72/88/83; exact user-kernel times 1.063/8.499/0.558/4.212 ms; 81.25 total versus the 82.25 formal best.", "candidate_commit": "f9ca15cb3e3e77b17e79f92810f047177c422d74", "change": "Changed b_frag[8][8] to b_frag[4][8], separated logical accumulator column from physical B slot, and rescheduled both steady and peeled-tail tiles so slots 0..3 are reloaded for logical columns 4..7 only after final group-0 use. CTA geometry, 32-KiB LDS, global A/B traffic, 128 MMAs per tile, output and NVIDIA fallback remain unchanged.", "correctness": "PASS on committed proxy/NVIDIA snapshot 3f59ed9d56b5afedbf985fad621fb5d7dab2c2bc: exact protected baseline projection; CUDA 12.2 build; three differential cases matched_ratio=1/max_abs=0; exhaustive B identity, per-wave cover, T=1/2/16/56 lifecycle, 16 accumulator chains, same-wave A ownership, exact traffic/resource/barrier model and all-zero/read-only regression; empty stderr. Independent detached audit re-derived provenance, every physical-slot identity, overwrite lifetime, both barrier phases, moved A LDS ownership and the source-level -32 int32/thread claim and approved one target submission. TARGET PASS: XPU-OJ #123033 compiled for xcore1000 and passed the sample plus all four test cases.", "decision": "revert", "device": "nvidia", "environment": "proxy/NVIDIA physical GPU 0 RTX A5000; UUID GPU-c59b5457-918c-909d-424d-afb0736b687a; driver 535.261.03; CUDA 12.2 nvcc V12.2.140; sm_86; run exp-20260823-036-3f59ed9d56b5-a01 at 2026-08-23T06:57:26+08:00; target XPU-OJ CUDA Maca C500 submission #123033 at 2026-08-23T07:27:25+08:00", "hypothesis": "Time-multiplexing four physical B-fragment columns across two logical groups reduces explicit B state from 64 to 32 int32 values per thread while preserving exact traffic, MMA, LDS and barriers, potentially improving C500 residency or scheduling by about one score step.", "id": "exp-20260823-036", "language": "CUDA Maca (target B-fragment strip mining plus NVIDIA compatibility path)", "notes": "Candidate LF source SHA-256 acfa6b9331047d5db7976ff2b00c044d869e89d3dd1d1973037b238fa33d37a2; remote-tested source/job commit 3f59ed9d56b5afedbf985fad621fb5d7dab2c2bc; final queued handoff tip f9ca15cb3e3e77b17e79f92810f047177c422d74; integrated OJ commit eccd5ec49f6442f2c15a7bfe7704f645595d7cfa. Target acceptance resolves mapping and same-wave correctness, but the source-level B-fragment reduction did not produce an allocation or scheduling benefit: case 2 slowed to 8.499 ms and total score fell by 1.00. Restore exact formal-best source 8c519e6c1bb5 and close B-fragment strip mining absent target register-count evidence.", "operator": "Fused MoE i8 tn", "result": "TARGET REJECTED: XPU-OJ #123033 was Accepted 4/4 at 81.25, but B-fragment strip mining scored 1.00 below formal best #117114. Restore the 82.25 formal-best source.", "schema_version": 1, "timestamp": "2026-08-23T06:57:26+08:00"}
{"artifacts": ["artifacts/raw/remote-runs/exp-20260823-038-fb459e2f6d77-a01/status.json", "artifacts/raw/remote-runs/exp-20260823-038-fb459e2f6d77-a01/stdout.log", "artifacts/raw/remote-runs/exp-20260823-038-fb459e2f6d77-a01/environment.txt", "artifacts/raw/remote-runs/exp-20260823-038-fb459e2f6d77-a01/gpu-before.csv"], "baseline_commit": "8c519e6c1bb57e7b124b60806db9575fa1267207", "benchmark": "proxy/NVIDIA RTX A5000 GPU 2 medians: cases 1-4 45.499, 330.777, 21.000 and 167.607 ms, one warmup and five samples. NVIDIA executes the unchanged fallback and cannot validate BSM completion or ordinary-STS visibility on C500.", "candidate_commit": "9f76431d86ba96113948c25d988922c675fe36a1", "change": "Replaced four steady B register loads and four explicit B shared stores with four direct global-to-existing-shared BSM issues after the first barrier, then replaced only the second CTA barrier with arrive(64) plus barrier_inst. Initial preload, tail, A path, 32-KiB LDS, traffic, MMA, output and NVIDIA fallback remain unchanged.", "correctness": "PASS on committed proxy/NVIDIA snapshot fb459e2f6d772fafe23f0cd3ee012740319ce387: exact formal-best reconstruction; CUDA 12.2 fallback build; three differential cases matched_ratio=1/max_abs=0; exhaustive 1,024-vector source/destination cover and exact shared image; T=1/2/16/56 tile labels and 2T-1 boundary model; resources and read-only regression; empty stderr. Independent detached audit verified provenance, vector bijections, BSM order and unchanged contract, but returned needs-fix because local official material does not establish that barrier_inst waits or fences the ordinary A shared stores before cross-lane next-A LDS.", "decision": "revert", "device": "nvidia", "environment": "proxy/NVIDIA physical GPU 2 RTX A5000; UUID GPU-8dc94d4a-f03d-678c-325a-1db5f31daf9e; driver 535.261.03; CUDA 12.2 nvcc V12.2.140; sm_86; run exp-20260823-038-fb459e2f6d77-a01 at 2026-08-23T06:46:31+08:00", "hypothesis": "Replacing steady B register LDG plus explicit STS with four single-buffer B-only ldg_b128_bsm copies and an exact count-zero wait can improve C500 issue efficiency while preserving the exact shared image and 2T-1 synchronization boundaries.", "id": "exp-20260823-038", "language": "CUDA Maca (target B-only count-zero BSM plus NVIDIA compatibility path)", "notes": "Candidate LF source SHA-256 6ea2682b0b458f80ceb91f7f25c4cc5d1c5b3e34468344ad25d8e220bca158a7; remote-tested source/job commit fb459e2f6d772fafe23f0cd3ee012740319ce387; final queued handoff tip 9f76431d86ba96113948c25d988922c675fe36a1. Count-zero BSM itself is supported by prior target acceptance, but 504 of 512 next-A vector reads are cross-lane and no available local source proves the replacement pair fences preceding ordinary A STS. Reject this exact candidate rather than spend an OJ attempt on an unproved synchronization contract.", "operator": "Fused MoE i8 tn", "result": "PROXY PASS / AUDIT REJECTED: mapping and fallback gates pass, but the mixed ordinary-A-STS plus BSM count-zero barrier lacks sufficient visibility semantics for target correctness. Do not integrate or submit without target documentation, ISA evidence, or an explicit synchronization that preserves the intended schedule.", "schema_version": 1, "timestamp": "2026-08-23T06:46:31+08:00"}
{"artifacts": ["artifacts/raw/remote-runs/exp-20260823-039-2e0b76ea8fbb-a01/status.json", "artifacts/raw/remote-runs/exp-20260823-039-2e0b76ea8fbb-a01/stdout.log", "artifacts/raw/remote-runs/exp-20260823-039-2e0b76ea8fbb-a01/environment.txt", "artifacts/raw/remote-runs/exp-20260823-039-2e0b76ea8fbb-a01/gpu-before.csv", "artifacts/raw/xpuoj/123095/terminal-top.png", "artifacts/raw/xpuoj/123095/terminal-cases.png", "artifacts/raw/xpuoj/123095/scoreboard.png"], "baseline_commit": "8c519e6c1bb57e7b124b60806db9575fa1267207", "benchmark": "proxy/NVIDIA RTX A5000 GPU 3 medians: cases 1-4 45.519, 328.521, 20.901 and 166.289 ms, one warmup and five samples. NVIDIA executes the unchanged fallback. Source model retains 16 row-metadata b32 loads and 8 multiplies/thread while removing eight long-lived weight floats in favor of one scalar temporary.", "candidate_commit": "1f2075099a6f38a98faecc7680f8242d495ba906", "change": "Replaced separate weights[2][4] and row_scale[2][4] arrays with row_factor[2][4]. Each row now loads its weight into a scalar temporary, loads scale-A into the persistent slot, and immediately forms the same factor; matrix/shared scheduling, scale-B, stores, geometry, barriers and fallback are unchanged.", "correctness": "PASS on committed proxy/NVIDIA snapshot 2e0b76ea8fbb304a6627a46bd4c77fdcdfbdfcd8: exact formal-best reconstruction; CUDA 12.2 build; three differential cases matched_ratio=1/max_abs=0; exhaustive row mapping and exact factor bits; 16 b32 metadata loads and 8 multiplies/thread; public grid/A bounds; all-zero/read-only regression; empty stderr. XPU-OJ submission #123095 then compiled for xcore1000 and passed 4/4 target correctness.", "decision": "revert", "device": "nvidia+xpuoj/c500", "environment": "proxy/NVIDIA physical GPU 3 RTX A5000; UUID GPU-afb2badc-bdd8-5ca7-f48c-ea3ffdb05e37; driver 535.261.03; CUDA 12.2 nvcc V12.2.140; sm_86; run exp-20260823-039-2e0b76ea8fbb-a01 at 2026-08-23T07:51:31+08:00; target XPU-OJ xcore1000 submission #123095", "hypothesis": "Loading each MoE weight into a scalar temporary and immediately multiplying it into the corresponding scale-A value removes eight long-lived float weight values while preserving exact row-factor bits and may improve C500 allocation or issue efficiency by one displayed score step.", "id": "exp-20260823-039", "language": "CUDA Maca (target row-factor scalar fusion plus NVIDIA compatibility path)", "notes": "Candidate LF source SHA-256 0bc57e1fcbd1fb4630f184c58cde3cba89097364a0d66db579b3bc01d0565bf8; remote-tested source/job commit 2e0b76ea8fbb304a6627a46bd4c77fdcdfbdfcd8; final queued handoff tip 1f2075099a6f38a98faecc7680f8242d495ba906; integrated/submitted commit d4bcc4600fb54a8415fa9d86fead78918ec745ca. Target cases 83/73/89/84 with exact user-kernel times 0.999/8.106/0.542/4.117 ms tied the 82.25 formal best at rank 25. Reject the tie and retain the exact formal-best source.", "operator": "Fused MoE i8 tn", "result": "TARGET ACCEPTED 4/4 / 82.25 TIE: XPU-OJ #123095 preserved correctness and exactly tied formal best without a displayed gain; formal best remains #117114 and the candidate is reverted.", "schema_version": 1, "submission_id": "123095", "target_cases": [83, 73, 89, 84], "target_commit": "d4bcc4600fb54a8415fa9d86fead78918ec745ca", "target_rank": 25, "target_score": 82.25, "target_times_ms": [0.999, 8.106, 0.542, 4.117], "timestamp": "2026-08-23T07:51:31+08:00"}
{"artifacts": ["artifacts/raw/remote-runs/exp-20260823-040-f5041b9bbc52-a01/status.json", "artifacts/raw/remote-runs/exp-20260823-040-f5041b9bbc52-a01/stdout.log", "artifacts/raw/remote-runs/exp-20260823-040-f5041b9bbc52-a01/environment.txt", "artifacts/raw/remote-runs/exp-20260823-040-f5041b9bbc52-a01/gpu-before.csv", "artifacts/raw/xpuoj/123118/terminal-top.png", "artifacts/raw/xpuoj/123118/terminal-cases.png", "artifacts/raw/xpuoj/123118/scoreboard.png"], "baseline_commit": "8c519e6c1bb57e7b124b60806db9575fa1267207", "benchmark": "proxy/NVIDIA RTX A5000 GPU 4 medians: cases 1-4 44.677, 328.603, 20.850 and 166.324 ms, one warmup and five samples; NVIDIA executes unchanged fallback.", "candidate_commit": "00c32014e060487eae8bbfa7d70639995be63757", "change": "Preserved output[16], pre-multiplied each of eight baseline row_scale values by its weight once, then processed half 0 and half 1 across all eight rows with one MmaFloat4 col_scale, values[4] and scales[2]. Store order becomes half-major; all operands, addresses, predicates, traffic, conversion, matrix/shared path and geometry remain exact.", "correctness": "PASS on committed proxy/NVIDIA snapshot f5041b9bbc5284f1bb9e4a97405354d9225b4a34: exact baseline reconstruction; CUDA 12.2 build; three differential cases matched_ratio=1/max_abs=0; exhaustive 64-scalar/address/predicate/scale/BF16 identity and 16384-address CTA cover; exact operation counts; public allocation/grid/A-load/output plus all-zero/read-only regressions; empty stderr. XPU-OJ submission #123118 then compiled for xcore1000 and passed 4/4 target correctness.", "decision": "revert", "device": "nvidia+xpuoj/c500", "environment": "proxy/NVIDIA physical GPU 4 RTX A5000; UUID GPU-7b8df9d9-f81c-0362-ea16-4fef072dfe24; driver 535.261.03; CUDA 12.2 nvcc V12.2.140; sm_86; run exp-20260823-040-f5041b9bbc52-a01 at 2026-08-23T07:57:48+08:00; target XPU-OJ xcore1000 submission #123118", "hypothesis": "Sequentially processing the two epilogue column halves with one reusable column-scale vector, four values and two packed scale pairs preserves all 64 per-thread results while reducing peak explicit epilogue state enough to improve target allocation by one displayed score step.", "id": "exp-20260823-040", "language": "CUDA Maca (target sequential epilogue half strip plus NVIDIA compatibility path)", "notes": "Candidate LF source SHA-256 8e16d67c5f1d65a8b32266954e120037a9cc068560760762b01e4c615d78cf51; remote-tested source/job commit f5041b9bbc5284f1bb9e4a97405354d9225b4a34; final queued handoff tip 00c32014e060487eae8bbfa7d70639995be63757; integrated/submitted commit 2fd21b5507730ac3a47adc2a05fb9953d95e39df. Target cases 83/73/89/83 with exact user-kernel times 1.012/8.152/0.546/4.147 ms scored 82.00 at rank 25, 0.25 below formal best. Reject and retain the exact formal-best source.", "operator": "Fused MoE i8 tn", "result": "TARGET ACCEPTED 4/4 / 82.00: XPU-OJ #123118 preserved correctness but scored 0.25 below formal best; formal best remains #117114 and the candidate is reverted.", "schema_version": 1, "submission_id": "123118", "target_cases": [83, 73, 89, 83], "target_commit": "2fd21b5507730ac3a47adc2a05fb9953d95e39df", "target_rank": 25, "target_score": 82.0, "target_times_ms": [1.012, 8.152, 0.546, 4.147], "timestamp": "2026-08-23T07:57:48+08:00"}
{"artifacts": ["artifacts/raw/remote-runs/exp-20260823-041-7bdf55b89bb9-a01/status.json", "artifacts/raw/remote-runs/exp-20260823-041-7bdf55b89bb9-a01/stdout.log", "artifacts/raw/remote-runs/exp-20260823-041-7bdf55b89bb9-a01/environment.txt", "artifacts/raw/remote-runs/exp-20260823-041-7bdf55b89bb9-a01/gpu-before.csv", "artifacts/raw/xpuoj/123150/result-summary.json", "artifacts/raw/xpuoj/123150/spj-report.txt", "artifacts/raw/xpuoj/123150/result-page.png", "artifacts/raw/xpuoj/123150/case-details.png", "artifacts/raw/xpuoj/123150/scoreboard.jpg"], "baseline_commit": "8c519e6c1bb57e7b124b60806db9575fa1267207", "benchmark": "proxy/NVIDIA RTX A5000 GPU 5 medians: cases 1-4 45.487, 328.734, 20.838 and 166.257 ms, one warmup and five samples; NVIDIA executes unchanged fallback.", "candidate_commit": "b962b39f017e9f9f4f7d3d42ed4a016819953b7e", "change": "Changed XH_LDS_B_B128 to use (tid%16)+16*rowi and removed lds_row_b[8] plus its unrolled initialization. All 32 literal call sites, B fragments, lds_col/lds_row_a, matrix/shared schedule, traffic, barriers, epilogue and dispatch are unchanged.", "correctness": "PASS on committed proxy/NVIDIA snapshot 7bdf55b89bb98f5bb6825c12e092a6236adc4a8d: exact baseline reconstruction; CUDA 12.2 build; three differential cases matched_ratio=1/max_abs=0; all 32 call sites, 256 threads and 32768 fragment words preserve exact B address/destination/order with two per-wave exact covers; public allocation/grid/A-load/output and all-zero/read-only regressions; empty stderr. XPU-OJ submission #123150 then compiled for xcore1000 and passed 4/4 target correctness.", "decision": "revert", "device": "nvidia+xpuoj/c500", "environment": "proxy/NVIDIA physical GPU 5 RTX A5000; UUID GPU-c3ec651b-17a7-c15a-8c55-2a34fc656289; driver 535.261.03; CUDA 12.2 nvcc V12.2.140; sm_86; run exp-20260823-041-7bdf55b89bb9-a01 at 2026-08-23T07:59:14+08:00; target XPU-OJ xcore1000 submission #123150", "hypothesis": "Inlining the literal B LDS row expression removes lds_row_b[8] and eight initialization assignments while preserving every B shared address and issue order, and may improve target integer-register allocation or address generation by one displayed score step.", "id": "exp-20260823-041", "language": "CUDA Maca (target inline B LDS row plus NVIDIA compatibility path)", "notes": "Candidate LF source SHA-256 e22f4d5b2eabbfe3027a32338285621a5768d9e221d812cb9b5fa6f43bbba7b4; remote-tested source/job commit 7bdf55b89bb98f5bb6825c12e092a6236adc4a8d; final queued handoff tip b962b39f017e9f9f4f7d3d42ed4a016819953b7e; integrated/submitted commit bbccae7cb8067e2892f5ecd6e180e22b0127e820. Target cases 83/73/89/84 with exact user-kernel times 1.002/8.105/0.548/4.105 ms tied the 82.25 formal best at rank 25. The source-level row-state removal did not cross a score threshold, so reject the tie and restore the exact formal-best source.", "operator": "Fused MoE i8 tn", "result": "TARGET ACCEPTED 4/4 / 82.25 TIE: XPU-OJ #123150 preserved correctness and exactly tied formal best without a displayed gain; formal best remains #117114 and the candidate is reverted.", "schema_version": 1, "submission_id": "123150", "target_cases": [83, 73, 89, 84], "target_commit": "bbccae7cb8067e2892f5ecd6e180e22b0127e820", "target_rank": 25, "target_score": 82.25, "target_times_ms": [1.002, 8.105, 0.548, 4.105], "timestamp": "2026-08-23T07:59:14+08:00"}
{"artifacts": ["artifacts/raw/remote-runs/exp-20260823-042-dfadfaa42cbf-a01/status.json", "artifacts/raw/remote-runs/exp-20260823-042-dfadfaa42cbf-a01/stdout.log", "artifacts/raw/remote-runs/exp-20260823-042-dfadfaa42cbf-a01/environment.txt", "artifacts/raw/remote-runs/exp-20260823-042-dfadfaa42cbf-a01/gpu-before.csv", "artifacts/raw/xpuoj/123253/result-summary.json", "artifacts/raw/xpuoj/123253/spj-report.txt", "artifacts/raw/xpuoj/123253/result-page.png", "artifacts/raw/xpuoj/123253/case-details.png", "artifacts/raw/xpuoj/123253/scoreboard.png"], "baseline_commit": "8c519e6c1bb57e7b124b60806db9575fa1267207", "benchmark": "proxy/NVIDIA RTX A5000 GPU 0 medians: cases 1-4 45.533, 333.607, 21.018 and 167.959 ms, one warmup and five samples; NVIDIA executes unchanged fallback. Target/C500 XPU-OJ #123253: case scores 83/73/89/83; exact user-kernel times 1.016/8.161/0.548/4.145 ms; 82.00 total versus the 82.25 formal best.", "candidate_commit": "9970505849f2468c06f178f4582beb59d05f4877", "change": "Added one target-only __launch_bounds__(256, 2) annotation to the MACA MMA kernel declaration; instructions, traffic, barriers, geometry, LDS, thread mapping, epilogue, dispatch and NVIDIA fallback are unchanged.", "correctness": "PASS on committed proxy/NVIDIA snapshot dfadfaa42cbf47ae78631c0530ed9ef23bf73756: exact formal-best reconstruction; one annotation only; CUDA 12.2 build; three differential cases matched_ratio=1/max_abs=0; full output/grid/A-bound/launch-model/read-only regression; empty stderr. XPU-OJ submission #123253 then compiled for xcore1000 and passed 4/4 target correctness.", "decision": "revert", "device": "nvidia+xpuoj/c500", "environment": "proxy/NVIDIA physical GPU 0 RTX A5000; UUID GPU-c59b5457-918c-909d-424d-afb0736b687a; driver 535.261.03; CUDA 12.2 nvcc V12.2.140; sm_86; run exp-20260823-042-dfadfaa42cbf-a01 at 2026-08-23T09:41:26+08:00; target XPU-OJ xcore1000 submission #123253 at 2026-08-23T09:57:33+08:00", "hypothesis": "Adding exactly __launch_bounds__(256, 2) to fused_moe_i8_tn_mma_kernel will constrain MXCC register allocation enough to sustain at least two 256-thread, 32-KiB-LDS CTAs per compute unit and improve at least one displayed C500 case without changing executable semantics.", "id": "exp-20260823-042", "language": "CUDA Maca (target launch bounds plus NVIDIA compatibility path)", "notes": "Candidate LF source SHA-256 6d63828e2a2e49573db8a5505cdf93804bc960ced7a077ba998b7e02ff767ffd; remote-tested source/job commit dfadfaa42cbf47ae78631c0530ed9ef23bf73756; final queued handoff tip 9970505849f2468c06f178f4582beb59d05f4877; integrated/submitted commit 5c68d01801a3f550386e6fb7610c243ded354382. Target cases 83/73/89/83 with exact user-kernel times 1.016/8.161/0.548/4.145 ms scored 82.00 at rank 25, 0.25 below formal best. MXCC accepted the two-argument annotation, but the requested occupancy contract produced no benefit; reject and restore the exact formal-best source.", "operator": "Fused MoE i8 tn", "result": "TARGET ACCEPTED 4/4 / 82.00: XPU-OJ #123253 accepted __launch_bounds__(256, 2) but scored 0.25 below formal best; formal best remains #117114 and the candidate is reverted.", "schema_version": 1, "submission_id": "123253", "target_cases": [83, 73, 89, 83], "target_commit": "5c68d01801a3f550386e6fb7610c243ded354382", "target_rank": 25, "target_score": 82.0, "target_times_ms": [1.016, 8.161, 0.548, 4.145], "timestamp": "2026-08-23T09:41:26+08:00"}
