{"artifacts": ["artifacts/raw/remote-runs/exp-20260818-000-6020d29b591c/status.json", "artifacts/raw/remote-runs/exp-20260818-000-6020d29b591c/gpu-before.csv", "artifacts/raw/remote-runs/exp-20260818-000-6020d29b591c/preflight-error.txt"], "baseline_commit": "6020d29b591cffa4fce3bcb52f02f60abb341249", "benchmark": "NOT RUN: GPU 0 failed the start gate at 57 percent utilization and 22426 MiB used.", "candidate_commit": "6020d29b591cffa4fce3bcb52f02f60abb341249", "change": "First end-to-end invocation of the isolated remote runner; no operator code change.", "correctness": "NOT RUN: remote runner rejected the job before CUDA compilation.", "decision": "investigate", "device": "nvidia", "environment": "proxy/NVIDIA server; requested GPU 0 RTX A5000; CUDA home /usr/local/cuda; preflight snapshot recorded", "hypothesis": "The committed-snapshot remote CUDA execution path can compile and run a minimal kernel on an approved idle RTX A5000.", "id": "exp-20260818-000", "language": "CUDA", "notes": "GPU 0 was already in use by another compute workload. No workload was started and no remote lock remained. Retry with a new experiment ID on an idle approved GPU.", "operator": "Fused MoE i8 tn / infrastructure smoke", "result": "PRECHECK REJECTED (exit 125); execution mirror, upload, staging, rejection evidence retrieval, and lock cleanup worked.", "schema_version": 1, "timestamp": "2026-08-18T13:24:55+00:00"}
{"artifacts": ["artifacts/raw/remote-runs/exp-20260818-001-e59225b509a5/status.json", "artifacts/raw/remote-runs/exp-20260818-001-e59225b509a5/stdout.log", "artifacts/raw/remote-runs/exp-20260818-001-e59225b509a5/environment.txt", "artifacts/raw/remote-runs/exp-20260818-001-e59225b509a5/gpu-before.csv"], "baseline_commit": "6020d29b591cffa4fce3bcb52f02f60abb341249", "benchmark": "Infrastructure smoke only; remote runner duration 1438566913 ns, not an operator performance benchmark.", "candidate_commit": "e59225b509a53e477dea69e7d1ecf14ce1c77ac3", "change": "Retried the unchanged CUDA smoke workload with a new experiment ID on idle approved GPU 1 after the GPU 0 preflight rejection.", "correctness": "PASS: CUDA kernel wrote and returned value 42 on visible device 0 (physical GPU 1 via CUDA_VISIBLE_DEVICES).", "decision": "keep", "device": "nvidia", "environment": "proxy/NVIDIA; physical GPU 1 RTX A5000; driver 535.261.03; CUDA 12.2 V12.2.140; Ubuntu 20.04.6", "hypothesis": "The committed-snapshot remote CUDA execution path can compile and run a minimal kernel on an approved idle RTX A5000.", "id": "exp-20260818-001", "language": "CUDA", "notes": "This validates transport, immutable commit provenance, isolated staging, CUDA compilation/execution, result retrieval, and cleanup of project locks. It does not validate Fused MoE correctness, MACA compilation, C500 performance, or an OJ score.", "operator": "Fused MoE i8 tn / infrastructure smoke", "result": "SUCCEEDED (exit 0); nvcc 12.2 compiled sm_86 binary, RTX A5000 compute 8.6 executed it, and raw results were retrieved.", "schema_version": 1, "timestamp": "2026-08-18T13:28:28+00:00"}
{"artifacts": ["artifacts/raw/remote-runs/exp-20260818-002-ccabad8ab154/status.json", "artifacts/raw/remote-runs/exp-20260818-002-ccabad8ab154/stdout.log", "artifacts/raw/remote-runs/exp-20260818-002-ccabad8ab154/environment.txt", "artifacts/raw/remote-runs/exp-20260818-002-ccabad8ab154/gpu-before.csv"], "baseline_commit": "8cc38f6bbbf6b22fe41b5f5f603c59738c44df35", "benchmark": "proxy/NVIDIA RTX A5000 medians: decode gate-up 45.584 ms (5.276 TOPS), prefill gate-up 341.346 ms (5.637 TOPS), decode down 21.856 ms (5.502 TOPS), prefill down 173.180 ms (5.555 TOPS); one warmup and five recorded iterations per case.", "candidate_commit": "ccabad8ab1541a2ec066795877f555fff5fe4e47", "change": "Added the self-contained CUDA Maca source, independent CPU reference tests, public-shape inference regression, full-shape sampled correctness, and a four-case NVIDIA proxy benchmark.", "correctness": "PASS: three randomized/boundary/extreme cases and one zero/read-only regression each achieved matched_ratio=1.000000 and max_abs=0; all four public allocation mappings passed; every public benchmark sampled output passed.", "decision": "keep", "device": "nvidia", "environment": "proxy/NVIDIA physical GPU 1 RTX A5000; driver 535.261.03; CUDA 12.2 nvcc V12.2.140; sm_86; run 2026-08-18T22:54:43+08:00", "hypothesis": "The current official CUDA tiling strategy, with sample-value shape inference removed, provides a mathematically correct and reproducible baseline on every disclosed workload shape.", "id": "exp-20260818-002", "language": "CUDA Maca (NVIDIA compatibility path)", "notes": "This establishes only a proxy/NVIDIA baseline. MACA compilation, C500 behavior, and the allocator-range behavior inside XPU-OJ remain unverified.", "operator": "Fused MoE i8 tn", "result": "SUCCEEDED: build, correctness, benchmark, and regression all passed at committed snapshot ccabad8ab154.", "schema_version": 1, "timestamp": "2026-08-18T14:56:30+00:00"}
{"artifacts": ["artifacts/raw/remote-runs/exp-20260818-003-3b7f02efb795/status.json", "artifacts/raw/remote-runs/exp-20260818-003-3b7f02efb795/stdout.log", "artifacts/raw/remote-runs/exp-20260818-003-3b7f02efb795/environment.txt", "artifacts/raw/remote-runs/exp-20260818-003-3b7f02efb795/gpu-before.csv"], "baseline_commit": "ccabad8ab1541a2ec066795877f555fff5fe4e47", "benchmark": "proxy/NVIDIA RTX A5000 medians: 38.742, 277.980, 17.531, 140.046 ms for decode gate-up, prefill gate-up, decode down, prefill down. Speedups vs exp-20260818-002: 1.1766x, 1.2280x, 1.2467x, 1.2366x (15.01%-19.79% latency reduction).", "candidate_commit": "3b7f02efb7950fa5106ea7cd166ccc40e06a8bdd", "change": "Changed only the four-byte dot primitive from four scalar byte extracts and multiplies to __dp4a; launch geometry, memory traffic, tests, inputs, warmup, and iterations are unchanged.", "correctness": "PASS: all randomized, boundary, extreme, zero, read-only-input, public allocation inference, and full-shape sampled correctness gates matched exp-20260818-002; matched_ratio=1.000000 and max_abs=0 on reference cases.", "decision": "keep", "device": "nvidia", "environment": "proxy/NVIDIA physical GPU 1 RTX A5000; driver 535.261.03; CUDA 12.2 nvcc V12.2.140; sm_86; run 2026-08-18T23:05:07+08:00", "hypothesis": "Replacing scalar four-byte unpacking with the packed signed INT8 __dp4a primitive reduces instruction pressure while preserving exact int32 accumulation.", "id": "exp-20260818-003", "language": "CUDA Maca (NVIDIA compatibility path)", "notes": "NVIDIA confirms the optimization hypothesis only on RTX A5000. Public MACA material did not explicitly document __dp4a; MXMACA compilation and C500 performance remain target gates.", "operator": "Fused MoE i8 tn", "result": "SUCCEEDED: build, correctness, benchmark, and regression passed; packed dot improved all four proxy workloads.", "schema_version": 1, "timestamp": "2026-08-18T15:07:21+00:00"}
{"artifacts": ["artifacts/raw/remote-runs/exp-20260818-004-b6e4272e9d8f/status.json", "artifacts/raw/remote-runs/exp-20260818-004-b6e4272e9d8f/stdout.log", "artifacts/raw/remote-runs/exp-20260818-004-b6e4272e9d8f/environment.txt", "artifacts/raw/remote-runs/exp-20260818-004-b6e4272e9d8f/gpu-before.csv"], "baseline_commit": "3b7f02efb7950fa5106ea7cd166ccc40e06a8bdd", "benchmark": "proxy/NVIDIA RTX A5000 medians: decode gate-up 43.577 ms (5.519 TOPS), prefill gate-up 341.350 ms (5.637 TOPS), decode down 21.775 ms (5.523 TOPS), prefill down 173.166 ms (5.556 TOPS); one warmup and five recorded iterations per case.", "candidate_commit": "b6e4272e9d8f13263f38d2dbff375dbd9c6e0eb0", "change": "Replaced only __dp4a with the previously tested four-byte scalar unpack-and-accumulate primitive; all tiling, memory access, shape inference, inputs, warmup, repetitions, and regression gates remain unchanged.", "correctness": "PASS: randomized, boundary, INT8 extreme, zero, read-only-input, four public allocation mappings, and full-shape sampled correctness all passed; reference cases matched_ratio=1.000000 and max_abs=0.", "decision": "keep", "device": "nvidia", "environment": "proxy/NVIDIA physical GPU 1 RTX A5000; driver 535.261.03; CUDA 12.2 nvcc V12.2.140; sm_86; run 2026-08-18T23:33:00+08:00", "hypothesis": "Restoring the official scalar byte-unpack dot4 removes the MXMACA-incompatible __dp4a intrinsic while preserving exact Fused MoE results and a reproducible fallback benchmark.", "id": "exp-20260818-004", "language": "CUDA Maca (NVIDIA compatibility path)", "notes": "This fallback is selected for target compilation/correctness validation after OJ submission 116962 proved __dp4a unavailable on xcore1000. NVIDIA data remains proxy-only; allocation-range behavior and C500 correctness/performance are unverified.", "operator": "Fused MoE i8 tn", "result": "SUCCEEDED: build, correctness, benchmark, and regression passed at committed snapshot b6e4272e9d8f; source exactly matches the exp-20260818-002 scalar baseline and contains no __dp4a.", "schema_version": 1, "timestamp": "2026-08-18T15:34:19+00:00"}
{"artifacts": ["artifacts/raw/remote-runs/exp-20260819-005-067e38fdd6f3/status.json", "artifacts/raw/remote-runs/exp-20260819-005-067e38fdd6f3/stdout.log", "artifacts/raw/remote-runs/exp-20260819-005-067e38fdd6f3/environment.txt", "artifacts/raw/remote-runs/exp-20260819-005-067e38fdd6f3/gpu-before.csv"], "baseline_commit": "b6e4272e9d8f13263f38d2dbff375dbd9c6e0eb0", "benchmark": "proxy/NVIDIA RTX A5000 medians: decode gate-up 45.529 ms (5.283 TOPS), prefill gate-up 338.711 ms (5.681 TOPS), decode down 21.707 ms (5.540 TOPS), prefill down 171.755 ms (5.601 TOPS); one warmup and five samples. The target MACA branch is intentionally not executed on NVIDIA.", "candidate_commit": "067e38fdd6f37defe20a32b2722b10a9ff9a4d88", "change": "Added a MACA-only __builtin_mxc_mma_16x16x16i8 backend adapted from the official standalone kernel: A and scale_a index routed rows directly, expert_ids selects each 128-row tile, and the existing scalar kernel remains unchanged for NVIDIA compatibility. Added an exact 128x128 output-tile coverage regression.", "correctness": "PASS on proxy/NVIDIA fallback: randomized boundary, two-expert tiles, INT8 extremes, zero/read-only, all four allocation mappings, and public-shape samples; matched_ratio=1.000000 and max_abs=0. Source audit also matched all 128 MMA calls and every A/B LDS/LDG call sequence to the official MACA kernel.", "decision": "investigate", "device": "nvidia", "environment": "proxy/NVIDIA physical GPU 1 RTX A5000; driver 535.261.03; CUDA 12.2 nvcc V12.2.140; sm_86; run 2026-08-19T00:22:21+08:00", "hypothesis": "Replacing only the MACA backend's scalar byte-unpack GEMM with the official xcore1000 128x128x128 INT8 MMA pipeline will remove the dominant instruction bottleneck while preserving the live OJ routed-row semantics.", "id": "exp-20260819-005", "language": "CUDA Maca (target MMA plus NVIDIA compatibility path)", "notes": "The target branch uses MACA/CUTE headers documented by the official standalone CMake path and contains no __dp4a. NVIDIA validates the unchanged fallback and host-visible mapping only; it cannot validate MXMACA builtins, wave execution, or C500 performance.", "operator": "Fused MoE i8 tn", "result": "SUCCEEDED (exit 0): committed snapshot built and completed correctness, benchmark, and regression; the 16,384-element MMA output mapping was covered exactly once. Target MXMACA compilation/correctness remains the falsifying gate.", "schema_version": 1, "timestamp": "2026-08-18T16:29:14+00:00"}
{"artifacts": ["artifacts/raw/remote-runs/exp-20260819-006-cba47c3418a5/status.json", "artifacts/raw/remote-runs/exp-20260819-006-cba47c3418a5/stdout.log", "artifacts/raw/remote-runs/exp-20260819-006-cba47c3418a5/environment.txt", "artifacts/raw/remote-runs/exp-20260819-006-cba47c3418a5/gpu-before.csv"], "baseline_commit": "067e38fdd6f37defe20a32b2722b10a9ff9a4d88", "benchmark": "proxy/NVIDIA RTX A5000 medians: decode gate-up 45.533 ms (5.282 TOPS), prefill gate-up 338.750 ms (5.680 TOPS), decode down 21.550 ms (5.580 TOPS), prefill down 172.007 ms (5.593 TOPS); one warmup and five samples. Results are effectively unchanged from exp-20260819-005 because the target MACA branch is not executed on NVIDIA.", "candidate_commit": "cba47c3418a56cea350ef407997f7456d0f7cd48", "change": "Changed only the MMA kernel a_base declaration and reset to derive int8_t* via const_cast<int8_t*>(a_ptr); added a committed remote job that checks both casts, the MMA builtin, and absence of __dp4a.", "correctness": "PASS on proxy/NVIDIA fallback: random boundary, two-expert tiles, INT8 extremes, zero/read-only, all four allocation mappings, public-shape sampled outputs, and exact 16,384-element MMA output coverage; matched_ratio=1.000000 and max_abs=0 on reference cases.", "decision": "investigate", "device": "nvidia", "environment": "proxy/NVIDIA physical GPU 1 RTX A5000; driver 535.261.03; CUDA 12.2 nvcc V12.2.140; sm_86; run 2026-08-19T00:54:08+08:00", "hypothesis": "Casting the read-only A base to the mutable pointer type required by MXMACA load builtins removes the five target compilation errors without changing addresses, data, or arithmetic.", "id": "exp-20260819-006", "language": "CUDA Maca (target MMA plus NVIDIA compatibility path)", "notes": "Submitted source candidate is 32,157 bytes, git blob 8901dc5c06c47ab557021e2109b62b61863271c4, SHA-256 eff74843777fcc33f3c597d28ecfe96177525f3bfd46fb7aa1b394bb3c6e0670. NVIDIA cannot compile or execute the MXMACA branch, so target compilation, wave-MMA correctness, and C500 score remain the OJ gates.", "operator": "Fused MoE i8 tn", "result": "SUCCEEDED (exit 0): committed snapshot built and completed source checks, correctness, benchmark, and regression at cba47c3418a5. The MXMACA pointer-type fix remains to be validated by XPU-OJ.", "schema_version": 1, "timestamp": "2026-08-18T16:54:18+00:00"}
{"artifacts": ["artifacts/raw/remote-runs/exp-20260819-007-83fd3d26e95f/status.json", "artifacts/raw/remote-runs/exp-20260819-007-83fd3d26e95f/stdout.log", "artifacts/raw/remote-runs/exp-20260819-007-83fd3d26e95f/environment.txt", "artifacts/raw/remote-runs/exp-20260819-007-83fd3d26e95f/gpu-before.csv"], "baseline_commit": "cba47c3418a56cea350ef407997f7456d0f7cd48", "benchmark": "proxy/NVIDIA RTX A5000 medians: decode gate-up 45.541 ms (5.281 TOPS), prefill gate-up 338.749 ms (5.680 TOPS), decode down 21.697 ms (5.543 TOPS), prefill down 173.208 ms (5.554 TOPS); one warmup and five samples. The target-only grid order is not exercised by the NVIDIA fallback.", "candidate_commit": "83fd3d26e95f7d3739a9f2522afe866ed76f59cb", "change": "Replaced the fixed max-8 grid_x with the official average-rows-per-expert grouping formula; arithmetic, memory addresses, MMA pipeline, and tile set are unchanged. Added an exact grid tile-coverage regression for all four public shapes.", "correctness": "PASS on proxy/NVIDIA fallback: random boundary, two-expert tiles, INT8 extremes, zero/read-only, all four allocation mappings, public-shape sampled outputs, exact 16,384-element MMA output coverage, and exact M-grid coverage. Every contract shape reports grid_x=1.", "decision": "investigate", "device": "nvidia", "environment": "proxy/NVIDIA physical GPU 1 RTX A5000; driver 535.261.03; CUDA 12.2 nvcc V12.2.140; sm_86; run 2026-08-19T01:33:20+08:00", "hypothesis": "Restoring the official expert-group grid order (grid_x=1 for all four contract shapes) keeps one 896 KiB gate-up A tile adjacent across N blocks instead of interleaving eight A tiles, reducing C500 cache working-set pressure most strongly in prefill gate-up.", "id": "exp-20260819-007", "language": "CUDA Maca (target MMA plus NVIDIA compatibility path)", "notes": "Candidate source is 32,654 bytes, git blob 76bb4578f1145bc5d76adbdc996050bd8e193771, SHA-256 c678c96101aa45ab7d97604cdcbf6204aed5d6284c23ff74557b2411c4414f68. C500 traversal and cache effects cannot be validated on NVIDIA; OJ 117034 at 81.5/rank 23 is the target baseline.", "operator": "Fused MoE i8 tn", "result": "SUCCEEDED (exit 0): committed snapshot built and completed source checks, correctness, benchmark, and regression at 83fd3d26e95f. Target cache-locality impact remains the XPU-OJ gate.", "schema_version": 1, "timestamp": "2026-08-18T17:33:31+00:00"}
{"artifacts": ["artifacts/raw/remote-runs/exp-20260819-008-d24ad933e174/status.json", "artifacts/raw/remote-runs/exp-20260819-008-d24ad933e174/stdout.log", "artifacts/raw/remote-runs/exp-20260819-008-d24ad933e174/environment.txt", "artifacts/raw/remote-runs/exp-20260819-008-d24ad933e174/gpu-before.csv"], "baseline_commit": "83fd3d26e95f7d3739a9f2522afe866ed76f59cb", "benchmark": "proxy/NVIDIA RTX A5000 medians: decode gate-up 45.530 ms, prefill gate-up 338.708 ms, decode down 21.548 ms, prefill down 171.745 ms; one warmup and five samples. The MACA-only wide kernel is not executed on NVIDIA.", "candidate_commit": "d24ad933e17437744d24f9f0466fb79d2aefe0ff", "change": "Added a MACA-only 128x256x128, 256-thread raw-array MMA path derived from the official 256x256x128 kernel, specialized only for prefill gate-up. It keeps M at 128 so no block crosses an expert boundary; the three other disclosed shapes retain the target-validated 128x128 pipeline. Added exact 32768-element output mapping and dispatch regressions.", "correctness": "PASS on proxy/NVIDIA fallback: randomized boundary, two-expert, INT8 extremes, zero/read-only, all four allocation mappings, public-shape samples, original 16384-element output mapping, new 32768-element wide mapping, exact M-grid coverage, and prefill-only dispatch all passed.", "decision": "investigate", "device": "nvidia", "environment": "proxy/NVIDIA physical GPU 1 RTX A5000; driver 535.261.03; CUDA 12.2 nvcc V12.2.140; sm_86; run 2026-08-19T02:06:29+08:00", "hypothesis": "For the 32768x4096x7168 prefill gate-up workload, widening one expert-safe tile from 128x128 to 128x256 and using the official direct global-to-shared MMA layout halves repeated A-tile loads across N blocks, raising per-tile arithmetic intensity and reducing the 73-point target bottleneck.", "id": "exp-20260819-008", "language": "CUDA Maca (target wide MMA plus NVIDIA compatibility path)", "notes": "Candidate contains no __dp4a. The source expands from 32654 bytes because the already validated 128x128 fallback remains intact. NVIDIA evidence validates provenance and the unchanged compatibility path only; MXMACA builtins and G2S behavior require target feedback.", "operator": "Fused MoE i8 tn", "result": "SUCCEEDED (exit 0): committed snapshot built and completed source checks, correctness, benchmark, and regression at d24ad933e174. Target compilation, wide-tile correctness, occupancy, and C500 performance remain XPU-OJ gates.", "schema_version": 1, "timestamp": "2026-08-18T18:06:29+00:00"}
{"artifacts": ["artifacts/raw/remote-runs/exp-20260819-009-7d4eef642c15/status.json", "artifacts/raw/remote-runs/exp-20260819-009-7d4eef642c15/stdout.log", "artifacts/raw/remote-runs/exp-20260819-009-7d4eef642c15/environment.txt", "artifacts/raw/remote-runs/exp-20260819-009-7d4eef642c15/gpu-before.csv"], "baseline_commit": "cc41b023817b84693e39887200e0221352e49255", "benchmark": "proxy/NVIDIA RTX A5000: allocation inference median fell from 188.6 ns for the two-query reference to 93.9 ns for the A-first path (2.008x). Core medians were 45.534, 338.755, 21.528, and 171.751 ms for decode gate-up, prefill gate-up, decode down, and prefill down; one warmup and five samples, with the unchanged NVIDIA fallback.", "candidate_commit": "7d4eef642c15b40cf8a311f2bb39ea721c6adef4", "change": "Changed infer_public_config to use A allocation inference as the primary path and query out only as a fallback; added A-primary/out-fallback regressions and an alternating one-query versus two-query host microbenchmark. MMA instructions, launch geometry, arithmetic, and the NVIDIA fallback kernel are unchanged.", "correctness": "PASS: build, three randomized/boundary/extreme correctness cases, A-primary and out-fallback inference for all four public shapes, exact 16,384-element MMA output mapping, exact M-grid coverage, all-zero/read-only regression, and public-shape sampled outputs all passed.", "decision": "investigate", "device": "nvidia", "environment": "proxy/NVIDIA physical GPU 1 RTX A5000; driver 535.261.03; CUDA 12.2 nvcc V12.2.140; sm_86; run 2026-08-19T02:33:29+08:00", "hypothesis": "Because the A allocation size uniquely identifies all four public shapes, returning immediately after the successful A query removes one driver allocation-range lookup from every run_kernel call and reduces fixed launch-path latency without changing the validated 128x128 MMA core.", "id": "exp-20260819-009", "language": "CUDA Maca (target MMA plus NVIDIA compatibility path)", "notes": "Submitted source is 33,213 bytes, git blob 7ce4555ce66260a9cb896fe5532761b904cdc4af, SHA-256 c4140f3b1c3eaf4bf86a8d7de51b26e3b872bbe14f18fa85873372cff0b3de23. The local foreground capture timed out after staging, but the isolated remote run finished with status succeeded/exit 0 and its complete artifacts were recovered; the workload was not rerun. NVIDIA cannot show whether XPU-OJ event timing includes the removed C500 driver query.", "operator": "Fused MoE i8 tn", "result": "SUCCEEDED (exit 0): committed snapshot built and completed correctness, benchmark, and regression on physical GPU 1; the fixed host query path was halved while core proxy timings stayed in the established noise band.", "schema_version": 1, "timestamp": "2026-08-18T18:33:29+00:00"}
