{"artifacts": ["artifacts/raw/c500-runs/exp-20260827-158-ca75ab08dbfc-a01", "handoffs/exp-20260827-158.md"], "baseline_commit": "287eb38a6dda53048e24960eba39879e548fc977", "benchmark": "ABBA case2 6.0615 to 6.0230 ms (-0.6352 percent), arms -0.6435/-0.6269 percent; case1 -1.3507 percent aggregate but arm B +1.0649 percent and candidate drift 4.2957 percent; case3 +0.3680 percent; case4 -0.1031 percent.", "candidate_commit": "ca75ab08dbfc86ceb1bcdc2643db48f5fca20b16", "change": "Added optional full fixed dimensions and selected exact 32768x4096x7168 only for case2, with lexical template reference order runtime sorted then runtime unsorted then fixed case2; kernel schedule, map, grid, addresses, synchronization, epilogue and ABI stayed exact.", "correctness": "PASS: focused reverse projection and dispatch tests; C500 candidate/baseline build; 3/3 differential correctness matched_ratio 1.0 max_abs 0; full regression, sampled/read-only correctness, source/tree integrity, no-process gate and 31-entry manifest.", "decision": "revert", "device": "c500-local", "environment": "MetaX C500 xcore1000 device 0; MACA 3.7.1.5; MXCC 1.0.0 d9102a1572; driver 3.8.30; 25 percent compute / 16000 MiB slice; no device process after; NVIDIA disabled.", "hypothesis": "Reordering exact case-2 clone references to runtime sorted, runtime unsorted, then fixed case2 improves case2 aggregate and both arms by at least 1 percent while protecting every other arm within 0.5 percent.", "id": "exp-20260827-158", "language": "CUDA Maca", "notes": "Tested ca75ab08dbfc; queue tip 47a24d0f6388. Source blob 1431718091b524f75c4ce52a1ff2cebca1341399; LF SHA-256 b202ae2464652aa18bf9380063f4ede9aa536837b1ac3f048577a66779864c50; transferred SHA-256 e5f924316fffefaa8c5e14a0e083024f076b1057b96d8011255b5f68d2e1669c. No repeat/profile/integration/NVIDIA/OJ; native code placement did not recover the missing exact-dimension gain.", "operator": "fused_moe_i8_tn", "result": "REJECTED: fixed case2 resources reached 0 stack / 232 MT / 40 ST while both runtime clones stayed 20/254/40, but target gain missed 1 percent and protected case1 arm B exceeded 0.5 percent.", "schema_version": 1, "timestamp": "2026-08-26T17:27:53+00:00"}
{"artifacts": ["artifacts/raw/c500-runs/exp-20260827-159-7a0cfa18640b-a01", "handoffs/exp-20260827-159.md"], "baseline_commit": "287eb38a6dda53048e24960eba39879e548fc977", "benchmark": "ABBA case1 1.0230 to 1.0360 ms (+1.2708 percent), arms -2.0038/+4.7094 percent; case2 +0.0165 percent; case3 +0.0918 percent; case4 +0.0590 percent. Case1 baseline/candidate drift -4.7710/+1.7527 percent.", "candidate_commit": "7a0cfa18640bd30f4c6aa9d50ea662b3408ee2db", "change": "Added exact case1 dispatch to a full fixed 4096x4096x7168 unsorted clone while runtime sorted cases2/4 and runtime unsorted case3/fallback remain unchanged; the exp-150 schedule payload is exact.", "correctness": "PASS: focused reverse projection and dispatch proof; 22/22 local tests; C500 candidate/baseline build; 3/3 differential correctness matched_ratio 1.0 max_abs 0; full regression, sampled/all-zero read-only correctness, source/tree integrity, no-process gates and 31-entry manifest.", "decision": "revert", "device": "c500-local", "environment": "MetaX C500 xcore1000 device 0; MACA 3.7.1.5; MXCC 1.0.0 d9102a1572; driver 3.8.30; 25 percent compute / 16000 MiB slice; no device process after; NVIDIA disabled.", "hypothesis": "Full compile-time case1 dimensions improve case1 aggregate and both ABBA arms by at least 3 percent without protected regressions.", "id": "exp-20260827-159", "language": "CUDA Maca", "notes": "Tested 7a0cfa18640b; queue tip 193187389dde. Source blob 6fc6c4fe1947eaa15f6366c1f2e718b12d252117; LF SHA-256 7d8e9a85aba561ba9e79bcab256b13976080206ce23e98fc1f85f2634a009fb3. No repeat/profile/integration/NVIDIA/OJ; full-fixed case1 is closed.", "operator": "fused_moe_i8_tn", "result": "REJECTED: fixed case1 codegen reached 0 stack / 232 MT / 40 ST while runtime clones stayed 20/254/40, but target aggregate regressed and arm B regressed 4.7094 percent.", "schema_version": 1, "timestamp": "2026-08-26T17:38:02+00:00"}
{"artifacts": ["artifacts/raw/c500-runs/exp-20260827-160-30a36923fe8f-a01", "handoffs/exp-20260827-160.md"], "baseline_commit": "287eb38a6dda53048e24960eba39879e548fc977", "benchmark": "ABBA case1 +0.6214 percent, arms +0.9597/+0.2857 percent; case2 6.0570 to 6.2505 ms (+3.1947 percent), arms +3.2029/+3.1864 percent; case3 +0.1845 percent; case4 +1.7412 percent, arms +1.8010/+1.6814 percent.", "candidate_commit": "30a36923fe8f659f32afd26367bde06495c2c2a8", "change": "Moved only steady and tail row-1 A10/A11 LDS to their assigned late consumer-safe sites; A00/A01, LDG/STS/B-LDS/MMA/barriers, addresses, mapping, dispatch, epilogue and ABI remain exact.", "correctness": "PASS: focused lifecycle and reverse projection; independent audit approve/no findings; 23/23 local tests; C500 build; 3/3 differential correctness matched_ratio 1.0 max_abs 0; full regression, sampled/all-zero read-only correctness, integrity, no-process gates and 31-entry manifest.", "decision": "revert", "device": "c500-local", "environment": "MetaX C500 xcore1000 device 0; MACA 3.7.1.5; MXCC 1.0.0 d9102a1572; driver 3.8.30; 25 percent compute / 16000 MiB slice; no device process after; NVIDIA disabled.", "hypothesis": "Pairing exact late A10 and A11 placements on retained late A00/A01 improves cases1/2 by at least 1 percent without protected regressions and eliminates stack or lowers MT.", "id": "exp-20260827-160", "language": "CUDA Maca", "notes": "Tested 30a36923fe8f; queue tip 9ddb419b6bd2. Source blob f2fac1503c9eedf8e16145b47b7e798b14ece6fc; LF SHA-256 c0acc0f5ce30b2ae810fbe0276652cc073ddce4423c46b0e2669d43ccad9338c. Independent audit approve/no findings. No repeat/profile/integration/NVIDIA/OJ.", "operator": "fused_moe_i8_tn", "result": "REJECTED: both runtime clones reached 0 stack / 254 MT / 40 ST, but case2 regressed 3.1947 percent and protected case4 regressed 1.7412 percent in both arms; the late A10/A11 and remaining spill-elimination family are closed.", "schema_version": 1, "timestamp": "2026-08-26T17:38:02+00:00"}
{"artifacts": ["artifacts/raw/c500-runs/exp-20260827-161-19e133e6c45b-a01", "handoffs/exp-20260827-161.md"], "baseline_commit": "287eb38a6dda53048e24960eba39879e548fc977", "benchmark": "ABBA case1 1.0225 to 1.0450 ms (+2.2005 percent, noisy split arms); case2 6.0605 to 6.2020 ms (+2.3348 percent), arms +2.3935/+2.2761 percent; case3 +2.1978 percent; case4 +1.4613 percent, with both arms regressing in cases2/3/4.", "candidate_commit": "19e133e6c45b37b98e1a64ec440b879cf7f7c13c", "change": "Moved only steady XH_LDG_B_STAGE_I(1) after XH_MMA_STAGE_MNKX2(0,1,2), changing B issue order from B0/B1/B2/B3 to B0/B2/B1/B3 while preserving addresses, bytes, shared stores, barriers, MMA order, geometry, mapping, epilogue and ABI.", "correctness": "PASS: focused 7/7 and combined 22/22 tests; C500 candidate/baseline build; 3/3 differential correctness matched_ratio 1.0 max_abs 0; full regression, sampled/read-only correctness, source/tree integrity, no-process gates and 31-entry manifest.", "decision": "revert", "device": "c500-local", "environment": "MetaX C500 xcore1000 device 0; MACA 3.7.1.5; MXCC 1.0.0 d9102a1572; 25 percent compute / 16000 MiB slice; no device process after; NVIDIA disabled.", "hypothesis": "Breaking the remaining adjacent B0/B1 issue burst by moving only steady B1 after MMA(0,1,2) improves case2 aggregate and both ABBA arms by at least 1.0 percent without protected-arm or resource regression.", "id": "exp-20260827-161", "language": "CUDA Maca", "notes": "Tested 19e133e6c45b; queue tip 9926931fdc39. Source blob 2063b2d3ebd817d3cadaac97e35071ac5887b2b7; LF SHA-256 b2780b38dccb4d9eb3eaf5809c56ec026fe00c51c36f4f7e20513cba50a1e0c5. Resources unchanged at 20 stack / 254 MT / 40 ST / 32768 shared / 2 warps. No repeat/profile/integration/NVIDIA/OJ; close B-load staggering family.", "operator": "fused_moe_i8_tn", "result": "REJECTED: correctness and resources passed, but stable case2 and protected cases3/4 regressed in both arms; late B1 shortens the global-load latency-hiding window.", "schema_version": 1, "timestamp": "2026-08-26T18:11:36+00:00"}
{"artifacts": [], "baseline_commit": "287eb38a6dda53048e24960eba39879e548fc977", "benchmark": "Analytical bound: 256 M tiles * 31 N boundaries * 16 KiB = 130023424 bytes = 124 MiB, only 7.38 percent of 1.761 GB profiled reads before overlap; actual CTA dispatch is not serialized at N boundaries.", "candidate_commit": "2b731eee1a1fda107f0e722b1372aea1f441e9e0", "change": "Read-only preflight of even [T-1,0,...,T-2] and odd [T-2,T-3,...,0,T-1] K ordering; no candidate source was accepted or committed.", "correctness": "Not run: preflight rejected the scheduling premise before implementation or device execution.", "decision": "revert", "device": "cpu", "environment": "Static scheduling/cache analysis for MetaX C500 xcore1000, 104 physical AP and authorized 25 percent slice; no C500, NVIDIA, OJ or browser access.", "hypothesis": "Alternating even/odd case-2 K traversal makes each CTA group's final 16 KiB A K128 slice equal the next N group's first slice and saves at least 1 percent through boundary L2 reuse.", "id": "exp-20260827-162", "language": "CUDA Maca", "notes": "The lane worktree contains uncommitted source edits from another execution context; Main preserved them unchanged and did not treat them as an accepted candidate. Historical exp-112 changed K traversal, raised 254 to 256 MT and regressed case2 2.2954 percent. No C500/OJ run.", "operator": "fused_moe_i8_tn", "result": "REJECTED: an 8-CTA N group cannot serialize on an approximately 26-AP slice, so linear block-ID adjacency does not imply tail-to-head temporal reuse; alternating parity also destroys current concurrent same-K phase alignment and may worsen A locality.", "schema_version": 1, "timestamp": "2026-08-26T18:35:54+00:00"}
{"artifacts": ["artifacts/raw/c500-runs/exp-20260827-163-f92ccbf234dd-a01"], "baseline_commit": "287eb38a6dda53048e24960eba39879e548fc977", "benchmark": "ABBA case4 3.3895->3.3245 ms (-1.9177%), arms -1.9469%/-1.8885%; protected case1 arm B 1.033->1.044 ms (+1.0649%).", "candidate_commit": "f92ccbf234dda0a91e19cae7476e7974ad3bbee1", "change": "Added an exact sorted case-4 <true,32768,7168,2048> clone while retaining runtime sorted/unsorted clones and the byte-exact exp-150 executable schedule.", "correctness": "Independent audit approved exact dispatch, 14336-tile coverage, reverse projection, synchronization and read-only contracts; trusted C500 build, 3/3 differential correctness, full regression and sampled correctness passed.", "decision": "revert", "device": "c500-local", "environment": "MetaX C500 device 0; MACA 3.7.1.5; MXCC 1.0.0 d9102a1572; 25% compute/16000 MiB; NVIDIA and TileLang disabled.", "hypothesis": "Exact case-4 full-fixed dimensions combined with the exp-150 late A00+A01 schedule improve case 4 aggregate and both arms by at least 4.9%, with protected arms within 0.5%.", "id": "exp-20260827-163", "language": "cuda_maca", "notes": "Source-audit approve; C500 target-and-protected-arm rejection. Do not reopen fixed-case4 plus exp-150 pair.", "operator": "fused_moe_i8_tn", "result": "Resource gate passed at fixed clone 0 stack/230 MT/40 ST/32768 shared/2 warps, but stable case4 target missed 4.9% and protected case1 arm B exceeded 0.5%; no repeat.", "schema_version": 1, "timestamp": "2026-08-26T19:26:46+00:00"}
{"artifacts": [], "baseline_commit": "287eb38a6dda53048e24960eba39879e548fc977", "benchmark": "Preflight model on the trusted public harness: case1 uses skewed=false and expert IDs (tile*73)%256, yielding 32 unique experts. Actual width-4 working set is 4A+4B = 7340032 bytes, not 4A+1B = 4587520 bytes; ideal reads remain 968884224 bytes, so the claimed 704643072-byte reduction is zero.", "candidate_commit": "5d932b754cd2bc8803593eb25db4bb3816069ab3", "change": "Added an exact case1 selector, strict 32-entry module stable-sort map builder, case1-only mapped clone and grid (4,32,8); case2/case4 keep the 256-entry map and case3/fallback remain unsorted.", "correctness": "Independent read-only audit approved 32-entry bijection, expert_ids[0..31] bounds, same-default-stream publication, physical-rank coverage 0..31, exact 1024/1024 M/N coverage, protected dispatch, read-only inputs and reverse projection; focused plus inherited tests passed 15/15.", "decision": "revert", "device": "cpu", "environment": "Static source and trusted-harness analysis for MetaX C500 xcore1000; no C500, NVIDIA, TileLang, OJ or browser execution.", "hypothesis": "Exact case1 32-tile stable expert sort with grid_x=4 forms same-expert width-4 clusters and improves case1 aggregate and both arms by at least 5 percent while protecting every other arm within 0.5 percent.", "id": "exp-20260827-164", "language": "cuda_maca", "notes": "Candidate source blob 7622d29c0c4d4ec80e5409f3db7c9504a238b746; LF SHA-256 6a7fcce0f3453f9570dbf638ef5663e41f5e58269c94c39268ee0c9e61303cc2. Auditor recommendation reject; do not reopen case1 full-sort without a demonstrated repeated-expert workload.", "operator": "fused_moe_i8_tn", "result": "REJECTED before C500: the candidate proof used the prefill quadratic skew distribution instead of actual decode-uniform case1, so no same-expert B reuse or credible 5 percent gain exists; the extra builder/map and grid_x=4 may only add overhead or weaken A locality.", "schema_version": 1, "timestamp": "2026-08-26T19:54:29+00:00"}
{"artifacts": ["artifacts/raw/c500-runs/exp-20260827-165-f114c6d62aa1-a01"], "baseline_commit": "287eb38a6dda53048e24960eba39879e548fc977", "benchmark": "ABBA case2 6.0565 to 6.0190 ms (-0.6192 percent), arms 6.056 to 6.019 (-0.6110 percent) and 6.057 to 6.019 (-0.6274 percent), with near-zero drift. Case3 -0.0923 percent; case4 exactly neutral. Case1 aggregate neutral but noisy opposite arms +2.8741/-2.8046 percent.", "candidate_commit": "f114c6d62aa175efd2be1a015b5917d58d6577ba", "change": "Added optional compile-time N/K carriers and selected fixed N=4096,K=7168 only for exact sorted case2; EM stays runtime and case4 sorted plus case1/case3/fallback use runtime dimensions with the kernel body, map, grid, schedule and ABI unchanged.", "correctness": "PASS: focused and inherited proofs; C500 candidate/baseline builds; 3/3 differential correctness matched_ratio 1.0 max_abs 0; full regression, all-zero read-only, sampled correctness, source/tree integrity, no-process gates and independently rehashed 31-entry manifest.", "decision": "revert", "device": "c500-local", "environment": "MetaX C500 xcore1000 device 0; MACA 3.7.1.5; MXCC 1.0.0 d9102a1572; driver 3.8.30; 25 percent compute / 16000 MiB slice; no device process before or after; NVIDIA and TileLang disabled.", "hypothesis": "On the exp-150 formal-best schedule, selecting compile-time N=4096/K=7168 only for exact sorted case2 reproduces the independently repeated exp-092 gain; case2 aggregate and both arms improve at least 1.0 percent while protected arms regress at most 0.5 percent and resources stay within 20/254/40/32768/2.", "id": "exp-20260827-165", "language": "cuda_maca", "notes": "Tested f114c6d62aa1; queue tip ce9eaaa9ba89. Source blob 8d6bef8644a2ef1cb933394e7a3dfec04a79b872; LF SHA-256 26d6a88da83ce129d85b8139eb7efe8c18b544171c4565c07b85d940b327ac85. Close N/K partial-specialization composition on exp-150.", "operator": "fused_moe_i8_tn", "result": "REJECTED: fixed case2 resources improved to 0 stack/232 MT/40 ST/32768 shared/2 while runtime clones remained 20/254/40/32768/2, but target aggregate and both arms missed the mandatory 1.0 percent gate; no repeat, profile, integration, NVIDIA, TileLang or OJ.", "schema_version": 1, "timestamp": "2026-08-26T20:13:48+00:00"}
{"artifacts": ["artifacts/raw/c500-runs/exp-20260827-166-1b0c89d9b50d-a01", "handoffs/exp-20260827-166.md"], "baseline_commit": "287eb38a6dda53048e24960eba39879e548fc977", "benchmark": "ABBA case4 3.3915 to 3.3210 ms (-2.0787 percent), arms -2.006/-2.151 percent, candidate drift -0.0602 percent; protected case1 -0.8072 percent, case2 -0.0165 percent, case3 +0.2750 percent, with every protected arm inside gate.", "candidate_commit": "1b0c89d9b50df6c3e9701768ce0a72caa0781207", "change": "Added a case-4-only fixed 32768x7168x2048 sorted kernel clone; case2 and unsorted clones retain runtime dimensions and the exp-150 executable schedule is unchanged.", "correctness": "PASS: 16/16 focused and 31/31 workflow tests; C500 candidate/baseline build; 3/3 differential correctness at matched_ratio 1.0 and max_abs 0; full regression, all-zero read-only, sampled correctness, source/tree integrity, no-process gates and 31-entry manifest.", "decision": "keep", "device": "c500-local", "environment": "MetaX C500 xcore1000 device 0; MACA 3.7.1.5; MXCC 1.0.0 d9102a1572; driver 3.8.30; 25 percent compute / 16000 MiB slice; no device process before or after; NVIDIA, TileLang and Triton disabled.", "hypothesis": "Exact sorted case 4 fixed EM/N/K improves aggregate and both ABBA arms by at least 1.5 percent while protected aggregates and arms pass.", "id": "exp-20260827-166", "language": "CUDA Maca", "notes": "Tested 1b0c89d9b50d; queue tip 0dae33c1deb8; integrated source must retain blob 4697250e773a83e71aff6b710fcd75a61e7bef0c and LF SHA-256 0edbf3ba0efea172fa1958e25c6904ec4314ff86b9249deaaac56a98092341b3. C500-local absolute timing is not an OJ prediction.", "operator": "fused_moe_i8_tn", "result": "KEEP: fixed clone reproduced 0 stack / 230 MT / 40 ST / 32768 shared / 2 warps; runtime clones stayed 20/254/40/32768/2; target and all protection gates passed.", "schema_version": 1, "timestamp": "2026-08-26T21:31:54+00:00"}
{"artifacts": [], "baseline_commit": "235a34a22889c4d1ce5465acc2daaf1cdb67547d", "benchmark": "Not run: feasibility gate rejected the synchronization premise before local tests, C500, NVIDIA, TileLang or OJ.", "candidate_commit": "ffe4194547e19c6bf9b82ffae19756ae45292ec1", "change": "Producer explored case2-only tensor-role swap scaffolding, then reverse-applied the partial text after the independent lifecycle proof found an unavoidable cross-wave overwrite race; no candidate source change was accepted or committed.", "correctness": "Static independent proof and Producer confirmation: next-A STS wave0/tid0 overlaps current-B LDS wave1/tid64 at B-region offsets 0..15; next-B STS wave1/tid64 overlaps current-A LDS wave0/tid8 at A-region offsets 1024..1039. One CTA barrier cannot order both old-read retirement and new-write publication.", "decision": "revert", "device": "cpu", "environment": "Read-only source/lifecycle analysis of MetaX C500 wave64 semantics at workflow ffe4194547e19c6bf9b82ffae19756ae45292ec1; no device execution.", "hypothesis": "Exact sorted case2 can alternate the existing two 16-KiB shared regions between A/B roles, reduce dynamic barriers from 111 to 56, and improve case2 at least 5.5 percent without extra storage or operation changes.", "id": "exp-20260827-167", "language": "CUDA Maca", "notes": "Reservations refs/xh-202628/experiments/exp-20260827-167 and refs/xh-202628/baselines/exp-20260827-167 remain immutable. Isolated worktree submission blob equals HEAD/formal-best blob 4697250e773a83e71aff6b710fcd75a61e7bef0c; its remaining status is an index/line-ending refresh artifact with empty textual/raw diff. Exp-033 obtains 56 barriers only with 48 KiB, exp-095 uses 64 KiB, and safe 32-KiB exp-120 retains two barriers and regressed 24.0762 percent.", "operator": "fused_moe_i8_tn", "result": "REJECTED: equal 16-KiB tensor shapes make swapped addresses representable but opposite-role ownership is cross-wave; safe ordinary STS needs both a pre-overwrite and post-publication barrier, or at least 48 KiB inactive storage.", "schema_version": 1, "timestamp": "2026-08-26T22:07:21+00:00"}
