{"artifacts": ["artifacts/raw/c500-runs/exp-20260826-126-192b59a1fcd0-a01", "handoffs/exp-20260826-126.md"], "baseline_commit": "2230963fdd9d6394b3b63864500ffab00818b4f0", "benchmark": "NOT RUN: correctness is a mandatory hard stop, so no warmup, ABBA sample, paired delta or performance claim exists.", "candidate_commit": "192b59a1fcd0487607aff999cece61fab46c3eed", "change": "Moved A0/A1 STS before the first CTA barrier, replaced four steady B LDG plus STS paths with flat-pointer async BSM, and replaced the second CTA barrier with arrive(64) plus barrier_inst; geometry, shared size, bytes, MMA/LDS, A2/A3, tail, epilogue and ABI were unchanged.", "correctness": "FAIL: candidate and baseline MXCC builds passed and candidate resources improved to 0 stack / 242 MT / 40 ST / 32768 shared / 2 warps, but the first C500 random-boundary-128 T=2 official matched-ratio gate failed. Independent exact-commit audit identified missing CTA-wide post-BSM shared publication before cross-wave next-B LDS; regression and ABBA did not run.", "decision": "revert", "device": "c500-local", "environment": "MetaX C500 device 0; xcore1000; MACA 3.7.1.5; MXCC 1.0.0 d9102a1572; driver 3.8.30; 25 percent compute / 16000 MiB slice; run exp-20260826-126-192b59a1fcd0-a01; device clean after terminal failed/1.", "hypothesis": "Moving ordinary A0/A1 publication before the first CTA barrier and replacing steady B register LDG plus STS with raw async BSM removes staging live ranges and improves at least one C500 case by 1 percent in both arms while preserving correctness and protected cases.", "id": "exp-20260826-126", "language": "CUDA Maca", "notes": "Tested 192b59a1fcd0487607aff999cece61fab46c3eed; final queue tip a9376ab1f08151b7e66d63871b84b0b71865f934; workflow f670e8292594eee88cfd174e46a13fc10d36889a; source blob 16f7d0bc3e237904843e9c2cd14c025a474a88fa; LF SHA-256 888a068ac8c9fb42aa16090d8fb85e725dfcf4c4f1167dcc327784bc8e540d47; workflow/candidate/baseline archives 96b11e609bd0b15ae58308135271e4eab7e53e74179858ec8ac2453a4b04bdb0/e6e8b6b734f4d0dc69eb57d8ef283d27514f2d4bfca5df7efd1cb79a8371a9cf/557b8e0cf9e1d82d58bb522a3e883511c6d66f8e5af7fa458909d42aef257073; manifest-file SHA-256 9ece12a07904c9905226b956cdba9ab9127ab6bdee6eda3281e6d1673fb3b573; audit REJECT; no NVIDIA/OJ; close raw-BSM/early-A exact mechanism.", "operator": "Fused MoE i8 tn", "result": "REJECTED after one attempt: exact C500 candidate is wrong on the first T=2 boundary case because wave-local BSM completion is not followed by a proven CTA-wide shared-publication edge; no rerun, integration, profiler, NVIDIA or OJ.", "schema_version": 1, "timestamp": "2026-08-26T03:01:01+00:00"}
{"artifacts": [], "baseline_commit": "2230963fdd9d6394b3b63864500ffab00818b4f0", "benchmark": "NOT RUN: no executable candidate exists; no C500, NVIDIA or OJ access occurred.", "candidate_commit": "cb49c5739b02feaf16b607c2af17babc4ab1682e", "change": "Reservation-only coordination record: no source, test, job or handoff change was made; the worktree remained at the formal-best source in workflow commit cb49c5739b02feaf16b607c2af17babc4ab1682e.", "correctness": "STOP before implementation: the reservation was created and assigned by a non-Main auditor while the intended Producer was already occupied by exp-127, violating the single-owner task envelope. Worktree is clean and source is unchanged formal best.", "decision": "revert", "device": "cpu", "environment": "Local Git/worktree audit only; no device run.", "hypothesis": "Moving only ordinary A0/A1 shared stores before the first CTA barrier might reduce 36-byte stack or 254 MT pressure and improve case4 by 1 percent in both arms without protected regression.", "id": "exp-20260826-128", "language": "CUDA Maca", "notes": "Unauthorized reservation refs retained at workflow cb49c5739b02feaf16b607c2af17babc4ab1682e and baseline 2230963fdd9d6394b3b63864500ffab00818b4f0; worktree batch-20260826-12/early-a01-sts-exp-20260826-128 clean; unchanged source blob e62b793a11b8fdd1b4f7bf58f4bac689aaf5128a and LF SHA-256 762b7581919a9cb75cde0e4732c8ac580ad236f86620f2d3f34c565d7c5a3204; no candidate/job/handoff/enqueue.", "operator": "Fused MoE i8 tn", "result": "REJECTED before implementation due coordination ownership violation and active-producer conflict; ID and reservation refs remain permanent and will not be reused.", "schema_version": 1, "timestamp": "2026-08-26T03:42:14+00:00"}
{"artifacts": [], "baseline_commit": "2230963fdd9d6394b3b63864500ffab00818b4f0", "benchmark": "NOT RUN: no executable candidate exists; no C500, NVIDIA or OJ access occurred.", "candidate_commit": "cb49c5739b02feaf16b607c2af17babc4ab1682e", "change": "Reservation-only coordination record: no source, test, job or handoff change was made; the worktree remained at the formal-best source in workflow commit cb49c5739b02feaf16b607c2af17babc4ab1682e.", "correctness": "STOP before implementation: the reservation was created by a non-Main auditor without an assigned Producer or authorized task envelope, violating Main-only experiment allocation. Worktree is clean and source is unchanged formal best.", "decision": "revert", "device": "cpu", "environment": "Local Git/worktree audit only; no device run.", "hypothesis": "Replacing only steady A0/A1 LDG plus STS with raw async BSM before the existing first CTA barrier might lower staging resources while preserving B and A2/A3 behavior.", "id": "exp-20260826-129", "language": "CUDA Maca", "notes": "Unauthorized reservation refs retained at workflow cb49c5739b02feaf16b607c2af17babc4ab1682e and baseline 2230963fdd9d6394b3b63864500ffab00818b4f0; worktree batch-20260826-12/raw-a01-bsm-published-exp-20260826-129 clean; unchanged source blob e62b793a11b8fdd1b4f7bf58f4bac689aaf5128a and LF SHA-256 762b7581919a9cb75cde0e4732c8ac580ad236f86620f2d3f34c565d7c5a3204; no candidate/job/handoff/enqueue.", "operator": "Fused MoE i8 tn", "result": "REJECTED before implementation due coordination ownership violation; ID and reservation refs remain permanent and will not be reused.", "schema_version": 1, "timestamp": "2026-08-26T03:42:14+00:00"}
{"artifacts": ["artifacts/raw/c500-runs/exp-20260826-127-3ca2ff2b03aa-a01", "handoffs/exp-20260826-127.md"], "baseline_commit": "2230963fdd9d6394b3b63864500ffab00818b4f0", "benchmark": "NOT RUN: correctness is a mandatory hard stop, so no warmup, ABBA samples, paired delta or performance claim exists.", "candidate_commit": "3ca2ff2b03aa6e98302e293a504f7284e6d532f1", "change": "Added exactly one CTA-wide __syncthreadshared() immediately after arrive(64) plus barrier_inst in exp-126 steady B staging; all source addresses, BSM issues, A staging, shared layout, MMA/LDS, geometry, dispatch, tail, epilogue and ABI were unchanged.", "correctness": "C500-LOCAL FAIL: candidate and baseline MXCC builds passed and candidate retained 0 stack / 242 MT / 40 ST / 32768 shared / 2 warps, but the first random-boundary-128 local harness matched-ratio gate failed with correctness-log SHA-256 987b62ddcfd9e359783b90280d10c3563892439b626287493eb2449fdad82189, identical to exp-126. The paired harness did not execute baseline correctness before this candidate hard stop; an independent known-good control run is required to exclude a C500 execution fault. Regression and ABBA did not run.", "decision": "revert", "device": "c500-local", "environment": "MetaX C500 device 0; xcore1000; MACA 3.7.1.5; MXCC 1.0.0 d9102a1572; driver 3.8.30; 25 percent compute / 16000 MiB slice; run exp-20260826-127-3ca2ff2b03aa-a01; device clean after terminal failed/1 with empty corrected/uncorrected RAS counts.", "hypothesis": "Adding an immediate CTA-wide shared barrier after arrive(64) plus barrier_inst makes exact exp-126 async BSM staging correct while retaining the 0-stack/242-MT opportunity and enabling at least one target case to improve by 1 percent in both ABBA arms.", "id": "exp-20260826-127", "language": "CUDA Maca", "notes": "Tested 3ca2ff2b03aa6e98302e293a504f7284e6d532f1; final queue tip 39d4c2114e70c66541176932b7b236916ce43ccc; workflow cb49c5739b02feaf16b607c2af17babc4ab1682e; source blob aac272b2027ef251bef57116b0334f9dda41a601; LF SHA-256 8bad85c52dd5caf01b36c126a2368636b9a51ae80e061167d66b8deb5eb78df6; workflow/candidate/baseline archives 29bad6987513bba4914acb60c297b4194258481deea274f1ad0114bc12e8f77a/dc51dcf721d093c430f64d1493e4933efc1963b2d619df393ad887113ff9435e/557b8e0cf9e1d82d58bb522a3e883511c6d66f8e5af7fa458909d42aef257073; manifest-file SHA-256 1a87fec56223df0fc97b357261f9fa4d662ab91038ebd4c6ca449df6df7904b5; audit completed; no NVIDIA/OJ; candidate remains locally rejected pending device-control interpretation.", "operator": "Fused MoE i8 tn", "result": "REJECTED by the current C500-local run: restoring CTA-wide publication did not change the first local correctness failure, falsifying the exp-126 publication-only root-cause conclusion if the known-good device control passes. No integration, NVIDIA or OJ.", "schema_version": 1, "timestamp": "2026-08-26T03:55:02+00:00"}
{"artifacts": ["artifacts/raw/c500-runs/exp-20260826-130-6831a1c3574a-a01", "handoffs/exp-20260826-130.md"], "baseline_commit": "2230963fdd9d6394b3b63864500ffab00818b4f0", "benchmark": "Same-source C500-local ABBA control candidate delta by cases 1-4: +0.0930, -0.0325, -0.1795 and +0.0434 percent; consistent with noise and not an optimization claim.", "candidate_commit": "6831a1c3574aef2a0f9269829f04b01e954b8cd5", "change": "Diagnostic only: candidate and baseline used the exact same formal-best submission source; only the required byte-identical experiment job and handoff were added.", "correctness": "PASS: both arms built; candidate passed all three differential correctness cases at matched_ratio 1.0 and max_abs 0, complete regression and sampled correctness. Source identity, tree integrity and all 31 manifest entries passed. Device settled to 0 percent utilization with no process and empty corrected/uncorrected RAS counts.", "decision": "revert", "device": "c500-local", "environment": "MetaX C500 device 0; xcore1000; MACA 3.7.1.5; MXCC 1.0.0 d9102a1572; driver 3.8.30; 25 percent compute / 16000 MiB slice; run exp-20260826-130-6831a1c3574a-a01; terminal succeeded/0.", "hypothesis": "The current C500 device and trusted execution path can compile and pass the complete correctness suite for the known-good formal-best source on two source-identical arms.", "id": "exp-20260826-130", "language": "CUDA Maca", "notes": "Tested 6831a1c3574aef2a0f9269829f04b01e954b8cd5; final queue tip fbf6921929664011a1aa19d9b7204d70ca532d40; workflow 9703bb1844a9a2201f56ad2e52ff04a8196272bd; candidate/baseline source blob e62b793a11b8fdd1b4f7bf58f4bac689aaf5128a; LF SHA-256 762b7581919a9cb75cde0e4732c8ac580ad236f86620f2d3f34c565d7c5a3204; transferred SHA-256 ac1242f96cd1e693446ed9d3bc9d0e99aa06af868026afb959e287d145b6fa0f; manifest-file SHA-256 462e4f3838be928cd952f3fd2491a3befbaf9c6874917e9f04c0732989783b32; no NVIDIA/OJ.", "operator": "Fused MoE i8 tn", "result": "CONTROL PASS: excludes a persistent C500 compute-path or trusted-harness failure at the time of the check and supports interpreting exp-126/127 as candidate-path local correctness failures; it does not prove their exact BSM root cause.", "schema_version": 1, "timestamp": "2026-08-26T04:09:49+00:00"}
{"artifacts": ["artifacts/raw/c500-runs/exp-20260826-131-6c471cbc579d-a01", "handoffs/exp-20260826-131.md"], "baseline_commit": "2230963fdd9d6394b3b63864500ffab00818b4f0", "benchmark": "NOT RUN: correctness is a mandatory hard stop, so no warmup, ABBA samples, paired delta or performance claim exists.", "candidate_commit": "6c471cbc579d1a8355aea8a388fd8436730f1626", "change": "Relative to exp-127, changed only the first BSM argument from a flat shared pointer to &(shared_b_tensor(store_row_b[bsmi], store_col)); numerical destination addresses, source addresses, issue sites, waits, CTA publication and all kernel behavior remained unchanged.", "correctness": "C500-LOCAL FAIL: candidate and baseline builds passed and candidate retained 0 stack / 242 MT / 40 ST / 32768 shared, but the first random-boundary-128 local matched-ratio gate failed. Correctness-log SHA-256 987b62ddcfd9e359783b90280d10c3563892439b626287493eb2449fdad82189 is identical to exp-126/127. Regression and ABBA did not run.", "decision": "revert", "device": "c500-local", "environment": "MetaX C500 device 0; xcore1000; MACA 3.7.1.5; MXCC 1.0.0 d9102a1572; driver 3.8.30; 25 percent compute / 16000 MiB slice; run exp-20260826-131-6c471cbc579d-a01; terminal failed/1; no process or RAS error before/after.", "hypothesis": "Replacing only the exp-127 flat BSM destination with the CUTE shared-tensor address used by correctness-passing exp-095 restores target correctness while retaining the 32-KiB same-bank 0-stack/242-MT opportunity and at least one 1-percent ABBA gain.", "id": "exp-20260826-131", "language": "CUDA Maca", "notes": "Tested 6c471cbc579d1a8355aea8a388fd8436730f1626; final queue tip c2d163c35c63dc8bc000405144739f5f009d0714; workflow b06b3a61cd9e443adde856b7ea05db587db23dd8; source blob a2520bf9089eced4a38d8c347370988c84a38a63; LF SHA-256 c7c971eac21b77e6309e1e317a8638ed6b6bcac630433f97fb34d257c2d32699; transferred SHA-256 01d044a4761b9f802e0b15aedb558fe08db135ea79cb39ef1d8d261fad40f240; manifest-file SHA-256 0d26ad5a6b5cbef9fe355f0baa21fe17bcba90233d34f9c3a247f8b48106a5e5; independent audit APPROVE for C500; no NVIDIA/OJ.", "operator": "Fused MoE i8 tn", "result": "REJECTED after one attempt: the exact CUTE typed BSM destination did not change the local failure, disproving flat pointer or address-space provenance as the sole cause. No rerun, integration, profiler, NVIDIA or OJ.", "schema_version": 1, "timestamp": "2026-08-26T04:26:48+00:00"}
{"artifacts": ["artifacts/raw/c500-runs/exp-20260826-132-adfc45dde772-a01", "handoffs/exp-20260826-132.md"], "baseline_commit": "2230963fdd9d6394b3b63864500ffab00818b4f0", "benchmark": "C500-local ABBA baseline-to-candidate deltas for cases 1-4 were +2.6079%, +0.2352%, +2.5112% and +1.5905%; positive is slower. Candidate resources were 36 stack / 254 MT / 48 ST / 32768 shared / 2 warps versus baseline 36 / 254 / 40 / 32768 / 2.", "candidate_commit": "adfc45dde7722f9113adc096dbac7fb624f4cea6", "change": "Removed persistent per-thread weights and row_scale arrays and loaded each row's weight and scale-A at its unchanged epilogue use site; all matrix, shared-memory, mapping, dispatch, scale-B and store behavior remained unchanged.", "correctness": "PASS: both C500 arms built; candidate passed 3/3 differential correctness at matched_ratio 1.0/max_abs 0, complete regression, sampled correctness, source/tree integrity and all 31 manifest entries.", "decision": "revert", "device": "c500-local", "environment": "MetaX C500 device 0; xcore1000; MACA 3.7.1.5; MXCC 1.0.0 d9102a1572; driver 3.8.30; 25 percent compute / 16000 MiB slice; run exp-20260826-132-adfc45dde772-a01; terminal succeeded/0; no process and empty RAS/PCIe error sets.", "hypothesis": "Lazy per-row epilogue metadata loads must remove the 36-byte stack or reduce MT to at most 246, then improve both case-2 arms by at least 1 percent without protected regression.", "id": "exp-20260826-132", "language": "CUDA Maca", "notes": "Tested adfc45dde7722f9113adc096dbac7fb624f4cea6; final queue tip 27e207dc80d47f86b90fc981b3d35013470a9aa2; workflow 46075f8342114d502e7903743d5d25b60099c6a3; source blob 772a042f98a561d451bfe2538c31f8379c212c9a; LF SHA-256 926387f5553a2d42c298714d79119aea195cb345a9c1f339b07bede9428694da; manifest-file SHA-256 bb18cd4e6f47b983d0571034ea590d907bc441c0b08cecb70aacf9c5ae724246; no NVIDIA/OJ.", "operator": "Fused MoE i8 tn", "result": "REJECTED: the required stack-or-MT reduction did not occur, ST increased by eight, case 2 was slower in both stable arms, and all protected cases regressed. No repeat, profiler, integration, NVIDIA or OJ.", "schema_version": 1, "timestamp": "2026-08-26T05:20:49+00:00"}
{"artifacts": ["artifacts/raw/c500-runs/exp-20260826-133-146fba1e8283-a01", "handoffs/exp-20260826-133.md"], "baseline_commit": "2230963fdd9d6394b3b63864500ffab00818b4f0", "benchmark": "C500-local ABBA baseline-to-candidate deltas for cases 1-4 were +1.1305%, +11.4309%, +1.7794% and +8.1624%; positive is slower. Candidate resources were 0 stack / 254 MT / 40 ST / 32768 shared / 2 warps versus baseline 36 / 254 / 40 / 32768 / 2.", "candidate_commit": "146fba1e8283917dd5a18ac2b70b86ed9675a903", "change": "Moved only the two steady ordinary A0/A1 STS from late second-phase MMA anchors to immediately after the final current-image group-0 A LDS; LDG, LDS, MMA, barriers, addresses, tail, epilogue and ABI remained unchanged.", "correctness": "C500 candidate/baseline builds passed; candidate differential correctness 3/3 matched_ratio=1.0 max_abs=0; full regression, all-zero/read-only, sampled correctness, source/tree integrity and 31-entry manifest passed.", "decision": "revert", "device": "c500-local", "environment": "MetaX C500 xcore1000; MACA 3.7.1.5; MXCC 1.0.0 d9102a1572; driver 3.8.30; device 0; 25 percent compute and 16000 MiB slice; no device process or RAS/PCIe events; NVIDIA disabled.", "hypothesis": "Moving only ordinary A0/A1 shared stores immediately after their last current-image group-0 LDS consumer will eliminate the 36-byte stack or reduce MT to at most 246 and improve case 2 by at least 1 percent in both arms.", "id": "exp-20260826-133", "language": "CUDA Maca", "notes": "Queue tip 39a9c943bd45089981709cdaf1d1148dbcbbc750; Main rejected without repeat, profile, integration, NVIDIA or OJ.", "operator": "Fused MoE i8 tn", "result": "Resource gate passed by eliminating stack, but stable cases 2, 3 and 4 and both target arms regressed decisively; immediate A0/A1 publication damages the target issue schedule.", "schema_version": 1, "timestamp": "2026-08-26T05:54:43+00:00"}
{"artifacts": [], "baseline_commit": "2230963fdd9d6394b3b63864500ffab00818b4f0", "benchmark": "NOT RUN: lifecycle correctness proof is a mandatory stop; no candidate build, C500, NVIDIA, ABBA or OJ submission occurred.", "candidate_commit": "cb905d4e9c85dfd37010756457a789a2636cd8ca", "change": "No source change was made. Pre-edit lifecycle and formal IR review proved the assigned STS-after-LDG ordering overwrites the previous-iteration A2/A3 payload before the current-image group-1 LDS consumer.", "correctness": "Static T=2 witness fails by construction: the proposed ordering stores next-image A2/A3 into shared before the current-image XH_LDS_A_B128(1,1), mixing K tiles. T=16/56 repeats the same invalid transition. Formal IR confirms STS consumes loop-carried PHIs before new LDGs.", "decision": "revert", "device": "cpu", "environment": "Static source and formal xcore1000 LLVM IR review only; no accelerator accessed; NVIDIA disabled.", "hypothesis": "Moving only ordinary A2/A3 STS after the same iteration's unchanged A2/A3 LDG will eliminate two loop-carried vector payload PHIs while preserving overlap and improving case 2 by at least 1 percent in both arms.", "id": "exp-20260826-134", "language": "CUDA Maca", "notes": "Reservation refs remain permanent. Worktree stayed clean at cb905d4e9c85dfd37010756457a789a2636cd8ca; no job, handoff, candidate commit or controller enqueue was created.", "operator": "Fused MoE i8 tn", "result": "Hypothesis is infeasible under the single-variable contract. A correct variant requires moving the group-1 LDS earlier or adding storage/double buffering, both mechanism widening.", "schema_version": 1, "timestamp": "2026-08-26T06:01:20+00:00"}
{"artifacts": ["artifacts/raw/c500-runs/exp-20260826-135-047096900e43-a01", "handoffs/exp-20260826-135.md"], "baseline_commit": "2230963fdd9d6394b3b63864500ffab00818b4f0", "benchmark": "C500-local ABBA baseline-to-candidate deltas: case1 +3.1814%, case2 +0.4947%, case3 -1.4286%, case4 -1.3301%; positive is slower. Case2 arms 6.166/6.165 to 6.196/6.196 ms; case1 arms 1.032/1.074 to 1.092/1.081 ms. Candidate resources 0 stack / 246 MT / 40 ST versus baseline 36 / 254 / 40.", "candidate_commit": "047096900e439bbe56c191bd35f9e04eb25f1976", "change": "Moved only four source B0-B3 group-0 LDS placements from prologue and steady backedge to steady-loop and peeled-tail entry; dynamic work, addresses, publication, barriers, global loads, stores, MMA, A path, layout, mapping, epilogue and ABI stayed unchanged.", "correctness": "Independent audit approved exact source. C500 builds passed; candidate differential correctness 3/3 matched_ratio=1.0 max_abs=0; full regression, all-zero/read-only, sampled correctness, source/tree integrity and 31-entry manifest passed.", "decision": "revert", "device": "c500-local", "environment": "MetaX C500 xcore1000; MACA 3.7.1.5; MXCC 1.0.0 d9102a1572; driver 3.8.30; device 0; 25 percent compute and 16000 MiB slice; no remaining device process or RAS/PCIe events; NVIDIA disabled.", "hypothesis": "Moving B0-B3 group-0 LDS from prologue/backedge to current steady/tail consumer entry will eliminate loop-carried fragments, reach stack zero or MT at most 246, and improve case 2 by at least 1 percent in both arms.", "id": "exp-20260826-135", "language": "CUDA Maca", "notes": "Queue tip 03d41e28198ee2f7e0e3e6c9cc429e23144f9fea; Main rejected without repeat, profile, integration, NVIDIA or OJ. Audit supplemented focused-test tail-first labels and full producer-consumer vector-pair bijection.", "operator": "Fused MoE i8 tn", "result": "Native resource opportunity was realized, but target case2 and protected case1 timing gates failed. Down cases improved about 1.3 to 1.4 percent and motivate a new down-only specialization experiment, not promotion of this candidate.", "schema_version": 1, "timestamp": "2026-08-26T06:34:07+00:00"}
