{"artifacts": ["artifacts/raw/c500-runs/exp-20260824-086-3352c0d9c545-a01"], "baseline_commit": "2230963fdd9d6394b3b63864500ffab00818b4f0", "benchmark": "C500-local ABBA medians baseline->candidate: case1 1.0900->1.0815 ms (-0.7798%); case2 6.1845->6.1850 ms (+0.0081%); case3 0.5620->0.5440 ms (-3.2028%), arms 0.561->0.546 and 0.563->0.542 ms; case4 3.4780->3.4660 ms (-0.3450%).", "candidate_commit": "3352c0d9c545e514e77d1fe40bb8317de453d8c4", "change": "Added optional fixed EM/N/K template parameters and selected fixed false/4096/7168/2048 dimensions only for exact case 3; sorted map, grids, staged payloads, MMA/LDS/STS/barriers, epilogue, ABI and other dispatches are unchanged.", "correctness": "PASS: C500 MXCC builds, 3/3 differential correctness, frozen full regression, sampled correctness, source/tree integrity, no-process gates and all 31 manifest entries.", "decision": "keep", "device": "c500-local", "environment": "MetaX C500 device 0; xcore1000; MACA 3.7.1.5; MXCC 1.0.0 d9102a1572; driver 3.8.30; 25 percent compute / 16000 MiB slice; run exp-20260824-086-3352c0d9c545-a01; c500-local.", "hypothesis": "Specializing only exact case 3 as false/4096/7168/2048 improves both C500 decode-down arms by at least 1.0 percent without any protected aggregate regression above 0.5 percent.", "id": "exp-20260824-086", "language": "CUDA Maca", "notes": "Tested commit 3352c0d9c545e514e77d1fe40bb8317de453d8c4; metadata queue commit 604cfdfccbc1b139c30ee3643ec7ce27f8f1d8d0; integrated commit a994b48c3b497a1ceb553d329f07a14c3b9c18c0; workflow ea4868c5e0d7ff53dd22e950344940c6fb33ea78; source blob c226c557ef0e329e636efdfae999e1cfe19fc6fb; LF SHA-256 0669645c415199487599f13a09cc2f16d6c97cecd48084f10861fe0741fcffb6; manifest-file SHA-256 181af6d9d794ad7256989369f9b8e26532249b8ed0ff0ed47687467ba1a5a75e. No NVIDIA run; no independent audit required.", "operator": "Fused MoE i8 tn", "result": "KEEP and integrated for serialized OJ validation: both target case-3 arms clear 1 percent and every protected aggregate remains within the 0.5 percent gate.", "schema_version": 1, "timestamp": "2026-08-24T12:41:30+00:00"}
{"artifacts": ["artifacts/raw/c500-runs/exp-20260824-087-43b9b99f5557-a01"], "baseline_commit": "2230963fdd9d6394b3b63864500ffab00818b4f0", "benchmark": "C500-local ABBA medians baseline->candidate: case1 1.0880->1.0820 ms (-0.5515%, noisy arms); case2 6.1880->6.1890 ms (+0.0162%), arms 6.186->6.188 and 6.190->6.190; case3 0.5640->0.5630 ms (-0.1773%); case4 3.4670->3.4705 ms (+0.1010%).", "candidate_commit": "43b9b99f5557a9b91c8a16c996e80609319ad887", "change": "Replaced only load_a_row_offset[4] and load_b_row[4] with eight named integer address carriers while preserving exact addresses, loads, issue order, payloads, barriers, geometry, map, epilogue and ABI.", "correctness": "PASS: C500 MXCC builds, 3/3 differential correctness, frozen regression, sampled correctness, source/tree integrity, no-process gates and all 31 manifest entries.", "decision": "revert", "device": "c500-local", "environment": "MetaX C500 device 0; xcore1000; MACA 3.7.1.5; MXCC 1.0.0 d9102a1572; driver 3.8.30; 25 percent compute / 16000 MiB slice; run exp-20260824-087-43b9b99f5557-a01; c500-local.", "hypothesis": "Replacing indexed staged A/B integer address arrays with eight named scalar carriers improves C500 case 2 by at least 1 percent without protected regression.", "id": "exp-20260824-087", "language": "CUDA Maca", "notes": "Tested commit 43b9b99f5557a9b91c8a16c996e80609319ad887; metadata queue commit b974a0b391e3763278e39e72721bcd372d544f5b; workflow ea4868c5e0d7ff53dd22e950344940c6fb33ea78; source blob 5f5eaa0193577f1e2b5406dcd4cf2df15cedcb57; LF SHA-256 2b0018a3b81ded8d476aac643a5314dd9d4001c284849a5d8b46cc41b5ed44b1; manifest-file SHA-256 5c09a633fb6d30c7769589ddd4a833e073437857ed90bc9f7b5512627febc984. No NVIDIA or OJ run; no independent audit required.", "operator": "Fused MoE i8 tn", "result": "REJECTED after one attempt: stable target case 2 is flat and misses the 1 percent gate; close staged address-carrier scalarization spelling without repeat, integration or OJ.", "schema_version": 1, "timestamp": "2026-08-24T12:58:01+00:00"}
{"artifacts": ["artifacts/raw/c500-runs/exp-20260824-088-9ff3f374e686-a01"], "baseline_commit": "a994b48c3b497a1ceb553d329f07a14c3b9c18c0", "benchmark": "C500-local ABBA medians baseline->candidate: case1 1.0785->1.0930 ms (+1.3445%), arms 1.077->1.081 and 1.080->1.105; case2 6.1840->6.1845 ms (+0.0081%); case3 0.5460->0.5465 ms (+0.0916%); case4 3.4805->3.4625 ms (-0.5172%).", "candidate_commit": "9ff3f374e686467cbc6579256db857ff5df663b2", "change": "Added only an exact case-1 selector and fixed launch before the existing exact case-3 selector; the kernel body, case3 specialization, sorted paths, fallback, map, geometry, barriers, epilogue and ABI are unchanged.", "correctness": "PASS: C500 MXCC builds, 3/3 differential correctness, frozen regression, sampled correctness, source/tree integrity, no-process gates and all 31 manifest entries.", "decision": "revert", "device": "c500-local", "environment": "MetaX C500 device 0; xcore1000; MACA 3.7.1.5; MXCC 1.0.0 d9102a1572; driver 3.8.30; 25 percent compute / 16000 MiB slice; run exp-20260824-088-9ff3f374e686-a01; c500-local.", "hypothesis": "Adding exact false/4096/4096/7168 dimensions only for case 1 on exp-086 improves both C500 case-1 arms by at least 1 percent without protected regression.", "id": "exp-20260824-088", "language": "CUDA Maca", "notes": "Tested commit 9ff3f374e686467cbc6579256db857ff5df663b2; metadata queue commit 65fc0e331e955dc4fa788f868934e277aa8d3e45; workflow a69cf6de80a174f8a18ab6099418ff9c7dadbf86; source blob d182200a5af2620af2880af3f53ee09e45eb3eae; LF SHA-256 9288cb5c720b447b791b4d3bbf92148d3392bdf0b51c842889c3266dbd48944c; manifest-file SHA-256 68c53a74c8a5776d0907b3fdd7f3f7cba6509299f2cf761315c88485f94736cc. No NVIDIA or OJ run; no independent audit required.", "operator": "Fused MoE i8 tn", "result": "REJECTED after one attempt: target case 1 regressed 1.3445 percent and both target arms missed the improvement gate; close case1 exact specialization on exp086 without OJ.", "schema_version": 1, "timestamp": "2026-08-24T13:15:35+00:00"}
{"artifacts": ["artifacts/raw/c500-runs/exp-20260824-089-60347bb9bc2b-a01"], "baseline_commit": "a994b48c3b497a1ceb553d329f07a14c3b9c18c0", "benchmark": "C500-local ABBA medians baseline->candidate: case1 1.0510->1.0350 ms (-1.5224%, noisy baseline arms); case2 6.1835->6.1870 ms (+0.0566%), arms 6.184->6.187 and 6.183->6.187; case3 0.5470->0.5475 ms (+0.0914%); case4 3.4620->3.4705 ms (+0.2455%).", "candidate_commit": "60347bb9bc2bb45260c3838a08331da1a0b2c863", "change": "Removed only output_row[8] and its initializer loops, deriving each epilogue output row as row_thread_base plus 64*i plus j while preserving mapping, stores, predicates, MMA/LDS/barriers, dispatch and ABI.", "correctness": "PASS: C500 MXCC builds, 3/3 differential correctness, frozen regression, sampled correctness, source/tree integrity, no-process gates and all 31 manifest entries.", "decision": "revert", "device": "c500-local", "environment": "MetaX C500 device 0; xcore1000; MACA 3.7.1.5; MXCC 1.0.0 d9102a1572; driver 3.8.30; 25 percent compute / 16000 MiB slice; run exp-20260824-089-60347bb9bc2b-a01; c500-local.", "hypothesis": "Replacing output_row[8] with exact affine loop-local row coordinates improves both paired case-2 arms by at least 1.0 percent without a stable protected aggregate regression above 0.5 percent.", "id": "exp-20260824-089", "language": "CUDA Maca", "notes": "Tested commit 60347bb9bc2bb45260c3838a08331da1a0b2c863; metadata queue commit bda13e670f62e42f8a7b3c9fb073d7a50d7904eb; workflow c677420c6bccf269788ad69dbe1573cacfc86bc3; source blob 7390820e63371097a46f2138cf726115586545bf; LF SHA-256 55654832dcbc9340c8cd7d0eac5581d62c038990a9f7c109fa62cc5a39f74fd7; manifest-file SHA-256 de1d6168bec764fdc437b913af7007fd46ca1be34bc128c0d4158432525ecfb6. No NVIDIA or OJ run; no independent audit required.", "operator": "Fused MoE i8 tn", "result": "REJECTED after one attempt: stable target case 2 is slightly slower in both arms and misses the 1 percent gate; close affine output-row scalarization without audit, integration, repeat or OJ.", "schema_version": 1, "timestamp": "2026-08-24T13:37:26+00:00"}
{"artifacts": ["artifacts/raw/c500-runs/exp-20260824-090-c46c37255884-a01"], "baseline_commit": "a994b48c3b497a1ceb553d329f07a14c3b9c18c0", "benchmark": "C500-local ABBA medians baseline->candidate: case1 1.0330->1.0970 ms (+6.1955%); case2 6.1840->6.1850 ms (+0.0162%); case3 0.5500->0.8555 ms (+55.5455%), arms 0.550/0.550->0.856/0.855; case4 3.4645->3.4670 ms (+0.0722%).", "candidate_commit": "c46c37255884b46a54a94b35e5705a2c6a958615", "change": "Added four named alternate B payload registers and an exact case-3 parity-selected one-iteration lookahead branch while preserving A pipeline, addresses, bytes, LDS, barriers, geometry, map, epilogue and ABI.", "correctness": "PASS: C500 MXCC candidate/baseline builds, 3/3 differential correctness, frozen regression, sampled correctness, source/tree integrity, no-process gates and all 31 manifest entries.", "decision": "revert", "device": "c500-local", "environment": "MetaX C500 device 0; xcore1000; MACA 3.7.1.5; MXCC 1.0.0 d9102a1572; driver 3.8.30; 25 percent compute / 16000 MiB slice; run exp-20260824-090-c46c37255884-a01; c500-local.", "hypothesis": "Exact case-3 two-bank ordinary-B register lookahead improves both decode-down arms by at least 1.0 percent without protected regression above 0.5 percent.", "id": "exp-20260824-090", "language": "CUDA Maca", "notes": "Tested commit c46c37255884b46a54a94b35e5705a2c6a958615; metadata queue commit e1b45002ce45531363f8eb8fc0de44d0e18892c7; workflow ad940691a91292c545ff5c317116e41e28574f4f; source blob 9b48f726a3dd8a1cb1e52fa21deda77e117eb685; LF SHA-256 e4eb42876d9e3883844bd745b49091ec36eac7910af16aff826d46bb9983c5b7; transferred SHA-256 758ea9fdbfd6774ecb546ca982b0afe732792c3e8fb740b238619f1d1815366a; job blob 7f91ad9b45b58a3fa128a95aeb839c7630bc5662; manifest-file SHA-256 c7865de1f8545829cc9592155b23e5520100961c3214fdf52bed770a3837b206. No NVIDIA or OJ run; no independent audit required.", "operator": "Fused MoE i8 tn", "result": "REJECTED after one attempt: target case 3 catastrophically regressed 55.5455 percent and protected case 1 regressed 6.1955 percent; close two-bank ordinary-B register-lookahead family without repeat, audit, integration or OJ.", "schema_version": 1, "timestamp": "2026-08-24T14:40:59+00:00"}
{"artifacts": ["artifacts/raw/c500-runs/exp-20260824-091-ea6defe1e460-a01"], "baseline_commit": "a994b48c3b497a1ceb553d329f07a14c3b9c18c0", "benchmark": "C500-local ABBA medians baseline->candidate: case1 1.0735->1.0695 ms (-0.3726%); case2 6.1865->6.1985 ms (+0.1940%), arms 6.183/6.190->6.198/6.199; case3 0.5475->0.5460 ms (-0.2740%); case4 3.4660->3.4730 ms (+0.2020%).", "candidate_commit": "ea6defe1e460f7be20497c5ccc2b2788397e209c", "change": "Scalarized only shared-memory A/B store rows and LDS rows/columns into named carriers while preserving global addresses, bytes, LDS/STS/MMA/barrier order, geometry, dispatch, epilogue and ABI.", "correctness": "PASS: C500 MXCC candidate/baseline builds, 3/3 differential correctness, frozen regression, sampled correctness, source/tree integrity, no-process gates and all 31 manifest entries.", "decision": "revert", "device": "c500-local", "environment": "MetaX C500 device 0; xcore1000; MACA 3.7.1.5; MXCC 1.0.0 d9102a1572; driver 3.8.30; 25 percent compute / 16000 MiB slice; run exp-20260824-091-ea6defe1e460-a01; c500-local.", "hypothesis": "Replacing five indexed shared-coordinate arrays with 20 named scalar carriers improves both C500 case-2 arms by at least 1.0 percent without stable protected regression above 0.5 percent.", "id": "exp-20260824-091", "language": "CUDA Maca", "notes": "Tested commit ea6defe1e460f7be20497c5ccc2b2788397e209c; metadata queue commit c1cf5b7fd8ab5137e9c9114f1a722ea3c7d9263f; workflow ad940691a91292c545ff5c317116e41e28574f4f; source blob ccea47b72bbe18e36cbd1c4e79d17aca043b65b4; LF SHA-256 bc641a2ce6172b92c0410f6d42be9657d56374492aeebc942f6cfce9d0b1ac70; transferred SHA-256 e044504282c849a355a62b5081d499c2578da5c11ca0a2a8723d84b668bbb611; job blob 7f91ad9b45b58a3fa128a95aeb839c7630bc5662; manifest-file SHA-256 058574bffbe23a3208aa78d75f8df280eb2ee64a77c2a47860d28486f19233e7. No NVIDIA or OJ run; conditional independent audit not reached.", "operator": "Fused MoE i8 tn", "result": "REJECTED after one attempt: both target case-2 arms regressed and the aggregate missed the 1 percent gate; close all-shared-coordinate named-carrier family without repeat, audit, integration or OJ.", "schema_version": 1, "timestamp": "2026-08-24T14:46:18+00:00"}
{"artifacts": ["artifacts/raw/c500-runs/exp-20260824-092-5a8de2813561-a01", "artifacts/raw/c500-runs/exp-20260824-092-5a8de2813561-a02"], "baseline_commit": "2230963fdd9d6394b3b63864500ffab00818b4f0", "benchmark": "C500-local ABBA medians baseline->candidate: attempt 1 case2 6.1890->6.1135 ms (-1.2199 percent), arms 6.189/6.189->6.111/6.116; attempt 2 case2 6.1870->6.1115 ms (-1.2203 percent), arms 6.186/6.188->6.114/6.109. Repeat maximum protected regression was case4 +0.3605 percent.", "candidate_commit": "5a8de28135616f6e76275c1b7bf2b1cdc5dcdc52", "change": "Added optional fixed N/K template carriers and selected fixed N=4096/K=7168 only for the existing exact sorted case-2 dispatch; runtime EM, kernel body, map/grid, MMA/LDS/STS/barriers, epilogue, ABI and other dispatches remain unchanged.", "correctness": "PASS twice: C500 candidate/baseline MXCC builds, 3/3 differential correctness, full regression, sampled correctness, source/tree integrity, no-process gates and all 31 manifest entries.", "decision": "keep", "device": "c500-local", "environment": "MetaX C500 device 0; xcore1000; MACA 3.7.1.5; MXCC 1.0.0 d9102a1572; driver 3.8.30; 25 percent compute / 16000 MiB slice; c500-local.", "hypothesis": "Fixing only case-2 N and K at compile time while retaining runtime EM improves both C500 case-2 arms by at least 1.0 percent without stable protected regression above 0.5 percent.", "id": "exp-20260824-092", "language": "CUDA Maca", "notes": "Tested commit 5a8de28135616f6e76275c1b7bf2b1cdc5dcdc52; metadata queue commit 7b595279f8afeb33dc2a6db1dbdd2b1d477c7c16; workflow 928a7ba5b513b7f61ea7a7c668c1cf1e6738e7be; source blob c3b3d78c721a7c1ef08c8390d1de1bf3e2c9e942; LF SHA-256 6bd67555fbc64787497a271c376c49c8e0055d479bef20149cce649742e874d1; job blob 7f91ad9b45b58a3fa128a95aeb839c7630bc5662; manifest-file SHA-256 ff8e18b576f7f1931ea221743d72e6c81d84841861dbfdaf9d66cbba36394970 and af52874614671a570f4b0a89a42c1ad9e91ae8cd604928797f2a938ebc988a28. No NVIDIA run; no independent audit required.", "operator": "Fused MoE i8 tn", "result": "KEEP for serialized OJ validation: both attempts and all four case-2 arms clear 1 percent; no stable protected aggregate exceeds the 0.5 percent gate.", "schema_version": 1, "timestamp": "2026-08-24T15:22:26+00:00"}
{"artifacts": ["artifacts/raw/c500-runs/exp-20260825-093-cf0e65abefd2-a01"], "baseline_commit": "2230963fdd9d6394b3b63864500ffab00818b4f0", "benchmark": "NOT RUN: build gate failed before warmup or ABBA.", "candidate_commit": "cf0e65abefd277b1f9de866edc005613d7cedcc0", "change": "Added an exact-case-2-only two-image 64-KiB asynchronous BSM staging path with arrive(64) and barrier_inst; protected paths retained the formal-best source behavior.", "correctness": "NOT RUN: candidate MXCC build failed with 19 undeclared-identifier errors in the common peeled tail; no target executable or correctness result exists.", "decision": "revert", "device": "c500-local", "environment": "MetaX C500 device 0; MACA 3.7.1.5; MXCC 1.0.0 d9102a1572; driver 3.8.30; 25 percent compute / 16000 MiB slice; compile-only failure.", "hypothesis": "Exact-case-2 64-KiB A+B parity BSM double buffering with gvmcnt-zero waits overlaps next-tile global-to-shared copy with current-tile MMA.", "id": "exp-20260825-093", "language": "CUDA Maca", "notes": "Queue commit b9fcfc86e934341db1cf0ae0cdaf92f02da5e698; workflow 2f717f195fb004a43080fcb22dc0279b31240158; source blob 595a2b00b5aaed5e3dea4b21a77a8f0c908d9371; LF SHA-256 f4e8049853cd6794226e980f8f0ec3d7422e214eb86fe8b59eb9dda01aa4b7b8; no NVIDIA or OJ run.", "operator": "Fused MoE i8 tn", "result": "REJECTED: immutable candidate failed target compilation; common peeled-tail tensor/store state was branch-local, and the BSM tail would also have used uninitialized legacy A payloads.", "schema_version": 1, "timestamp": "2026-08-24T17:12:53+00:00"}
{"artifacts": ["artifacts/raw/c500-runs/exp-20260825-094-62839e1c5c2d-a01"], "baseline_commit": "2230963fdd9d6394b3b63864500ffab00818b4f0", "benchmark": "C500-local ABBA medians baseline->candidate: case1 1.0560->1.0800 ms (+2.2727%, noisy baseline); case2 6.1800->6.1835 (+0.0566%); case3 0.5605->0.5610 (+0.0892%); case4 3.4605->4.2250 (+22.0922%), arms 3.460->4.223 and 3.461->4.227.", "candidate_commit": "62839e1c5c2de4703963047728a48e0f982d01a1", "change": "Added a default-zero steady-loop unroll template factor and selected factor two only for the exact sorted case-4 launch.", "correctness": "PASS: candidate/baseline MXCC builds, 3/3 differential correctness, full regression, sampled correctness, source/tree integrity, no-process gates and 31-entry manifest.", "decision": "revert", "device": "c500-local", "environment": "MetaX C500 device 0; MACA 3.7.1.5; MXCC 1.0.0 d9102a1572; driver 3.8.30; 25 percent compute / 16000 MiB slice.", "hypothesis": "Giving only exact sorted case 4 factor-2 partial-unroll metadata improves both target arms by at least 1 percent without protected regression.", "id": "exp-20260825-094", "language": "CUDA Maca", "notes": "Queue commit d1f5a3ef8a89642ba82d88d9483540ebb218772e; workflow 2f717f195fb004a43080fcb22dc0279b31240158; source blob 8158d617c0277435ae1117d6e0e68f908c5db53a; LF SHA-256 4ad2024cbf309749d94a6b6ba76521c4eeaf320e5d3fd038df778e8a94010def; manifest-file SHA-256 55262805d669f1b574f36603c7a0edf41fdba36e51abc54cf76bf8e123d3e341; no NVIDIA or OJ run.", "operator": "Fused MoE i8 tn", "result": "REJECTED: both low-drift target arms regress about 22.1 percent; close factor-2 partial K-loop unroll without repeat, integration or OJ.", "schema_version": 1, "timestamp": "2026-08-24T17:12:54+00:00"}
{"artifacts": ["artifacts/raw/c500-runs/exp-20260825-095-574183cd9199-a01"], "baseline_commit": "2230963fdd9d6394b3b63864500ffab00818b4f0", "benchmark": "C500-local ABBA medians baseline->candidate: case1 1.0335->1.0615 ms (+2.7092%, noisy candidate drift); case2 6.1885->9.3655 ms (+51.3372%), arms 6.189/6.188->9.366/9.365; case3 0.5635->0.5575 ms (-1.0648%); case4 3.4665->3.3610 ms (-3.0434%).", "candidate_commit": "574183cd91999143e7394c73c441935ad4676990", "change": "Replayed exp-093 BSM issue/wait/parity exactly, exposed final-parity tensor views to the common tail, and compiled exactly the load_a_2/load_a_3 peeled-tail STS operations only for the non-BSM path.", "correctness": "PASS: candidate/baseline MXCC builds, 3/3 differential correctness, full regression, sampled correctness, source/tree integrity, no-process gates and all 31 manifest entries.", "decision": "revert", "device": "c500-local", "environment": "MetaX C500 device 0; xcore1000; MACA 3.7.1.5; MXCC 1.0.0 d9102a1572; driver 3.8.30; 25 percent compute / 16000 MiB slice; c500-local.", "hypothesis": "Correcting exp-093 final-parity tensor scope and making the two legacy A-tail STS operations false-parity-only allows exact-case-2 64-KiB BSM parity staging to improve both target arms by at least 1 percent.", "id": "exp-20260825-095", "language": "CUDA Maca", "notes": "Tested commit 574183cd91999143e7394c73c441935ad4676990; queue commit 9ab9f07f69a08b7df04dc2ebe74cdd21611be842; workflow 41020a87289bc5b351188f35e6aad0f8dd602bfd; source blob 6d002a4369752f06cad5b1a5f8261e87417a02a2; LF SHA-256 af6db0e9634d21d882df70614fa47dd30e830e5adbc2f564f885c11a32bdb6b3; job blob 7f91ad9b45b58a3fa128a95aeb839c7630bc5662; manifest-file SHA-256 9f835ca214fc7a6c98f691029ea55c71ce74d81204bead3367930bfcd644ad69. No NVIDIA or OJ run.", "operator": "Fused MoE i8 tn", "result": "REJECTED: corrected BSM path compiles and is exact, but stable case-2 arms regress 51.3372 percent; close 64-KiB parity BSM without repeat, profile, audit, integration or OJ.", "schema_version": 1, "timestamp": "2026-08-24T17:44:22+00:00"}
