{"artifacts": ["artifacts/raw/remote-runs/exp-20260822-021-943fb53ebeeb/status.json", "artifacts/raw/remote-runs/exp-20260822-021-943fb53ebeeb/stdout.log", "artifacts/raw/remote-runs/exp-20260822-021-943fb53ebeeb/environment.txt", "artifacts/raw/remote-runs/exp-20260822-021-943fb53ebeeb/gpu-before.csv", "artifacts/raw/xpuoj/122045/result-summary.png", "artifacts/raw/xpuoj/122045/result-details.png", "artifacts/raw/xpuoj/122045/scoreboard.png", "artifacts/raw/xpuoj/122045/scoreboard-self.png"], "baseline_commit": "8c519e6c1bb57e7b124b60806db9575fa1267207", "benchmark": "proxy/NVIDIA RTX A5000 medians: decode gate-up 45.145 ms, prefill gate-up 338.746 ms, decode down 21.530 ms, prefill down 171.746 ms; one warmup and five samples. NVIDIA executes the unchanged fallback. Proxy skew model reduced maximum B reuse distance from 271 to 31 tile footprints and 24-tile LRU misses from 8448 to 6304. Target/C500 XPU-OJ #122045: case scores 83/71/89/83; user-kernel times 1007 us/9 ms/544 us/4129 us; 81.50 total versus the 82.25 best baseline.", "candidate_commit": "943fb53ebeeb7cdd76a5208c4e1d5afbc43f1885", "change": "Templated only the MACA tile-index mapping. Case 2 launches grid (2,256,16) and maps tile_m=blockIdx.y, tile_n=blockIdx.z*2+blockIdx.x; the other three shapes instantiate the original mapping. CTA size, LDS, MMA/load/store body, addresses, arithmetic, shape inference, and NVIDIA fallback are unchanged. Added exact dispatch, coverage, linear-order, and finite-cache regression proofs.", "correctness": "PASS on committed proxy/NVIDIA snapshot: source-core hash matched OJ #117114 after the tile mapping; build, three randomized/boundary/extreme correctness cases, all four allocation mappings and public-shape samples, exact 16,384-element MMA output mapping, exact 256x32 case-2 grid coverage, unique case-2 dispatch, all A-load bounds, and all-zero/read-only regression passed. TARGET PASS: XPU-OJ #122045 compiled for xcore1000 and passed the sample plus all four test cases.", "decision": "revert", "device": "nvidia", "environment": "proxy/NVIDIA physical GPU 1 RTX A5000; driver 535.261.03; CUDA 12.2 nvcc V12.2.140; sm_86; run 2026-08-22T15:17:57+08:00; target XPU-OJ CUDA Maca C500 submission #122045", "hypothesis": "Case 2 has skewed expert routing, so scanning all 256 M tiles inside each two-N group can shorten repeated expert B-tile reuse enough for L2 while preserving immediate two-CTA A reuse, the validated 256-thread MMA body, and 32 KiB LDS.", "id": "exp-20260822-021", "language": "CUDA Maca (target case-2 L2 CTA schedule plus NVIDIA compatibility path)", "notes": "Candidate source git blob 0281d7b0aac6dfcd67211c145e643c06d4abeb56. OJ submitted LF-normalized source was 32,838 bytes, SHA-256 bf6e351f9edc49f6dcd7367245705c587a5db76f9575d1f36390b82a42ed5901. The target accepted the template mapping and exact tile coverage, but reducing the B reuse window did not offset reloading each A tile for 16 N groups; case 2 fell from the best 73 points / 8.158 ms to 71 points / 9 ms. Restore the active submission source exactly to best commit 8c519e6c1bb5. No rejected __dp4a, wide/paired CTA, BSM, or non-zero-arrive path is present.", "operator": "Fused MoE i8 tn", "result": "TARGET REJECTED: XPU-OJ #122045 was Accepted 4/4 at 81.50, but specialized case 2 fell from the best baseline's 73 points / 8.158 ms to 71 points / 9 ms. The other three baseline paths remained within measurement noise at 83/89/83.", "schema_version": 1, "timestamp": "2026-08-22T07:20:33+00:00"}
{"artifacts": ["artifacts/raw/remote-runs/exp-20260822-022-3584f6802448/status.json", "artifacts/raw/remote-runs/exp-20260822-022-3584f6802448/stdout.log", "artifacts/raw/remote-runs/exp-20260822-022-3584f6802448/environment.txt", "artifacts/raw/remote-runs/exp-20260822-022-3584f6802448/gpu-before.csv", "artifacts/raw/xpuoj/122083/result-summary.png", "artifacts/raw/xpuoj/122083/result-details.png", "artifacts/raw/xpuoj/122083/scoreboard.png", "artifacts/raw/xpuoj/122083/scoreboard-self.png"], "baseline_commit": "8c519e6c1bb57e7b124b60806db9575fa1267207", "benchmark": "proxy/NVIDIA RTX A5000 medians: decode gate-up 44.924 ms, prefill gate-up 338.728 ms, decode down 21.530 ms, prefill down 171.766 ms; one warmup and five samples. NVIDIA executes the unchanged fallback. The 24-tile abstract LRU model preserves A misses at 256 and reduces B misses from 8192 to 7488 (total 8448 to 7744). Target/C500 XPU-OJ #122083: case scores 83/73/89/83; user-kernel times 1004 us/8.172 ms/544 us/4.133 ms; 82.00 total versus the 82.25 best baseline.", "candidate_commit": "3584f680244849c8b74d188635ba522204396534", "change": "Templated only the MACA logical tile-N mapping. Case 2 keeps grid (1,32,256), 256 threads, 32 KiB LDS, and maps odd tile_m blocks to tile_n=gridDim.y-1-blockIdx.y; even tile_m and all other shapes retain tile_n=blockIdx.y. MMA/load/store addresses after tile mapping, arithmetic, bytes, CTA count, shape inference, and NVIDIA fallback are unchanged. Added exact 2D coverage, single-case dispatch, and finite-cache regressions.", "correctness": "PASS on committed proxy/NVIDIA snapshot: source-core hash matches the 82.25 baseline after tile mapping; build; randomized boundary, two-expert, and INT8-extreme cases all matched_ratio=1.0/max_abs=0; all four allocation mappings and public-shape samples; exact 16,384-element MMA output coverage; exact M/N grid coverage; case-2-only serpentine dispatch; A-load bounds; all-zero/read-only regression. TARGET PASS: XPU-OJ #122083 compiled for xcore1000 and passed the sample plus all four test cases.", "decision": "revert", "device": "nvidia", "environment": "proxy/NVIDIA physical GPU 1 RTX A5000; driver 535.261.03; CUDA 12.2 nvcc V12.2.140; sm_86; run 2026-08-22T16:08:02+08:00; target XPU-OJ CUDA Maca C500 submission #122083", "hypothesis": "Case 2 uses a skewed expert distribution. Alternating ascending and descending logical N order across adjacent M tiles changes same-expert B reuse distances from a fixed 31 tile footprints to 0,2,...,62, creating partial finite-L2 hits while each M tile still executes all 32 N CTAs consecutively and retains full A reuse.", "id": "exp-20260822-022", "language": "CUDA Maca (target case-2 serpentine N schedule plus NVIDIA compatibility path)", "notes": "Candidate source git blob 6fbb83f037a33defbca7eeb70e7bf7b02c619077. OJ submitted LF-normalized source was 32,678 bytes, SHA-256 45bf9f165813cdceb16c24f4eac2989e253cc1e2b0413cbb3fe0ed3d7690d7cd. The target accepted the mapping and exact tile coverage, but the modeled finite-cache improvement did not reduce latency: case 2 moved from the best 8.158 ms to 8.172 ms and stayed at 73 points; case 4 noise reduced total score by 0.25. Restore active submission and regression source exactly to best commit 8c519e6c1bb5. No __dp4a, wide or paired CTA, BSM, non-zero arrive, or prior 2-N full-M scan path is present.", "operator": "Fused MoE i8 tn", "result": "TARGET REJECTED: XPU-OJ #122083 was Accepted 4/4 at 82.00, but the case-2 serpentine N schedule did not improve the best baseline's 73 points / 8.158 ms and measured 8.172 ms. The other three paths were within run-to-run noise at 83/89/83.", "schema_version": 1, "timestamp": "2026-08-22T08:09:18+00:00"}
{"artifacts":["artifacts/raw/remote-runs/exp-20260822-023-7f2b2add3cd6/status.json","artifacts/raw/remote-runs/exp-20260822-023-7f2b2add3cd6/stdout.log","artifacts/raw/remote-runs/exp-20260822-023-7f2b2add3cd6/environment.txt","artifacts/raw/remote-runs/exp-20260822-023-7f2b2add3cd6/gpu-before.csv","artifacts/raw/xpuoj/122125/result-summary.png","artifacts/raw/xpuoj/122125/result-details.png","artifacts/raw/xpuoj/122125/scoreboard.png","artifacts/raw/xpuoj/122125/scoreboard-self.png"],"baseline_commit":"8c519e6c1bb57e7b124b60806db9575fa1267207","benchmark":"proxy/NVIDIA RTX A5000 medians: decode gate-up 45.530 ms, prefill gate-up 338.748 ms, decode down 21.530 ms, prefill down 171.745 ms; one warmup and five samples. NVIDIA executes the unchanged fallback, so timings establish provenance and no fallback regression only. Target/C500 XPU-OJ #122125: case scores 83/73/89/83; exact user-kernel times 1009 us/8.153 ms/546 us/4.131 ms; 82.00 total versus the 82.25 best baseline.","candidate_commit":"7f2b2add3cd623623a6986012052abf5d64ac297","change":"Templated only the MACA epilogue policy. Case 2 uses the original 128x128 matrix core and, after its final MMA/LDS use, executes a CTA barrier, lets threads 0..127 load one scale_a*moe_weight product and one scale_b value into the first 1 KiB of the existing 32 KiB shared allocation, executes a second barrier, then uses four b128 LDS reads per thread. The other three shapes instantiate the original epilogue. Added exact dispatch, producer/consumer coverage, byte-model, LDS-footprint, barrier, and baseline matrix-core regressions.","correctness":"PASS on committed proxy/NVIDIA snapshot: source prefix SHA-256 matched the 82.25 baseline matrix core; build; randomized boundary, two-expert, and INT8-extreme cases matched_ratio=1.0/max_abs=0; all four public allocation mappings and sampled outputs; exact MMA output/grid/A-load coverage; exactly one case-2 cooperative dispatch; 128 row and 128 column producers each cover once and every scale has 16 consumers; 24,576->1,536 global scale-byte proof; 1,024-byte reused-LDS proof; all-zero/read-only regression. TARGET PASS: XPU-OJ #122125 compiled for xcore1000 and passed the sample plus all four test cases.","decision":"revert","device":"nvidia","environment":"proxy/NVIDIA physical GPU 1 RTX A5000; driver 535.261.03; CUDA 12.2 nvcc V12.2.140; sm_86; run exp-20260822-023-7f2b2add3cd6 at 2026-08-22T17:04:07+08:00; target XPU-OJ CUDA Maca C500 submission #122125","hypothesis":"Case 2 redundantly loads the same 128 scale_a values, 128 moe_weights, and 128 scale_b values sixteen times per 128x128 CTA. Reusing the existing LDS after all MMA reads to cooperatively cache combined row scales and column scales reduces global epilogue scale traffic from 24 KiB to 1.5 KiB per CTA without changing matrix A/B bytes, CTA size, allocated LDS, MMA work, or 32-N A reuse; the saved ~180 MiB over case 2 can outweigh two shared barriers and cross the next score threshold.","id":"exp-20260822-023","language":"CUDA Maca (target case-2 cooperative epilogue-scale LDS cache plus NVIDIA compatibility path)","notes":"Candidate source git blob 6fb52be3d3f7ff61ec9b45d386db230d9fffab79. OJ submitted LF-normalized source was 34,934 bytes, SHA-256 7d938dcec680ae1471ec33428c5510c750e88bdaf9c3e3f0df510065a4682cb0. The target accepted the template, scalar b32 loads, cooperative LDS producer/consumer mapping, and barriers. Cutting nominal scale traffic by 23,040 bytes per CTA moved case 2 only from the best 8.158 ms to 8.153 ms (5 us / 0.06%) and stayed at 73 points; it was also 95 us slower than the prior case-2 specialization #117118. The scale working set was likely already cache-friendly and two CTA barriers plus LDS loads offset the saved global requests. Restore active submission and regression source exactly to best commit 8c519e6c1bb5. No __dp4a, wide/paired CTA, bsm, non-zero arrive, 2-N full-M scan, or serpentine path is present.","operator":"Fused MoE i8 tn","result":"TARGET REJECTED: XPU-OJ #122125 was Accepted 4/4 at 82.00, but the cooperative case-2 epilogue-scale cache remained at 73 points / 8.153 ms and did not beat the 82.25 best. The other three baseline paths measured 83/89/83.","schema_version":1,"timestamp":"2026-08-22T17:04:07+08:00"}
{"artifacts": ["artifacts/raw/remote-runs/exp-20260822-024-6440a6c27218/status.json", "artifacts/raw/remote-runs/exp-20260822-024-6440a6c27218/stdout.log", "artifacts/raw/remote-runs/exp-20260822-024-6440a6c27218/environment.txt", "artifacts/raw/remote-runs/exp-20260822-024-6440a6c27218/gpu-before.csv", "artifacts/raw/xpuoj/122209/canceled.png"], "baseline_commit": "8c519e6c1bb57e7b124b60806db9575fa1267207", "benchmark": "proxy/NVIDIA RTX A5000 medians: decode gate-up 45.552 ms, prefill gate-up 338.696 ms, decode down 21.528 ms, prefill down 171.804 ms; one warmup and five samples. NVIDIA executes the unchanged fallback, so timings establish provenance and no fallback regression only. XPU-OJ #122209 was canceled before C500 execution and provides no target benchmark.", "candidate_commit": "6440a6c27218ca2d869310aac229172bc188594f", "change": "Templated only the MACA outer M-tile ownership. Case 2 checks even/odd adjacent expert IDs: an even leader processes one or two same-expert M tiles serially with the unchanged matrix core; the paired odd CTA returns. Different experts and all three other shapes compute exactly one original tile. The grid, 256 threads, 32 KiB LDS, per-logical-tile A/B bytes, MMA/LDG/STS sequence, arithmetic, and NVIDIA fallback are unchanged. Added arbitrary-order exact coverage and case-2-only dispatch regressions.", "correctness": "Proxy/NVIDIA snapshot passed source checks, build, randomized correctness and regression, but NVIDIA executes the fallback. A later target-path concurrency audit invalidated the synchronization proof: a fast wave can start the second logical tile's STS into the shared 32 KiB LDS while a slow wave still reads the first tile. XPU-OJ #122209 was canceled before compilation/execution, so exp-024 has no C500 correctness evidence.", "decision": "revert", "device": "nvidia", "environment": "proxy/NVIDIA physical GPU 1 RTX A5000; driver 535.261.03; CUDA 12.2 nvcc V12.2.140; sm_86; run exp-20260822-024-6440a6c27218 at 2026-08-22T18:02:46+08:00; XPU-OJ #122209 canceled", "hypothesis": "Case 2 uses skewed grouped routing, so adjacent 128-row tiles can share an expert. Letting each even leader CTA serially compute an adjacent same-expert M tile while the follower returns preserves the target-validated 256-thread, 32 KiB, 128x128 core and every logical tile load, but shortens reuse of one 896 KiB B N-tile from the intervening 32-N expert footprint to the immediately repeated CTA loop and removes a full active CTA body.", "id": "exp-20260822-024", "language": "CUDA Maca (target case-2 adjacent same-expert M-tile pairing plus NVIDIA compatibility path)", "notes": "Candidate source git blob e33edff795f82107d84a1109d7c4a4d77a67f8f1. OJ #122209 exact LF source was 33,718 bytes with SHA-256 c7b46f07e31b1e47fcf1a2e54882a61db7d8a89413db72b6680025c9f25c2858. The submission was canceled after prolonged Pending. Later #122376 and Accepted #122383 used exact exp-023 source (34,934 bytes, SHA-256 7d938dcec680ae1471ec33428c5510c750e88bdaf9c3e3f0df510065a4682cb0), so they do not validate this experiment. Supersede with exp-025, adding one uniform paired-loop CTA barrier after the first tile's final LDS read.", "operator": "Fused MoE i8 tn", "result": "TARGET NOT EVALUATED: XPU-OJ #122209 was Canceled. Post-run audit found a missing CTA barrier at the serial logical-tile LDS reuse boundary, so exp-024 is rejected as synchronization-unsafe and superseded by a single-fix experiment.", "schema_version": 1, "timestamp": "2026-08-22T10:04:40+00:00"}
{"artifacts": ["artifacts/raw/remote-runs/exp-20260822-025-542372e3560c/status.json", "artifacts/raw/remote-runs/exp-20260822-025-542372e3560c/stdout.log", "artifacts/raw/remote-runs/exp-20260822-025-542372e3560c/environment.txt", "artifacts/raw/remote-runs/exp-20260822-025-542372e3560c/gpu-before.csv", "artifacts/raw/xpuoj/122458/result-summary.png", "artifacts/raw/xpuoj/122458/result-details.png", "artifacts/raw/xpuoj/122458/scoreboard.png", "artifacts/raw/xpuoj/122458/scoreboard-self.png"], "baseline_commit": "8c519e6c1bb57e7b124b60806db9575fa1267207", "benchmark": "proxy/NVIDIA RTX A5000 medians: decode gate-up 44.874 ms, prefill gate-up 338.700 ms, decode down 21.529 ms, prefill down 171.747 ms; one warmup and five samples. NVIDIA executes the unchanged fallback, so timings establish provenance and no fallback regression only. Target/C500 XPU-OJ #122458: case scores 83/73/88/83; exact user-kernel times 1016 us/8.180 ms/552 us/4.154 ms; 81.75 total versus the 82.25 best baseline.", "candidate_commit": "542372e3560c7575aefcb3b4f7e25698f702b8bf", "change": "Superseded exp-024 with one synchronization fix: after the last MMA/LDS consumption and before epilogue work, paired leaders execute a uniform shared barrier only when another logical tile remains. Single-tile paths execute no new barrier. Adjacent-M ownership, 256 threads, 32 KiB LDS, 128x128 matrix core, A/B bytes, grid, arithmetic, epilogue, other shapes, and NVIDIA fallback are unchanged. Added barrier-policy and source-order regressions.", "correctness": "PASS on committed proxy/NVIDIA snapshot: source proof confirms the best-baseline K pipeline hash, exactly one paired-loop barrier after final LDS use, four total target CTA barriers, and unchanged dispatch/resource structure; CUDA 12.2 build; randomized boundary/two-expert/INT8-extreme correctness matched_ratio=1.0 and max_abs=0; all allocation, output/grid/A-load, arbitrary-order pairing, 128/256 all-same leader, 1/2 barrier-policy, all-zero and read-only regressions passed. TARGET PASS: XPU-OJ #122458 compiled for xcore1000 and passed the sample plus all four test cases.", "decision": "revert", "device": "nvidia", "environment": "proxy/NVIDIA physical GPU 1 RTX A5000; driver 535.261.03; CUDA 12.2 nvcc V12.2.140; sm_86; run exp-20260822-025-542372e3560c at 2026-08-22T20:41:08+08:00; target XPU-OJ CUDA Maca C500 submission #122458", "hypothesis": "Case 2 skewed routing may place the same expert in adjacent 128-row tiles. A leader CTA can serially compute such a pair to make the 896 KiB B N-tile immediately reusable and remove the follower body, provided one uniform CTA barrier after the first tile's final LDS use prevents the second tile from overwriting shared state still read by a slow wave.", "id": "exp-20260822-025", "language": "CUDA Maca (race-free target adjacent-M pairing plus NVIDIA compatibility path)", "notes": "Candidate source git blob b4f4d2e189a297f057b53189e321c645e7adef56. OJ-submitted LF source was 33,993 bytes with SHA-256 d32a150236c14cfa350c2d953027efd7819752f693fed5d38e5f0c453afa445d. The target accepted the barrier, template dispatch and paired ownership, but case 2 measured 8.180 ms, 22 us slower than the best baseline, while unrelated case 3 noise reduced the total by another 0.25. Adjacent-M pairing provided no target benefit; restore active submission and regression source exactly to best commit 8c519e6c1bb5. No rejected __dp4a, wide/paired-N CTA, BSM, arrive, 2-N full-M scan, serpentine or cooperative scale-cache path is present.", "operator": "Fused MoE i8 tn", "result": "TARGET REJECTED: XPU-OJ #122458 was Accepted 4/4 at 81.75, but race-free adjacent-M pairing left case 2 at 73 points / 8.180 ms and did not beat the 82.25 best. The other three cases measured 83/88/83.", "schema_version": 1, "timestamp": "2026-08-22T12:46:08+00:00"}
