{"artifacts": ["artifacts/raw/c500-runs/exp-20260827-188-aeea17508ffe-a01", "handoffs/exp-20260827-188.md"], "baseline_commit": "235a34a22889c4d1ce5465acc2daaf1cdb67547d", "benchmark": "C500 ABBA case2 6.0615 to 6.0895 ms (+0.4619 percent), arms 6.060 to 5.960 ms (-1.6502 percent) and 6.063 to 6.219 ms (+2.5730 percent), with 4.3456 percent candidate drift. Protected cases 1/3/4 changed -0.0481/+0.2752/+0.0451 percent.", "candidate_commit": "aeea17508ffef9e3db3758c477fc022b8d6a1a19", "change": "Composed the OJ-validated exact case-2 fixed N/K plus in-place uint32 B-row carriers with an odd-cluster N-serpentine logical tile mapping; all traffic, addresses after mapping, synchronization, geometry cardinality, epilogue and ABI stayed exact.", "correctness": "PASS: independent detached mapping/address audit; local focused/protected/control tests 37/37; C500 candidate/baseline builds, 3/3 differential correctness at matched_ratio 1.0/max_abs 0, full regression, sampled/all-zero read-only correctness, source/tree integrity, no-process gates and independently rehashed 31-entry manifest.", "decision": "revert", "device": "c500-local", "environment": "MetaX C500 xcore1000 device 0; MACA 3.7.1.5; MXCC 1.0.0 d9102a1572; driver 3.8.30; 25 percent compute / 16000 MiB slice; no device process before or after; NVIDIA, TileLang and Triton disabled.", "hypothesis": "Composing exact case-2 fixed N/K and in-place bounded uint32 B-row carriers with odd-cluster N serpentine improves case 2 aggregate and both ABBA arms by at least 1.8 percent while every protected observation remains within 0.5 percent.", "id": "exp-20260827-188", "language": "CUDA Maca", "notes": "Tested aeea17508ffef9e3db3758c477fc022b8d6a1a19; metadata handoff 885f9c935232df24e6bd908c716e2a3c01b6239c. Candidate source blob 9bbcc1b27b0caa18dca55d6abc44aecb3f2ec7a4; LF SHA-256 2d452f8261e19a1c83f46d1e848c24dd43e1087379df829eb0bb8bce2800e577. Exact case-2 resources 0 stack / 232 MT / 40 ST / 32768 shared / 2 warps. Workflow/candidate/baseline archives 7b10150fe8cca698bf4240f59a77b479b7407cd38172293ad1aa5439f9ef199d / 6c6fd7f00e1c84d22f9afda4dfc7e38fb6277011a2a2ba09c10595f667a616ff / aa366722f62ee409474596d898d280fa8e781c4124976a48e769ead8a456271f. No repeat, integration, enqueue or OJ.", "operator": "fused_moe_i8_tn", "result": "REJECTED: aggregate and both-arm 1.8 percent gates fail; even the favorable arm reaches only 1.6502 percent, so the unstable second arm does not authorize a repeat.", "schema_version": 1, "timestamp": "2026-08-27T15:21:18+00:00"}
{"artifacts": ["artifacts/raw/c500-runs/exp-20260827-189-ab1192f7fb73-a01", "handoffs/exp-20260827-189.md"], "baseline_commit": "235a34a22889c4d1ce5465acc2daaf1cdb67547d", "benchmark": "NOT RUN: candidate MXCC build failed; no baseline build, correctness, regression, warmup or ABBA samples exist.", "candidate_commit": "ab1192f7fb733881fb69a8c639a09dc9690a607e", "change": "Only the exact 4096x7168x2048 clone replaces four CUTE B address chains with one row-zero base and literal offsets 0, 2048, 4096 and 6144; all other paths and schedules remain exact.", "correctness": "No-device focused tests passed 6/6 and detached independent audit exhaustively proved 917504 aligned in-bounds B-vector starts. Trusted C500 candidate build failed before correctness because offsets 4096 and 6144 exceed the GVM I13 limit.", "decision": "revert", "device": "c500-local", "environment": "MetaX C500/xcore1000; MACA 3.7.1.5; MXCC 1.0.0 d9102a1572; device 0; 25 percent compute / 16000 MiB; trusted run failed/1 and returned a verified 20-entry manifest.", "hypothesis": "Exact case3 uses one dynamic B base and four literal LDG offsets to remove at least four native address issues per wave and K tile while preserving resources.", "id": "exp-20260827-189", "language": "CUDA Maca", "notes": "Tested ab1192f7fb733881fb69a8c639a09dc9690a607e; queue tip df0b42bcf3cf5a338238d7ad63f16b1ce38604d7; source blob 51e109c91c2a018d2f5b6a603f3f8f7573e7c532; LF SHA-256 d6d3670e0467f07e59f8f453091588e442182b98d46c307728d5889b1b46223e. Partial fixed-clone resources were 0 stack / 226 MT / 40 ST / 32768 shared / 2 warps. Controller rejected; no OJ.", "operator": "fused_moe_i8_tn", "result": "REJECTED: xcore1000 backend reports Illegal instruction detected: Offset exceeds GVM I13 limit at four tail/steady 4096/6144 sites.", "schema_version": 1, "timestamp": "2026-08-28T03:18:20+00:00"}
{"artifacts": ["artifacts/raw/c500-runs/exp-20260828-190-71d54d2b869e-a01", "handoffs/exp-20260828-190.md"], "baseline_commit": "235a34a22889c4d1ce5465acc2daaf1cdb67547d", "benchmark": "C500 ABBA case3 0.5470 to 0.5385 ms (-1.5539 percent), arms 0.543 to 0.538 ms (-0.9208 percent) and 0.551 to 0.539 ms (-2.1779 percent). Protected case1 aggregate regressed 1.9052 percent and arm A regressed 5.2 percent.", "candidate_commit": "71d54d2b869efd524a7c718c1e651b18da24371e", "change": "Only exact case3 uses one row-slot-2 B base per K tile and signed literal offsets -4096, -2048, 0 and 2048; all other paths and schedules remain exact.", "correctness": "PASS: focused proof 7/7, independent detached audit over all 917504 vector starts, candidate/baseline builds, 3/3 differential correctness at matched_ratio 1.0/max_abs 0, full regression, sampled/all-zero read-only correctness, integrity, no-process gates and independently rehashed 31-entry manifest.", "decision": "revert", "device": "c500-local", "environment": "MetaX C500 xcore1000 device 0; MACA 3.7.1.5; MXCC 1.0.0 d9102a1572; 25 percent compute / 16000 MiB slice; no device process before or after; NVIDIA, TileLang, Triton and OJ disabled.", "hypothesis": "Centered signed-I13 B-load literals improve exact case3 by at least 4.190845 percent while protected arms remain within 0.5 percent.", "id": "exp-20260828-190", "language": "CUDA Maca", "notes": "Tested 71d54d2b869efd524a7c718c1e651b18da24371e; queue tip 2a5e15f8ebedd02a3bb41fc57a327c0010450fee; source blob a6e68a4ed62f8f5aa0b9b3c129ebf6c3c641f7a7; LF SHA-256 e0f2662249f31c5eb7f453cc94fc0d62a7086b23739543c46ae42bfc9d5bf03c. Exact case3 resources 0 stack / 226 MT / 40 ST / 32768 shared / 2 warps. Controller rejected after immutable enqueue; no repeat, integration or OJ.", "operator": "fused_moe_i8_tn", "result": "REJECTED: target improvement is far below the 4.190845 percent OJ score-tier gate and protected case1 is unstable/regressed.", "schema_version": 1, "timestamp": "2026-08-28T03:41:57+00:00"}
{"artifacts": ["artifacts/raw/c500-runs/exp-20260828-191-28608b6bbbf4-a01", "handoffs/exp-20260828-191.md"], "baseline_commit": "235a34a22889c4d1ce5465acc2daaf1cdb67547d", "benchmark": "NOT RUN: warmup candidate passed cases1/2 then exact case3 trapped a target Memory Violation; no target sample or ABBA timing exists.", "candidate_commit": "28608b6bbbf4b915166daec4623e9ca161d7047d", "change": "Added an exact case3 clone with 16 KiB A-only shared storage, 16 resident direct-global B fragments, and retired-slot next-tile reloads; cases1/2/4 and fallback project to formal best.", "correctness": "Local focused 5/5 and detached exhaustive audit passed. C500 builds, generic small 3/3 differential correctness, regression and integrity passed, but first exact public case3 launch trapped Memory Violation before ABBA.", "decision": "revert", "device": "c500-local", "environment": "MetaX C500 xcore1000 device0; MACA 3.7.1.5; MXCC 1.0.0 d9102a1572; 25 percent compute / 16000 MiB; run failed/1; no device process after; NVIDIA/TileLang/Triton/OJ disabled.", "hypothesis": "An exact-case3 single-bank direct-global B fragment pipeline deletes B shared staging and all CTA barriers, improving case3 by at least 4.190845 percent.", "id": "exp-20260828-191", "language": "CUDA Maca", "notes": "Source blob 73232853836f9107c46e4be3731165686f93f400; LF SHA-256 4bbaba04061dec696e4ec6db8d7db590900441c8aca3d0e68a6f2f3dc80a21be. Direct clone resources 0 stack / 184 MT / 40 ST / 16384 shared / 2 warps. Run duration 18.787756782 s; 25-entry manifest verified. No enqueue/integration/OJ. Any CUTE-address correction requires a new experiment.", "operator": "fused_moe_i8_tn", "result": "REJECTED: raw fully composed lane-varying B GEP likely lowered through a signed 32-bit GVM offset when expert bases cross 2 GiB; unchanged source must not be rerun.", "schema_version": 1, "timestamp": "2026-08-28T04:35:39+00:00"}
{"artifacts": ["artifacts/raw/c500-runs/exp-20260828-192-f9367e2c1249-a01", "handoffs/exp-20260828-192.md"], "baseline_commit": "235a34a22889c4d1ce5465acc2daaf1cdb67547d", "benchmark": "NOT RUN: baseline warmup passed all cases; candidate warmup passed cases1/2 then exact case3 trapped the same target Memory Violation, so no case3 sample or ABBA timing exists.", "candidate_commit": "f9367e2c124970711dd59002be46e223ca390aaa", "change": "Restored only the three formal shared-A CTA barriers in exp-191's exact case3 direct-global B clone; raw B address, register pipeline, traffic, mapping, epilogue and ABI remained identical.", "correctness": "Local focused 5/5, workflow 15/15 and detached audit passed. C500 builds, generic-small 3/3 differential correctness, full regression, all-zero read-only and integrity passed, but the first exact public case3 launch trapped Memory Violation before ABBA.", "decision": "revert", "device": "c500-local", "environment": "MetaX C500 xcore1000 device0; MACA 3.7.1.5; MXCC 1.0.0 d9102a1572; 25 percent compute / 16000 MiB; run failed/1; no device process after; NVIDIA/TileLang/Triton/OJ disabled.", "hypothesis": "Restoring formal A barriers makes the direct-global B pipeline correct while preserving its structural B-shared deletion and score-tier-scale performance potential.", "id": "exp-20260828-192", "language": "CUDA Maca", "notes": "Source blob 6fd9ca3e787c35881e1d3d0ae265b50936071b0b; LF SHA-256 ed3dfea6e6b1e1073f3142d88cb40f6e77a314ae8162fc395885c2e8e14d12f3. Direct clone resources 0 stack / 184 MT / 40 ST / 16384 shared / 2 warps. Run duration 18.833234067 s; 25-entry manifest verified. The repeated trap rejects missing A completion and authorizes only a new-ID CUTE-address correction; no enqueue/integration/OJ.", "operator": "fused_moe_i8_tn", "result": "REJECTED: restoring all formal A barriers leaves the exact same full-shape Memory Violation, isolating the remaining defect to raw lane-varying B address lowering.", "schema_version": 1, "timestamp": "2026-08-28T04:46:28Z"}
{"artifacts": ["artifacts/raw/c500-runs/exp-20260828-193-ce915b170cfe-a01", "handoffs/exp-20260828-193.md"], "baseline_commit": "235a34a22889c4d1ce5465acc2daaf1cdb67547d", "benchmark": "NOT RUN: baseline warmup passed all cases; candidate warmup passed cases1/2 then exact case3 trapped the same target Memory Violation, so no case3 sample or ABBA timing exists.", "candidate_commit": "ce915b170cfefbff897374731912d32761ed25bd", "change": "Changed only exp-192's direct LDG first operand from a raw fully composed B GEP to the established CUTE global_b(row,k,tile) tensor operand; all traffic, scheduling, barriers, mapping and ABI remained exact.", "correctness": "Focused 6/6, workflow 15/15 and detached exhaustive audit passed. C500 builds, generic-small 3/3 differential correctness, full regression, all-zero read-only and integrity passed, but the first exact public case3 launch trapped Memory Violation before ABBA.", "decision": "revert", "device": "c500-local", "environment": "MetaX C500 xcore1000 device0; MACA 3.7.1.5; MXCC 1.0.0 d9102a1572; 25 percent compute / 16000 MiB; run failed/1; no device process after; NVIDIA/TileLang/Triton/OJ disabled.", "hypothesis": "CUTE iterator lowering avoids the unsafe raw GEP while preserving the direct-global B register pipeline's score-tier-scale structural benefit.", "id": "exp-20260828-193", "language": "CUDA Maca", "notes": "Source blob e0312e2a777f23dd652de2f395d3c91f94f74f13; LF SHA-256 00edd0d8f650af3bf62c3c443ae38f0f4d8a25a773c68ef8aeb25b5dbbfbaac2. Direct clone resources 0 stack / 182 MT / 40 ST / 16384 shared / 2 warps. Run duration 18.912354797 s; 25-entry manifest verified. Raw/CUTE spelling and missing/restored A barriers are all ruled out; the direct-global B family is closed. No enqueue/integration/OJ.", "operator": "fused_moe_i8_tn", "result": "REJECTED: target public-shape Memory Violation persists with the proven CUTE address form, so the direct-global B scatter/register-fragment mechanism is not target-safe.", "schema_version": 1, "timestamp": "2026-08-28T05:03:38Z"}
{"artifacts": ["artifacts/raw/c500-runs/exp-20260828-194-fdf00c7af281-a01", "handoffs/exp-20260828-194.md"], "baseline_commit": "235a34a22889c4d1ce5465acc2daaf1cdb67547d", "benchmark": "C500-local ABBA case2 baseline 6.0595 ms versus candidate 6.1535 ms, +1.551283 percent regression; arms baseline 6.061/6.058 and candidate 6.157/6.150 ms. Protected cases changed -0.815739/-0.183150/-0.150286 percent.", "candidate_commit": "fdf00c7af281f9ef327cf5a72b4c1fece401cd69", "change": "Only generic-sorted case 2 swaps the physical 16-KiB A/B shared bases; traffic, logical addresses, bank signatures, operation order, barriers, grid, epilogue and ABI remain exact.", "correctness": "PASS: detached address/lifecycle audit; focused 6/6; C500 build, 3/3 differential correctness, full regression, sampled correctness, source/tree integrity and result manifest.", "decision": "revert", "device": "c500-local", "environment": "MetaX C500/xcore1000 device 0; MACA 3.7.1.5; MXCC 1.0.0 d9102a1572; 25 percent compute / 16000 MiB slice; no device process before or after; NVIDIA, TileLang and Triton disabled.", "hypothesis": "Placing case-2 B at shared byte zero removes enough hot-loop base-add work to improve exact sorted case 2 by at least one percent without protected regression.", "id": "exp-20260828-194", "language": "CUDA Maca", "notes": "Workflow fe864624259633a783dee721b66faeebe9f2aa85; metadata closure 3ca5583c0bb3ef703c51fdae630836bd043359db; candidate blob cf359c0951d3b73614ec01bac9b9c1f68c6c3346 / LF SHA-256 48d9d3dc527278710f28befde213e44423aa8f7e6df0835ed0de4fbfa0242b22; generic sorted resources 20/254/40/32768/2 and fixed case4 0/230/40/32768/2. Controller queued then rejected exact immutable candidate.", "operator": "fused_moe_i8_tn", "result": "REJECTED: target case2 regressed stably in aggregate and both arms despite correct execution and identical reported resources; no repeat, integration, or OJ.", "schema_version": 1, "timestamp": "2026-08-28T09:28:17+00:00"}
{"artifacts": ["artifacts/raw/c500-runs/exp-20260828-195-83e313d4c122-a01", "handoffs/exp-20260828-195.md"], "baseline_commit": "235a34a22889c4d1ce5465acc2daaf1cdb67547d", "benchmark": "C500 ABBA case2 6.0620 to 6.0310 ms (-0.511382 percent), both arms approximately -0.511 percent; cases3/4 flat and case1 noisy across arms.", "candidate_commit": "83e313d4c12253a735cf3519d5f041f01c1fb4eb", "change": "Only generic-sorted case2 materializes sixteen named physical B-LDS pointers before the K loop; shared layout, addresses, traffic, operation order, synchronization, dispatch, epilogue and ABI remain exact.", "correctness": "PASS: focused proof, detached address/lifecycle audit, candidate/baseline build, 3/3 differential correctness, full regression, sampled/read-only correctness, source/tree integrity, no-process gates and independently verified 31-entry manifest.", "decision": "revert", "device": "c500-local", "environment": "MetaX C500 xcore1000 device0; MACA 3.7.1.5; MXCC 1.0.0 d9102a1572; 25 percent compute / 16000 MiB; no device process before or after; NVIDIA, TileLang, Triton and OJ disabled.", "hypothesis": "Hoisting sixteen named B-LDS address carriers removes repeated case-2 shared-address work without changing physical addresses or issue order.", "id": "exp-20260828-195", "language": "CUDA Maca", "notes": "Tested 83e313d4c12253a735cf3519d5f041f01c1fb4eb; queue tip 6418c96342263626a1a1807fed46ebf56bf11261; source blob 14a222a4bb8bd0d31d196c47abea2c185bfb5dd9 / LF SHA-256 a37ccbaa3ca9e6062ad2173d842d7abe37e5fe4f346052a4f4be4cf56fb07f8c. Generic resources 0 stack / 250 MT / 40 ST / 32768 shared / 2 warps. Controller rejected; no OJ.", "operator": "fused_moe_i8_tn", "result": "REJECTED: safe standalone improvement did not compose with OJ-tested exp-180; exp-196 retained no incremental case2 gain and no credible leaderboard tier crossing.", "schema_version": 1, "timestamp": "2026-08-28T10:16:57+00:00"}
{"artifacts": ["artifacts/raw/c500-runs/exp-20260828-196-c40940682917-a01", "handoffs/exp-20260828-196.md"], "baseline_commit": "235a34a22889c4d1ce5465acc2daaf1cdb67547d", "benchmark": "C500 ABBA case2 6.0635 to 5.9835 ms (-1.319370 percent), arms 6.062 to 5.984 (-1.2867 percent) and 6.065 to 5.983 ms (-1.3520 percent). Exp-180 alone previously improved the same formal baseline by 1.3530 percent, so the composition adds no gain.", "candidate_commit": "c409406829179138b5ffc89edc357ff17d32f95f", "change": "Only exact sorted case2 composes exp-180 fixed N/K plus in-place uint32 B global-address carriers with exp-195 named B-LDS carriers; cases1/3/4 and formal layout/order/ABI remain exact.", "correctness": "PASS: two-stage exact inverse, exhaustive 1835008 global starts and per-wave LDS cover, local 19/19 plus shell harnesses, candidate/baseline build, 3/3 differential correctness, full regression, sampled/read-only correctness, source/tree integrity, no-process gates and independently verified 31-entry manifest.", "decision": "revert", "device": "c500-local", "environment": "MetaX C500 xcore1000 device0; MACA 3.7.1.5; MXCC 1.0.0 d9102a1572; 25 percent compute / 16000 MiB; no device process before or after; NVIDIA, TileLang, Triton and OJ disabled.", "hypothesis": "Combining OJ-tested fixed-u32 case2 addressing with named B-LDS carriers preserves an incremental gain sufficient to cross the next leaderboard score tier.", "id": "exp-20260828-196", "language": "CUDA Maca", "notes": "Tested c409406829179138b5ffc89edc357ff17d32f95f; queue tip aa3fc57dda916eb5a6d65afca746162ee95d89bb; source blob fd12bbbbf2f104bf2cc45bbf3cd8ca56333a5103 / LF SHA-256 0d4b092fc3a3177f65f5232a6c1c5d1d97435207b18a58dea4b5b0ccf07f850f. Exact case2 resources 0 stack / 230 MT / 40 ST / 32768 shared / 2 warps. Controller rejected; no OJ.", "operator": "fused_moe_i8_tn", "result": "REJECTED: correct but 0.0336 percentage points worse than exp-180's same-environment relative result; no credible incremental OJ tier opportunity and no leaderboard submission.", "schema_version": 1, "timestamp": "2026-08-28T10:17:21+00:00"}
{"artifacts": ["artifacts/raw/c500-runs/exp-20260828-197-7a259a6b3869-a01", "handoffs/exp-20260828-197.md"], "baseline_commit": "235a34a22889c4d1ce5465acc2daaf1cdb67547d", "benchmark": "C500 ABBA case2 6.0585 to 15.2115 ms (+151.076999 percent), stable candidate arms 15.216/15.207 ms; other cases effectively unchanged.", "candidate_commit": "7a259a6b3869ac53d285ef6d22c60f4e4a7fce58", "change": "Exact sorted case2 only uses a new 64x256x128 four-wave 2M-by-2N kernel with 8 KiB A and 32 KiB B shared; other paths and ABI remain exact.", "correctness": "PASS: local 21/21 plus shell gates, detached mapping/lifecycle audit, both builds, 3/3 differential correctness, full regression, sampled/read-only correctness, integrity, no-process gates and verified 31-entry manifest.", "decision": "revert", "device": "c500-local", "environment": "MetaX C500 xcore1000 device0; MACA 3.7.1.5; MXCC 1.0.0 d9102a1572; 25 percent compute / 16000 MiB; no device process before or after.", "hypothesis": "A four-wave 64x256 case-2 CTA halves cold A traffic while sorted B cache reuse offsets doubled B traffic enough to improve the leaderboard score tier.", "id": "exp-20260828-197", "language": "CUDA Maca", "notes": "Tested 7a259a6b3869ac53d285ef6d22c60f4e4a7fce58; queue tip efe5b8e956217018330b4e456f786c7d19fb553b; source blob 18059221ddd8c0dbd1bcdd14f645ce491b4fa5ad / LF SHA-256 53173d7eb4daa1065accaa8dd759f405033c271d5e0a883132f9604dd480adea. Resources 68/254/40/40960/2. Controller rejected.", "operator": "fused_moe_i8_tn", "result": "REJECTED: exact correct mechanism is 2.51x slower on the target and has no leaderboard opportunity; no OJ.", "schema_version": 1, "timestamp": "2026-08-28T10:51:49+00:00"}
