{"artifacts": ["artifacts/raw/c500-runs/exp-20260829-227-c5d090c65a72-a01", "artifacts/raw/c500-runs/exp-20260829-227-c5d090c65a72-a02", "handoffs/exp-20260829-227.md"], "baseline_commit": "8341aa38e55659285673111df90e786c1fba08df", "benchmark": "C500 attempt1 case2 5.9870->5.9600 ms (-0.450977%), arms -0.417641%/-0.484302%; attempt2 5.9985->5.9735 ms (-0.416771%), arms -0.434274%/-0.399334%; all four target arms favorable", "candidate_commit": "c5d090c65a72fff82658c4ac5eff28a6178b18f4", "change": "Only exact sorted case2 enables the composed histogram/packed-map, predicate, A-address and N-serpentine mechanisms; decode and case4 protected paths remain unchanged", "correctness": "PASS: focused and inherited tests 19/19; independent mapping/address audit approved; two C500 attempts each passed dual build, 3/3 differential correctness, full regression, sampled/read-only and source/tree integrity; both manifests independently rehashed 31/31", "decision": "keep", "device": "c500-local", "environment": "MetaX C500/xcore1000 device0; MACA 3.7.1.5; MXCC 1.0.0 d9102a1572; 25 percent compute / 16000 MiB; no device process before or after", "hypothesis": "Compose histogram packed map, exact-case2 predicate removal, A load_k folding and odd-cluster N serpentine to create a leaderboard-relevant case2 gain", "id": "exp-20260829-227", "language": "CUDA Maca", "notes": "Tested c5d090c65a72fff82658c4ac5eff28a6178b18f4; queue tip 23a9b6ce56d3221c74a6d77b28492c9b23318cd2; source blob 1e181a1a3e5cd9a41f3c906724554060690c66d0; LF SHA-256 09c9b2e2fd501e50b760165cdfaaec2f8f348ee8bf03516dd9a42ed4061c7be8; manifests 5da9b5cd50063aa5d7451ae591a97a9679ee5499b01e9cad14d99623b8b66aad and e40688eb6a5f55a85a60ad0bf745d5594c4915c91aec655a508b296ee7649f2e", "operator": "fused_moe_i8_tn", "result": "PROMOTED for leaderboard-first OJ attempt after two same-direction repetitions; local absolute timing is not an OJ score prediction and exp-208 transfer risk remains", "schema_version": 1, "timestamp": "2026-08-29T11:11:06+00:00"}
{"artifacts": ["artifacts/raw/c500-runs/exp-20260829-228-62d0e2b12d7d-a01", "artifacts/raw/c500-runs/exp-20260829-228-62d0e2b12d7d-a02", "artifacts/raw/xpuoj/131621", "handoffs/exp-20260829-228.md"], "baseline_commit": "8341aa38e55659285673111df90e786c1fba08df", "benchmark": "C500 attempt1 case2 5.9875->5.9590 ms (-0.475992%), arms 5.987->5.958 and 5.988->5.960; attempt2 5.9855->5.9595 ms (-0.434383%), arms 5.986->5.961 and 5.985->5.958. OJ cases 86/77/90/86 at 0.802/6.476/0.495/3.485 ms and total 84.75.", "candidate_commit": "62d0e2b12d7dc65e44fe3aa42a370272ea90edfb", "change": "Only exact sorted case2 combines histogram packed map, A load_k folding and odd-cluster N serpentine while restoring formal predicates, physical guard, metadata, scale-B and stores.", "correctness": "PASS: focused/inherited 20/20; detached audit GO; two C500 attempts each passed dual build, 3/3 differential correctness, full regression, sampled/read-only checks, source/tree integrity and independently rehashed 31/31 manifests; OJ 4/4 Accepted.", "decision": "revert", "device": "c500-local and XPU-OJ C500", "environment": "MetaX C500/xcore1000; MACA 3.7.1.5; CUDA Maca OJ", "hypothesis": "Remove the predicate/plain-load component implicated by exp-208/227 while retaining histogram packed map, A load_k folding and odd-cluster N serpentine for an OJ case2 display gain.", "id": "exp-20260829-228", "language": "CUDA Maca", "notes": "Tested 62d0e2b12d7dc65e44fe3aa42a370272ea90edfb; queue tip cc3170e5cd09b1608843d0cbe66bd076aff30352; integrated d7b9c8f0f72c26dcbc38e7991d624782fa505f8c; source blob bc9d306020440637ac29e8f2d692c886f6b74b59; LF SHA-256 72ed616f0bfd8136d4468c1499ba4a920d20ba40b1e459963a96832d7a49fa7a; OJ 131621 finalized; source restored to formal blob 48704a2870975c3990f4681089b1a4efc35d99fa.", "operator": "fused_moe_i8_tn", "result": "REJECTED TIE: OJ remained 84.75 with unchanged cases and rank 17", "schema_version": 1, "timestamp": "2026-08-29T13:09:42+00:00"}
{"artifacts": ["artifacts/raw/c500-runs/exp-20260829-229-84a267b11fd2-a01", "handoffs/exp-20260829-229.md"], "baseline_commit": "8341aa38e55659285673111df90e786c1fba08df", "benchmark": "C500 ABBA case4 3.3315 to 3.3540 ms (+0.675371 percent); baseline arms 3.331/3.332 ms and both candidate arms 3.354 ms. Other cases protected/noise-level.", "candidate_commit": "84a267b11fd2158435aafb25275f240510841512", "change": "Change only kPrefillDownModuleFullSortGridM from 8 to 32 for exact sorted case4; preserve the kernel body and all other dispatch paths.", "correctness": "PASS: focused 6/6; C500 dual build, 3/3 differential correctness, full regression, sampled/read-only checks, source/tree integrity and independently verified 31/31 manifest.", "decision": "revert", "device": "c500-local", "environment": "MetaX C500/xcore1000 device0; MACA 3.7.1.5; MXCC 1.0.0 d9102a1572; 25 percent compute / 16000 MiB; no device process before or after.", "hypothesis": "Exact sorted case4 width32 forms eight homogeneous 32-tile intervals, reducing ideal B refill from 448 MiB to 112 MiB with exact CTA coverage.", "id": "exp-20260829-229", "language": "CUDA Maca", "notes": "Tested 84a267b11fd2158435aafb25275f240510841512; queue tip bf71703555cc8843a7aed607b1d00f009544f116; source blob a7ea3db552f60b73c7ca8a299736c2831e688108; LF SHA-256 4807d6ddf41f080dd304948c59a164cf753212e5bcae0c9749547b6a94b9eb5c; manifest SHA-256 38f45df56dc741565343d09e4f396ec1d19da9f15ee367a19ceecd47368b0760; controller rejected; formal source remained exact.", "operator": "fused_moe_i8_tn", "result": "REJECTED: exact width32 scheduling regressed case4 in both arms and has no leaderboard score path; no repeat, integration or OJ.", "schema_version": 1, "timestamp": "2026-08-29T14:03:25+00:00"}
{"artifacts": ["artifacts/raw/c500-runs/exp-20260829-231-ce6bc13693e9-a01"], "baseline_commit": "8341aa38e55659285673111df90e786c1fba08df", "benchmark": "NOT RUN: candidate compile failed because two peeled-tail A STS operands referenced undeclared store_col at source lines 1380 and 1384.", "candidate_commit": "ce6bc13693e9cbdab8816a0c15862b8fc3746938", "change": "Pair two exact sorted case4 M tiles in one 512-thread CTA with 32 KiB A and 16 KiB shared B; preserve formal A/B images and the 104-event per-wave schedule.", "correctness": "NOT RUN ON C500: target compilation failed before correctness; detached static audit approved the formal A/B mapping and lifecycle, and focused/workflow tests passed 21/21.", "decision": "revert", "device": "c500-local", "environment": "MetaX C500/xcore1000 device0; MACA 3.7.1.5; 25 percent compute / 16000 MiB; failed during candidate build before device execution.", "hypothesis": "Corrected 512-thread dual-M case4 CTA preserves the exact formal shared B image while sharing one B tile across two adjacent same-expert M tiles, halving B staging and crossing the next case4 leaderboard tier.", "id": "exp-20260829-231", "language": "CUDA Maca", "notes": "Source blob cb3b30f7ebbcd2eb5c973895422b15a86cbe094d; LF SHA-256 2ab8f0666cf2e617ea3f25a9f1f7034813a243e1aec47757bbb86937729d6cdb; no enqueue, integration or OJ; exp232 is the only corrected successor.", "operator": "fused_moe_i8_tn", "result": "REJECTED IMMUTABLY: target compile failure; corrected source moved to new experiment exp-20260829-232.", "schema_version": 1, "timestamp": "2026-08-29T15:29:48+00:00"}
{"artifacts": ["artifacts/raw/c500-runs/exp-20260829-232-f1a051c17125-a01"], "baseline_commit": "8341aa38e55659285673111df90e786c1fba08df", "benchmark": "C500 ABBA medians candidate vs baseline: case1 0.8520 vs 0.8415 ms (+1.247772 percent), case2 5.9865 vs 5.9865 ms (flat), case3 0.5260 vs 0.5235 ms (+0.477555 percent), case4 3.4240 vs 3.3280 ms (+2.884615 percent); both case4 candidate arms regressed.", "candidate_commit": "f1a051c171257b76acdc85df08e7dacf6778d258", "change": "Replay exp231 exactly and replace only the two undeclared peeled-tail A-store column operands with the proven formal store_col_a swizzle.", "correctness": "PASS: detached compile-fix audit approved; focused/workflow/ABBA tests 21/21; C500 dual build, 3/3 differential correctness, full regression, sampled correctness, source/tree integrity and manifest validation.", "decision": "revert", "device": "c500-local", "environment": "MetaX C500/xcore1000 device0; MACA 3.7.1.5; MXCC 1.0.0 d9102a1572; 25 percent compute / 16000 MiB; no device process before or after.", "hypothesis": "The compile-corrected 512-thread dual-M case4 kernel preserves the exact formal shared images while halving aggregate B staging and improves case4 by about 6.879 percent to cross the next leaderboard point.", "id": "exp-20260829-232", "language": "CUDA Maca", "notes": "Tested f1a051c171257b76acdc85df08e7dacf6778d258; queue tip f6ae4eb802a21c0c358c4ead09c3aab57c4e5601; source blob eb3a56e6b95d54fc4166713f475112b3d265fd35; LF SHA-256 7dea6bf50b02b0ba8126c1d8c632e8f2f2f0abd12d92b35b49324df6c15d404a; resources 0 stack / 216 MT / 36 ST / 49152 shared; controller rejected; formal source remained exact.", "operator": "fused_moe_i8_tn", "result": "REJECTED: target case4 regressed 2.884615 percent instead of improving about 6.879 percent; no repeat, integration or OJ. The same 512-thread/48-KiB geometry gates the modeled case2 dual-M extension, so that follow-on is no-go.", "schema_version": 1, "timestamp": "2026-08-29T15:29:48+00:00"}
{"artifacts": ["artifacts/raw/c500-runs/exp-20260830-233-acdc401fe043-a01", "handoffs/exp-20260830-233.md"], "baseline_commit": "8341aa38e55659285673111df90e786c1fba08df", "benchmark": "C500 ABBA candidate vs baseline: case1 0.8400 vs 0.8405 ms (-0.059488%); case2 5.9980 vs 5.9880 ms (+0.167001%); case3 0.5245 vs 0.5265 ms (-0.379867%); case4 3.3410 vs 3.3325 ms (+0.255064%). Formal K128 ST registers increased 40->46.", "candidate_commit": "acdc401fe0439204a5c7749cbb28b626e1079959", "change": "Changed only formal XH_CVT_F32_TO_BF16 to add one high-word carry for bit patterns matching 0x7f7f8000 under mask 0x7fff8000; decode m4 RNE conversion and all kernel mapping, memory, synchronization, arithmetic, stores and ABI remained exact.", "correctness": "PASS: focused numerical proof 6/6 over all retained high words at rounding boundaries, exhaustive low words for 16 extreme/subnormal classes and 250000 random finite values; C500 dual build, 3/3 differential correctness, full regression, sampled/all-zero read-only, source/tree integrity and manifest passed.", "decision": "revert", "device": "c500-local", "environment": "MetaX C500/xcore1000 device0; MACA 3.7.1.5; MXCC 1.0.0 d9102a1572; 25 percent compute / 16000 MiB; no device process before or after; run exp-20260830-233-acdc401fe043-a01 succeeded/0.", "hypothesis": "Preserve only the finite-to-infinity RNE carry while truncating all other formal K128 FP32-to-BF16 conversions, satisfying the live tolerance while reducing epilogue work.", "id": "exp-20260830-233", "language": "CUDA Maca", "notes": "Tested acdc401fe0439204a5c7749cbb28b626e1079959; queue tip 254dff3b33231786aa371425451ea2d18bfb7671; source blob 99bc880e5cf1713e0282f78e5bb5c8ed66ce1076; LF SHA-256 17e0f9031dd19957f6b5620ebb1aae2fa3a293e98441fb7e1c27c353a201ceb4; candidate/baseline staged SHA-256 739c652d631180348055b50eaa1eab6daad78727516c36c6c60ccb782d9da37c/77db352a0dbb3176f0f933c4d84370ec0997ce84b91d73a53ea2b08fc4c409e9; manifest 31/31; overflow-preserving truncation family closed.", "operator": "Fused MoE i8 tn", "result": "REJECTED: both prefill target paths regressed in both arms and MXCC increased ST pressure instead of reducing target work; no repeat, integration or OJ.", "schema_version": 1, "timestamp": "2026-08-29T16:46:15+00:00"}
{"artifacts": ["artifacts/raw/c500-runs/exp-20260830-234-51868cb3f165-a01", "artifacts/raw/c500-runs/exp-20260830-234-51868cb3f165-a02", "artifacts/raw/xpuoj/132033", "handoffs/exp-20260830-234.md"], "baseline_commit": "8341aa38e55659285673111df90e786c1fba08df", "benchmark": "C500 attempt1 case2 -0.200367% and case4 -0.300075%; attempt2 case2 -0.175336% and case4 -0.375263%. All eight prefill candidate arms favorable; fixed public K128 resources stayed 0 stack/230 MT/40 ST/32768 shared. OJ progress checkpoints 21.5 after case1, 63.25 after case3 and 84.75 terminal were consistent with unchanged cases 86/77/90/86.", "candidate_commit": "51868cb3f165da00465473ebaa362adf2541384c", "change": "Changed only formal XH_CVT_F32_TO_BF16 from RNE bias to +0x8000 ties-away; decode m4 conversion and all accumulation, addresses, mapping, synchronization, dispatch, stores, ABI and read-only inputs remained exact.", "correctness": "PASS: focused numerical proof 6/6 over all retained high words at boundaries, exhaustive low words for 16 extreme/subnormal classes and 250000 random finite values; two C500 runs each passed dual build, 3/3 differential correctness at matched_ratio 1.0/max_abs 0, full regression, sampled/all-zero read-only, source/tree integrity and 31/31 manifest; OJ 4/4 Accepted.", "decision": "revert", "device": "c500-local and XPU-OJ C500", "environment": "MetaX C500/xcore1000 device0; MACA 3.7.1.5; MXCC 1.0.0 d9102a1572; 25 percent compute / 16000 MiB; no device process before or after; runs exp-20260830-234-51868cb3f165-a01/a02 succeeded/0; CUDA Maca OJ.", "hypothesis": "Replay formal-only BF16 ties-away rounding on the current 84.75 source; removing retained-LSB extraction should preserve the live contract and produce stable prefill target improvement.", "id": "exp-20260830-234", "language": "CUDA Maca", "notes": "Tested 51868cb3f165da00465473ebaa362adf2541384c; queue tip 942c27f647d6373939cc50e84e7996cf829c57a7; integrated b8435ecdacfd766f6a8dfd801241427f019b5fb3; source blob 4f86bcec48d66b46895586adc066e7536bfc9806; LF SHA-256 aef88c80cc707dd06174b3ba51826c83b9aad96bf3d9c16a312b0fb6eb66a49b; staged source SHA-256 6316576838a62518826f44c1c61032212ab37c8b2803008ba07bf6cc39f3bccf; OJ 132033 finalized; source restored to formal blob 48704a2870975c3990f4681089b1a4efc35d99fa.", "operator": "Fused MoE i8 tn", "result": "REJECTED TIE: OJ remained 84.75 with unchanged cases and live rank 17", "schema_version": 1, "timestamp": "2026-08-29T17:21:55+00:00"}
{"artifacts": ["artifacts/raw/c500-runs/exp-20260830-235-4b349582d248-a01", "handoffs/exp-20260830-235.md"], "baseline_commit": "8341aa38e55659285673111df90e786c1fba08df", "benchmark": "C500 ABBA case2 baseline 5.9885 ms (5.989/5.988) versus candidate 6.0340 ms (6.034/6.034), +0.759790 percent regression; exact-case2 resources 0/230/40/32768 to 0/224/40/32768.", "candidate_commit": "4b349582d2480972659043fcbd6032649d61035b", "change": "Only exact sorted case2 reused four A-row carriers as bounded uint32 byte offsets, retained tile-unit K traversal, compiled out the A pointer induction, and preserved B, traffic, issue order, synchronization, mapping, epilogue and ABI.", "correctness": "PASS: focused 4/4 with 14680064 exhaustive A starts; C500 dual build, 3/3 differential correctness, full regression, sampled/read-only checks, source/tree integrity and 31/31 manifest.", "decision": "revert", "device": "c500-local", "environment": "MetaX C500/xcore1000 device0; MACA 3.7.1.5; MXCC 1.0.0 d9102a1572; 25 percent compute / 16000 MiB; run succeeded/0; no device process after.", "hypothesis": "Exact case2 bounded-u32 A byte offsets lower eight A loads to short-address form and remove enough address work to cross the next leaderboard tier.", "id": "exp-20260830-235", "language": "CUDA Maca", "notes": "Queue tip 8c9d446d5eafd1e1e1c0f6b298a0c60c84c08cd8; source blob 691d81ad82ad70939ad199dc02aae4566bbd9611; LF SHA-256 8f521ae66f7b777fedd4beaa7fed4b7351fdaee171d1daa43d8ee3b6c85f1102; formal source remained exact.", "operator": "Fused MoE i8 tn", "result": "REJECTED: both target arms regressed stably despite six fewer MT registers; no score path, repeat, MIR diagnostic, integration or OJ.", "schema_version": 1, "timestamp": "2026-08-29T18:30:07+00:00"}
{"artifacts": ["artifacts/raw/xpuoj/132136", "handoffs/exp-20260830-236.md"], "baseline_commit": "8341aa38e55659285673111df90e786c1fba08df", "benchmark": "C500 NOT RUN because SSH transport failed before staging. OJ 132136 Accepted 83.00 with cases 86/72/89/85 and exact user-kernel times 0.815/8.655/0.503/3.736 ms; formal best is 84.75 with 86/77/90/86.", "candidate_commit": "e405a3da412ccf55e627ce91f7193389018a3d5f", "change": "Only exact sorted case2 folded lane-local load_k into four bounded A-row carriers, recovered them as uint32 at A pointer additions, and preserved formal a_base initialization, reset and 128-byte induction; B, traffic, schedule, synchronization, mapping, epilogue and ABI remained exact.", "correctness": "PASS: focused 4/4 with 14680064 exhaustive A starts and OJ 4/4 Accepted. No target C500 build, regression, resources or ABBA evidence exists because transport failed before staging.", "decision": "revert", "device": "XPU-OJ C500; c500-local not run", "environment": "CUDA Maca OJ. Local MetaX C500 transport unavailable: BatchMode authentication returned Permission denied (password).", "hypothesis": "Explicit uint32 recovery of bounded A carriers while retaining formal pointer induction removes high-half address work and may cross the case2 78-point boundary.", "id": "exp-20260830-236", "language": "CUDA Maca", "notes": "Tested e405a3da412ccf55e627ce91f7193389018a3d5f; integrated a832aa0c23be147d89987737a2eb52e94be61137; source blob 83f160a40f9cd77081b7dbd8f58c5f0c02373689; LF SHA-256 b770a63ce5b363c9a6b804e295aed967e9fdccf7bc184d4eb4acb1d056b2aef6; OJ 132136 finalized; source restored by 97188bc to formal blob 48704a2870975c3990f4681089b1a4efc35d99fa.", "operator": "Fused MoE i8 tn", "result": "REJECTED: OJ case2 regressed from 77 points / 6.425 ms to 72 points / 8.655 ms and cases3/4 each lost one point; no formal-best change.", "schema_version": 1, "timestamp": "2026-08-29T19:26:28+00:00"}
{"artifacts": ["artifacts/raw/xpuoj/132202", "handoffs/exp-20260830-237.md"], "baseline_commit": "8341aa38e55659285673111df90e786c1fba08df", "benchmark": "C500 NOT RUN because SSH transport remained unavailable. OJ 132202 Accepted 83.00 with cases 86/72/89/85 and exact user-kernel times 0.815/8.605/0.497/3.687 ms; formal best is 84.75 with 86/77/90/86.", "candidate_commit": "f1ec348379ed31561347ed3291ba40ed7469264c", "change": "Route only exact sorted case4 through the synchronous K256 m4 body on the existing full-sort map and grid (8,56,32); keep case2 on the formal K128 path and use the same templated m4 body for decode.", "correctness": "PASS: focused 4/4, workflow 12/12, detached audit approve, and OJ 4/4 Accepted. No target C500 build, regression, resources or ABBA evidence exists because transport was unavailable.", "decision": "revert", "device": "XPU-OJ C500; c500-local not run", "environment": "CUDA Maca OJ. Local MetaX C500 transport unavailable: BatchMode authentication returned Permission denied (password).", "hypothesis": "Full sorting may make the synchronous K256 m4 body profitable for exact case4 and cross the approximately 6.879 percent next-score boundary.", "id": "exp-20260830-237", "language": "CUDA Maca", "notes": "Tested f1ec348379ed31561347ed3291ba40ed7469264c; queue tip ece919e40794890aabaa776e68e925de69035db9; integrated 469c9f23e2f932555cecc09effcefde2b5ce8117; source blob cd86941793c065e09afe800e4a092598c28116a1; LF SHA-256 9b3652571de6d9e44424c7c233647125fe329e4548da0785b01e9186fbbf8569; OJ 132202 finalized; source restored by a38b612 to formal blob 48704a2870975c3990f4681089b1a4efc35d99fa.", "operator": "Fused MoE i8 tn", "result": "REJECTED: OJ case4 regressed from 86 points / 3.473 ms to 85 points / 3.687 ms, case2 fell 77->72 and case3 fell 90->89; no formal-best change.", "schema_version": 1, "timestamp": "2026-08-29T20:05:55+00:00"}
{"artifacts": ["artifacts/raw/xpuoj/132232", "handoffs/exp-20260830-238.md"], "baseline_commit": "8341aa38e55659285673111df90e786c1fba08df", "benchmark": "C500 NOT RUN. OJ 132232 Accepted 84.75 with cases 86/77/90/86 and exact user-kernel times 0.801/6.439/0.489/3.454 ms; case2 was 6.439 ms and remained 77 points; live rank 17.", "candidate_commit": "ab11d9ebe5a88b4b3a60bd8c9ea186e3c908613b", "change": "Only exact full-sort prefill uses the histogram packed payload map and formal K128 ties-away conversion; decode m4 retains its source-identical RNE path.", "correctness": "PASS: focused identity/mapping/BF16 tests 10/10, workflow tests 12/12, randomized grouped-bijection proof, restricted inverse to formal source, and OJ 4/4 Accepted. No C500 build/regression/resource evidence exists for the combination because transport was unavailable.", "decision": "revert", "device": "xpuoj-c500", "environment": "CUDA Maca XPU-OJ C500. Local C500 transport unavailable: BatchMode authentication required a password, so no target build/resource/regression/performance claim is made for the combination.", "hypothesis": "Compose the independently C500-positive histogram packed map and formal ties-away conversion to cross the exact case2 78-point boundary while preserving decode m4.", "id": "exp-20260830-238", "language": "CUDA Maca", "notes": "Implementation ab11d9ebe5a88b4b3a60bd8c9ea186e3c908613b; queue/integrated tip 6c07dec4358c709976eef75378a69535cd69023f; source blob 90f5989c1212af0ddeb84d2eea4ed21c182a10b5; LF SHA-256 b2837d142c50a8f59795edb1494362366c6267b47c5e02c170a717951f862b9a; OJ 132232 finalized; formal source restored exactly.", "operator": "Fused MoE i8 tn", "result": "REJECTED TIE: the combined mechanism did not cross any OJ display tier and did not exceed formal best 84.75.", "schema_version": 1, "timestamp": "2026-08-29T20:46:27+00:00"}
